Topic_no,Keywords,Contrib,System,Text
5,"test, run, make, thread, error, write, exist, build, main, fail, rocksdb, summary, pass, bug, case, make_sure, function, differential_revision, disable, review",0.0755,conscrypt,"Track False Start change in tests In BoringSSL, the SSL_MODE_ENABLE_FALSE_START (aka SSL_MODE_HANDSHAKE_CUTTHROUGH) is unconditionally enabled because BoringSSL does the appropriate checks internally. Make sure our tests also reflect this fact by testing the appropriate settings. Bug: 26139262 Bug: 26139500 Change-Id: I125aa440cdb76d2efbfee2be7387b47d22446950/"
,,0.1103,conscrypt,"Stop using set_options to set protocol support. (#500) The *_set_min_protocol_version and *_set_max_protocol_version functions were introduced to be explicit about setting supported versions. Use those functions instead of SSL_set_options with disabling constants. There arent any higher-level tests because this is already covered by tests like SSLSocket.test_SSLSocket_setEnabledProtocols, SSLSocket.test_SSLSocket_noncontiguousProtocols_useLower, etc./"
,,0.0744,conscrypt,"Refactor OpenSSLCipher (#654) The heavily-nested class structure makes it hard to follow what every class is doing. Instead, break them out into their own classes by algorithm./"
,,0.0577,Frostwire,[android] avoid NPE on SwipeLayout::dispatchTouchEvent. build 327/
,,0.0685,Frostwire,[android] MoPubAdNetwork test ad units. Interstitial loading bug fix/
,,0.077,javacpp,* Fix potential race condition when deallocating `Pointer` objects from multiple threads/
,,0.121,jna,"Fix issue# 68 File monitor thread terminates on any removeWatch call. Change W32FileMonitor.dispose() to unwatch any remaining files in map, allows watcher thread to exit. git-svn-id: 2f8a963e-d2e4-e7d0-97bf-ccb7fcea9d80/Fix issue# 68 File monitor thread terminates on any removeWatch call. git-svn-id: 2f8a963e-d2e4-e7d0-97bf-ccb7fcea9d80/Fix for Jira issue: 67 FileMonitor incorrectly handles FILE_DELETED notification mask. Added a unit test and committed fix. git-svn-id: 2f8a963e-d2e4-e7d0-97bf-ccb7fcea9d80/"
,,0.0677,jna,Fix transparent window error on win2k git-svn-id: 2f8a963e-d2e4-e7d0-97bf-ccb7fcea9d80/
,,0.0758,OpenDDS,improved error indication from specific transport to framework/
,,0.1136,OpenDDS,"Added links_lock_ to stop contention during connect_datalink causing multiple datalink instances to be created/Multicast Transport work possible deadlocking in MulticastTransport.cpp, added logging to trace assoc failures throughout multicast, removed an unused TransportClient* arg in UdpTransport/"
,,0.0628,OpenDDS,Coverity Scan Defects: Addressing Uncaught Exceptions/
,,0.6522,OpenDDS,"Merge pull request from jwillemsen/jwi-aceerror-541 Use ACE_ERROR together with LM_ERROR, see issue ACE_ERROR together with LM_ERROR, see issue * dds/DCPS/DataReaderImpl.cpp: * dds/DCPS/DataWriterImpl.cpp: * dds/DCPS/DiscoveryBase.h: * dds/DCPS/MultiTopicDataReaderBase.cpp: * dds/DCPS/RTPS/ParameterListConverter.cpp: * dds/DCPS/RTPS/Sedp.cpp: * dds/DCPS/RTPS/Spdp.cpp: * dds/DCPS/ReactorInterceptor.cpp: * dds/DCPS/RecorderImpl.cpp: * dds/DCPS/ReplayerImpl.cpp: * dds/DCPS/StaticDiscovery.cpp: * dds/DCPS/transport/framework/ReceiveListenerSet.cpp: * dds/DCPS/transport/multicast/MulticastTransport.cpp: * dds/DCPS/transport/rtps_udp/RtpsUdpDataLink.cpp: * dds/DCPS/transport/rtps_udp/RtpsUdpSendStrategy.cpp: * dds/DCPS/transport/rtps_udp/RtpsUdpTransport.cpp: * dds/DCPS/transport/shmem/ShmemTransport.cpp: * dds/DCPS/transport/tcp/TcpTransport.cpp: * dds/DCPS/transport/udp/UdpTransport.cpp: * dds/FACE/config/QosSettings.cpp: * dds/idl/ts_generator.cpp: * performance-tests/DCPS/MulticastListenerTest/Writer.cpp: * performance-tests/DCPS/SimpleE2ETest/Reader.cpp: * performance-tests/DCPS/SimpleE2ETest/Writer.cpp: * performance-tests/DCPS/TCPListenerTest/Writer.cpp: * performance-tests/DCPS/UDPListenerTest/Writer.cpp: * performance-tests/DCPS/UDPNoKeyTest/Reader.cpp: * performance-tests/DCPS/UDPNoKeyTest/Writer.cpp: * tests/DCPS/Compiler/idl_test1_main/main.cpp: * tests/DCPS/Compiler/idl_test3_main/main.cpp: * tests/DCPS/FooTest5/DataReaderListener.cpp: * tests/DCPS/ManyToMany/publisher.cpp: * tests/DCPS/ManyToMany/subscriber.cpp: * tests/DCPS/NotifyTest/subscriber.cpp: * tests/DCPS/Ownership/DataReaderListener.cpp: * tests/DCPS/Ownership/subscriber.cpp: * tests/DCPS/Presentation/main.cpp: * tests/DCPS/RtpsDiscovery/RtpsDiscoveryTest.cpp: * tests/DCPS/StaticDiscovery/DataReaderListenerImpl.cpp: * tests/FACE/Compiler/idl_test1_main/main.cpp: * tests/FACE/Compiler/idl_test3_main/main.cpp: * tests/FACE/Unit/test_check.h: * tests/transport/rtps/subscriber.cpp: * tests/transport/rtps_reliability/rtps_reliability.cpp:/"
,,0.6368,OpenDDS,"Merge pull request from jwillemsen/jwi-aceerror-541 Use ACE_ERROR together with LM_ERROR, see issue ACE_ERROR together with LM_ERROR, see issue * dds/DCPS/DataReaderImpl.cpp: * dds/DCPS/DataWriterImpl.cpp: * dds/DCPS/DiscoveryBase.h: * dds/DCPS/MultiTopicDataReaderBase.cpp: * dds/DCPS/RTPS/ParameterListConverter.cpp: * dds/DCPS/RTPS/Sedp.cpp: * dds/DCPS/RTPS/Spdp.cpp: * dds/DCPS/ReactorInterceptor.cpp: * dds/DCPS/RecorderImpl.cpp: * dds/DCPS/ReplayerImpl.cpp: * dds/DCPS/StaticDiscovery.cpp: * dds/DCPS/transport/framework/ReceiveListenerSet.cpp: * dds/DCPS/transport/multicast/MulticastTransport.cpp: * dds/DCPS/transport/rtps_udp/RtpsUdpDataLink.cpp: * dds/DCPS/transport/rtps_udp/RtpsUdpSendStrategy.cpp: * dds/DCPS/transport/rtps_udp/RtpsUdpTransport.cpp: * dds/DCPS/transport/shmem/ShmemTransport.cpp: * dds/DCPS/transport/tcp/TcpTransport.cpp: * dds/DCPS/transport/udp/UdpTransport.cpp: * dds/FACE/config/QosSettings.cpp: * dds/idl/ts_generator.cpp: * performance-tests/DCPS/MulticastListenerTest/Writer.cpp: * performance-tests/DCPS/SimpleE2ETest/Reader.cpp: * performance-tests/DCPS/SimpleE2ETest/Writer.cpp: * performance-tests/DCPS/TCPListenerTest/Writer.cpp: * performance-tests/DCPS/UDPListenerTest/Writer.cpp: * performance-tests/DCPS/UDPNoKeyTest/Reader.cpp: * performance-tests/DCPS/UDPNoKeyTest/Writer.cpp: * tests/DCPS/Compiler/idl_test1_main/main.cpp: * tests/DCPS/Compiler/idl_test3_main/main.cpp: * tests/DCPS/FooTest5/DataReaderListener.cpp: * tests/DCPS/ManyToMany/publisher.cpp: * tests/DCPS/ManyToMany/subscriber.cpp: * tests/DCPS/NotifyTest/subscriber.cpp: * tests/DCPS/Ownership/DataReaderListener.cpp: * tests/DCPS/Ownership/subscriber.cpp: * tests/DCPS/Presentation/main.cpp: * tests/DCPS/RtpsDiscovery/RtpsDiscoveryTest.cpp: * tests/DCPS/StaticDiscovery/DataReaderListenerImpl.cpp: * tests/FACE/Compiler/idl_test1_main/main.cpp: * tests/FACE/Compiler/idl_test3_main/main.cpp: * tests/FACE/Unit/test_check.h: * tests/transport/rtps/subscriber.cpp: * tests/transport/rtps_reliability/rtps_reliability.cpp:/Merge pull request from oschwaldp-oci/coverity_scan_defects_fixes Coverity Scan defect: checking result of dynamic; ACE logging fixes; etc./"
,,0.0653,realm-java,Fixed create of Group(byte[]). Enabled all GroupTest tests and added new test./
,,0.1628,realm-java,Merge pull request from realm/ez-allow-disable-analytics Ignore errors in analytics BG thread and allow disabling it/Ignore errors in analytics BG thread and allow disabling it/Avoid wildcard imports and execute in the background/Merge branch master into cm-bug-clear/Merge branch master of github.com:realm/realm-java into kg-bug-migrate-linkview/
,,0.0652,realm-java,Merge pull request from realm/cm/bug/badversionexception Fix BadVersionException/Fixed race condition causing BadVersionException/
,,0.0577,realm-java,Fix threading example/
,,0.0609,realm-java,Nh/fix test (#3868) * Fix SyncConfiguration test/
,,0.0723,realm-java,PermissionManager should ignore intermittent errors (#6506)/
,,0.0681,realm-java,PermissionManager should ignore intermittent errors (#6506)/
,,0.1335,rocksdb,"Make db_stress built for ROCKSDB_LITE Summary: Make db_stress built for ROCKSDB_LITE. The test doesnt pass tough. It seg fault quickly. But I took a look and it doesnt seem to be related to lite version. Likely to be a bug inside RocksDB. Test Plan: make db_stress Reviewers: yhchiang, rven, ljin, igor Reviewed By: igor Subscribers: leveldb, dhruba Differential Revision:"
,,0.2468,rocksdb,"rocksdb: Add missing override Summary: When using latest clang (3.6 or 3.7/trunck) rocksdb is failing with many errors. Almost all of them are missing override errors. This diff adds missing override keyword. No manual changes. Prerequisites: bear and clang 3.5 build with extra tools ```lang=bash % USE_CLANG=1 bear make all generate a compilation database % clang-modernize . . % make format ``` Test Plan: Make sure all tests are passing. ```lang=bash % default fb code clang. % make check ``` Verify less error and no missing override errors. ```lang=bash % Have trunk clang present in path. % ROCKSDB_NO_FBCODE=1 CC=clang CXX=clang++ make ``` Reviewers: igor, kradhakrishnan, rven, meyering, sdong Reviewed By: sdong Subscribers: dhruba, leveldb Differential Revision:"
,,0.5587,rocksdb,"rocksdb: switch to gtest Summary: Our existing test notation is very similar to what is used in gtest. It makes it easy to adopt what is different. In this diff I modify existing [[ | test fixture ]] classes to inherit from `testing::Test`. Also for unit tests that use fixture class, `TEST` is replaced with `TEST_F` as required in gtest. There are several custom `main` functions in our existing tests. To make this transition easier, I modify all `main` functions to fallow gtest notation. But eventually we can remove them and use implementation of `main` that gtest provides. ```lang=bash % cat ~/transform files=$(git ls-files *test\.cc) for file in $files do if grep ""rocksdb::test::RunAllTests()"" $file then if grep ^class \w+Test { $file then perl s/^(class \w+Test) {/${1}: public testing::Test {/g $file perl s/^(TEST)/${1}_F/g $file fi perl s/(int main.*\{)/${1}::testing::InitGoogleTest(&argc, argv);/g $file perl s/rocksdb::test::RunAllTests/RUN_ALL_TESTS/g $file fi done % sh ~/transform % make format ``` Second iteration of this diff contains only scripted changes. Third iteration contains manual changes to fix last errors and make it compilable. Test Plan: Build and notice no errors. ```lang=bash % USE_CLANG=1 make check ``` Tests are still testing. Reviewers: meyering, sdong, rven, igor Reviewed By: igor Subscribers: dhruba, leveldb Differential Revision:"
,,0.3208,rocksdb,"Fix flakiness of WalManagerTest Summary: We should use mocked-out env for these tests to make it more realiable. Added benefit is that instead of actually sleeping for 3 seconds, we can instead pretend to sleep and just increase time counters. Test Plan: for i in `seq 100`; do ./wal_manager_test ;done Reviewers: rven, meyering Reviewed By: meyering Subscribers: meyering, dhruba, leveldb Differential Revision: Add missing override Summary: When using latest clang (3.6 or 3.7/trunck) rocksdb is failing with many errors. Almost all of them are missing override errors. This diff adds missing override keyword. No manual changes. Prerequisites: bear and clang 3.5 build with extra tools ```lang=bash % USE_CLANG=1 bear make all generate a compilation database % clang-modernize . . % make format ``` Test Plan: Make sure all tests are passing. ```lang=bash % default fb code clang. % make check ``` Verify less error and no missing override errors. ```lang=bash % Have trunk clang present in path. % ROCKSDB_NO_FBCODE=1 CC=clang CXX=clang++ make ``` Reviewers: igor, kradhakrishnan, rven, meyering, sdong Reviewed By: sdong Subscribers: dhruba, leveldb Differential Revision:"
,,0.2611,rocksdb,"rocksdb: Add missing override Summary: When using latest clang (3.6 or 3.7/trunck) rocksdb is failing with many errors. Almost all of them are missing override errors. This diff adds missing override keyword. No manual changes. Prerequisites: bear and clang 3.5 build with extra tools ```lang=bash % USE_CLANG=1 bear make all generate a compilation database % clang-modernize . . % make format ``` Test Plan: Make sure all tests are passing. ```lang=bash % default fb code clang. % make check ``` Verify less error and no missing override errors. ```lang=bash % Have trunk clang present in path. % ROCKSDB_NO_FBCODE=1 CC=clang CXX=clang++ make ``` Reviewers: igor, kradhakrishnan, rven, meyering, sdong Reviewed By: sdong Subscribers: dhruba, leveldb Differential Revision:"
,,0.5984,rocksdb,"rocksdb: switch to gtest Summary: Our existing test notation is very similar to what is used in gtest. It makes it easy to adopt what is different. In this diff I modify existing [[ | test fixture ]] classes to inherit from `testing::Test`. Also for unit tests that use fixture class, `TEST` is replaced with `TEST_F` as required in gtest. There are several custom `main` functions in our existing tests. To make this transition easier, I modify all `main` functions to fallow gtest notation. But eventually we can remove them and use implementation of `main` that gtest provides. ```lang=bash % cat ~/transform files=$(git ls-files *test\.cc) for file in $files do if grep ""rocksdb::test::RunAllTests()"" $file then if grep ^class \w+Test { $file then perl s/^(class \w+Test) {/${1}: public testing::Test {/g $file perl s/^(TEST)/${1}_F/g $file fi perl s/(int main.*\{)/${1}::testing::InitGoogleTest(&argc, argv);/g $file perl s/rocksdb::test::RunAllTests/RUN_ALL_TESTS/g $file fi done % sh ~/transform % make format ``` Second iteration of this diff contains only scripted changes. Third iteration contains manual changes to fix last errors and make it compilable. Test Plan: Build and notice no errors. ```lang=bash % USE_CLANG=1 make check ``` Tests are still testing. Reviewers: meyering, sdong, rven, igor Reviewed By: igor Subscribers: dhruba, leveldb Differential Revision: Add missing override Summary: When using latest clang (3.6 or 3.7/trunck) rocksdb is failing with many errors. Almost all of them are missing override errors. This diff adds missing override keyword. No manual changes. Prerequisites: bear and clang 3.5 build with extra tools ```lang=bash % USE_CLANG=1 bear make all generate a compilation database % clang-modernize . . % make format ``` Test Plan: Make sure all tests are passing. ```lang=bash % default fb code clang. % make check ``` Verify less error and no missing override errors. ```lang=bash % Have trunk clang present in path. % ROCKSDB_NO_FBCODE=1 CC=clang CXX=clang++ make ``` Reviewers: igor, kradhakrishnan, rven, meyering, sdong Reviewed By: sdong Subscribers: dhruba, leveldb Differential Revision:"
,,0.3432,rocksdb,"Using chrono as a fallback Summary: Right now if they system we are compiling on is not Linux and not Mac we will get a compilation error this diff use chrono as a fallback when we are compiling on something other than Linux/FreeBSD/Mac Test Plan: compile on CentOS/FreeBSD ./db_test (still running) Reviewers: igor Reviewed By: igor Subscribers: dhruba Differential Revision: pull request from dalgaaf/wip-da-fix-elif Fix with no expression/util/env_posix.cc: fix check for __MACH__ Fix with no expression add defined() to check. Signed-off-by: Danny Al-Gaaf chrono use Summary: For some reason, libstdc++ implements steady_clock::now() using syscall instead of VDSO optimized clock_gettime() when using glibc 2.16 and earlier. This leads to significant performance degradation for users with older glibcs. See bug reported here: We observed this behavior when testing mongo on AWS hosts. Facebook hosts are unaffected since we use glibc2.17 and 2.20. Revert ""Fix timing"" This reverts commit 965d9d50b8cbb413de5e834b5b83ddbb682d0f1d. Revert ""Use chrono for timing"" This reverts commit 001ce64dc7659c65569ffb1c440e26cd23db3c94. Test Plan: make check Reviewers: MarkCallaghan, yhchiang, rven, meyering, sdong Reviewed By: sdong Subscribers: dhruba, leveldb Differential Revision: Add missing override Summary: When using latest clang (3.6 or 3.7/trunck) rocksdb is failing with many errors. Almost all of them are missing override errors. This diff adds missing override keyword. No manual changes. Prerequisites: bear and clang 3.5 build with extra tools ```lang=bash % USE_CLANG=1 bear make all generate a compilation database % clang-modernize . . % make format ``` Test Plan: Make sure all tests are passing. ```lang=bash % default fb code clang. % make check ``` Verify less error and no missing override errors. ```lang=bash % Have trunk clang present in path. % ROCKSDB_NO_FBCODE=1 CC=clang CXX=clang++ make ``` Reviewers: igor, kradhakrishnan, rven, meyering, sdong Reviewed By: sdong Subscribers: dhruba, leveldb Differential Revision: Fix Division by zero scan-build warning Summary: scan-build complains with division by zero warning in a test. Added an assertion to prevent this. scan-build report: Test Plan: Make sure scan-build does not report Division by zero and all tests are passing. ```lang=bash % make analyze % make check ``` Reviewers: igor, meyering Reviewed By: meyering Subscribers: sdong, dhruba, leveldb Differential Revision:"
,,0.6022,rocksdb,"rocksdb: switch to gtest Summary: Our existing test notation is very similar to what is used in gtest. It makes it easy to adopt what is different. In this diff I modify existing [[ | test fixture ]] classes to inherit from `testing::Test`. Also for unit tests that use fixture class, `TEST` is replaced with `TEST_F` as required in gtest. There are several custom `main` functions in our existing tests. To make this transition easier, I modify all `main` functions to fallow gtest notation. But eventually we can remove them and use implementation of `main` that gtest provides. ```lang=bash % cat ~/transform files=$(git ls-files *test\.cc) for file in $files do if grep ""rocksdb::test::RunAllTests()"" $file then if grep ^class \w+Test { $file then perl s/^(class \w+Test) {/${1}: public testing::Test {/g $file perl s/^(TEST)/${1}_F/g $file fi perl s/(int main.*\{)/${1}::testing::InitGoogleTest(&argc, argv);/g $file perl s/rocksdb::test::RunAllTests/RUN_ALL_TESTS/g $file fi done % sh ~/transform % make format ``` Second iteration of this diff contains only scripted changes. Third iteration contains manual changes to fix last errors and make it compilable. Test Plan: Build and notice no errors. ```lang=bash % USE_CLANG=1 make check ``` Tests are still testing. Reviewers: meyering, sdong, rven, igor Reviewed By: igor Subscribers: dhruba, leveldb Differential Revision: Add missing override Summary: When using latest clang (3.6 or 3.7/trunck) rocksdb is failing with many errors. Almost all of them are missing override errors. This diff adds missing override keyword. No manual changes. Prerequisites: bear and clang 3.5 build with extra tools ```lang=bash % USE_CLANG=1 bear make all generate a compilation database % clang-modernize . . % make format ``` Test Plan: Make sure all tests are passing. ```lang=bash % default fb code clang. % make check ``` Verify less error and no missing override errors. ```lang=bash % Have trunk clang present in path. % ROCKSDB_NO_FBCODE=1 CC=clang CXX=clang++ make ``` Reviewers: igor, kradhakrishnan, rven, meyering, sdong Reviewed By: sdong Subscribers: dhruba, leveldb Differential Revision:"
,,0.4635,rocksdb,"Fix BackupEngine Summary: In D28521 we removed GarbageCollect() from BackupEngines constructor. The reason was that opening BackupEngine on HDFS was very slow and in most cases we didnt have any garbage. We allowed the user to call GarbageCollect() when it detects some garbage files in his backup directory. Unfortunately, this left us vulnerable to an interesting issue. Lets say we started a backup and copied files {1, 3} but the backup failed. On another host, we restore DB from backup and generate {1, 3, 5}. Since {1, 3} is already there, we will not overwrite. However, these files might be from a different database so their contents might be different. See internal task t6781803 for more info. Now, when were copying files and we discover a file already there, we check: 1. if the file is not referenced from any backups, we overwrite the file. 2. if the file is referenced from other backups AND the checksums dont match, we fail the backup. This will only happen if user is using a single backup directory for backing up two different databases. 3. if the file is referenced from other backups AND the checksums match, its all good. We skip the copy and go copy the next file. Test Plan: Added new test to backupable_db_test. The test fails before this patch. Reviewers: sdong, rven, yhchiang Reviewed By: yhchiang Subscribers: dhruba, leveldb Differential Revision: use ASSERT_TRUE, not ASSERT_EQ(true; same for false Summary: The usage Im fixing here caused trouble on Fedora 21 when compiling with the current gcc version 4.9.2 20150212 (Red Hat 4.9.2-6) (GCC): db/write_controller_test.cc: In member function ëvirtual void rocksdb::WriteControllerTest_SanityTest_Test::TestBody()í: db/write_controller_test.cc:23:165: error: converting ëfalseí to pointer type for argument 1 of ëchar testing::internal::IsNullLiteralHelper(testing::internal::Secret*)í [-Werror=conversion-null] ASSERT_EQ(false, controller.IsStopped()); ^ This change was induced mechanically via: git grep ASSERT_EQ\(false|xargs perl s/ASSERT_EQ\(false, /ASSERT_FALSE(/ git grep ASSERT_EQ\(true|xargs perl s/ASSERT_EQ\(true, /ASSERT_TRUE(/ Except for the three in utilities/backupable/backupable_db_test.cc for which I ended up reformatting (joining lines) in the result. As for why this problem is exhibited with that version of gcc, and none of the others Ive used (from 4.8.1 through gcc-5.0.0 and newer), I suspect its a bug in F21s gcc that has been fixed in gcc-5.0.0. Test Plan: ""make"" now succeed on Fedora 21 Reviewers: ljin, rven, igor.sugak, yhchiang, sdong, igor Reviewed By: igor Subscribers: dhruba Differential Revision: switch to gtest Summary: Our existing test notation is very similar to what is used in gtest. It makes it easy to adopt what is different. In this diff I modify existing [[ | test fixture ]] classes to inherit from `testing::Test`. Also for unit tests that use fixture class, `TEST` is replaced with `TEST_F` as required in gtest. There are several custom `main` functions in our existing tests. To make this transition easier, I modify all `main` functions to fallow gtest notation. But eventually we can remove them and use implementation of `main` that gtest provides. ```lang=bash % cat ~/transform files=$(git ls-files *test\.cc) for file in $files do if grep ""rocksdb::test::RunAllTests()"" $file then if grep ^class \w+Test { $file then perl s/^(class \w+Test) {/${1}: public testing::Test {/g $file perl s/^(TEST)/${1}_F/g $file fi perl s/(int main.*\{)/${1}::testing::InitGoogleTest(&argc, argv);/g $file perl s/rocksdb::test::RunAllTests/RUN_ALL_TESTS/g $file fi done % sh ~/transform % make format ``` Second iteration of this diff contains only scripted changes. Third iteration contains manual changes to fix last errors and make it compilable. Test Plan: Build and notice no errors. ```lang=bash % USE_CLANG=1 make check ``` Tests are still testing. Reviewers: meyering, sdong, rven, igor Reviewed By: igor Subscribers: dhruba, leveldb Differential Revision: Replace ASSERT* with EXPECT* in functions that does not return void value Summary: gtest does not use exceptions to fail a unit test by design, and `ASSERT*`s are implemented using `return`. As a consequence we cannot use `ASSERT*` in a function that does not return `void` value ([[ | 1]]), and have to fix our existing code. This diff does this in a generic way, with no manual changes. In order to detect all existing `ASSERT*` that are used in functions that doesnt return void value, I change the code to generate compile errors for such cases. In `util/testharness.h` I defined `EXPECT*` assertions, the same way as `ASSERT*`, and redefined `ASSERT*` to return `void`. Then executed: ```lang=bash % USE_CLANG=1 make all 2> build.log % perl print ""-- "".$F[0].""\n"" if /: error:/ \ build.log | xargs 1 perl s/ASSERT/EXPECT/g if $. $number % make format ``` After that I reverted back change to `ASSERT*` in `util/testharness.h`. But preserved introduced `EXPECT*`, which is the same as `ASSERT*`. This will be deleted once switched to gtest. This diff is independent and contains manual changes only in `util/testharness.h`. Test Plan: Make sure all tests are passing. ```lang=bash % USE_CLANG=1 make check ``` Reviewers: igor, lgalanis, sdong, yufei.zhu, rven, meyering Reviewed By: meyering Subscribers: dhruba, leveldb Differential Revision: a bug in ReadOnlyBackupEngine Summary: This diff fixes a bug introduced by D28521. Read-only backup engine can delete a backup that is later than the latest we never check the condition. I also added a bunch of logging that will help with debugging cases like this in the future. See more discussion at t6218248. Test Plan: Added a unit test that was failing before the change. Also, see new LOG file contents: Reviewers: benj, sanketh, sumeet, yhchiang, rven, sdong Reviewed By: sdong Subscribers: dhruba, leveldb Differential Revision: Add missing override Summary: When using latest clang (3.6 or 3.7/trunck) rocksdb is failing with many errors. Almost all of them are missing override errors. This diff adds missing override keyword. No manual changes. Prerequisites: bear and clang 3.5 build with extra tools ```lang=bash % USE_CLANG=1 bear make all generate a compilation database % clang-modernize . . % make format ``` Test Plan: Make sure all tests are passing. ```lang=bash % default fb code clang. % make check ``` Verify less error and no missing override errors. ```lang=bash % Have trunk clang present in path. % ROCKSDB_NO_FBCODE=1 CC=clang CXX=clang++ make ``` Reviewers: igor, kradhakrishnan, rven, meyering, sdong Reviewed By: sdong Subscribers: dhruba, leveldb Differential Revision:"
