Topic_no,Keywords,Contrib,System,Text
,,0.2292,rocksdb,"Fix compile Summary: as title, we have unused variables. this is a short-term solution Test Plan: compiles Reviewers: IslamAbdelRahman, sdong, rven Reviewed By: rven Subscribers: dhruba, leveldb Differential Revision: fbson Summary: mac compile is fixed in fbson, so it can be returned back from 7ce1b2c Test Plan: make all check make valgrind_check Reviewers: golovachalexander, igor Reviewed By: igor Subscribers: dhruba Differential Revision: Add missing override Summary: When using latest clang (3.6 or 3.7/trunck) rocksdb is failing with many errors. Almost all of them are missing override errors. This diff adds missing override keyword. No manual changes. Prerequisites: bear and clang 3.5 build with extra tools ```lang=bash % USE_CLANG=1 bear make all generate a compilation database % clang-modernize . . % make format ``` Test Plan: Make sure all tests are passing. ```lang=bash % default fb code clang. % make check ``` Verify less error and no missing override errors. ```lang=bash % Have trunk clang present in path. % ROCKSDB_NO_FBCODE=1 CC=clang CXX=clang++ make ``` Reviewers: igor, kradhakrishnan, rven, meyering, sdong Reviewed By: sdong Subscribers: dhruba, leveldb Differential Revision:"
,,0.5488,rocksdb,"rocksdb: switch to gtest Summary: Our existing test notation is very similar to what is used in gtest. It makes it easy to adopt what is different. In this diff I modify existing [[ | test fixture ]] classes to inherit from `testing::Test`. Also for unit tests that use fixture class, `TEST` is replaced with `TEST_F` as required in gtest. There are several custom `main` functions in our existing tests. To make this transition easier, I modify all `main` functions to fallow gtest notation. But eventually we can remove them and use implementation of `main` that gtest provides. ```lang=bash % cat ~/transform files=$(git ls-files *test\.cc) for file in $files do if grep ""rocksdb::test::RunAllTests()"" $file then if grep ^class \w+Test { $file then perl s/^(class \w+Test) {/${1}: public testing::Test {/g $file perl s/^(TEST)/${1}_F/g $file fi perl s/(int main.*\{)/${1}::testing::InitGoogleTest(&argc, argv);/g $file perl s/rocksdb::test::RunAllTests/RUN_ALL_TESTS/g $file fi done % sh ~/transform % make format ``` Second iteration of this diff contains only scripted changes. Third iteration contains manual changes to fix last errors and make it compilable. Test Plan: Build and notice no errors. ```lang=bash % USE_CLANG=1 make check ``` Tests are still testing. Reviewers: meyering, sdong, rven, igor Reviewed By: igor Subscribers: dhruba, leveldb Differential Revision:"
,,0.0639,rocksdb,Merge pull request from charsyam/feature/type-1 fix typos/fix typos/
,,0.5434,rocksdb,"rocksdb: switch to gtest Summary: Our existing test notation is very similar to what is used in gtest. It makes it easy to adopt what is different. In this diff I modify existing [[ | test fixture ]] classes to inherit from `testing::Test`. Also for unit tests that use fixture class, `TEST` is replaced with `TEST_F` as required in gtest. There are several custom `main` functions in our existing tests. To make this transition easier, I modify all `main` functions to fallow gtest notation. But eventually we can remove them and use implementation of `main` that gtest provides. ```lang=bash % cat ~/transform files=$(git ls-files *test\.cc) for file in $files do if grep ""rocksdb::test::RunAllTests()"" $file then if grep ^class \w+Test { $file then perl s/^(class \w+Test) {/${1}: public testing::Test {/g $file perl s/^(TEST)/${1}_F/g $file fi perl s/(int main.*\{)/${1}::testing::InitGoogleTest(&argc, argv);/g $file perl s/rocksdb::test::RunAllTests/RUN_ALL_TESTS/g $file fi done % sh ~/transform % make format ``` Second iteration of this diff contains only scripted changes. Third iteration contains manual changes to fix last errors and make it compilable. Test Plan: Build and notice no errors. ```lang=bash % USE_CLANG=1 make check ``` Tests are still testing. Reviewers: meyering, sdong, rven, igor Reviewed By: igor Subscribers: dhruba, leveldb Differential Revision:"
,,0.634,rocksdb,"rocksdb: Remove ""util/string_util.h"" from util/testharness.h Summary: 1. Manually deleted ""util/string_util.h"" from util/testharness.h 2. ``` % USE_CLANG=1 make all 2> build.log % perl say $F[0] if /: error:/ build.log | sort | xargs sed /#include ""util\/testharness.h""/i ""util\/string_util.h"" ``` Test Plan: Make sure make all completes with no errors. ``` % make all ``` Reviewers: meyering, igor, sdong Reviewed By: sdong Subscribers: dhruba, leveldb Differential Revision: switch to gtest Summary: Our existing test notation is very similar to what is used in gtest. It makes it easy to adopt what is different. In this diff I modify existing [[ | test fixture ]] classes to inherit from `testing::Test`. Also for unit tests that use fixture class, `TEST` is replaced with `TEST_F` as required in gtest. There are several custom `main` functions in our existing tests. To make this transition easier, I modify all `main` functions to fallow gtest notation. But eventually we can remove them and use implementation of `main` that gtest provides. ```lang=bash % cat ~/transform files=$(git ls-files *test\.cc) for file in $files do if grep ""rocksdb::test::RunAllTests()"" $file then if grep ^class \w+Test { $file then perl s/^(class \w+Test) {/${1}: public testing::Test {/g $file perl s/^(TEST)/${1}_F/g $file fi perl s/(int main.*\{)/${1}::testing::InitGoogleTest(&argc, argv);/g $file perl s/rocksdb::test::RunAllTests/RUN_ALL_TESTS/g $file fi done % sh ~/transform % make format ``` Second iteration of this diff contains only scripted changes. Third iteration contains manual changes to fix last errors and make it compilable. Test Plan: Build and notice no errors. ```lang=bash % USE_CLANG=1 make check ``` Tests are still testing. Reviewers: meyering, sdong, rven, igor Reviewed By: igor Subscribers: dhruba, leveldb Differential Revision: Replace ASSERT* with EXPECT* in functions that does not return void value Summary: gtest does not use exceptions to fail a unit test by design, and `ASSERT*`s are implemented using `return`. As a consequence we cannot use `ASSERT*` in a function that does not return `void` value ([[ | 1]]), and have to fix our existing code. This diff does this in a generic way, with no manual changes. In order to detect all existing `ASSERT*` that are used in functions that doesnt return void value, I change the code to generate compile errors for such cases. In `util/testharness.h` I defined `EXPECT*` assertions, the same way as `ASSERT*`, and redefined `ASSERT*` to return `void`. Then executed: ```lang=bash % USE_CLANG=1 make all 2> build.log % perl print ""-- "".$F[0].""\n"" if /: error:/ \ build.log | xargs 1 perl s/ASSERT/EXPECT/g if $. $number % make format ``` After that I reverted back change to `ASSERT*` in `util/testharness.h`. But preserved introduced `EXPECT*`, which is the same as `ASSERT*`. This will be deleted once switched to gtest. This diff is independent and contains manual changes only in `util/testharness.h`. Test Plan: Make sure all tests are passing. ```lang=bash % USE_CLANG=1 make check ``` Reviewers: igor, lgalanis, sdong, yufei.zhu, rven, meyering Reviewed By: meyering Subscribers: dhruba, leveldb Differential Revision: Small refactoring before migrating to gtest Summary: These changes are necessary to make tests look more generic, and avoid feature conflicts with gtest. Test Plan: Make sure no build errors, and all test are passing. ``` % make check ``` Reviewers: igor, meyering Reviewed By: meyering Subscribers: dhruba, leveldb Differential Revision: Add missing override Summary: When using latest clang (3.6 or 3.7/trunck) rocksdb is failing with many errors. Almost all of them are missing override errors. This diff adds missing override keyword. No manual changes. Prerequisites: bear and clang 3.5 build with extra tools ```lang=bash % USE_CLANG=1 bear make all generate a compilation database % clang-modernize . . % make format ``` Test Plan: Make sure all tests are passing. ```lang=bash % default fb code clang. % make check ``` Verify less error and no missing override errors. ```lang=bash % Have trunk clang present in path. % ROCKSDB_NO_FBCODE=1 CC=clang CXX=clang++ make ``` Reviewers: igor, kradhakrishnan, rven, meyering, sdong Reviewed By: sdong Subscribers: dhruba, leveldb Differential Revision: add missing 5th arg in TestArgs initializer Summary: Adding and to CXXFLAGS provoked this failure: table/table_test.cc:1854:56: error: missing initializer for member ërocksdb::TestArgs::format_versioní [-Werror=missing-field-initializers] TestArgs args { DB_TEST, false, 16, kNoCompression }; ^ Add the missing, 5th value (format_version). Test Plan: Run ""make EXTRA_CXXFLAGS=-W and see fewer errors. Reviewers: ljin, sdong, igor.sugak, igor Reviewed By: igor Subscribers: dhruba Differential Revision:"
,,0.2405,rocksdb,"rocksdb: Add missing override Summary: When using latest clang (3.6 or 3.7/trunck) rocksdb is failing with many errors. Almost all of them are missing override errors. This diff adds missing override keyword. No manual changes. Prerequisites: bear and clang 3.5 build with extra tools ```lang=bash % USE_CLANG=1 bear make all generate a compilation database % clang-modernize . . % make format ``` Test Plan: Make sure all tests are passing. ```lang=bash % default fb code clang. % make check ``` Verify less error and no missing override errors. ```lang=bash % Have trunk clang present in path. % ROCKSDB_NO_FBCODE=1 CC=clang CXX=clang++ make ``` Reviewers: igor, kradhakrishnan, rven, meyering, sdong Reviewed By: sdong Subscribers: dhruba, leveldb Differential Revision: remove extraneous ""const"" attribute from return type Summary: The ""const"" attribute does not make sense on a return type, and provokes a warning/error from gcc Test Plan: Run ""make EXTRA_CXXFLAGS=-W and see fewer errors. Reviewers: ljin, sdong, igor.sugak, igor Reviewed By: igor Subscribers: dhruba Differential Revision:"
,,0.3447,rocksdb,"Reset parent_index and base_index when picking files marked for compaction Summary: This caused a crash of our MongoDB + RocksDB instance. PickCompactionBySize() sets its own parent_index. We never reset this parent_index when picking PickFilesMarkedForCompactionExperimental(). So we might end up doing SetupOtherInputs() with parent_index that was set by PickCompactionBySize, although were using compaction calculated using PickFilesMarkedForCompactionExperimental. Test Plan: Added a unit test that fails with assertion on master. Reviewers: yhchiang, rven, sdong Reviewed By: sdong Subscribers: dhruba, leveldb Differential Revision: pull request from charsyam/feature/type-1 fix typos/fix typos/Fix CompactRange for universal compaction with num_levels > 1 Summary: CompactRange for universal compaction with num_levels > 1 seems to have a bug. The unit test also has a bug so it doesnt capture the problem. Fix it. Revert the compact range to the logic equivalent to num_levels=1. Always compact all files together. It should also fix DBTest.IncreaseUniversalCompactionNumLevels. The issue was that options.write_buffer_size 100 10 and options.write_buffer_size 100 10 are not used in later test scenarios. So write_buffer_size of 4MB was used. The compaction trigger condition is not anymore obvious as expected. Test Plan: Run the new test and all test suites Reviewers: yhchiang, rven, kradhakrishnan, anthony, igor Reviewed By: igor Subscribers: leveldb, dhruba Differential Revision: an assertion in CompactionPicker Summary: Reading CompactionPicker I noticed this dangerous substraction of two unsigned integers. We should assert to mark this as safe. Test Plan: make check Reviewers: anthony, rven, yhchiang, sdong Reviewed By: sdong Subscribers: kradhakrishnan, dhruba, leveldb Differential Revision: experimental API MarkForCompaction() Summary: Some Mongo+Rocks datasets in Parses environment are not doing compactions very frequently. During the quiet period (with no IO), wed like to schedule compactions so that our reads become faster. Also, aggressively compacting during quiet periods helps when write bursts happen. In addition, we also want to compact files that are containing deleted key ranges (like old oplog keys). All of this is currently not possible with CompactRange() because its single-threaded and blocks all other compactions from happening. Running CompactRange() risks an issue of blocking writes because we generate too much Level 0 files before the compaction is over. Stopping writes is very dangerous because they hold transaction locks. We tried running manual compaction once on Mongo+Rocks and everything fell apart. MarkForCompaction() solves all of those problems. This is very light-weight manual compaction. It is lower priority than automatic compactions, which means it shouldnt interfere with background process keeping the LSM tree clean. However, if no automatic compactions need to be run (or we have extra background threads available), we will start compacting files that are marked for compaction. Test Plan: added a new unit test Reviewers: yhchiang, rven, MarkCallaghan, sdong Reviewed By: sdong Subscribers: yoshinorim, dhruba, leveldb Differential Revision: bug in ExpandWhileOverlapping() Summary: If ExpandWhileOverlapping() we dont clear inputs. Thats a bug introduced by my recent patch However, we have no tests covering ExpandWhileOverlapping(). I created a task t6771252 to add ExpandWhileOverlapping() tests. Test Plan: make check Reviewers: sdong, rven, yhchiang Reviewed By: yhchiang Subscribers: dhruba, leveldb Differential Revision: to allow a callback with an argument and use it to get DBTest.DynamicLevelCompressionPerLevel2 more straight-forward Summary: Allow users to give a callback function with parameter using sync point, so more complicated verification can be done in tests. Use it in DBTest.DynamicLevelCompressionPerLevel2 so that failures will be more easy to debug. Test Plan: Run all tests. Run DBTest.DynamicLevelCompressionPerLevel2 with valgrind check. Reviewers: rven, yhchiang, anthony, kradhakrishnan, igor Reviewed By: igor Subscribers: leveldb, dhruba Differential Revision: compile warning on CLANG Summary: oops Test Plan: compiles now Reviewers: sdong, yhchiang Subscribers: dhruba, leveldb Differential Revision: Compaction class easier to use Summary: The goal of this diff is to make Compaction class easier to use. This should also make new compaction algorithms easier to write (like CompactFiles from and dynamic leveled and multi-leveled universal from Here are couple of things demonstrating that Compaction class is hard to use: 1. we have two constructors of Compaction class 2. theres this thing called grandparents_, but it appears to only be setup for leveled compaction and not compactfiles 3. its easy to introduce a subtle and dangerous bug like this: D36225 4. SetupBottomMostLevel() is hard to understand and it shouldnt be. See this comment: It also made it harder for to write CompactFiles, as evidenced by this: The problem is that we create Compaction object, which holds a lot of state, and then pass it around to some functions. After those functions are done mutating, then we call couple of functions on Compaction object, like SetupBottommostLevel() and MarkFilesBeingCompacted(). It is very hard to see whats happening with all that Compactions state while its travelling across different functions. If youre writing a new PickCompaction() function you need to try really hard to understand what are all the functions you need to run on Compaction object and what state you need to setup. My proposed solution is to make important parts of Compaction immutable after construction. PickCompaction() should calculate compaction inputs and then pass them onto Compaction object once they are finalized. That makes it easy to create a new compaction just provide all the parameters to the constructor and youre done. No need to call confusing functions after you created your object. This diff doesnt fully achieve that goal, but it comes pretty close. Here are some of the changes: * have one Compaction constructor instead of two. * inputs_ is constant after construction * MarkFilesBeingCompacted() is now private to Compaction class and automatically called on construction/destruction. * SetupBottommostLevel() is gone. Compaction figures it out on its own based on the input. * CompactionPickers functions are not passing around Compaction object anymore. They are only passing around the state that they need. Test Plan: make check make asan_check make valgrind_check Reviewers: rven, anthony, sdong, yhchiang Reviewed By: yhchiang Subscribers: sdong, yhchiang, dhruba, leveldb Differential Revision: to allow RocksDB to pick size bases of levels dynamically. Summary: When having fixed max_bytes_for_level_base, the ratio of size of largest level and the second one can range from 0 to the multiplier. This makes LSM tree frequently irregular and unpredictable. It can also cause poor space amplification in some cases. In this improvement (proposed by Igor Kabiljo), we introduce a parameter option.level_compaction_use_dynamic_max_bytes. When turning it on, RocksDB is free to pick a level base in the range of (options.max_bytes_for_level_base/options.max_bytes_for_level_multiplier, options.max_bytes_for_level_base] so that real level ratios are close to options.max_bytes_for_level_multiplier. Test Plan: New unit tests and pass tests suites including valgrind. Reviewers: MarkCallaghan, rven, yhchiang, igor, ikabiljo Reviewed By: ikabiljo Subscribers: yoshinorim, ikabiljo, dhruba, leveldb Differential Revision:"
