Topic_no,Keywords,Contrib,System,Text
,,0.43700000000000006,rocksdb,"Improve perf of Pessimistic Transaction expirations (and optimistic transactions) Summary: copy from task 8196669: 1) Optimistic transactions do not support batching writes from different threads. 2) Pessimistic transactions do not support batching writes if an expiration time is set. In these 2 cases, we currently do not do any write batching in DBImpl::WriteImpl() because there is a WriteCallback that could decide at the last minute to abort the write. But we could support batching write operations with callbacks if we make sure to process the callbacks correctly. To do this, we would first need to modify write_thread.cc to stop preventing writes with callbacks from being batched together. Then we would need to change DBImpl::WriteImpl() to call all WriteCallbacks in a batch, only write the batches that succeed, and correctly set the state of each batchs WriteThread::Writer. Test Plan: Added test WriteWithCallbackTest to write_callback_test.cc which creates multiple client threads and verifies that writes are batched and executed properly. Reviewers: hermanlee4, anthony, ngbronson Subscribers: leveldb, dhruba Differential Revision: duplicated property constants Summary: Before this diff, there were duplicated constants to refer to properties (user- facing API had strings and InternalStats had an enum). I noticed these were inconsistent in terms of which constants are provided, names of constants, and documentation of constants. Overall it seemed annoying/error-prone to maintain these duplicated constants. So, this diff gets rid of InternalStatss constants and replaces them with a map keyed on the user-facing constant. The value in that map contains a function pointer to get the property value, so we dont need to do string matching while holding db->mutex_. This approach has a side benefit of making many small handler functions rather than a giant switch-statement. Test Plan: db_properties_test passes, running ""make commit-prereq Reviewers: sdong, yhchiang, kradhakrishnan, IslamAbdelRahman, rven, anthony Reviewed By: anthony Subscribers: dhruba, leveldb Differential Revision: for with batching Summary: Concurrent memtable adds were incorrectly computing the last sequence number for a write batch group when the write batches were not solitary. This is the cause of Test Plan: 1. unit tests 2. new unit test 3. parallel db_bench stress tests with batch size of 10 and asserts enabled Reviewers: igor, sdong Reviewed By: sdong Subscribers: IslamAbdelRahman, MarkCallaghan, dhruba Differential Revision: includes cleanup] Remove util->db dependency for ThreadStatusUtil Summary: We can avoid the dependency by forward-declaring ColumnFamilyData and then treating it as a black box. That means callers of ThreadStatusUtil need to explicitly provide more options, even if they can be derived from the ColumnFamilyData, since ThreadStatusUtil doesnt include the definition. This is part of a series of diffs to eliminate circular dependencies between directories (e.g., db/* files depending on util/* files and vice-versa). Test Plan: $ ./db_test $ make commit-prereq Reviewers: sdong, yhchiang, IslamAbdelRahman Subscribers: dhruba, leveldb Differential Revision: includes cleanup] Move cross-function test points Summary: I split the db-specific test points out into a separate file under db/ directory. There were also a few bugs to fix in xfunc.{h,cc} that prevented it from compiling previously; see Test Plan: compilation works now, below command works, will also run ""make xfunc"". $ make check ROCKSDB_XFUNC_TEST=managed_new tests-regexp=DBTest Reviewers: sdong, yhchiang Subscribers: dhruba Differential Revision: SstFileWriter from creating empty sst files Summary: SstFileWriter may create an sst file with no entries Right now this will fail when being ingested using DB::AddFile() saying that the keys are corrupted Test Plan: make check Reviewers: yhchiang, rven, anthony, sdong Reviewed By: sdong Subscribers: dhruba Differential Revision: for build on solaris Makefile adjust paths for solaris build Makefile enable _GLIBCXX_USE_C99 so that std::to_string is available db_compaction_test.cc Initialise a variable to avoid a compilation error db_impl.cc Include db_test.cc Include Environment.java recognise solaris envrionment options_bulder.cc Make log unambiguous geodb_impl.cc Make log and floor unambiguous/DeleteFilesInRange: Mark files to be deleted as being compacted before applying change Summary: While running the myrocks regression suite, I found that while dropping a table soon after inserting rows into it resulted in an assertion failure in CheckConsistencyForDeletes for not finding a file which was recently added or moved. Marking the files to be deleted as being compacted before calling LogAndApplyChange fixed the assertion failures. Test Plan: DBCompactionTest.DeleteFileRange Reviewers: IslamAbdelRahman, anthony, yhchiang, kradhakrishnan, sdong Reviewed By: sdong Subscribers: dhruba, yoshinorim, leveldb Differential Revision: to closer match MyRocks build Summary: myrocks seems to build rocksdb using (and treats warnings as errors). This diff adds that flag to the rocksdb build, and fixes the compilation failures that result. I have not checked for any other differences in the build flags for rocksdb build as part of myrocks. Test Plan: make check Reviewers: sdong, rven Reviewed By: rven Subscribers: dhruba Differential Revision: Visual Studio Warning C4351 Currently Windows build is broken because of Warning C4351. Disable the warning before figuring out the right way to fix it./Fix CLANG errors introduced by 7d87f02799bd0a8fd36df24fab5baa4968615c86 Summary: Fix some CLANG errors introduced in 7d87f02799bd0a8fd36df24fab5baa4968615c86 Test Plan: Build with both of CLANG and gcc Reviewers: rven, yhchiang, kradhakrishnan, anthony, IslamAbdelRahman, ngbronson Subscribers: leveldb, dhruba Differential Revision: for concurrent adds to memtable Summary: This diff adds support for concurrent adds to the skiplist memtable implementations. Memory allocation is made thread-safe by the addition of a spinlock, with small per-core buffers to avoid contention. Concurrent memtable writes are made via an additional method and dont impose a performance overhead on the non-concurrent case, so parallelism can be selected on a per-batch basis. Write thread synchronization is an increasing bottleneck for higher levels of concurrency, so this diff adds (default off). This feature causes threads joining a write batch group to spin for a short time (default 100 usec) using sched_yield, rather than going to sleep on a mutex. If the timing of the yield calls indicates that another thread has actually run during the yield then spinning is avoided. This option improves performance for concurrent situations even without parallel adds, although it has the potential to increase CPU usage (and the heuristic adaptation is not yet mature). Parallel writes are not currently compatible with inplace updates, update callbacks, or delete filtering. Enable it with (and Parallel memtable writes are performance neutral when there is no actual parallelism, and in my experiments (SSD server-class Linux and varying contention and key sizes for fillrandom) they are always a performance win when there is more than one thread. Statistics are updated earlier in the write path, dropping the number of DB mutex acquisitions from 2 to 1 for almost all cases. This diff was motivated and inspired by Yahoos cLSM work. It is more conservative than cLSM: RocksDBs write batch group leader role is preserved (along with all of the existing flush and write throttling logic) and concurrent writers are blocked until all memtable insertions have completed and the sequence number has been advanced, to preserve linearizability. My test config is ""db_bench on a two-socket Xeon E5-2660 2.2Ghz with lots of memory and an SSD hard drive. With 1 thread I get ~440Kops/sec. Peak performance for 1 socket (numactl is slightly more than 1Mops/sec, at 16 threads. Peak performance across both sockets happens at 30 threads, and is ~900Kops/sec, although with fewer threads there is less performance loss when the system has background work. Test Plan: 1. concurrent stress tests for InlineSkipList and DynamicBloom 2. make clean; make check 3. make clean; DISABLE_JEMALLOC=1 make valgrind_check; valgrind db_bench 4. make clean; COMPILE_WITH_TSAN=1 make all check; db_bench 5. make clean; COMPILE_WITH_ASAN=1 make all check; db_bench 6. make clean; OPT=-DROCKSDB_LITE make check 7. verify no perf regressions when disabled Reviewers: igor, sdong Reviewed By: sdong Subscribers: MarkCallaghan, IslamAbdelRahman, anthony, yhchiang, rven, sdong, guyg8, kradhakrishnan, dhruba Differential Revision: call to install superversion and schedule work in enableautocompactions Summary: This patch fixes There is a recent change in rocksdb to disable auto compactions on startup: However, there is a small timing window where a column family needs to be compacted and schedules a compaction, but the scheduled compaction fails when it checks the disable_auto_compactions setting. The expectation is once the application is ready, it will call EnableAutoCompactions() to allow new compactions to go through. However, if the Column family is stalled because L0 is full, and no writes can go through, it is possible the column family may never have a new compaction request get scheduled. EnableAutoCompaction() should probably schedule an new flush and compaction event when it resets disable_auto_compaction. Using InstallSuperVersionAndScheduleWork, we call SchedulePendingFlush, SchedulePendingCompaction, as well as MaybeScheduleFlushOrcompaction on all the column families to avoid the situation above. This is still a first pass for feedback. Could also just call SchedePendingFlush and SchedulePendingCompaction directly. Test Plan: Run on Asan build cd _build-5.6-ASan/ && ./mysql-test/mtr rocksdb_rpl.rpl_rocksdb_stress_crash Ensure that it no longer hangs during the test. Reviewers: hermanlee4, yhchiang, anthony Reviewed By: anthony Subscribers: leveldb, yhchiang, dhruba Differential Revision: minor bugs in delete operator, snprintf, and size_t usage Summary: List of changes: 1) Fix the snprintf() usage in cases where wrong variable was used to determine the output buffer size. 2) Remove unnecessary checks before calling delete operator. 3) Increase code correctness by using size_t type when getting vectors size. 4) Unify the coding style by removing namespace::std usage at the top of the file to confirm to the majority usage. 5) Fix various lint errors pointed out by arc lint. Test Plan: Code review and build: git diff make clean make 32 commit-prereq arc lint Reviewers: kradhakrishnan, sdong, rven, anthony, yhchiang, igor Reviewed By: igor Subscribers: dhruba, leveldb Differential Revision: manual compactions in parallel with other automatic or manual compactions in restricted cases Summary: This diff provides a framework for doing manual compactions in parallel with other compactions. We now have a deque of manual compactions. We also pass manual compactions as an argument from RunManualCompactions down to BackgroundCompactions, so that RunManualCompactions can be reentrant. Parallelism is controlled by the two routines ConflictingManualCompaction to allow/disallow new parallel/manual compactions based on already existing ManualCompactions. In this diff, by default manual compactions still have to run exclusive of other compactions. However, by setting the compaction option, exclusive_manual_compaction to false, it is possible to run other compactions in parallel with a manual compaction. However, we are still restricted to one manual compaction per column family at a time. All of these restrictions will be relaxed in future diffs. I will be adding more tests later. Test Plan: Rocksdb regression + new tests + valgrind Reviewers: igor, anthony, IslamAbdelRahman, kradhakrishnan, yhchiang, sdong Reviewed By: sdong Subscribers: yoshinorim, dhruba, leveldb Differential Revision: SST files for Transaction conflict detection Summary: Currently, transactions can fail even if there is no actual write conflict. This is due to relying on only the memtables to check for write-conflicts. Users have to tune memtable settings to try to avoid this, but its hard to figure out exactly how to tune these settings. With this diff, TransactionDB will use both memtables and SST files to determine if there are any write conflicts. This relies on the fact that BlockBasedTable stores sequence numbers for all writes that happen after any open snapshot. Also, D50295 is needed to prevent SingleDelete from disappearing writes (the TODOs in this test code will be fixed once the other diff is approved and merged). Note that Optimistic transactions will still rely on tuning memtable settings as we do not want to read from SST while on the write thread. Also, memtable settings can still be used to reduce how often TransactionDB needs to read SST files. Test Plan: unit tests, db bench Reviewers: rven, yhchiang, kradhakrishnan, IslamAbdelRahman, sdong Reviewed By: sdong Subscribers: dhruba, leveldb, yoshinorim Differential Revision: the fix for a race condition in persisting options Summary: This patch fix a race condition in persisting options which will cause a crash when: * Thread A obtain cf options and start to persist options based on that cf options. * Thread B kicks in and finish DropColumnFamily and delete cf_handle. * Thread A wakes up and tries to finish the persisting options and crashes. Test Plan: Add a test in column_family_test that can reproduce the crash Reviewers: anthony, IslamAbdelRahman, rven, kradhakrishnan, sdong Reviewed By: sdong Subscribers: leveldb, dhruba Differential Revision: marking snapshots for write-conflict checking Take 2 Summary: D51183 was reverted due to breaking the LITE build. This diff is the same as D51183 but with a fix for the LITE BUILD(D51693) Test Plan: run all unit tests Reviewers: sdong Reviewed By: sdong Subscribers: dhruba, leveldb Differential Revision: ""Fix a race condition in persisting options"" This reverts commit 2fa3ed5180340e485a1caf6fa71cc400ea599278. It breaks RocksDB lite build/Fix a race condition in persisting options Summary: This patch fix a race condition in persisting options which will cause a crash when: * Thread A obtain cf options and start to persist options based on that cf options. * Thread B kicks in and finish DropColumnFamily and delete cf_handle. * Thread A wakes up and tries to finish the persisting options and crashes. Test Plan: Add a test in column_family_test that can reproduce the crash Reviewers: anthony, IslamAbdelRahman, rven, kradhakrishnan, sdong Reviewed By: sdong Subscribers: dhruba, leveldb Differential Revision: public api to schedule flush/compaction, code to prevent race with db::open Summary: Fixes T8781168. Added a new function EnableAutoCompactions in db.h to be publicly avialable. This allows compaction to be re-enabled after disabling it via SetOptions Refactored code to set the dbptr earlier on in TransactionDB::Open and DB::Open Temporarily disable auto_compaction in TransactionDB::Open until dbptr is set to prevent race condition. Test Plan: Ran make all check verified fix on myrocks side: was able to reproduce the seg fault with ../tools/mysqltest.sh rocksdb.drop_table method was to manually sleep the thread after DB::Open but before TransactionDB ptr was assigned in transaction_db_impl.cc: DB::Open(db_options, dbname, column_families_copy, handles, &db); clock_t goal (60000 * 10) + clock(); while (goal > clock()); ...dbptr(aka rdb) gets assigned below verified my changes fixed the issue. Also added unit test ToggleAutoCompaction in transaction_test.cc Reviewers: hermanlee4, anthony Reviewed By: anthony Subscribers: alex, dhruba Differential Revision: to only flush the column family with the largest memtable while option.db_write_buffer_size is hit Summary: When option.db_write_buffer_size is hit, we currently flush all column families. Move to flush the column family with the largest active memt table instead. In this way, we can avoid too many small files in some cases. Test Plan: Modify test DBTest.SharedWriteBuffer to work with the updated behavior Reviewers: kradhakrishnan, yhchiang, rven, anthony, IslamAbdelRahman, igor Reviewed By: igor Subscribers: march, leveldb, dhruba Differential Revision:"
,,0.23800000000000002,rocksdb,"Not scheduling more L1->L2 compaction if L0->L1 is pending with higher priority Summary: When L0->L1 is pending, there may be one L1->L2 compaction going on which prevents the L0->L1 compaction from happening. If L1 needs more data to be moved to L2, then we may continue scheduling more L1->L2 compactions. The end result may be that L0->L1 compaction will not happen until L1 size drops to below target size. We can reduce the stalling because of number of L0 files by stopping schedling new L1->L2 compaction when L0s score is higher than L1. Test Plan: Run all existing tests. Reviewers: yhchiang, MarkCallaghan, rven, anthony, IslamAbdelRahman, igor Reviewed By: igor Subscribers: leveldb, dhruba Differential Revision: pull request from zhipeng-jia/develop fix typo: sr to picking_sr/fix typo: sr to picking_sr/Fix minor bugs in delete operator, snprintf, and size_t usage Summary: List of changes: 1) Fix the snprintf() usage in cases where wrong variable was used to determine the output buffer size. 2) Remove unnecessary checks before calling delete operator. 3) Increase code correctness by using size_t type when getting vectors size. 4) Unify the coding style by removing namespace::std usage at the top of the file to confirm to the majority usage. 5) Fix various lint errors pointed out by arc lint. Test Plan: Code review and build: git diff make clean make 32 commit-prereq arc lint Reviewers: kradhakrishnan, sdong, rven, anthony, yhchiang, igor Reviewed By: igor Subscribers: dhruba, leveldb Differential Revision: manual compactions in parallel with other automatic or manual compactions in restricted cases Summary: This diff provides a framework for doing manual compactions in parallel with other compactions. We now have a deque of manual compactions. We also pass manual compactions as an argument from RunManualCompactions down to BackgroundCompactions, so that RunManualCompactions can be reentrant. Parallelism is controlled by the two routines ConflictingManualCompaction to allow/disallow new parallel/manual compactions based on already existing ManualCompactions. In this diff, by default manual compactions still have to run exclusive of other compactions. However, by setting the compaction option, exclusive_manual_compaction to false, it is possible to run other compactions in parallel with a manual compaction. However, we are still restricted to one manual compaction per column family at a time. All of these restrictions will be relaxed in future diffs. I will be adding more tests later. Test Plan: Rocksdb regression + new tests + valgrind Reviewers: igor, anthony, IslamAbdelRahman, kradhakrishnan, yhchiang, sdong Reviewed By: sdong Subscribers: yoshinorim, dhruba, leveldb Differential Revision: avoid to form compactions if there is no file Summary: Currently RocksDB may break in lines like this: for (size_t i sorted_runs.size() 1; i >= first_index_after; i--) { if options.level0_file_num_compaction_trigger=0. Fix it by not executing the logic of picking compactions if there is no file (sorted_runs.size() 0). Also internally set options.level0_file_num_compaction_trigger=1 if users give a 0. 0 is a value makes no sense in RocksDB. Test Plan: Run all tests. Will add a unit test too. Reviewers: yhchiang, IslamAbdelRahman, anthony, kradhakrishnan, rven Reviewed By: rven Subscribers: leveldb, dhruba Differential Revision:"
,,0.5327,rocksdb,"Eliminate duplicated property constants Summary: Before this diff, there were duplicated constants to refer to properties (user- facing API had strings and InternalStats had an enum). I noticed these were inconsistent in terms of which constants are provided, names of constants, and documentation of constants. Overall it seemed annoying/error-prone to maintain these duplicated constants. So, this diff gets rid of InternalStatss constants and replaces them with a map keyed on the user-facing constant. The value in that map contains a function pointer to get the property value, so we dont need to do string matching while holding db->mutex_. This approach has a side benefit of making many small handler functions rather than a giant switch-statement. Test Plan: db_properties_test passes, running ""make commit-prereq Reviewers: sdong, yhchiang, kradhakrishnan, IslamAbdelRahman, rven, anthony Reviewed By: anthony Subscribers: dhruba, leveldb Differential Revision: for concurrent adds to memtable Summary: This diff adds support for concurrent adds to the skiplist memtable implementations. Memory allocation is made thread-safe by the addition of a spinlock, with small per-core buffers to avoid contention. Concurrent memtable writes are made via an additional method and dont impose a performance overhead on the non-concurrent case, so parallelism can be selected on a per-batch basis. Write thread synchronization is an increasing bottleneck for higher levels of concurrency, so this diff adds (default off). This feature causes threads joining a write batch group to spin for a short time (default 100 usec) using sched_yield, rather than going to sleep on a mutex. If the timing of the yield calls indicates that another thread has actually run during the yield then spinning is avoided. This option improves performance for concurrent situations even without parallel adds, although it has the potential to increase CPU usage (and the heuristic adaptation is not yet mature). Parallel writes are not currently compatible with inplace updates, update callbacks, or delete filtering. Enable it with (and Parallel memtable writes are performance neutral when there is no actual parallelism, and in my experiments (SSD server-class Linux and varying contention and key sizes for fillrandom) they are always a performance win when there is more than one thread. Statistics are updated earlier in the write path, dropping the number of DB mutex acquisitions from 2 to 1 for almost all cases. This diff was motivated and inspired by Yahoos cLSM work. It is more conservative than cLSM: RocksDBs write batch group leader role is preserved (along with all of the existing flush and write throttling logic) and concurrent writers are blocked until all memtable insertions have completed and the sequence number has been advanced, to preserve linearizability. My test config is ""db_bench on a two-socket Xeon E5-2660 2.2Ghz with lots of memory and an SSD hard drive. With 1 thread I get ~440Kops/sec. Peak performance for 1 socket (numactl is slightly more than 1Mops/sec, at 16 threads. Peak performance across both sockets happens at 30 threads, and is ~900Kops/sec, although with fewer threads there is less performance loss when the system has background work. Test Plan: 1. concurrent stress tests for InlineSkipList and DynamicBloom 2. make clean; make check 3. make clean; DISABLE_JEMALLOC=1 make valgrind_check; valgrind db_bench 4. make clean; COMPILE_WITH_TSAN=1 make all check; db_bench 5. make clean; COMPILE_WITH_ASAN=1 make all check; db_bench 6. make clean; OPT=-DROCKSDB_LITE make check 7. verify no perf regressions when disabled Reviewers: igor, sdong Reviewed By: sdong Subscribers: MarkCallaghan, IslamAbdelRahman, anthony, yhchiang, rven, sdong, guyg8, kradhakrishnan, dhruba Differential Revision: when writing to the last write buffer Summary: Now if inserting to mem table is much faster than writing to files, there is no mechanism users can rely on to avoid stopping for reaching options.max_write_buffer_number. With the commit, if there are more than four maximum write buffers configured, we slow down to the rate of options.delayed_write_rate while we reach the last one. Test Plan: 1. Add a new unit test. 2. Run db_bench with ./db_bench based on hard drive and see stopping is avoided with the commit. Reviewers: yhchiang, IslamAbdelRahman, anthony, rven, kradhakrishnan, igor Reviewed By: igor Subscribers: MarkCallaghan, leveldb, dhruba Differential Revision: rebase issues and new code warnings./"
