Topic_no,Keywords,Contrib,System,Text
,,0.3215,rocksdb,"Check PrefixMayMatch on Seek() Summary: As a follow-up diff for add optimization to check PrefixMayMatch on Seek() Test Plan: make all check Reviewers: igor, haobo, sdong, yhchiang, dhruba Reviewed By: haobo CC: leveldb Differential Revision: family logging Summary: Now that we have column families involved, we need to add extra context to every log message. They now start with ""[column family name] log message"" Also added some logging that I think would be useful, like level summary after every flush (I often needed that when going through the logs). Test Plan: make check + ran db_bench to confirm Im happy with log output Reviewers: dhruba, haobo, ljin, yhchiang, sdong Reviewed By: haobo CC: leveldb Differential Revision: for narrowing down FindFile range and avoiding checking unrelevant L0 files Summary: The file tree structure in Version is prebuilt and the range of each file is known. On the Get() code path, we do binary search in FindFile() by comparing target key with each files largest key and also check the range for each L0 file. With some pre-calculated knowledge, each key comparision that has been done can serve as a hint to narrow down further searches: (1) If a key falls within a L0 files range, we can safely skip the next file if its range does not overlap with the current one. (2) If a key falls within a files range in level L0 Ln-1, we should only need to binary search in the next level for files that overlap with the current one. (1) will be able to skip some files depending one the key distribution. (2) can greatly reduce the range of binary search, especially for bottom levels, given that one file most likely only overlaps with N files from the level below (where N is max_bytes_for_level_multiplier). So on level L, we will only look at ~N files instead of N^L files. Some inital results: measured with 500M key DB, when write is light (10k/s 1.2M/s), this improves QPS ~7% on top of blocked bloom. When write is heavier (80k/s 9.6M/s), it gives us ~13% improvement. Test Plan: make all check Reviewers: haobo, igor, dhruba, sdong, yhchiang Reviewed By: haobo CC: leveldb Differential Revision: accessing multiple objects in Version::Get() Summary: One of our profilings shows that Version::Get() sometimes is slow when getting pointer of user comparators or other global objects. In this patch: (1) we keep pointers of immutable objects in Version to avoid accesses them though option objects or cfd objects (2) table_reader is directly cached in FileMetaData so that table cache dont have to go through handle first to fetch it (3) If level 0 has less than 3 files, skip the filtering logic based on SST tables key range. Smallest and largest key are stored in separated memory locations, which has potential cache misses Test Plan: make all check Reviewers: haobo, ljin Reviewed By: haobo CC: igor, yhchiang, nkg-, leveldb Differential Revision: family support for DB::OpenForReadOnly() Summary: When opening DB in read-only mode, client can choose to only specify a subset of column families (""default"" column family cant be omitted, though) Test Plan: added a unit test in column_family_test Reviewers: haobo, sdong, ljin, dhruba Reviewed By: haobo CC: leveldb Differential Revision: env_ from MergingIterator Summary: env_ is not used. Compiling for iOS complains. Test Plan: compiles now Reviewers: ljin, haobo, sdong, dhruba Reviewed By: ljin CC: leveldb Differential Revision: valgrind error caused by FileMetaData as two level iterators index block handle Summary: It is a regression valgrind bug caused by using FileMetaData as index block handle. One of the fields of FileMetaData is not initialized after being contructed and copied, but Im not able to find which one. Also, I realized that its not a good idea to use FileMetaData as in TwoLevelIterator::InitDataBlock(), a copied FileMetaData can be compared with the one in version set byte by byte, but the refs can be changed. Also comparing such a large structure is slightly more expensive. Use a simpler structure instead Test Plan: Run the failing valgrind test (Harness.RandomizedLongDB) make all check Reviewers: igor, haobo, ljin Reviewed By: igor CC: yhchiang, leveldb Differential Revision: store version number in MANIFEST Summary: Talked to internal project name> folks and they found it really scary that they wont be able to roll back once they upgrade to 2.8. We should fix this. Test Plan: make check Reviewers: haobo, ljin Reviewed By: ljin CC: leveldb Differential Revision: Preallocate new MANIFEST files Summary: We dont preallocate MANIFEST file, even though we have an option for that. This diff preallocates manifest file every time we create it Test Plan: make check Reviewers: dhruba, haobo Reviewed By: haobo CC: leveldb Differential Revision: Options.max_num_files=-1, non level0 files also by pass table cache Summary: This is the part that was not finished when doing the Options.max_num_files=-1 feature. For iterating non level0 SST files (which was done using two level iterator), table cache is not bypassed. With this patch, the leftover feature is done. Test Plan: make all check; change Options.max_num_files=-1 in one of the tests to cover the codes. Reviewers: haobo, igor, dhruba, ljin, yhchiang Reviewed By: haobo CC: leveldb Differential Revision: in CompactionPicker Summary: As it turns out, we need the call to ComputeCompactionScore (previously: Finalize) in CompactionPicker. The issue caused a deadlock in db_stress: The last two lines before a deadlock were: 2014/03/18-22:43:41.481029 7facafbee700 (Original Log Time 2014/03/18-22:43:41.480989) Compaction nothing to do 2014/03/18-22:43:41.481041 7faccf7fc700 wait for fewer level0 files... ""Compaction nothing to do"" and other thread waiting for fewer level0 files. Hm hm. I moved the pre-sorting to SaveTo, which should fix both the original and the new issue. Test Plan: make check for now, will run db_stress in jenkins Reviewers: dhruba, haobo, sdong Reviewed By: haobo CC: leveldb Differential Revision: shared_ptr assignment in Version::Get() Summary: This is a 500ns operation while the whole Get() call takes only a few micro Test Plan: ran db_bench, for a DB with 50M keys, QPS jumps from 5.2M/s to 7.2M/s Reviewers: haobo, igor, dhruba Reviewed By: haobo CC: leveldb Differential Revision: Finalize in CompactionPicker Summary: Finalize re-sorts (read: mutates) the files_ in Version* and it is called by CompactionPicker during normal runtime. At the same time, this same Version* lives in the SuperVersion* and is accessed without the mutex in GetImpl() code path. Mutating the files_ in one thread and reading the same files_ in another thread is a bad idea. It caused this issue: Long-term, we need to be more careful with method contracts and clearly document what state can be mutated when. Now that we are much faster because we dont lock in GetImpl(), we keep running into data races that were not a problem before when we were slower. db_stress has been very helpful in detecting those. Short-term, I removed Finalize() from CompactionPicker. Note: I believe this is an issue in current 2.7 version running in production. Test Plan: make check Will also run db_stress to see if issue is gone Reviewers: sdong, ljin, dhruba, haobo Reviewed By: sdong CC: leveldb Differential Revision: the log_number check in Recover() Summary: There is a chance that an old MANIFEST is corrupted in 2.7 but just not noticed. This check would fail them. Change it to log instead of returning a Corruption status. Test Plan: make Reviewers: haobo, igor Reviewed By: igor CC: leveldb Differential Revision: version in dumpmanifest/Optimize fallocation Summary: Based on my recent findings (posted in our internal group), if we use fallocate without KEEP_SIZE flag, we get superior performance of fdatasync() in append-only workloads. This diff provides an option for user to not use KEEP_SIZE flag, thus optimizing his sync performance by up to 2x-3x. At one point we also just called posix_fallocate instead of fallocate, which isnt very fast: (tl;dr it manually writes out zero bytes to allocate storage). This diff also fixes that, by first calling fallocate and then posix_fallocate if fallocate is not supported. Test Plan: make check Reviewers: dhruba, sdong, haobo, ljin Reviewed By: dhruba CC: leveldb Differential Revision: race condition in manifest roll Summary: When the manifest is getting rolled the following happens: 1) manifest_file_number_ is assigned to a new manifest number (even though the old one is still current) 2) mutex is unlocked 3) SetCurrentFile() creates temporary file manifest_file_number_.dbtmp 4) SetCurrentFile() renames manifest_file_number_.dbtmp to CURRENT 5) mutex is locked If FindObsoleteFiles happens between (3) and (4) it will: 1) Delete manifest_file_number_.dbtmp (because its not in pending_outputs_) 2) Delete old manifest (because the manifest_file_number_ already points to a new one) I introduce the concept of prev_manifest_file_number_ that will avoid the race condition. However, we should discuss the future of MANIFEST file rolling. We found some race conditions with it last week and who knows how many more are there. Nobody is using it in production because we dont trust the implementation. Should we even support it? Test Plan: make check Reviewers: ljin, dhruba, haobo, sdong Reviewed By: haobo CC: leveldb Differential Revision: log_number correctly in MANIFEST Summary: Here is what it can cause probelm: There is one memtable flush and one compaction. Both call LogAndApply(). If both edits are applied in the same batch with flush edit first and the compaction edit followed. LogAndApplyHelper() will assign compaction edit current VersionSets log number(which should be smaller than the log number from flush edit). It cause log_numbers in MANIFEST to be not monotonic increasing, which violates the assume Recover() makes. What is more is after comitting to MANIFEST file, log_number_ in VersionSet is updated to the log_number from the last edit, which is the compaction one. It ends up not updating the log_number. Test Plan: make whitebox_crash_test got another assertion about iter->valid(), not sure if that is related to this. Reviewers: igor, haobo Reviewed By: igor CC: leveldb Differential Revision: log_number in LogAndApply/CF cleanup part 2/Bug fixes introduced by code cleanup/[CF] Code cleanup part 1 Summary: Im cleaning up some code preparing for the big diff review tomorrow. This is the first part of the cleanup. Changes are mostly cosmetic. The goal is to decrease amount of code difference between columnfamilies and master branch. This diff also fixes race condition when dropping column family. Test Plan: Ran db_stress with variety of parameters Reviewers: dhruba, haobo Differential Revision: Fix column family dropping Summary: Column family should be dropped after the change has been commited Test Plan: db stress Reviewers: dhruba, haobo CC: leveldb Differential Revision: Dont reuse dropped column family IDs Summary: Column family IDs should be unique, even if column family is dropped. To achieve this, we save max column family in manifest. Note that the diff is still not ready. Im only using differential to move the patch to my Mac machine. Test Plan: added a test to column_family_test Reviewers: dhruba, haobo CC: leveldb Differential Revision: a group commit bug in LogAndApply Summary: EncodeTo(&record) does not overwrite, it appends to it. This means that group commit log and apply will look something like: record1 record1record2 record1record2record3 Im surprised this didnt show up in production, but I think the reason is that MANIFEST group commit almost never happens. This bug turned up in column family work, where opening a database failed with ""adding a same column family twice"". Test Plan: Tested the change in column family branch and observed that the problem is gone (with db_stress) Reviewers: dhruba, haobo Reviewed By: dhruba CC: leveldb Differential Revision: the terrible hack in for flush_block_policy_factory Summary: Previous code is too convoluted and I must be drunk for letting such code to be written without a second thought. Thanks to the discussion with I added the `Options` when generating the flusher, thus avoiding the tricks. Just FYI: I resisted to add Options in flush_block_policy.h since I wanted to avoid cyclic dependencies: FlushBlockPolicy dpends on Options and Options also depends FlushBlockPolicy... While I appreciate my effort to prevent it, the old design turns out creating more troubles than it tried to avoid. Test Plan: ran ./table_test Reviewers: sdong Reviewed By: sdong CC: sdong, leveldb Differential Revision: Rething LogAndApply for column families Summary: I though I might get away with as little changes to LogAndApply() as possible. It turns out this is not the case. This diff introduces different behavior of LogAndApply() for three cases: 1. column family add 2. column family drop 3. no-column family manipulation (1) and (2) dont support group commit yet. There were a lot of problems with old version od LogAndApply, detected by db_stress. The biggest was non-atomicity of manifest writes and metadata changes (i.e. if column family add is in manifest, it also has to be in in-memory data structure). Test Plan: db_stress Reviewers: dhruba, haobo CC: leveldb Differential Revision: Log::Reader more robust Summary: This diff does two things: (1) Log::Reader does not report a corruption when the last record in a log or manifest file is truncated (meaning that log writer died in the middle of the write). Inherited the code from LevelDB: (2) Turn off mmap writes for all writes to log and manifest files (2) is necessary because if we use mmap writes, the last record is not truncated, but is actually filled with zeros, making checksum fail. It is hard to recover from checksum failing. Test Plan: Added unit tests from LevelDB Actually recovered a ""corrupted"" MANIFEST file. Reviewers: dhruba, haobo Reviewed By: haobo CC: leveldb Differential Revision: LogAndApply() group commit/Set dropped column family before persisting in the manifest/[CF] Small refactor of Recover() and DumpManifest()/[CF] CreateColumnFamily fix Summary: This fixes few bugs with CreateColumnFamily * We first have to LogAndApply and then call VersionSet::CreateColumnFamily. Otherwise, WriteSnapshot might be invoked, writing out column family add inside of LogAndApply, even though its not really committed * Fix LogAndApplyHelper() to not apply log number to column_family_data, which is in case of column family add, just a dummy (default) column family * Create SuperVerion when creating column family Test Plan: column_family_test Reviewers: dhruba, haobo CC: leveldb Differential Revision: Column family support for LDB tool Summary: Added list_column_family command and also updated dump_manifest Test Plan: no Reviewers: dhruba, haobo CC: leveldb Differential Revision: More tests Summary: New unit tests for column families Test Plan: this is a test Reviewers: dhruba, haobo CC: leveldb Differential Revision: table properties Summary: Adapt table properties to column family world Test Plan: make check Reviewers: kailiu CC: leveldb Differential Revision: the table properties to application Summary: Provide a public API for users to access the table properties for each SSTable. Test Plan: Added a unit tests to test the function correctness under differnet conditions. Reviewers: haobo, dhruba, sdong Reviewed By: haobo CC: leveldb Differential Revision:"
,,0.1747,rocksdb,"[CF] Code cleanup part 1 Summary: Im cleaning up some code preparing for the big diff review tomorrow. This is the first part of the cleanup. Changes are mostly cosmetic. The goal is to decrease amount of code difference between columnfamilies and master branch. This diff also fixes race condition when dropping column family. Test Plan: Ran db_stress with variety of parameters Reviewers: dhruba, haobo Differential Revision:"
,,0.1627,rocksdb,"[CF] Fix CF bugs in WriteBatch Summary: This diff fixes two bugs: * Increase sequence number even if WriteBatch fails. This is important because WriteBatches in WAL logs have implictly increasing sequence number, even if one update in a write batch fails. This caused some writes to get lost in my CF stress testing * Tolerate invalid column family errors on recovery. When a column family is dropped, processing WAL logs can have some WriteBatches that still refer to the dropped column family. In recovery environment, we want to ignore those errors. In clients Write() code path, however, we want to return the failure to the client if hes trying to add data to invalid column family. Test Plan: db_stresss verification works now Reviewers: dhruba, haobo CC: leveldb Differential Revision:"
,,0.2039,rocksdb,"Change WriteBatch interface/[CF] Handle failure in WriteBatch::Handler Summary: * Add ColumnFamilyHandle::GetID() function. Client needs to know column familys ID to be able to construct WriteBatch * Handle WriteBatch::Handler failure gracefully. Since WriteBatch is not a very smart function (it takes raw CF id), client can add data to WriteBatch for column family that doesnt exist. In that case, we need to gracefully return failure status from DB::Write(). To do that, I added a return Status to WriteBatch functions PutCF, DeleteCF and MergeCF. Test Plan: Added test to column_family_test Reviewers: dhruba, haobo CC: leveldb Differential Revision:"
,,0.1135,rocksdb,"Fix a bug causing LOG is not created when max_log_file_size is set. Summary: Fix a bug causing LOG is not created when max_log_file_size is set. This bug is reported in issue Test Plan: Add TEST(AutoRollLoggerTest, LogFileExistence). make auto_roll_logger_test ./auto_roll_logger_test Reviewers: haobo, sdong, ljin, igor, igor2 Reviewed By: igor2 Subscribers: dhruba, leveldb Differential Revision:"
,,0.1619,rocksdb,"Adding option to save PlainTable index and bloom filter in SST file. Summary: Adding option to save PlainTable index and bloom filter in SST file. If there is no bloom block and/or index block, PlainTableReader builds new ones. Otherwise PlainTableReader just use these blocks. Test Plan: make all check Reviewers: sdong Reviewed By: sdong Subscribers: leveldb Differential Revision: PlainTableReaders variables for better data locality Summary: Clean PlainTableReaders data structures: (1) inline bloom_ (in order to do this, change DynamicBloom to allow lazy initialization) (2) remove some variables only used when initialization from the class (3) put variables not used in normal read code paths to the end of the class and reference prefix_extractor directly (4) make Options a reference. Test Plan: make all check Reviewers: haobo, ljin Reviewed By: ljin Subscribers: igor, yhchiang, dhruba, leveldb Differential Revision: replace some divide (remainder) operations with shifts in locality mode, and other improvements Summary: This patch changes meaning of options.bloom_locality: 0 means disable cache line optimization and any positive number means use CACHE_LINE_SIZE as block size (the previous behavior is the block size will be CACHE_LINE_SIZE*options.bloom_locality). By doing it, the divide operations inside a block can be replaced by a shift. Performance is improved: Also, improve the basic algorithm in two ways: (1) make sure num of blocks is an odd number (2) rotate bytes after every probe in locality mode. Since the divider is 2^n, unless doing it, we are never able to use all the bits. Improvements of false positive: Test Plan: make all check Reviewers: ljin, haobo Reviewed By: haobo Subscribers: dhruba, yhchiang, igor, leveldb Differential Revision:"
,,0.0844,rocksdb,"[RocksDB] allow LDB tool to have customized key formatter Summary: Currently ldb tool dump keys either in ascii format or hex format neither is ideal if the key has a binary structure and is not readable in ascii. This diff also allows LDB tool to be customized in ways beyond DB options. Test Plan: verify that key formatter works with some simple db with binary key. Reviewers: sdong, ljin Reviewed By: ljin Subscribers: leveldb Differential Revision:"
,,0.2355,rocksdb,"print compaction_filter name in Options.Dump Summary: Was looking at an issue. All options are the same except compaction_filter was missed from a newer package. Our option dump does not capture that Test Plan: make release Reviewers: sdong, igor, yhchiang Reviewed By: yhchiang Subscribers: leveldb Differential Revision: bytes_per_sync to 1MB if rate limiter is enabled Summary: as title Test Plan: make all check Reviewers: igor, yhchiang, sdong Reviewed By: sdong Subscribers: leveldb Differential Revision: heap-buffer-overflow issue when Options.num_levels > 7. Summary: Currently, when num_levels has been changed to > 7, internally it will not resize max_bytes_for_level_multiplier_additional. As a result, max_bytes_for_level_multiplier_additional.size() will be smaller than num_levels, which causes heap-buffer-overflow. Test Plan: make all check Reviewers: haobo, sdong, ljin Reviewed By: ljin Subscribers: leveldb Differential Revision: Missing Column Families Summary: Provide an convenience option to create column families if they are missing from the DB. Task Test Plan: added unit test. also, stress test for some time Reviewers: sdong, haobo, dhruba, ljin, yhchiang Reviewed By: yhchiang Subscribers: yhchiang, leveldb Differential Revision: compaction style Summary: Introducing new compaction style FIFO. FIFO compaction style has write amplification of 1 (+1 for WAL) and it deletes the oldest files when the total DB size exceeds pre-configured values. FIFO compaction style is suited for storing high-frequency event logs. Test Plan: Added a unit test Reviewers: dhruba, haobo, sdong Reviewed By: dhruba Subscribers: alberts, leveldb Differential Revision:"
,,0.1332,rocksdb,"Add support for C bindings to the compaction V2 filter mechanism. Test Plan: make c_test && ./c_test Some fixes after merge./C API: create missing cfs, cleanup/C API: update options w/ convenience funcs & fifo compaction/Fix valgrind error in c_test Summary: External contribution caused some valgrind errors: This diff fixes them Test Plan: ran valgrind Reviewers: sdong, yhchiang, ljin Reviewed By: ljin Subscribers: leveldb Differential Revision: API: Allow setting compaction filter factory/C API: Add support for compaction filter factories (v1)/C API: column family support/C API: support constructing write batch from serialized representation/Add a way to set compaction filter in the C API/Support for compaction filters in the C API/"
,,0.22,rocksdb,"PlainTable to encode to avoid to rewrite prefix when it is the same as the previous key Summary: Add a encoding feature of PlainTable to encode PlainTables keys to save some bytes for the same prefixes. The data format is documented in table/plain_table_factory.h Test Plan: Add unit test coverage in plain_table_db_test Reviewers: yhchiang, igor, dhruba, ljin, haobo Reviewed By: haobo Subscribers: nkg-, leveldb Differential Revision: order of parameters in adaptive table factory Summary: This is minor, but if we put the writing talbe factory as the third parameter, when we add a new table format, well have a situation: 1) block based factory 2) plain table factory 3) output factory 4) new format factory I think it makes more sense to have output as the first parameter. Also, fixed a NewAdaptiveTableFactory() call in unit test Test Plan: unit test Reviewers: sdong Reviewed By: sdong Subscribers: leveldb Differential Revision: a table factory that can read DB with both of PlainTable and BlockBasedTable in it Summary: The new table factory is used if users want to convert a DB from one table format to the other. A user can use this table to open a DB written using one table format and write new files to another table format. Test Plan: add a unit test Reviewers: haobo, igor Reviewed By: igor Subscribers: dhruba, ljin, yhchiang, leveldb Differential Revision:"
,,0.095,rocksdb,"remove malloc when create data and index iterator in Get Summary: Define Block::Iter to be an independent class to be used by block_based_table_reader When creating data and index iterator, update an existing iterator rather than new one Thus malloc and free could be reduced Benchmark, Base: commit 76286ee67ef4b89579a92134b996a681c36a1331 commands: disable_auto_compactions=1 malloc: 3.30% 1.42% free: 3.59%->1.61% Test Plan: make all check run db_stress valgrind ./db_test ./table_test Reviewers: ljin, yhchiang, dhruba, igor, sdong Reviewed By: sdong Subscribers: leveldb Differential Revision: the hash index Summary: Materialize the hash index to avoid the soaring cpu/flash usage when initializing the database. Test Plan: existing unit tests passed Reviewers: sdong, haobo Reviewed By: sdong CC: leveldb Differential Revision:"
,,0.1839,rocksdb,"Adding option to save PlainTable index and bloom filter in SST file. Summary: Adding option to save PlainTable index and bloom filter in SST file. If there is no bloom block and/or index block, PlainTableReader builds new ones. Otherwise PlainTableReader just use these blocks. Test Plan: make all check Reviewers: sdong Reviewed By: sdong Subscribers: leveldb Differential Revision:"
