Topic_no,Keywords,Contrib,System,Text
,,0.5383,rocksdb,"CompactFiles, EventListener and GetDatabaseMetaData Summary: This diff adds three sets of APIs to RocksDB. GetColumnFamilyMetaData * This APIs allow users to obtain the current state of a RocksDB instance on one column family. * See GetColumnFamilyMetaData in include/rocksdb/db.h EventListener * A virtual class that allows users to implement a set of call-back functions which will be called when specific events of a RocksDB instance happens. * To register EventListener, simply insert an EventListener to ColumnFamilyOptions::listeners CompactFiles * CompactFiles API inputs a set of file numbers and an output level, and RocksDB will try to compact those files into the specified level. Example * Example code can be found in example/compact_files_example.cc, which implements a simple external compactor using EventListener, GetColumnFamilyMetaData, and CompactFiles API. Test Plan: listener_test compactor_test example/compact_files_example export ROCKSDB_TESTS=CompactFiles db_test export ROCKSDB_TESTS=MetaData db_test Reviewers: ljin, igor, rven, sdong Reviewed By: sdong Subscribers: MarkCallaghan, dhruba, leveldb Differential Revision: to return status and also add it to StackableDB Summary: as title Test Plan: ./db_test Reviewers: sdong, yhchiang, rven, igor Reviewed By: igor Subscribers: dhruba, leveldb Differential Revision: Summary: Abstract out FlushProcess and take it out of DBImpl. This also includes taking DeletionState outside of DBImpl. Currently this diff is only doing the refactoring. Future work includes: 1. Decoupling flush_process.cc, make it depend on less state 2. Write flush_process_test, which will mock out everything that FlushProcess depends on and test it in isolation Test Plan: make check Reviewers: rven, yhchiang, sdong, ljin Reviewed By: ljin Subscribers: dhruba, leveldb Differential Revision: max_write_buffer_number dynamic Summary: as title Test Plan: unit test Reviewers: sdong, yhchiang, igor Reviewed By: igor Subscribers: dhruba, leveldb Differential Revision: compaction related options changeable Summary: make compaction related options changeable. Most of changes are tedious, following the same convention: grabs MutableCFOptions at the beginning of compaction under mutex, then pass it throughout the job and register it in SuperVersion at the end. Test Plan: make all check Reviewers: igor, yhchiang, sdong Reviewed By: sdong Subscribers: leveldb Differential Revision: for memtable related options Summary: as title Test Plan: make all check I will think a way to set up stress test for this Reviewers: sdong, yhchiang, igor Reviewed By: igor Subscribers: leveldb Differential Revision: db recovery Summary: Avoid creating unnecessary sst files while db opening Test Plan: make all check Reviewers: sdong, igor Reviewed By: igor Subscribers: zagfox, yhchiang, ljin, leveldb Differential Revision: instead of pull-model for managing Write stalls Summary: Introducing WriteController, which is a source of truth about per-DB write delays. Lets define an DB epoch as a period where there are no flushes and compactions (i.e. new epoch is started when flush or compaction finishes). Each epoch can either: * proceed with all writes without delay * delay all writes by fixed time * stop all writes The three modes are recomputed at each epoch change (flush, compaction), rather than on every write (which is currently the case). When we have a lot of column families, our current pull behavior adds a big overhead, since we need to loop over every column family for every write. With new push model, overhead on Write code-path is minimal. This is just the start. Next step is to also take care of stalls introduced by slow memtable flushes. The final goal is to eliminate function MakeRoomForWrite(), which currently needs to be called for every column family by every write. Test Plan: make check for now. Ill add some unit tests later. Also, perf test. Reviewers: dhruba, yhchiang, MarkCallaghan, sdong, ljin Reviewed By: ljin Subscribers: leveldb Differential Revision: path with arena==nullptr from NewInternalIterator Summary: Simply code by removing code path which does not use Arena from NewInternalIterator Test Plan: make all check make valgrind_check Reviewers: sdong Reviewed By: sdong Subscribers: leveldb Differential Revision: ImmutableOptions Summary: As a preparation to support updating some options dynamically, Id like to first introduce ImmutableOptions, which is a subset of Options that cannot be changed during the course of a DB lifetime without restart. ColumnFamily will keep both Options and ImmutableOptions. Any component below ColumnFamily should only take ImmutableOptions in their constructor. Other options should be taken from APIs, which will be allowed to adjust dynamically. I am yet to make changes to memtable and other related classes to take ImmutableOptions in their ctor. That can be done in a seprate diff as this one is already pretty big. Test Plan: make all check Reviewers: yhchiang, igor, sdong Reviewed By: sdong Subscribers: leveldb, dhruba Differential Revision:"
,,0.1065,rocksdb,"unfriend ForwardIterator from VersionSet Summary: as title Test Plan: make release will run full test on all stacked diffs Reviewers: sdong, yhchiang, igor Reviewed By: igor Subscribers: dhruba, leveldb Differential Revision:"
,,0.11199999999999999,rocksdb,"reduce references to cfd->options() in DBImpl Summary: I found it is almost impossible to get rid of this function in a single batch. I will take a step by step approach Test Plan: make release Reviewers: sdong, yhchiang, igor Reviewed By: igor Subscribers: leveldb Differential Revision: a new ReadOptions parameter iterate_upper_bound/"
,,0.365,rocksdb,"Turn on and fix all the errors Summary: We need to turn on for mobile. See D1671432 (internal phabricator) for details. This diff turns on the warning flag and fixes all the errors. There were also some interesting errors that I might call bugs, especially in plain table. Going forward, I think it makes sense to have this flag turned on and be very very careful when converting 64-bit to 32-bit variables. Test Plan: compiles Reviewers: ljin, rven, yhchiang, sdong Reviewed By: yhchiang Subscribers: bobbaldwin, dhruba, leveldb Differential Revision: back on Summary: It turns out that has different rules for gcc than clang. Previous commit fixed clang. This commits fixes the rest of the warnings for gcc. Test Plan: compiles Reviewers: ljin, yhchiang, rven, sdong Reviewed By: sdong Subscribers: dhruba, leveldb Differential Revision:"
,,0.4631,rocksdb,"dynamic inplace_update options Summary: Make inplace_update_support and inplace_update_num_locks dynamic. inplace_callback becomes immutable We are almost free of references to cfd->options() in db_impl Test Plan: unit test Reviewers: igor, yhchiang, rven, sdong Reviewed By: sdong Subscribers: leveldb Differential Revision: for memtable related options Summary: as title Test Plan: make all check I will think a way to set up stress test for this Reviewers: sdong, yhchiang, igor Reviewed By: igor Subscribers: leveldb Differential Revision: model for flushing memtables Summary: When memtable is full it calls the registered callback. That callback then registers column family as needing the flush. Every write checks if there are some column families that need to be flushed. This completely eliminates the need for MakeRoomForWrite() function and simplifies our Write code-path. There is some complexity with the concurrency when the column family is dropped. I made it a bit less complex by dropping the column family from the write thread in Let me know if you want to discuss this. Test Plan: make check works. Ill also run db_stress with creating and dropping column families for a while. Reviewers: yhchiang, sdong, ljin Reviewed By: ljin Subscribers: leveldb Differential Revision: pass MergeContext as pointer, not reference Summary: To follow the coding convention and make sure when passing reference as a parameter it is also const, pass MergeContext as a pointer to mem tables. Test Plan: make all check Reviewers: ljin, igor Reviewed By: igor Subscribers: leveldb, dhruba, yhchiang Differential Revision: Summary: removed reference to options in WriteBatch and DBImpl::Get() Test Plan: make all check Reviewers: yhchiang, igor, sdong Reviewed By: sdong Subscribers: leveldb Differential Revision:"
,,0.3391,rocksdb,"Turn on and fix all the errors Summary: We need to turn on for mobile. See D1671432 (internal phabricator) for details. This diff turns on the warning flag and fixes all the errors. There were also some interesting errors that I might call bugs, especially in plain table. Going forward, I think it makes sense to have this flag turned on and be very very careful when converting 64-bit to 32-bit variables. Test Plan: compiles Reviewers: ljin, rven, yhchiang, sdong Reviewed By: yhchiang Subscribers: bobbaldwin, dhruba, leveldb Differential Revision: VersionBuilder unit testable Summary: Rename Version::Builder to VersionBuilder and expose its definition to a header. Make VerisonBuilder not reference Version or ColumnFamilyData, only working with VersionStorageInfo. Add version_builder_test which has a simple test. Test Plan: make all check Reviewers: rven, yhchiang, igor, ljin Reviewed By: igor Subscribers: leveldb, dhruba Differential Revision: the bug where compaction does not fail when RocksDB cant create a new file. Summary: This diff has two fixes. 1. Fix the bug where compaction does not fail when RocksDB cant create a new file. 2. When NewWritableFiles() fails in OpenCompactionOutputFiles(), previously such fail-to-created file will be still be included as a compaction output. This patch also fixes this bug. 3. Allow VersionEdit::EncodeTo() to return Status and add basic check. Test Plan: ./version_edit_test export ROCKSDB_TESTS=FileCreationRandomFailure ./db_test Reviewers: ljin, sdong, nkg-, igor Reviewed By: igor Subscribers: dhruba, leveldb Differential Revision: swapped variable names to accurately reflect usage/Avoid retrying to read property block from a table when it does not exist. Summary: Avoid retrying to read property block from a table when it does not exist in updating stats for compensating deletion entries. In addition, ReadTableProperties() now returns Status::NotFound instead of Status::Corruption when table properties does not exist in the file. Test Plan: make db_test export ROCKSDB_TESTS=CompactionDeleteionTrigger ./db_test Reviewers: ljin, sdong Reviewed By: sdong Subscribers: leveldb Differential Revision:"
,,0.4889,rocksdb,"Get rid of mutex in CompactionJobs state Summary: Based on feedback in the diff, we shouldnt keep db_mutex in CompactionJobs state. This diff removes db_mutex from CompactionJob state, by making next_file_number_ atomic. That way we only need to pass the lock to InstallCompactionResults() because of LogAndApply() Test Plan: make check Reviewers: ljin, yhchiang, rven, sdong Reviewed By: sdong Subscribers: sdong, dhruba, leveldb Differential Revision: naming convention of getters in version_set.h Summary: Enforce the accessier naming convention in functions in version_set.h Test Plan: make all check Reviewers: ljin, yhchiang, rven, igor Reviewed By: igor Subscribers: leveldb, dhruba Differential Revision: VersionBuilder unit testable Summary: Rename Version::Builder to VersionBuilder and expose its definition to a header. Make VerisonBuilder not reference Version or ColumnFamilyData, only working with VersionStorageInfo. Add version_builder_test which has a simple test. Test Plan: make all check Reviewers: rven, yhchiang, igor, ljin Reviewed By: igor Subscribers: leveldb, dhruba Differential Revision: CompactionPicker more easily tested Summary: Make compaction picker easier to test. The basic idea is to separate a minimum subcomponent of Version to VersionStorageInfo, which just responsible to LSM tree. A stub VersionStorageInfo can then be easily created and passed into compaction picker so that we can check the outputs. It now passes most tests. Still two things need to be done: (1) deal with the FIFO compactions file size. (2) write an example test to make sure the interface can do the job. Add a compaction_picker_test to make sure compaction picker codes can be easily unit tested. Test Plan: Pass all unit tests and compaction_picker_test Reviewers: yhchiang, rven, igor, ljin Reviewed By: ljin Subscribers: leveldb, dhruba Differential Revision: FileLevel to LevelFilesBrief / unfriend CompactedDBImpl Summary: We have several different types of data structures for file information. FileLevel is kinda of confusing since it only contains file range and fd. Rename it to LevelFilesBrief to make it clear. Unfriend CompactedDBImpl as a by product Test Plan: make release / make all will run full test with all stacked diffs Reviewers: sdong, yhchiang, rven, igor Reviewed By: igor Subscribers: dhruba, leveldb Differential Revision: Compaction and CompactionPicker from VersionSet Summary: as title Test Plan: running make all check Reviewers: sdong, yhchiang, rven, igor Reviewed By: igor Subscribers: dhruba, leveldb Differential Revision: compaction related options changeable Summary: make compaction related options changeable. Most of changes are tedious, following the same convention: grabs MutableCFOptions at the beginning of compaction under mutex, then pass it throughout the job and register it in SuperVersion at the end. Test Plan: make all check Reviewers: igor, yhchiang, sdong Reviewed By: sdong Subscribers: leveldb Differential Revision: version_set options_ to db_options_ to avoid confusion Summary: as title Test Plan: make release Reviewers: sdong, yhchiang, igor Reviewed By: igor Subscribers: leveldb Differential Revision: instead of pull-model for managing Write stalls Summary: Introducing WriteController, which is a source of truth about per-DB write delays. Lets define an DB epoch as a period where there are no flushes and compactions (i.e. new epoch is started when flush or compaction finishes). Each epoch can either: * proceed with all writes without delay * delay all writes by fixed time * stop all writes The three modes are recomputed at each epoch change (flush, compaction), rather than on every write (which is currently the case). When we have a lot of column families, our current pull behavior adds a big overhead, since we need to loop over every column family for every write. With new push model, overhead on Write code-path is minimal. This is just the start. Next step is to also take care of stalls introduced by slow memtable flushes. The final goal is to eliminate function MakeRoomForWrite(), which currently needs to be called for every column family by every write. Test Plan: make check for now. Ill add some unit tests later. Also, perf test. Reviewers: dhruba, yhchiang, MarkCallaghan, sdong, ljin Reviewed By: ljin Subscribers: leveldb Differential Revision:"
,,0.5363,rocksdb,"Turn on and fix all the errors Summary: We need to turn on for mobile. See D1671432 (internal phabricator) for details. This diff turns on the warning flag and fixes all the errors. There were also some interesting errors that I might call bugs, especially in plain table. Going forward, I think it makes sense to have this flag turned on and be very very careful when converting 64-bit to 32-bit variables. Test Plan: compiles Reviewers: ljin, rven, yhchiang, sdong Reviewed By: yhchiang Subscribers: bobbaldwin, dhruba, leveldb Differential Revision: EventListener and GetDatabaseMetaData Summary: This diff adds three sets of APIs to RocksDB. GetColumnFamilyMetaData * This APIs allow users to obtain the current state of a RocksDB instance on one column family. * See GetColumnFamilyMetaData in include/rocksdb/db.h EventListener * A virtual class that allows users to implement a set of call-back functions which will be called when specific events of a RocksDB instance happens. * To register EventListener, simply insert an EventListener to ColumnFamilyOptions::listeners CompactFiles * CompactFiles API inputs a set of file numbers and an output level, and RocksDB will try to compact those files into the specified level. Example * Example code can be found in example/compact_files_example.cc, which implements a simple external compactor using EventListener, GetColumnFamilyMetaData, and CompactFiles API. Test Plan: listener_test compactor_test example/compact_files_example export ROCKSDB_TESTS=CompactFiles db_test export ROCKSDB_TESTS=MetaData db_test Reviewers: ljin, igor, rven, sdong Reviewed By: sdong Subscribers: MarkCallaghan, dhruba, leveldb Differential Revision: CompactionPicker more easily tested Summary: Make compaction picker easier to test. The basic idea is to separate a minimum subcomponent of Version to VersionStorageInfo, which just responsible to LSM tree. A stub VersionStorageInfo can then be easily created and passed into compaction picker so that we can check the outputs. It now passes most tests. Still two things need to be done: (1) deal with the FIFO compactions file size. (2) write an example test to make sure the interface can do the job. Add a compaction_picker_test to make sure compaction picker codes can be easily unit tested. Test Plan: Pass all unit tests and compaction_picker_test Reviewers: yhchiang, rven, igor, ljin Reviewed By: ljin Subscribers: leveldb, dhruba Differential Revision: FileLevel to LevelFilesBrief / unfriend CompactedDBImpl Summary: We have several different types of data structures for file information. FileLevel is kinda of confusing since it only contains file range and fd. Rename it to LevelFilesBrief to make it clear. Unfriend CompactedDBImpl as a by product Test Plan: make release / make all will run full test with all stacked diffs Reviewers: sdong, yhchiang, rven, igor Reviewed By: igor Subscribers: dhruba, leveldb Differential Revision: compaction related options changeable Summary: make compaction related options changeable. Most of changes are tedious, following the same convention: grabs MutableCFOptions at the beginning of compaction under mutex, then pass it throughout the job and register it in SuperVersion at the end. Test Plan: make all check Reviewers: igor, yhchiang, sdong Reviewed By: sdong Subscribers: leveldb Differential Revision:"
,,0.27,rocksdb,"Turn on and fix all the errors Summary: We need to turn on for mobile. See D1671432 (internal phabricator) for details. This diff turns on the warning flag and fixes all the errors. There were also some interesting errors that I might call bugs, especially in plain table. Going forward, I think it makes sense to have this flag turned on and be very very careful when converting 64-bit to 32-bit variables. Test Plan: compiles Reviewers: ljin, rven, yhchiang, sdong Reviewed By: yhchiang Subscribers: bobbaldwin, dhruba, leveldb Differential Revision:"
,,0.2446,rocksdb,"rename FileLevel to LevelFilesBrief / unfriend CompactedDBImpl Summary: We have several different types of data structures for file information. FileLevel is kinda of confusing since it only contains file range and fd. Rename it to LevelFilesBrief to make it clear. Unfriend CompactedDBImpl as a by product Test Plan: make release / make all will run full test with all stacked diffs Reviewers: sdong, yhchiang, rven, igor Reviewed By: igor Subscribers: dhruba, leveldb Differential Revision:"
,,0.2573,rocksdb,"WriteThread Summary: This diff just moves the write thread control out of the DBImpl. I will need this as I will control column family data concurrency by only accessing some data in the write thread. That way, we wont have to lock our accesses to column family hash table (mappings from IDs to CFDs). Test Plan: make check Reviewers: sdong, yhchiang, ljin Reviewed By: ljin Subscribers: leveldb Differential Revision: column family from write thread Summary: If we drop column family only from (single) write thread, we can be sure that nobody will drop the column family while were writing (and our mutex is released). This greatly simplifies my patch thats getting rid of MakeRoomForWrite(). Test Plan: make check, but also running stress test Reviewers: ljin, sdong Reviewed By: sdong Subscribers: leveldb Differential Revision: path with arena==nullptr from NewInternalIterator Summary: Simply code by removing code path which does not use Arena from NewInternalIterator Test Plan: make all check make valgrind_check Reviewers: sdong Reviewed By: sdong Subscribers: leveldb Differential Revision:"
,,0.1998,rocksdb,"Turn on Summary: ...and fix all the errors :) Jim suggested turning on because it helped him fix number of critical bugs in fbcode. I think its a good idea to be clean. Test Plan: compiles Reviewers: yhchiang, rven, sdong, ljin Reviewed By: ljin Subscribers: dhruba, leveldb Differential Revision:"
,,0.4563,rocksdb,"CompactFiles, EventListener and GetDatabaseMetaData Summary: This diff adds three sets of APIs to RocksDB. GetColumnFamilyMetaData * This APIs allow users to obtain the current state of a RocksDB instance on one column family. * See GetColumnFamilyMetaData in include/rocksdb/db.h EventListener * A virtual class that allows users to implement a set of call-back functions which will be called when specific events of a RocksDB instance happens. * To register EventListener, simply insert an EventListener to ColumnFamilyOptions::listeners CompactFiles * CompactFiles API inputs a set of file numbers and an output level, and RocksDB will try to compact those files into the specified level. Example * Example code can be found in example/compact_files_example.cc, which implements a simple external compactor using EventListener, GetColumnFamilyMetaData, and CompactFiles API. Test Plan: listener_test compactor_test example/compact_files_example export ROCKSDB_TESTS=CompactFiles db_test export ROCKSDB_TESTS=MetaData db_test Reviewers: ljin, igor, rven, sdong Reviewed By: sdong Subscribers: MarkCallaghan, dhruba, leveldb Differential Revision: CompactionPicker more easily tested Summary: Make compaction picker easier to test. The basic idea is to separate a minimum subcomponent of Version to VersionStorageInfo, which just responsible to LSM tree. A stub VersionStorageInfo can then be easily created and passed into compaction picker so that we can check the outputs. It now passes most tests. Still two things need to be done: (1) deal with the FIFO compactions file size. (2) write an example test to make sure the interface can do the job. Add a compaction_picker_test to make sure compaction picker codes can be easily unit tested. Test Plan: Pass all unit tests and compaction_picker_test Reviewers: yhchiang, rven, igor, ljin Reviewed By: ljin Subscribers: leveldb, dhruba Differential Revision: compaction related options changeable Summary: make compaction related options changeable. Most of changes are tedious, following the same convention: grabs MutableCFOptions at the beginning of compaction under mutex, then pass it throughout the job and register it in SuperVersion at the end. Test Plan: make all check Reviewers: igor, yhchiang, sdong Reviewed By: sdong Subscribers: leveldb Differential Revision:"
,,0.2999,rocksdb,"Push model for flushing memtables Summary: When memtable is full it calls the registered callback. That callback then registers column family as needing the flush. Every write checks if there are some column families that need to be flushed. This completely eliminates the need for MakeRoomForWrite() function and simplifies our Write code-path. There is some complexity with the concurrency when the column family is dropped. I made it a bit less complex by dropping the column family from the write thread in Let me know if you want to discuss this. Test Plan: make check works. Ill also run db_stress with creating and dropping column families for a while. Reviewers: yhchiang, sdong, ljin Reviewed By: ljin Subscribers: leveldb Differential Revision:"
,,0.3266,rocksdb,"Turn back on Summary: It turns out that has different rules for gcc than clang. Previous commit fixed clang. This commits fixes the rest of the warnings for gcc. Test Plan: compiles Reviewers: ljin, yhchiang, rven, sdong Reviewed By: sdong Subscribers: dhruba, leveldb Differential Revision: InfoLogLevel to the logs in db/db_iter.cc Summary: Apply InfoLogLevel to the logs in db/db_iter.cc Test Plan: make Reviewers: igor, ljin, sdong Reviewed By: sdong Subscribers: dhruba, leveldb Differential Revision: references to cfd->options() in DBImpl Summary: I found it is almost impossible to get rid of this function in a single batch. I will take a step by step approach Test Plan: make release Reviewers: sdong, yhchiang, igor Reviewed By: igor Subscribers: leveldb Differential Revision: a new ReadOptions parameter iterate_upper_bound/"
,,0.1844,rocksdb,"Apply InfoLogLevel to the logs in db/repair.cc Summary: Apply InfoLogLevel to the logs in db/repair.cc Test Plan: make Reviewers: ljin, sdong, igor Reviewed By: igor Subscribers: dhruba, leveldb Differential Revision: for memtable related options Summary: as title Test Plan: make all check I will think a way to set up stress test for this Reviewers: sdong, yhchiang, igor Reviewed By: igor Subscribers: leveldb Differential Revision:"
