Topic_no,Keywords,Contrib,System,Text
16,"user, key, introduce, memtable, copy, performance, case, summary, number, memory, reduce, size, store, buffer, improve, avoid, datum, current, benchmark, improvement",0.0672,conscrypt,"OpenSSLKey: tolerate null encoding during conversion Since we could have a situation where we have an opaque key backed by some hardware device that we dont know how to handle, just throw an InvalidKeyException instead of NullPointerException. Change-Id: I33588d1654b6b33f11640b2d65e7213c864e6e1a/"
,,0.1291,conscrypt,"Add OpenSSLEngineImpl Add support for SSLEngine via OpenSSL APIs. Currently this supports just the basic SSLEngine functionality. It can be improved in efficiency and performance, but it appears not to leak anything and be correct according to our test suites. Change-Id: Iea2dc3922e7c30e26daca38361877bd2f88ae668/Remove SSLEngineImpl This is replaced by OpenSSL-backed SSLEngineImpl. Change-Id: I7b51f6fa772e431c6283008535bfec90821d0bef/"
,,0.0887,conscrypt,Consolidate EVP_MD references to one place There were several places where EVP_get_digestbyname was being called for the same data. Consolidate these all down to one place so there is no need to call it several times in the same program. Test: cts-tradefed run cts CtsLibcoreTestCases arm64-v8a Change-Id: Ib3f8b678c775e74eb5edaabde42f042d7b4eac95/
,,0.2739,conscrypt,"Refactoring session management (#172) This change breaks session management into two distinct types: SslSessionWrapper: These are created as BoringSSL calls back the new session handler, allowing the application to cache sessions. Clients will also offer these to BoringSSL for reuse if a compatible session was found. BoringSSL is free to use it or not, but the Conscrypt code no longer makes assumptions here. Instead, it always uses the ActiveSession. ActiveSession: This is a session that wraps the SSL instance (rather than the SSL_SESSION wherever possible). That way no concern has to be paid to what BoringSSL is doing with sessions under the covers. Fixes"
,,0.2693,conscrypt,"Refactoring session management (#172) This change breaks session management into two distinct types: SslSessionWrapper: These are created as BoringSSL calls back the new session handler, allowing the application to cache sessions. Clients will also offer these to BoringSSL for reuse if a compatible session was found. BoringSSL is free to use it or not, but the Conscrypt code no longer makes assumptions here. Instead, it always uses the ActiveSession. ActiveSession: This is a session that wraps the SSL instance (rather than the SSL_SESSION wherever possible). That way no concern has to be paid to what BoringSSL is doing with sessions under the covers. Fixes"
,,0.2647,conscrypt,"Refactoring session management (#172) This change breaks session management into two distinct types: SslSessionWrapper: These are created as BoringSSL calls back the new session handler, allowing the application to cache sessions. Clients will also offer these to BoringSSL for reuse if a compatible session was found. BoringSSL is free to use it or not, but the Conscrypt code no longer makes assumptions here. Instead, it always uses the ActiveSession. ActiveSession: This is a session that wraps the SSL instance (rather than the SSL_SESSION wherever possible). That way no concern has to be paid to what BoringSSL is doing with sessions under the covers. Fixes"
,,0.2286,conscrypt,"Switch to CRYPTO_BUFFER client CA APIs. This gets us closer to TLS_with_buffers_method (issue It also, along the way, much more thoroughly checks errors of all the various operations involved./Fixing leak introduced in (#264)/Change unsigned to int to avoid signed-unsigned comparison. (#261)/Encode certs in verify callback (#248) This code was copied from Netty/netty-tcnative and seems to significantly increases performance of the verify callback. Before we call back to Java, we first encode all of the certs and then decode them in Java into X509Certificate instances. Previous code was calling into JNI for each method in the certificate. This helps in addressing encoded local certs to BoringSSL (#253) Current code was encoding and then decoding the certs before finally passing them to the native code. We were also separately setting and then verifying the private key. All of this can be replaced with a single JNI call SSL_set_chain_and_key, which accepts the encoded certs (we dont have to decode them again). See This shows a perf bump for the handshake (from ~750 to 800 ops/sec)./Refactoring session management (#172) This change breaks session management into two distinct types: SslSessionWrapper: These are created as BoringSSL calls back the new session handler, allowing the application to cache sessions. Clients will also offer these to BoringSSL for reuse if a compatible session was found. BoringSSL is free to use it or not, but the Conscrypt code no longer makes assumptions here. Instead, it always uses the ActiveSession. ActiveSession: This is a session that wraps the SSL instance (rather than the SSL_SESSION wherever possible). That way no concern has to be paid to what BoringSSL is doing with sessions under the covers. Fixes"
,,0.1963,conscrypt,"Support Java 6 Runtime (#299) Various fixes to support Java 6, 7, and 8. Separating out utility classes (for openjdk) to be explicit as to which methods are supported by particular Java version. Adding the ability to specify the test JVM to use on the command-line. For example, the following will build with the default Java installation, but will run the openjdk and integ-tests with Java 6: ./gradlew build Fixes session management (#172) This change breaks session management into two distinct types: SslSessionWrapper: These are created as BoringSSL calls back the new session handler, allowing the application to cache sessions. Clients will also offer these to BoringSSL for reuse if a compatible session was found. BoringSSL is free to use it or not, but the Conscrypt code no longer makes assumptions here. Instead, it always uses the ActiveSession. ActiveSession: This is a session that wraps the SSL instance (rather than the SSL_SESSION wherever possible). That way no concern has to be paid to what BoringSSL is doing with sessions under the covers. Fixes"
,,0.2662,conscrypt,"Refactoring session management (#172) This change breaks session management into two distinct types: SslSessionWrapper: These are created as BoringSSL calls back the new session handler, allowing the application to cache sessions. Clients will also offer these to BoringSSL for reuse if a compatible session was found. BoringSSL is free to use it or not, but the Conscrypt code no longer makes assumptions here. Instead, it always uses the ActiveSession. ActiveSession: This is a session that wraps the SSL instance (rather than the SSL_SESSION wherever possible). That way no concern has to be paid to what BoringSSL is doing with sessions under the covers. Fixes"
,,0.2631,conscrypt,"Refactoring session management (#172) This change breaks session management into two distinct types: SslSessionWrapper: These are created as BoringSSL calls back the new session handler, allowing the application to cache sessions. Clients will also offer these to BoringSSL for reuse if a compatible session was found. BoringSSL is free to use it or not, but the Conscrypt code no longer makes assumptions here. Instead, it always uses the ActiveSession. ActiveSession: This is a session that wraps the SSL instance (rather than the SSL_SESSION wherever possible). That way no concern has to be paid to what BoringSSL is doing with sessions under the covers. Fixes"
,,0.2662,conscrypt,"Refactoring session management (#172) This change breaks session management into two distinct types: SslSessionWrapper: These are created as BoringSSL calls back the new session handler, allowing the application to cache sessions. Clients will also offer these to BoringSSL for reuse if a compatible session was found. BoringSSL is free to use it or not, but the Conscrypt code no longer makes assumptions here. Instead, it always uses the ActiveSession. ActiveSession: This is a session that wraps the SSL instance (rather than the SSL_SESSION wherever possible). That way no concern has to be paid to what BoringSSL is doing with sessions under the covers. Fixes"
,,0.2486,conscrypt,"Fix a bunch of warnings. (#254) Removes unused variables, fixes cases of non-final ALL_CAPS_VARS, removes wildcard import./Refactoring session management (#172) This change breaks session management into two distinct types: SslSessionWrapper: These are created as BoringSSL calls back the new session handler, allowing the application to cache sessions. Clients will also offer these to BoringSSL for reuse if a compatible session was found. BoringSSL is free to use it or not, but the Conscrypt code no longer makes assumptions here. Instead, it always uses the ActiveSession. ActiveSession: This is a session that wraps the SSL instance (rather than the SSL_SESSION wherever possible). That way no concern has to be paid to what BoringSSL is doing with sessions under the covers. Fixes"
,,0.0673,frostwire,[desktop] PlaylistItem.equals() improvement/
,,0.0665,jna,require structure field order/fix broken Structure.setFieldOrder issue/
,,0.0609,jna,Fix ABI check regression/Rebased from gcc/
,,0.0639,jna,"Fixed testReadFile, not always null-terminated./"
,,0.0652,jna,Copy changes into Github checkout./
,,0.0673,jna,Copy changes into Github checkout./
,,0.066,jna,restored because of lost source code/
,,0.0744,jna,"VARIANT: Fix wrong asumptions, datatypes and add add unittests/"
,,0.0673,OpenDDS,Wed Apr 25 22:38:56 UTC 2007 Scott Harris
,,0.0686,OpenDDS,Wed May 2 22:03:56 UTC 2007 Scott Harris
,,0.0673,OpenDDS,Wed Apr 25 22:38:56 UTC 2007 Scott Harris
,,0.08800000000000001,OpenDDS,"Introduce a new Loaner interface which is now used as part of the zero copy sequences so that they dont pull in the full reader implementation, see issue * dds/DCPS/Loaner.h: Added. * dds/DCPS/DataReaderImpl.h: * dds/DCPS/MultiTopicDataReaderBase.h: * dds/DCPS/WriterInfo.h: * dds/DCPS/ZeroCopySeq_T.h: * dds/DCPS/ZeroCopySeq_T.inl:/"
,,0.0607,OpenDDS,Fix mingw64 link issue/Fix MultiTopicDataReader memory access problem/
,,0.0692,OpenDDS,Corrected issue with bad DH shared-secret sizes/SSL formatting fixes/
,,0.0855,OpenDDS,"Replace DCPS_DATA_TYPE warning MPC feature To avoid changing all the build server configs and avoid any possiblity of the warning not showing on the users end, instead of disabling an MPC feature to mask DCPS_DATA_TYPE warnings in OpenDDS, have opendds_idl just not do warn if the IDL file is in tests, performance-tests, and java of DDS_ROOT. Also make the check for DCPS_DATA_TYPE take all the possible whitespace into effect./"
,,0.0723,OpenDDS,Replaced monitor ptr with smart ptr to fix memory leaks./
,,0.0689,pljava,Changed MemoryContext management for multi-call functions/
,,0.077,pljava,Minor performance improvement due to less created Java TupleDesc objects./
,,0.0789,pljava,Minor performance improvement due to less created Java TupleDesc objects./
,,0.0878,realm-java,Count cpuX files in /sys/devices/system/cpu as a more accurate way (#3997) * Count cpuX files in /sys/devices/system/cpu as a more accurate way of counting processors and setting the max threads for the Executor. (#3810) * Suppress Findbugs warning * Better comments; Default to Runtime.getRuntime().availableProcessors()/
,,0.0804,realm-java,Restoring Sync logging (#4315) * Restoring Sync logging/
,,0.1049,realm-java,"Remove depreacted RealmProxyMediator.getTableName (#5456) Prefix ""class_"" should be hide from java layer and handled in Object Store. Try to that direction step by step. Close some performance issues when initializing the Schema (#5404)/"
,,0.0972,realm-java,"Remove depreacted RealmProxyMediator.getTableName (#5456) Prefix ""class_"" should be hide from java layer and handled in Object Store. Try to that direction step by step. Close"
,,0.166,rocksdb,"Bugfix for issue 33; reduce lock contention in Get(), parallel benchmarks. Fix for issue 33 (non-null-terminated result from leveldb_property_value()) Support for running multiple instances of a benchmark in parallel. Reduce lock contention on Get(): (1) Do not hold the lock while searching memtables. (2) Shard block and table caches 16-ways. Benchmark for evaluating this change: $ db_bench (fillseq1 is a small hack to make sure fillseq runs once regardless of number of threads specified on the command line). git-svn-id: 62dab493-f737-651d-591e-8d6aee1b9529/"
,,0.1671,rocksdb,"Bugfix for issue 33; reduce lock contention in Get(), parallel benchmarks. Fix for issue 33 (non-null-terminated result from leveldb_property_value()) Support for running multiple instances of a benchmark in parallel. Reduce lock contention on Get(): (1) Do not hold the lock while searching memtables. (2) Shard block and table caches 16-ways. Benchmark for evaluating this change: $ db_bench (fillseq1 is a small hack to make sure fillseq runs once regardless of number of threads specified on the command line). git-svn-id: 62dab493-f737-651d-591e-8d6aee1b9529/Platform detection during build, plus compatibility patches for machines without This revision adds two major changes: 1. build_detect_platform which generates build_config.mk with platform-dependent flags for the build process 2. /port/atomic_pointer.h with anAtomicPointerimplementation for platforms without Some of this code is loosely based on patches submitted to the LevelDB mailing list at Tip of the hat to Dave Smith and Edouard A, who both sent patches. The presence of Snappy ( and cstdatomic are now both detected in the build_detect_platform script (1.) which gets executing during make. For (2.), instead of broadly importing atomicops_* from Chromium or the Google performance tools, we chose to just implement AtomicPointer and the limited atomic load and store operations it needs. This resulted in much less code and fewer files everything is contained in atomic_pointer.h. git-svn-id: 62dab493-f737-651d-591e-8d6aee1b9529/"
,,0.1609,rocksdb,"Bugfix for issue 33; reduce lock contention in Get(), parallel benchmarks. Fix for issue 33 (non-null-terminated result from leveldb_property_value()) Support for running multiple instances of a benchmark in parallel. Reduce lock contention on Get(): (1) Do not hold the lock while searching memtables. (2) Shard block and table caches 16-ways. Benchmark for evaluating this change: $ db_bench (fillseq1 is a small hack to make sure fillseq runs once regardless of number of threads specified on the command line). git-svn-id: 62dab493-f737-651d-591e-8d6aee1b9529/"
,,0.1686,rocksdb,"Bugfix for issue 33; reduce lock contention in Get(), parallel benchmarks. Fix for issue 33 (non-null-terminated result from leveldb_property_value()) Support for running multiple instances of a benchmark in parallel. Reduce lock contention on Get(): (1) Do not hold the lock while searching memtables. (2) Shard block and table caches 16-ways. Benchmark for evaluating this change: $ db_bench (fillseq1 is a small hack to make sure fillseq runs once regardless of number of threads specified on the command line). git-svn-id: 62dab493-f737-651d-591e-8d6aee1b9529/"
,,0.1395,rocksdb,"[RocksDB] Expose thread local perf counter for low overhead, per call level performance statistics. Summary: As title. No locking/atomic is needed due to thread local. There is also no need to modify the existing client interface, in order to expose related counters. perf_context_test shows a simple example of retrieving the number of user key comparison done for each put and get call. More counters could be added later. Sample output ./perf_context_test 1000000 Test PerfContextTest.KeyComparisonCount Inserting 1000000 key/value pairs ... total user key comparison get: 43446523 total user key comparison put: 8017877 max user key comparison get: 88939 avg user key comparison get:43 Basically, the current skiplist does well on average, but could perform poorly in extreme cases. Test Plan: run perf_context_test number of entries to put/get> Reviewers: dhruba Differential Revision: refering freed memory in earlier commit. Summary: Fix refering freed memory in earlier commit by Test Plan: make check Reviewers: haobo, sheki Reviewed By: haobo CC: leveldb Differential Revision: name of user comparator in LOG. Summary: The current code prints the name of the InternalKeyComparator in the log file. We would also like to print the name of the user-specified comparator for easier debugging. Test Plan: make check Reviewers: sheki Reviewed By: sheki CC: leveldb Differential Revision:"
,,0.1731,rocksdb,"Aggressively inlining the short functions in coding.cc Summary: This diff takes an even more aggressive way to inline the functions. A decent rule that I followed is ""not inline a function if it is more than 10 lines long."" Normally optimizing code by inline is ugly and hard to control, but since one of our usecase has significant amount of CPU used in functions from coding.cc, Id like to try this diff out. Test Plan: 1. the size for some .o file increased a little bit, but most less than 1%. So I think the negative impact of inline is negligible. 2. As the regression test shows (ran for 10 times and I calculated the average number) Metrics Befor After rocksdb.build.fillseq.qps 426595 444515 (+4.6%) rocksdb.build.memtablefillrandom.qps 121739 123110 rocksdb.build.memtablereadrandom.qps 1285103 1280520 rocksdb.build.overwrite.qps 125816 135570 (+9%) rocksdb.build.readrandom_fillunique_random.qps 285995 296863 rocksdb.build.readrandom_memtable_sst.qps 1027132 1027279 rocksdb.build.readrandom.qps 1041427 1054665 rocksdb.build.readrandom_smallblockcache.qps 1028631 1038433 rocksdb.build.readwhilewriting.qps 918352 914629 Reviewers: haobo, sdong, igor CC: leveldb Differential Revision:"
,,0.1361,rocksdb,"Merge branch master into performance Conflicts: Makefile db/db_impl.cc db/db_test.cc db/memtable_list.cc db/memtable_list.h table/block_based_table_reader.cc table/table_test.cc util/cache.cc util/coding.cc/Add a call DisownData() to Cache, which should speed up shutdown Summary: On a shutdown, freeing memory takes a long time. If were shutting down, we dont really care about memory leaks. I added a call to Cache that will avoid freeing all objects in cache. Test Plan: I created a script to test the speedup and demonstrate how to use the call: Clean shutdown took 7.2 seconds, while fast and dirty one took 6.3 seconds. Unfortunately, the speedup is not that big, but should be bigger with bigger block_cache. I have set up the capacity to 80GB, but the script filled up only ~7GB. Reviewers: dhruba, haobo, MarkCallaghan, xjin Reviewed By: dhruba CC: leveldb Differential Revision: `atomic_size_t usage` Summary: By disassemble the function, we found that the atomic variables do invoke the `lock` that locks the memory bus. As a tradeoff, we protect the GetUsage by mutex and leave usage_ as plain size_t. Test Plan: passed `cache_test` Reviewers: dhruba CC: leveldb Differential Revision: usage info for the cache Summary: This diff will help us to figure out the memory usage for the cache part. Test Plan: added a new memory usage test for cache Reviewers: haobo, sdong, dhruba CC: leveldb Differential Revision: Cache::GetCapacity constant Summary: This will allow us to access constant via `DB::GetOptions().table_cache.GetCapacity()` or `DB::GetOptions().block_cache.GetCapacity()` since GetOptions() is also constant method./"
,,0.2154,rocksdb,"[Performance Branch] HashLinkList to avoid to convert length prefixed string back to internal keys Summary: Converting from length prefixed buffer back to internal key costs some CPU but it is not necessary. In this patch, internal keys are pass though the functions so that we dont need to convert back to it. Test Plan: make all check Reviewers: haobo, kailiu Reviewed By: kailiu CC: igor, leveldb Differential Revision: branch master into performance Conflicts: Makefile db/db_impl.cc db/db_impl.h db/db_test.cc db/memtable.cc db/memtable.h db/version_edit.h db/version_set.cc include/rocksdb/options.h util/hash_skiplist_rep.cc util/options.cc/Remove the unnecessary use of shared_ptr Summary: shared_ptr is slower than unique_ptr (which literally comes with no performance cost compare with raw pointers). In memtable and memtable rep, we use shared_ptr when wed actually should use unique_ptr. According to igors previous work, we are likely to make quite some performance gain from this diff. Test Plan: make check Reviewers: dhruba, igor, sdong, haobo CC: leveldb Differential Revision: [Performance Branch] Added dynamic bloom, to be used for memable non-existing key filtering Summary: as title Test Plan: dynamic_bloom_test Reviewers: dhruba, sdong, kailiu CC: leveldb Differential Revision: branch master into performance/[RocksDB][Performance Branch] Make height and branching factor configurable for skiplist implementation Summary: As title. Especially, HashSkipListRepFactory will be able to specify a relatively small height, to reduce the memory overhead of one skiplist per bucket. Test Plan: make check and test it on leaf4 Reviewers: dhruba, sdong, kailiu CC: reconnect.grayhat, leveldb Differential Revision: for Performance Branch] A Hacky patch to lazily generate memtable key for prefix-hashed memtables. Summary: For prefix mem tables, encoding mem table key may be unnecessary if the prefix doesnt have any key. This patch is a little bit hacky but I want to try out the performance gain of removing this lazy initialization. In longer term, we might want to revisit the way we abstract mem tables implementations. Test Plan: make all check Reviewers: haobo, igor, kailiu Reviewed By: igor CC: leveldb Differential Revision:"
,,0.3197,rocksdb,"Remove the unnecessary use of shared_ptr Summary: shared_ptr is slower than unique_ptr (which literally comes with no performance cost compare with raw pointers). In memtable and memtable rep, we use shared_ptr when wed actually should use unique_ptr. According to igors previous work, we are likely to make quite some performance gain from this diff. Test Plan: make check Reviewers: dhruba, igor, sdong, haobo CC: leveldb Differential Revision: Branch] A Hashed Linked List Based Mem Table Summary: Implement a mem table, in which keys are hashed based on prefixes. In each bucket, entries are organized in a sorted linked list. It has the same thread safety guarantee as skip list. The motivation is to optimize memory usage for the case that prefix hashing is primary way of seeking to the entry. Compared to hash skip list implementation, this implementation is more memory efficient, but inside each bucket, search is always linear. The target scenario is that there are only very limited number of records in each hash bucket. Test Plan: Add a test case in db_test Reviewers: haobo, kailiu, dhruba Reviewed By: haobo CC: igor, nkg-, leveldb Differential Revision: Branch] Make height and branching factor configurable for skiplist implementation Summary: As title. Especially, HashSkipListRepFactory will be able to specify a relatively small height, to reduce the memory overhead of one skiplist per bucket. Test Plan: make check and test it on leaf4 Reviewers: dhruba, sdong, kailiu CC: reconnect.grayhat, leveldb Differential Revision:"
,,0.1458,rocksdb,"[RocksDB][Performance Branch] Make height and branching factor configurable for skiplist implementation Summary: As title. Especially, HashSkipListRepFactory will be able to specify a relatively small height, to reduce the memory overhead of one skiplist per bucket. Test Plan: make check and test it on leaf4 Reviewers: dhruba, sdong, kailiu CC: reconnect.grayhat, leveldb Differential Revision:"
,,0.3165,rocksdb,"[Performance Branch] A Hashed Linked List Based Mem Table Summary: Implement a mem table, in which keys are hashed based on prefixes. In each bucket, entries are organized in a sorted linked list. It has the same thread safety guarantee as skip list. The motivation is to optimize memory usage for the case that prefix hashing is primary way of seeking to the entry. Compared to hash skip list implementation, this implementation is more memory efficient, but inside each bucket, search is always linear. The target scenario is that there are only very limited number of records in each hash bucket. Test Plan: Add a test case in db_test Reviewers: haobo, kailiu, dhruba Reviewed By: haobo CC: igor, nkg-, leveldb Differential Revision: [Performance Branch] Added dynamic bloom, to be used for memable non-existing key filtering Summary: as title Test Plan: dynamic_bloom_test Reviewers: dhruba, sdong, kailiu CC: leveldb Differential Revision: Branch] Make height and branching factor configurable for skiplist implementation Summary: As title. Especially, HashSkipListRepFactory will be able to specify a relatively small height, to reduce the memory overhead of one skiplist per bucket. Test Plan: make check and test it on leaf4 Reviewers: dhruba, sdong, kailiu CC: reconnect.grayhat, leveldb Differential Revision: fix prefix_test Summary: user comparator needs to work if either input is prefix only. Test Plan: ./prefix_test Reviewers: dhruba, igor Reviewed By: igor CC: leveldb Differential Revision:"
