Topic_no,Keywords,Contrib,System,Text
,,0.1166,rocksdb,"Option to cache index/filter blocks with priority Summary: Add option to block based table to insert index/filter blocks to block cache with priority. Combined with LRUCache with high_pri_pool_ratio, we can reserved space for index/filter blocks, make them less likely to be evicted. Depends on D61977. Test Plan: See unit test. Reviewers: lightmark, IslamAbdelRahman, sdong Reviewed By: sdong Subscribers: andrewkr, dhruba, march, leveldb Differential Revision:"
,,0.1525,rocksdb,"WriteBatch support for range deletion Summary: Add API to WriteBatch to store range deletions in its buffer which are later added to memtable. In the WriteBatch buffer, a range deletion is encoded as ""<optype><CF ID (optional)><begin key><end key>"". With this diff, the range tombstones are stored inline with the data in the memtable. Its useful for now because the test cases rely on the data being accessible via memtable. My next step is to store range tombstones in a separate area in the memtable. Test Plan: unit tests Reviewers: IslamAbdelRahman, sdong, wanning Reviewed By: wanning Subscribers: andrewkr, dhruba, leveldb Differential Revision:"
,,0.3751,rocksdb,"Compaction Support for Range Deletion Summary: This diff introduces RangeDelAggregator, which takes ownership of iterators provided to it via AddTombstones(). The tombstones are organized in a two-level map (snapshot stripe begin key tombstone). Tombstone creation avoids data copy by holding Slices returned by the iterator, which remain valid thanks to pinning. For compaction, we create a hierarchical range tombstone iterator with structure matching the iterator over compaction input data. An aggregator based on that iterator is used by CompactionIterator to determine which keys are covered by range tombstones. In case of merge operand, the same aggregator is used by MergeHelper. Upon finishing each file in the compaction, relevant range tombstones are added to the output files range tombstone metablock and file boundaries are updated accordingly. To check whether a key is covered by range tombstone, RangeDelAggregator::ShouldDelete() considers tombstones in the keys snapshot stripe. When this function is used outside of compaction, it also checks newer stripes, which can contain covering tombstones. Currently the intra-stripe check involves a linear scan; however, in the future we plan to collapse ranges within a stripe such that binary search can be used. RangeDelAggregator::AddToBuilder() adds all range tombstones in the tables key-range to a new tables range tombstone meta-block. Since range tombstones may fall in the gap between files, we may need to extend some files key-ranges. The strategy is (1) first file extends as far left as possible and other files do not extend left, (2) all files extend right until either the start of the next file or the end of the last range tombstone in the gap, whichever comes first. One other notable change is adding release/move semantics to ScopedArenaIterator such that it can be used to transfer ownership of an arena-allocated iterator, similar to how unique_ptr is used for mallocd data. Depends on D61473 Test Plan: compaction_iterator_test, mock_table, end-to-end tests in D63927 Reviewers: sdong, IslamAbdelRahman, wanning, yhchiang, lightmark Reviewed By: lightmark Subscribers: andrewkr, dhruba, leveldb Differential Revision: cut compaction output when compact to level 0 Summary: we should not call ShouldStopBefore() in compaction when the compaction targets level 0. Otherwise, CheckConsistency will fail the assertion of seq number check on level 0. Test Plan: make all check I also manully test that using db_bench to compact files to level 0. Without this line change, the assertion files and multiple files are generated on level 0 after compaction. Reviewers: yhchiang, andrewkr, yiwu, sdong Reviewed By: sdong Subscribers: andrewkr, dhruba, leveldb Differential Revision: TableBuilderOptions::level and relevant changes (#1335)/Merge options source_compaction_factor, max_grandparent_overlap_bytes and expanded_compaction_factor into max_compaction_bytes Summary: To reduce number of options, merge source_compaction_factor, max_grandparent_overlap_bytes and expanded_compaction_factor into max_compaction_bytes. Test Plan: Add two new unit tests. Run all existing tests, including jtest. Reviewers: yhchiang, igor, IslamAbdelRahman Reviewed By: IslamAbdelRahman Subscribers: leveldb, andrewkr, dhruba Differential Revision:"
,,0.1586,rocksdb,Two-level Indexes Summary: Partition Index blocks and use a Partition-index as a 2nd level index. The two-level index can be used by setting BlockBasedTableOptions::kTwoLevelIndexSearch as the index type and configuring BlockBasedTableOptions::index_per_partition t15539501 Closes Differential Revision: D4473535 Pulled By: maysamyabandeh fbshipit-source-id: bffb87e/
,,0.1618,rocksdb,Two-level Indexes Summary: Partition Index blocks and use a Partition-index as a 2nd level index. The two-level index can be used by setting BlockBasedTableOptions::kTwoLevelIndexSearch as the index type and configuring BlockBasedTableOptions::index_per_partition t15539501 Closes Differential Revision: D4473535 Pulled By: maysamyabandeh fbshipit-source-id: bffb87e/
,,0.2391,rocksdb,"Maintain position in range deletions map Summary: When deletion-collapsing mode is enabled (i.e., for DBIter/CompactionIterator), we maintain position in the tombstone maps across calls to ShouldDelete(). Since iterators often access keys sequentially (or reverse-sequentially), scanning forward/backward from the last position can be faster than binary-searching the map for every key. When Next() is invoked on an iterator, we use kForwardTraversal to scan forwards, if needed, until arriving at the range deletion containing the next key. Similarly for Prev(), we use kBackwardTraversal to scan backwards in the range deletion map. When the iterator seeks, we use kBinarySearch for repositioning After tombstones are added or before the first ShouldDelete() invocation, the current position is set to invalid, which forces kBinarySearch to be used. Non-iterator users (i.e., Get()) use kFullScan, which has the same behavior as before---scan the whole map for every key passed to ShouldDelete(). Closes Differential Revision: D4350318 Pulled By: ajkr fbshipit-source-id: 5129b76/Collapse range deletions Summary: Added a tombstone-collapsing mode to RangeDelAggregator, which eliminates overlap in the TombstoneMap. In this mode, we can check whether a tombstone covers a user key using upper_bound() (i.e., binary search). However, the tradeoff is the overhead to add tombstones is now higher, so at first Ive only enabled it for range scans (compaction/flush/user iterators), where we expect a high number of calls to ShouldDelete() for the same tombstones. Point queries like Get() will still use the linear scan approach. Also in this diff I changed RangeDelAggregators TombstoneMap to use multimap with user keys instead of map with internal keys. Callers sometimes provided ParsedInternalKey directly, from which it wouldve required string copying to derive an internal key Slice with which we could search the map. Closes Differential Revision: D4270397 Pulled By: ajkr fbshipit-source-id: 93092c7/DeleteRange compaction statistics Summary: ""rocksdb.compaction.key.drop.range_del"" number of keys dropped during compaction due to a range tombstone covering them ""rocksdb.compaction.range_del.drop.obsolete"" number of range tombstones dropped due to compaction to bottom level and no snapshot saving them s/CompactionIteratorStats/CompactionIterationStats/g since this class is no longer specific to CompactionIterator its also updated for range tombstone iteration during compaction Move the above class into a separate .h file to avoid circular dependency. Closes Differential Revision: D4187179 Pulled By: ajkr fbshipit-source-id: 10c2103/Lazily initialize RangeDelAggregators map and pinning manager Summary: Since a RangeDelAggregator is created for each read request, these heap-allocating member variables were consuming significant CPU (~3% total) which slowed down request throughput. The map and pinning manager are only necessary when range deletions exist, so we can defer their initialization until the first range deletion is encountered. Currently lazy initialization is done for reads only since reads pass us a single snapshot, which is easier to store on the stack for later insertion into the map than the vector passed to us by flush or compaction. Note the Arena member variable is still expensive, I will figure out what to do with it in a subsequent diff. It cannot be lazily initialized because we currently use this arena even to allocate empty iterators, which is necessary even when no range deletions exist. Closes Differential Revision: D4203488 Pulled By: ajkr fbshipit-source-id: 3b36279/fix deleterange asan issue Summary: pinned_iters_mgr_ pins iterators allocated with arena_, so we should order the instance variable declarations such that the pinned iterators have their destructors executed before the arena is destroyed. Closes Differential Revision: D4191984 Pulled By: ajkr fbshipit-source-id: 1386f20/Consider subcompaction boundaries when updating file boundaries for range deletion Summary: Adjusted AddToBuilder() to take lower_bound and upper_bound, which serve two purposes: (1) only range deletions overlapping with the interval [lower_bound, upper_bound) will be added to the output file, and (2) the output files boundaries will not be extended before lower_bound or after upper_bound. Our computation of lower_bound/upper_bound consider both subcompaction boundaries and previous/next files within the subcompaction. Test cases are here (level subcompactions: and universal subcompactions: but cant be included in this diff as they depend on committing the API first. They fail before this change and pass after. Closes Reviewed By: yhchiang Differential Revision: D4171685 Pulled By: ajkr fbshipit-source-id: ee99db8/"
,,0.2639,rocksdb,"Fix DeleteRange including sentinels in output files Summary: when writing RangeDelAggregator::AddToBuilder, I forgot that there are sentinel tombstones in the middle of the interval map since gaps between real tombstones are represented with sentinels. blame: Closes Differential Revision: D4460426 Pulled By: ajkr fbshipit-source-id: 69444b5/Maintain position in range deletions map Summary: When deletion-collapsing mode is enabled (i.e., for DBIter/CompactionIterator), we maintain position in the tombstone maps across calls to ShouldDelete(). Since iterators often access keys sequentially (or reverse-sequentially), scanning forward/backward from the last position can be faster than binary-searching the map for every key. When Next() is invoked on an iterator, we use kForwardTraversal to scan forwards, if needed, until arriving at the range deletion containing the next key. Similarly for Prev(), we use kBackwardTraversal to scan backwards in the range deletion map. When the iterator seeks, we use kBinarySearch for repositioning After tombstones are added or before the first ShouldDelete() invocation, the current position is set to invalid, which forces kBinarySearch to be used. Non-iterator users (i.e., Get()) use kFullScan, which has the same behavior as before---scan the whole map for every key passed to ShouldDelete(). Closes Differential Revision: D4350318 Pulled By: ajkr fbshipit-source-id: 5129b76/Collapse range deletions Summary: Added a tombstone-collapsing mode to RangeDelAggregator, which eliminates overlap in the TombstoneMap. In this mode, we can check whether a tombstone covers a user key using upper_bound() (i.e., binary search). However, the tradeoff is the overhead to add tombstones is now higher, so at first Ive only enabled it for range scans (compaction/flush/user iterators), where we expect a high number of calls to ShouldDelete() for the same tombstones. Point queries like Get() will still use the linear scan approach. Also in this diff I changed RangeDelAggregators TombstoneMap to use multimap with user keys instead of map with internal keys. Callers sometimes provided ParsedInternalKey directly, from which it wouldve required string copying to derive an internal key Slice with which we could search the map. Closes Differential Revision: D4270397 Pulled By: ajkr fbshipit-source-id: 93092c7/DeleteRange compaction statistics Summary: ""rocksdb.compaction.key.drop.range_del"" number of keys dropped during compaction due to a range tombstone covering them ""rocksdb.compaction.range_del.drop.obsolete"" number of range tombstones dropped due to compaction to bottom level and no snapshot saving them s/CompactionIteratorStats/CompactionIterationStats/g since this class is no longer specific to CompactionIterator its also updated for range tombstone iteration during compaction Move the above class into a separate .h file to avoid circular dependency. Closes Differential Revision: D4187179 Pulled By: ajkr fbshipit-source-id: 10c2103/Lazily initialize RangeDelAggregators map and pinning manager Summary: Since a RangeDelAggregator is created for each read request, these heap-allocating member variables were consuming significant CPU (~3% total) which slowed down request throughput. The map and pinning manager are only necessary when range deletions exist, so we can defer their initialization until the first range deletion is encountered. Currently lazy initialization is done for reads only since reads pass us a single snapshot, which is easier to store on the stack for later insertion into the map than the vector passed to us by flush or compaction. Note the Arena member variable is still expensive, I will figure out what to do with it in a subsequent diff. It cannot be lazily initialized because we currently use this arena even to allocate empty iterators, which is necessary even when no range deletions exist. Closes Differential Revision: D4203488 Pulled By: ajkr fbshipit-source-id: 3b36279/Consider subcompaction boundaries when updating file boundaries for range deletion Summary: Adjusted AddToBuilder() to take lower_bound and upper_bound, which serve two purposes: (1) only range deletions overlapping with the interval [lower_bound, upper_bound) will be added to the output file, and (2) the output files boundaries will not be extended before lower_bound or after upper_bound. Our computation of lower_bound/upper_bound consider both subcompaction boundaries and previous/next files within the subcompaction. Test cases are here (level subcompactions: and universal subcompactions: but cant be included in this diff as they depend on committing the API first. They fail before this change and pass after. Closes Reviewed By: yhchiang Differential Revision: D4171685 Pulled By: ajkr fbshipit-source-id: ee99db8/"
,,0.1068,rocksdb,Fix unaligned reads in read cache Summary: Fix unaligned reads in read cache by using RandomAccessFileReader Allow read cache flags in db_bench Closes Differential Revision: D4610885 Pulled By: IslamAbdelRahman fbshipit-source-id: 2aa1dc8/
,,0.2507,rocksdb,"do not read next datablock if upperbound is reached Summary: Now if we have iterate_upper_bound set, we continue read until get a key >= upper_bound. For a lot of cases that neighboring data blocks have a user key gap between them, our index key will be a user key in the middle to get a shorter size. For example, if we have blocks: [a b c d][f g h] Then the index key for the first block will be e. then if upper bound is any key between d and e, for example, d1, d2, ..., d99999999999, we dont have to read the second block and also know that we have done our iteration by reaching the last key that smaller the upper bound already. This diff can reduce RA in most cases. Closes Differential Revision: D4990693 Pulled By: lightmark fbshipit-source-id: ab30ea2e3c6edf3fddd5efed3c34fcf7739827ff/Revert ""Delete filter before closing the table"" Summary: This reverts commit 89833577a80ad7a2cbf6b99c5957f572b3548152. Closes Differential Revision: D4986982 Pulled By: maysamyabandeh fbshipit-source-id: 56c4c07b7b5b7c6fe122d5c2f2199d221c8510c0/Readers for partition filter Summary: This is the last split of this pull request: which includes the reader part as well as the tests. Closes Differential Revision: D4672216 Pulled By: maysamyabandeh fbshipit-source-id: 6a2b829/Refactoring Summary: This is the first split of and will be needed for the upcoming partitioned filter patch. Closes Differential Revision: D4652152 Pulled By: maysamyabandeh fbshipit-source-id: 9801778/"
,,0.1526,rocksdb,Configure index partition size Summary: Allow the users to specify the target index partition size. With this patch an index partition is cut before its estimated in-memory size goes above the configured value for metadata_block_size. The filter partitions are still cut right after an index partition is cut. Closes Differential Revision: D4780216 Pulled By: maysamyabandeh fbshipit-source-id: 95a0831/
,,0.1235,rocksdb,"unbiase readamp bitmap Summary: Consider BlockReadAmpBitmap with bytes_per_bit 32. Suppose bytes [a, b) were used, while bytes [a-32, a) and [b+1, b+33) werent used; more formally, the union of ranges passed to BlockReadAmpBitmap::Mark() contains [a, b) and doesnt intersect with [a-32, a) and [b+1, b+33). Then bits [floor(a/32), ceil(b/32)] will be set, and so the number of useful bytes will be estimated as (ceil(b/32) floor(a/32)) * 32, which is on average equal to b-a+31. An extreme example: if we use 1 byte from each block, itll be counted as 32 bytes from each block. Its easy to remove this bias by slightly changing the semantics of the bitmap. Currently each bit represents a byte range [i*32, (i+1)*32). This diff makes each bit represent a single byte: i*32 + X, where X is a random number in [0, 31] generated when bitmap is created. So, e.g., if you read a single byte at random, with probability 31/32 it wont be counted at all, and with probability 1/32 it will be counted as 32 bytes; so, on average its counted as 1 byte. *But there is one exception: the last bit will always set with the old way.* (*) assuming read_amp_bytes_per_bit 32. Closes Differential Revision: D5035652 Pulled By: lightmark fbshipit-source-id: bd98b1b9b49fbe61f9e3781d07f624e3cbd92356/update IterKey that can get user key and internal key explicitly Summary: to void future bug that caused by the mix of userkey/internalkey Closes Differential Revision: D4825889 Pulled By: lightmark fbshipit-source-id: 28411db/"
,,0.3112,rocksdb,"do not read next datablock if upperbound is reached Summary: Now if we have iterate_upper_bound set, we continue read until get a key >= upper_bound. For a lot of cases that neighboring data blocks have a user key gap between them, our index key will be a user key in the middle to get a shorter size. For example, if we have blocks: [a b c d][f g h] Then the index key for the first block will be e. then if upper bound is any key between d and e, for example, d1, d2, ..., d99999999999, we dont have to read the second block and also know that we have done our iteration by reaching the last key that smaller the upper bound already. This diff can reduce RA in most cases. Closes Differential Revision: D4990693 Pulled By: lightmark fbshipit-source-id: ab30ea2e3c6edf3fddd5efed3c34fcf7739827ff/"
,,0.2981,rocksdb,"do not read next datablock if upperbound is reached Summary: Now if we have iterate_upper_bound set, we continue read until get a key >= upper_bound. For a lot of cases that neighboring data blocks have a user key gap between them, our index key will be a user key in the middle to get a shorter size. For example, if we have blocks: [a b c d][f g h] Then the index key for the first block will be e. then if upper bound is any key between d and e, for example, d1, d2, ..., d99999999999, we dont have to read the second block and also know that we have done our iteration by reaching the last key that smaller the upper bound already. This diff can reduce RA in most cases. Closes Differential Revision: D4990693 Pulled By: lightmark fbshipit-source-id: ab30ea2e3c6edf3fddd5efed3c34fcf7739827ff/"
,,0.3005,rocksdb,"do not read next datablock if upperbound is reached Summary: Now if we have iterate_upper_bound set, we continue read until get a key >= upper_bound. For a lot of cases that neighboring data blocks have a user key gap between them, our index key will be a user key in the middle to get a shorter size. For example, if we have blocks: [a b c d][f g h] Then the index key for the first block will be e. then if upper bound is any key between d and e, for example, d1, d2, ..., d99999999999, we dont have to read the second block and also know that we have done our iteration by reaching the last key that smaller the upper bound already. This diff can reduce RA in most cases. Closes Differential Revision: D4990693 Pulled By: lightmark fbshipit-source-id: ab30ea2e3c6edf3fddd5efed3c34fcf7739827ff/"
,,0.3088,rocksdb,"do not read next datablock if upperbound is reached Summary: Now if we have iterate_upper_bound set, we continue read until get a key >= upper_bound. For a lot of cases that neighboring data blocks have a user key gap between them, our index key will be a user key in the middle to get a shorter size. For example, if we have blocks: [a b c d][f g h] Then the index key for the first block will be e. then if upper bound is any key between d and e, for example, d1, d2, ..., d99999999999, we dont have to read the second block and also know that we have done our iteration by reaching the last key that smaller the upper bound already. This diff can reduce RA in most cases. Closes Differential Revision: D4990693 Pulled By: lightmark fbshipit-source-id: ab30ea2e3c6edf3fddd5efed3c34fcf7739827ff/"
,,0.1535,rocksdb,"Call RateLimiter for compaction reads Summary: Allow users to rate limit background work based on read bytes, written bytes, or sum of read and written bytes. Support these by changing the RateLimiter API, so no additional options were needed. Closes Differential Revision: D5216946 Pulled By: ajkr fbshipit-source-id: aec57a8357dbb4bfde2003261094d786d94f724e/"
,,0.152,rocksdb,"Call RateLimiter for compaction reads Summary: Allow users to rate limit background work based on read bytes, written bytes, or sum of read and written bytes. Support these by changing the RateLimiter API, so no additional options were needed. Closes Differential Revision: D5216946 Pulled By: ajkr fbshipit-source-id: aec57a8357dbb4bfde2003261094d786d94f724e/"
,,0.1291,rocksdb,Cut filter partition based on metadata_block_size Summary: Currently metadata_block_size controls only index partition size. With this patch a partition is cut after any of index or filter partitions reaches metadata_block_size. Closes Differential Revision: D5275651 Pulled By: maysamyabandeh fbshipit-source-id: 5057e4424b4c8902043782e6bf8c38f0c4f25160/
,,0.1291,rocksdb,Cut filter partition based on metadata_block_size Summary: Currently metadata_block_size controls only index partition size. With this patch a partition is cut after any of index or filter partitions reaches metadata_block_size. Closes Differential Revision: D5275651 Pulled By: maysamyabandeh fbshipit-source-id: 5057e4424b4c8902043782e6bf8c38f0c4f25160/
,,0.1659,rocksdb,"Call RateLimiter for compaction reads Summary: Allow users to rate limit background work based on read bytes, written bytes, or sum of read and written bytes. Support these by changing the RateLimiter API, so no additional options were needed. Closes Differential Revision: D5216946 Pulled By: ajkr fbshipit-source-id: aec57a8357dbb4bfde2003261094d786d94f724e/"
,,0.1239,rocksdb,Cut filter partition based on metadata_block_size Summary: Currently metadata_block_size controls only index partition size. With this patch a partition is cut after any of index or filter partitions reaches metadata_block_size. Closes Differential Revision: D5275651 Pulled By: maysamyabandeh fbshipit-source-id: 5057e4424b4c8902043782e6bf8c38f0c4f25160/
,,0.2331,rocksdb,"Improve Status message for block checksum mismatches Summary: Weve got some DBs where iterators return Status with message ""Corruption: block checksum mismatch"" all the time. Thats not very informative. It would be much easier to investigate if the error message contained the file name then we would know e.g. how old the corrupted file is, which would be very useful for finding the root cause. This PR adds file name, offset and other stuff to some block corruption-related status messages. It doesnt improve all the error messages, just a few that were easy to improve. Im mostly interested in ""block checksum mismatch"" and ""Bad table magic number"" since theyre the only corruption errors that Ive ever seen in the wild. Closes Differential Revision: D5345702 Pulled By: al13n321 fbshipit-source-id: fc8023d43f1935ad927cef1b9c55481ab3cb1339/"
,,0.2418,rocksdb,"record index partition properties Summary: When Partitioning index/filter is enabled the user might need to check the index block size as well as the top-level index size via sst_dump. This patch records i) number of partitions, ii) top-level index size and make it accessible through sst_dump. The number of partitions for filters is the same as that of indexes. The top-level index for filters has a similar size to top-level index for indexes, so it is not repeated. Closes Differential Revision: D5224225 Pulled By: maysamyabandeh fbshipit-source-id: 5324598c75793523aef1bb7ee225a5475e95a9cb/"
