Topic_no,Keywords,Contrib,System,Text
,,0.2707,rocksdb,"xxHash Summary: Originally: Im taking over to apply some finishing touches Test Plan: will add tests Reviewers: dhruba, haobo, sdong, yhchiang, ljin Reviewed By: yhchiang CC: leveldb Differential Revision: add a mode to operate multiple DBs Summary: This patch introduces a new parameter num_multi_db in db_bench. When this parameter is larger than 1, multiple DBs will be created. In all benchmarks, any operation applies to a random DB among them. This is to benchmark the performance of similar applications. Test Plan: run db_bench on both of num_multi_db=0 and more. Reviewers: haobo, ljin, igor Reviewed By: igor CC: igor, yhchiang, dhruba, nkg-, leveldb Differential Revision: Summary: as title Test Plan: ran it Reviewers: igor, haobo, yhchiang Reviewed By: yhchiang CC: leveldb Differential Revision: add IteratorCreationWhileWriting mode and allow prefix_seek Summary: as title Test Plan: ran it Reviewers: igor, haobo, yhchiang Reviewed By: igor CC: leveldb Differential Revision: up db_bench filluniquerandom mode Summary: filluniquerandom is painfully slow due to the naive bitmap check to find out if a key has been seen before. Majority of time is spent on searching the last few keys. Split a giant BitSet to smaller ones so that we can quickly check if a BitSet is full and thus can skip quickly. It used to take over one hour to filluniquerandom for 100M keys, now it takes about 10 mins. Test Plan: unit test also verified correctness in db_bench and make sure all keys are generated Reviewers: igor, haobo, yhchiang Reviewed By: igor CC: leveldb, dhruba Differential Revision: cleanup Summary: clean up the db_bench a little bit. also avoid allocating memory for key in the loop Test Plan: I verified a run with filluniquerandom & readrandom. Iterator seek will be used lot to measure performance. Will fix whatever comes up Reviewers: haobo, igor, yhchiang Reviewed By: igor CC: leveldb Differential Revision: hash_link_list Nodes key space consecutively followed at the end Summary: per sdongs request, this will help processor prefetch on n->key case. Test Plan: make all check Reviewers: sdong, haobo, igor Reviewed By: sdong CC: leveldb Differential Revision: friendly blocked bloomfilter Summary: By constraining the probes within cache line(s), we can improve the cache miss rate thus performance. This probably only makes sense for in-memory workload so defaults the option to off. Numbers and comparision can be found in wiki: Test Plan: benchmarked this change substantially. Will run make all check as well Reviewers: haobo, igor, dhruba, sdong, yhchiang Reviewed By: haobo CC: leveldb Differential Revision: SliceTransform object ownership Summary: (1) Fix SanitizeOptions() to also check HashLinkList. The current dynamic case just happens to work because the 2 classes have the same layout. (2) Do not delete SliceTransform object in HashSkipListFactory and HashLinkListFactory destructor. Reason: SanitizeOptions() enforces prefix_extractor and SliceTransform to be the same object when Hash**Factory is used. This makes the behavior strange: when Hash**Factory is used, prefix_extractor will be released by RocksDB. If other memtable factory is used, prefix_extractor should be released by user. Test Plan: db_bench && make asan_check Reviewers: haobo, igor, sdong Reviewed By: igor CC: leveldb, dhruba Differential Revision: db_bench to use HashSkipList for real Summary: For HashSkipList case, DBImpl has sanity check to see if prefix_extractor in options is the same as the one in memtable factory. If not, it falls back to SkipList. As result, I was experimenting with SkipList performance. No wonder it is much worse than LinkedList Test Plan: ran benchmark Reviewers: haobo, sdong, igor Reviewed By: igor CC: leveldb Differential Revision: max_background_flushes in db_bench Summary: as title Test Plan: make release Reviewers: haobo, sdong, igor Reviewed By: haobo CC: leveldb Differential Revision: key evenly distributed between 0 and FLAGS_num Summary: The issue is that when FLAGS_num is small, the leading bytes of the key are padded with 0s. This makes all keys have the same prefix 00000000 Most of the changes are just to make lint happy Test Plan: ran db_bench Reviewers: sdong, haobo, igor Reviewed By: sdong CC: leveldb Differential Revision:"
,,0.2567,rocksdb,"Enable hash index for block-based table Summary: Based on previous patches, this diff eventually provides the end-to-end mechanism for users to specify the hash-index. Test Plan: Wrote several new unit tests. Reviewers: sdong, haobo, dhruba Reviewed By: sdong CC: leveldb Differential Revision: IterKey and use it in DBImpl::ProcessKeyValueCompaction() Summary: 1. Polish IterKey a little bit. 2. Turn to use it in local parameter of current_user_key in DBImpl::ProcessKeyValueCompaction(). Our profile showing that DBImpl::ProcessKeyValueCompaction() has about 14% costs in std::string (the base including reading and writing data but excluding compaction filtering), which is higher than it should be. There are two std::string used in DBImpl::ProcessKeyValueCompaction(), compaction_filter_value and current_user_key and its hard to distinguish the two. Test Plan: make all check Reviewers: haobo, ljin Reviewed By: haobo CC: igor, yhchiang, dhruba, leveldb Differential Revision: not to store copied key in std::string Summary: Move PlainTableIterators copied key from std::string local buffer to avoid paying the extra costs in std::string related to sharing. Reuse the same buffer class in DbIter. Move the class to dbformat.h. This patch improves iterator performance significantly. Running this benchmark: ./table_reader_bench The average latency is improved to about 750 nanoseconds from 1100 nanoseconds. Test Plan: Add a unit test. make all check Reviewers: haobo, ljin Reviewed By: haobo CC: igor, yhchiang, dhruba, leveldb Differential Revision:"
,,0.0798,rocksdb,"macros for perf_context Summary: This will allow us to disable them completely for iOS or for better performance Test Plan: will run make all check Reviewers: igor, haobo, dhruba Reviewed By: haobo CC: leveldb Differential Revision:"
,,0.2117,rocksdb,"Expose number of entries in mem tables to users Summary: In this patch, two new DB properties are defined: rocksdb.num-immutable-mem-table and rocksdb.num-entries-imm-mem-tables, from where number of entries in mem tables can be exposed to users Test Plan: Cover the codes in db_test make all check Reviewers: haobo, ljin, igor Reviewed By: igor CC: nkg-, igor, yhchiang, dhruba, leveldb Differential Revision: heuristic way to check if a memtable is full Summary: This is is based on Its not finished but I would like to give a prototype to avoid arena over-allocation while making better use of the already allocated memory blocks. Instead of check approximate memtable size, we will take a deeper look at the arena, which incorporate essential idea that suggests: flush when arena has allocated its last and the last is ""almost full"" Test Plan: N/A Reviewers: haobo, sdong Reviewed By: sdong CC: leveldb, sdong Differential Revision:"
,,0.1427,rocksdb,"macros for perf_context Summary: This will allow us to disable them completely for iOS or for better performance Test Plan: will run make all check Reviewers: igor, haobo, dhruba Reviewed By: haobo CC: leveldb Differential Revision: to use static allocated char array for saved_key_ (if it is not too long) Summary: DBIter now uses a std::string for saved_key. Based on some profiling, it could be more expensive than we though. Optimize it with the same technique as LookupKey if it is short, we copy it to a static allocated char. Otherwise, dynamically allocate memory for it. Test Plan: make all check Reviewers: haobo, ljin Reviewed By: haobo CC: dhruba, igor, yhchiang, leveldb Differential Revision:"
,,0.3413,rocksdb,"Revert ""Revert ""Allow allocating dynamic bloom, plain table indexes and hash linked list from huge page TLB"""" And make the default 0 for hash linked list memtable This reverts commit d69dc64be78a8da3ce661454655966d11ff61bb6./PlainTableReader to expose index size to users Summary: This is a temp solution to expose index sizes to users from PlainTableReader before we persistent them to files. In this patch, the memory consumption of indexes used by PlainTableReader will be reported as two user defined properties, so that users can monitor them. Test Plan: Add a unit test. make all check` Reviewers: haobo, ljin Reviewed By: haobo CC: nkg-, yhchiang, igor, ljin, dhruba, leveldb Differential Revision: not to store copied key in std::string Summary: Move PlainTableIterators copied key from std::string local buffer to avoid paying the extra costs in std::string related to sharing. Reuse the same buffer class in DbIter. Move the class to dbformat.h. This patch improves iterator performance significantly. Running this benchmark: ./table_reader_bench The average latency is improved to about 750 nanoseconds from 1100 nanoseconds. Test Plan: Add a unit test. make all check Reviewers: haobo, ljin Reviewed By: haobo CC: igor, yhchiang, dhruba, leveldb Differential Revision: shouldnt check bloom filter in total order mode Summary: In total order mode, iterators seek() shouldnt check total order. Also some cleaning up about checking null for shared pointers. I dont know the behavior before it. This bug was reported by Test Plan: test plain_table_db_test Reviewers: ljin, haobo, igor Reviewed By: igor CC: yhchiang, dhruba, igor, leveldb Differential Revision: more black-box tests for PlainTable and explicitly support total order mode Summary: 1. Add some more implementation-aware tests for PlainTable 2. move from a hard-coded one index per 16 rows in one prefix to a configurable number. Also, make hash table ratio 0 means binary search only. Also fixes some divide 0 risks. 3. Explicitly support total order (only use binary search) 4. some code cleaning up. Test Plan: make all check Reviewers: haobo, kailiu Reviewed By: haobo CC: leveldb Differential Revision:"
,,0.3859,rocksdb,"Revert ""Revert ""Allow allocating dynamic bloom, plain table indexes and hash linked list from huge page TLB"""" And make the default 0 for hash linked list memtable This reverts commit d69dc64be78a8da3ce661454655966d11ff61bb6./Add a new mem-table representation based on cuckoo hash. Summary: Major Changes * Add a new mem-table representation, HashCuckooRep, which is based cuckoo hash. Cuckoo hash uses multiple hash functions. This allows each key to have multiple possible locations in the mem-table. Put: When insert a key, it will try to find whether one of its possible locations is vacant and store the key. If none of its possible locations are available, then it will kick out a victim key and store at that location. The kicked-out victim key will then be stored at a vacant space of its possible locations or kick-out another victim. In this diff, the kick-out path (known as cuckoo-path) is found using BFS, which guarantees to be the shortest. Get: Simply tries all possible locations of a key this guarantees worst-case constant time complexity. Time complexity: O(1) for Get, and average O(1) for Put if the fullness of the mem-table is below 80%. Default using two hash functions, the number of hash functions used by the cuckoo-hash may dynamically increase if it fails to find a short-enough kick-out path. Currently, HashCuckooRep does not support iteration and snapshots, as our current main purpose of this is to optimize point access. Minor Changes * Add IsSnapshotSupported() to DB to indicate whether the current DB supports snapshots. If it returns false, then DB::GetSnapshot() will always return nullptr. Test Plan: Run existing tests. Will develop a test specifically for cuckoo hash in the next diff. Reviewers: sdong, haobo Reviewed By: sdong CC: leveldb, dhruba, igor Differential Revision: number of entries in mem tables to users Summary: In this patch, two new DB properties are defined: rocksdb.num-immutable-mem-table and rocksdb.num-entries-imm-mem-tables, from where number of entries in mem tables can be exposed to users Test Plan: Cover the codes in db_test make all check Reviewers: haobo, ljin, igor Reviewed By: igor CC: nkg-, igor, yhchiang, dhruba, leveldb Differential Revision: for perf_context Summary: This will allow us to disable them completely for iOS or for better performance Test Plan: will run make all check Reviewers: igor, haobo, dhruba Reviewed By: haobo CC: leveldb Differential Revision: hash_link_list Nodes key space consecutively followed at the end Summary: per sdongs request, this will help processor prefetch on n->key case. Test Plan: make all check Reviewers: sdong, haobo, igor Reviewed By: sdong CC: leveldb Differential Revision: not to reference Memtable Summary: In one of the perf, I shows 10%-25% CPU costs of MemTableIterator.Seek(), when doing dynamic prefix seek, are spent on checking whether we need to do bloom filter check or finding out the prefix extractor. Seems that more level of pointer checking makes CPU cache miss more likely. This patch makes things slightly simpler by copying pointer of bloom of prefix extractor into the iterator. Test Plan: make all check Reviewers: haobo, ljin Reviewed By: ljin CC: igor, dhruba, yhchiang, leveldb Differential Revision: heuristic way to check if a memtable is full Summary: This is is based on Its not finished but I would like to give a prototype to avoid arena over-allocation while making better use of the already allocated memory blocks. Instead of check approximate memtable size, we will take a deeper look at the arena, which incorporate essential idea that suggests: flush when arena has allocated its last and the last is ""almost full"" Test Plan: N/A Reviewers: haobo, sdong Reviewed By: sdong CC: leveldb, sdong Differential Revision: SliceTransform object ownership Summary: (1) Fix SanitizeOptions() to also check HashLinkList. The current dynamic case just happens to work because the 2 classes have the same layout. (2) Do not delete SliceTransform object in HashSkipListFactory and HashLinkListFactory destructor. Reason: SanitizeOptions() enforces prefix_extractor and SliceTransform to be the same object when Hash**Factory is used. This makes the behavior strange: when Hash**Factory is used, prefix_extractor will be released by RocksDB. If other memtable factory is used, prefix_extractor should be released by user. Test Plan: db_bench && make asan_check Reviewers: haobo, igor, sdong Reviewed By: igor CC: leveldb, dhruba Differential Revision: a hash-index component for block Summary: this is the key component extracted from diff: I separate it to a dedicated patch to make the review easier. Test Plan: added a unit test and passed it. Reviewers: haobo, sdong, dhruba CC: leveldb Differential Revision:"
,,0.2213,rocksdb,"Adding option to save PlainTable index and bloom filter in SST file. Summary: Adding option to save PlainTable index and bloom filter in SST file. If there is no bloom block and/or index block, PlainTableReader builds new ones. Otherwise PlainTableReader just use these blocks. Test Plan: make all check Reviewers: sdong Reviewed By: sdong Subscribers: leveldb Differential Revision: arena to allocate memtables bloomfilter and hashskiplists buckets_ Summary: Bloomfilter and hashskiplists buckets_ allocated by memtables arena DynamicBloom: pass arena via constructor, allocate space in SetTotalBits HashSkipListRep: allocate space of buckets_ using arena. do not delete it in deconstructor because arena would take care of it. Several test files are changed. Test Plan: make all check Reviewers: ljin, haobo, yhchiang, sdong Reviewed By: sdong Subscribers: igor, dhruba Differential Revision: bloom filter data block for L0 files Summary: as title Test Plan: db_bench the initial result is very promising. I will post results of complete runs Reviewers: dhruba, haobo, sdong, igor Reviewed By: sdong Subscribers: leveldb Differential Revision: PlainTableReaders variables for better data locality Summary: Clean PlainTableReaders data structures: (1) inline bloom_ (in order to do this, change DynamicBloom to allow lazy initialization) (2) remove some variables only used when initialization from the class (3) put variables not used in normal read code paths to the end of the class and reference prefix_extractor directly (4) make Options a reference. Test Plan: make all check Reviewers: haobo, ljin Reviewed By: ljin Subscribers: igor, yhchiang, dhruba, leveldb Differential Revision: replace some divide (remainder) operations with shifts in locality mode, and other improvements Summary: This patch changes meaning of options.bloom_locality: 0 means disable cache line optimization and any positive number means use CACHE_LINE_SIZE as block size (the previous behavior is the block size will be CACHE_LINE_SIZE*options.bloom_locality). By doing it, the divide operations inside a block can be replaced by a shift. Performance is improved: Also, improve the basic algorithm in two ways: (1) make sure num of blocks is an odd number (2) rotate bytes after every probe in locality mode. Since the divider is 2^n, unless doing it, we are never able to use all the bits. Improvements of false positive: Test Plan: make all check Reviewers: ljin, haobo Reviewed By: haobo Subscribers: dhruba, yhchiang, igor, leveldb Differential Revision:"
,,0.228,rocksdb,"HashLinkList memtable switches a bucket to a skip list to reduce performance outliers Summary: In this patch, we enhance HashLinkList memtable to reduce performance outliers when a bucket contains too many entries. We switch to skip list for this case to enable binary search. Add threshold_use_skiplist parameter to determine when a bucket needs to switch to skip list. The new data structure is documented in comments in the codes. Test Plan: make all check set threshold_use_skiplist in several tests Reviewers: yhchiang, haobo, ljin Reviewed By: yhchiang, ljin Subscribers: nkg-, xjin, dhruba, yhchiang, leveldb Differential Revision:"
,,0.3001,rocksdb,"use arena to allocate memtables bloomfilter and hashskiplists buckets_ Summary: Bloomfilter and hashskiplists buckets_ allocated by memtables arena DynamicBloom: pass arena via constructor, allocate space in SetTotalBits HashSkipListRep: allocate space of buckets_ using arena. do not delete it in deconstructor because arena would take care of it. Several test files are changed. Test Plan: make all check Reviewers: ljin, haobo, yhchiang, sdong Reviewed By: sdong Subscribers: igor, dhruba Differential Revision: replace some divide (remainder) operations with shifts in locality mode, and other improvements Summary: This patch changes meaning of options.bloom_locality: 0 means disable cache line optimization and any positive number means use CACHE_LINE_SIZE as block size (the previous behavior is the block size will be CACHE_LINE_SIZE*options.bloom_locality). By doing it, the divide operations inside a block can be replaced by a shift. Performance is improved: Also, improve the basic algorithm in two ways: (1) make sure num of blocks is an odd number (2) rotate bytes after every probe in locality mode. Since the divider is 2^n, unless doing it, we are never able to use all the bits. Improvements of false positive: Test Plan: make all check Reviewers: ljin, haobo Reviewed By: haobo Subscribers: dhruba, yhchiang, igor, leveldb Differential Revision:"
,,0.2071,rocksdb,"Add DB property ""rocksdb.estimate-table-readers-mem"" Summary: Add a DB Property ""rocksdb.estimate-table-readers-mem"" to return estimated memory usage by all loaded table readers, other than allocated from block cache. Refactor the property codes to allow getting property from a version, with DB mutex not acquired. Test Plan: Add several checks of this new property in existing codes for various cases. Reviewers: yhchiang, ljin Reviewed By: ljin Subscribers: xjin, igor, leveldb Differential Revision: malloc when create data and index iterator in Get Summary: Define Block::Iter to be an independent class to be used by block_based_table_reader When creating data and index iterator, update an existing iterator rather than new one Thus malloc and free could be reduced Benchmark, Base: commit 76286ee67ef4b89579a92134b996a681c36a1331 commands: disable_auto_compactions=1 malloc: 3.30% 1.42% free: 3.59%->1.61% Test Plan: make all check run db_stress valgrind ./db_test ./table_test Reviewers: ljin, yhchiang, dhruba, igor, sdong Reviewed By: sdong Subscribers: leveldb Differential Revision: IterKey instead of string in Block::Iter to reduce malloc Summary: Modify a functioin TrimAppend in dbformat.h: IterKey. Write a test for it in dbformat_test Use IterKey in block::Iter to replace std::string to reduce malloc. Evaluate it using perf record. malloc: 4.26% 2.91% free: 3.61% 3.08% Test Plan: make all check ./valgrind db_test dbformat_test Reviewers: ljin, haobo, yhchiang, dhruba, igor, sdong Reviewed By: sdong Differential Revision: Reduce memory footprint of the blockbased table hash index. Summary: Currently, the in-memory hash index of blockbased table uses a precise hash map to track the prefix to block range mapping. In some use cases, especially when prefix itself is big, the memory overhead becomes a problem. This diff introduces a fixed hash bucket array that does not store the prefix and allows prefix collision, which is similar to the plaintable hash index, in order to reduce the memory consumption. Just a quick draft, still testing and refining. Test Plan: unit test and shadow testing Reviewers: dhruba, kailiu, sdong Reviewed By: sdong Subscribers: leveldb Differential Revision:"
,,0.2051,rocksdb,"Fix compressed cache/[RocksDB] Reduce memory footprint of the blockbased table hash index. Summary: Currently, the in-memory hash index of blockbased table uses a precise hash map to track the prefix to block range mapping. In some use cases, especially when prefix itself is big, the memory overhead becomes a problem. This diff introduces a fixed hash bucket array that does not store the prefix and allows prefix collision, which is similar to the plaintable hash index, in order to reduce the memory consumption. Just a quick draft, still testing and refining. Test Plan: unit test and shadow testing Reviewers: dhruba, kailiu, sdong Reviewed By: sdong Subscribers: leveldb Differential Revision: the hash index Summary: Materialize the hash index to avoid the soaring cpu/flash usage when initializing the database. Test Plan: existing unit tests passed Reviewers: sdong, haobo Reviewed By: sdong CC: leveldb Differential Revision:"
,,0.1181,rocksdb,"store file_indexer info in sequential memory Summary: use arena to allocate space for next_level_index_ and level_rb_ Thus increasing data locality and make Version::Get faster. Benchmark detail Base version: commit d2a727c182338514af955bbcb1d92db4af83b41c command used: ./db_bench readrandom,readrandom,readrandom Result: cpu running percentage: Version::Get, improved from 7.98% to 7.42% FileIndexer::GetNextLevelIndex, improved from 1.18% to 0.68%. Test Plan: make all check Reviewers: ljin, haobo, yhchiang, sdong Reviewed By: sdong Subscribers: dhruba, igor Differential Revision:"
,,0.2507,rocksdb,"Use IterKey instead of string in Block::Iter to reduce malloc Summary: Modify a functioin TrimAppend in dbformat.h: IterKey. Write a test for it in dbformat_test Use IterKey in block::Iter to replace std::string to reduce malloc. Evaluate it using perf record. malloc: 4.26% 2.91% free: 3.61% 3.08% Test Plan: make all check ./valgrind db_test dbformat_test Reviewers: ljin, haobo, yhchiang, dhruba, igor, sdong Reviewed By: sdong Differential Revision: memtable switches a bucket to a skip list to reduce performance outliers Summary: In this patch, we enhance HashLinkList memtable to reduce performance outliers when a bucket contains too many entries. We switch to skip list for this case to enable binary search. Add threshold_use_skiplist parameter to determine when a bucket needs to switch to skip list. The new data structure is documented in comments in the codes. Test Plan: make all check set threshold_use_skiplist in several tests Reviewers: yhchiang, haobo, ljin Reviewed By: yhchiang, ljin Subscribers: nkg-, xjin, dhruba, yhchiang, leveldb Differential Revision: iterator Summary: Forward iterator puts everything together in a flat structure instead of a hierarchy of nested iterators. this should simplify the code and provide better performance. It also enables more optimization since all information are accessiable in one place. Init evaluation shows about 6% improvement Test Plan: db_test and db_bench Reviewers: dhruba, igor, tnovak, sdong, haobo Reviewed By: haobo Subscribers: sdong, leveldb Differential Revision:"
,,0.1092,rocksdb,"Allow user to specify DB path of output file of manual compaction Summary: Add a parameter path_id to DB::CompactRange(), to indicate where the output file should be placed to. Test Plan: add a unit test Reviewers: yhchiang, ljin Reviewed By: ljin Subscribers: xjin, igor, dhruba, MarkCallaghan, leveldb Differential Revision: file_indexer info in sequential memory Summary: use arena to allocate space for next_level_index_ and level_rb_ Thus increasing data locality and make Version::Get faster. Benchmark detail Base version: commit d2a727c182338514af955bbcb1d92db4af83b41c command used: ./db_bench readrandom,readrandom,readrandom Result: cpu running percentage: Version::Get, improved from 7.98% to 7.42% FileIndexer::GetNextLevelIndex, improved from 1.18% to 0.68%. Test Plan: make all check Reviewers: ljin, haobo, yhchiang, sdong Reviewed By: sdong Subscribers: dhruba, igor Differential Revision:"
