Topic_no,Keywords,Contrib,System,Text
,,0.1252,rocksdb,Inform caller when rocksdb is stalling writes Summary: Add a new function in Listener to let the caller know when rocksdb is stalling writes. Closes Differential Revision: D5860124 Pulled By: schischi fbshipit-source-id: ee791606169aa64f772c86f817cebf02624e05e1/
,,0.1196,rocksdb,WritePrepared Txn: Refactor conf params Summary: Summary of changes: Move seq_per_batch out of Options Rename concurrent_prepare to two_write_queues Add allocate_seq_only_for_data_ Closes Differential Revision: D6304458 Pulled By: maysamyabandeh fbshipit-source-id: 08e685bfa82bbc41b5b1c5eb7040a8ca6e05e58c/
,,0.1234,rocksdb,Enable MSVC W4 with a few exceptions. Fix warnings and bugs Summary: Closes Differential Revision: D6079011 Pulled By: yiwu-arbug fbshipit-source-id: 988a721e7e7617967859dba71d660fc69f4dff57/
,,0.2572,rocksdb,"TableProperty::oldest_key_time defaults to 0 Summary: We dont propagate TableProperty::oldest_key_time on compaction and just write the default value to SST files. It is more natural to default the value to 0. Also revert db_sst_test back to before Closes Differential Revision: D6165702 Pulled By: yiwu-arbug fbshipit-source-id: ca3ce5928d96ae79a5beb12bb7d8c640a71478a0/Add DB::Properties::kEstimateOldestKeyTime Summary: With FIFO compaction we would like to get the oldest data time for monitoring. The problem is we dont have timestamp for each key in the DB. As an approximation, we expose the earliest of sst file ""creation_time"" property. My plan is to override the property with a more accurate value with blob db, where we actually have timestamp. Closes Differential Revision: D5770600 Pulled By: yiwu-arbug fbshipit-source-id: 03833c8f10bbfbee62f8ea5c0d03c0cafb5d853a/"
,,0.2116,rocksdb,"Add DB::Properties::kEstimateOldestKeyTime Summary: With FIFO compaction we would like to get the oldest data time for monitoring. The problem is we dont have timestamp for each key in the DB. As an approximation, we expose the earliest of sst file ""creation_time"" property. My plan is to override the property with a more accurate value with blob db, where we actually have timestamp. Closes Differential Revision: D5770600 Pulled By: yiwu-arbug fbshipit-source-id: 03833c8f10bbfbee62f8ea5c0d03c0cafb5d853a/"
,,0.2018,rocksdb,"Add DB::Properties::kEstimateOldestKeyTime Summary: With FIFO compaction we would like to get the oldest data time for monitoring. The problem is we dont have timestamp for each key in the DB. As an approximation, we expose the earliest of sst file ""creation_time"" property. My plan is to override the property with a more accurate value with blob db, where we actually have timestamp. Closes Differential Revision: D5770600 Pulled By: yiwu-arbug fbshipit-source-id: 03833c8f10bbfbee62f8ea5c0d03c0cafb5d853a/"
,,0.145,rocksdb,Move static variables out of the header file Summary: Static variables in header files will be instantiated in every file that includes the header file. This patch moves some of them from options_helper.h to its .cc files. It also moves the static variable out of the offset_of since the template function could also lead to multiple instantiation perhaps due to inlining. Fixes Closes Differential Revision: D6363794 Pulled By: maysamyabandeh fbshipit-source-id: d0a07f061b4d992ab4e0de2706e622131d258fdd/Make DBOption compaction_readahead_size dynamic Summary: Closes Differential Revision: D6056141 Pulled By: miasantreble fbshipit-source-id: 56df1630f464fd56b07d25d38161f699e0528b7f/
,,0.1492,rocksdb,Make Universal compaction options dynamic Summary: Let me know if more test coverage is needed Closes Differential Revision: D6457165 Pulled By: miasantreble fbshipit-source-id: 3f944abff28aa7775237f1c4f61c64ccbad4eea9/Move static variables out of the header file Summary: Static variables in header files will be instantiated in every file that includes the header file. This patch moves some of them from options_helper.h to its .cc files. It also moves the static variable out of the offset_of since the template function could also lead to multiple instantiation perhaps due to inlining. Fixes Closes Differential Revision: D6363794 Pulled By: maysamyabandeh fbshipit-source-id: d0a07f061b4d992ab4e0de2706e622131d258fdd/
,,0.1178,rocksdb,Add a BlockBasedTableOption to turn off index block compression. Summary: Add a new bool option index_uncompressed in BlockBasedTableOptions. Closes Differential Revision: D6686161 Pulled By: anand1976 fbshipit-source-id: 748b46993d48a01e5f89b6bd3e41f06a59ec6054/
,,0.2227,rocksdb,"Blob DB: miscellaneous changes Summary: * Expose garbage collection related options * Minor logging and counter name update * Remove unused constants. Closes Differential Revision: D6867077 Pulled By: yiwu-arbug fbshipit-source-id: 6c3272a9c9d78b125a0bd6b2e56d00d087cdd6c8/Add a histogram stat for memtable flush Summary: Add a new histogram stat called rocksdb.db.flush.micros for memtable flush Closes Differential Revision: D6559496 Pulled By: anand1976 fbshipit-source-id: f5c771ba2568630458751795e8c37a493ff9b14d/Blob DB: Add statistics Summary: Adding a list of blob db counters. Also remove WaStats() which doesnt expose the stats and can be substitute by (BLOB_DB_BYTES_WRITTEN / BLOB_DB_BLOB_FILE_BYTES_WRITTEN). Closes Differential Revision: D6394216 Pulled By: yiwu-arbug fbshipit-source-id: 017508c8ff3fcd7ea7403c64d0f9834b24816803/Add a ticker stat for number of keys skipped during iteration Summary: This diff adds a new ticker stat, NUMBER_ITER_SKIP, to count the number of internal keys skipped during iteration. Keys can be skipped due to deletes, or lower sequence number, or higher sequence number than the one requested. Also, fix the issue when StatisticsData is naturally aligned on cacheline boundary, padding becomes a zero size array, which the Windows compiler doesnt like. So add a cacheline worth of padding in that case to keep it happy. We cannot conditionally add padding as gcc doesnt allow using sizeof in preprocessor directives. Closes Differential Revision: D6353897 Pulled By: anand1976 fbshipit-source-id: 441d5a09af9c4e22e7355242dfc0c7b27aa0a6c2/"
,,0.1667,rocksdb,Blob DB: Add statistics Summary: Adding a list of blob db counters. Also remove WaStats() which doesnt expose the stats and can be substitute by (BLOB_DB_BYTES_WRITTEN / BLOB_DB_BLOB_FILE_BYTES_WRITTEN). Closes Differential Revision: D6394216 Pulled By: yiwu-arbug fbshipit-source-id: 017508c8ff3fcd7ea7403c64d0f9834b24816803/
,,0.2071,rocksdb,"Blob DB: fix crash when DB full but no candidate file to evict Summary: When blob_files is empty, std::min_element will return blobfiles.end(), which cannot be dereference. Fixing it. Closes Differential Revision: D6764927 Pulled By: yiwu-arbug fbshipit-source-id: 86f78700132be95760d35ac63480dfd3a8bbe17a/Blob DB: Add statistics Summary: Adding a list of blob db counters. Also remove WaStats() which doesnt expose the stats and can be substitute by (BLOB_DB_BYTES_WRITTEN / BLOB_DB_BLOB_FILE_BYTES_WRITTEN). Closes Differential Revision: D6394216 Pulled By: yiwu-arbug fbshipit-source-id: 017508c8ff3fcd7ea7403c64d0f9834b24816803/"
,,0.2037,rocksdb,Blob DB: dump blob_db_options.min_blob_size Summary: min_blob_size was missing from BlobDBOptions::Dump. Closes Differential Revision: D6781525 Pulled By: yiwu-arbug fbshipit-source-id: 40d9b391578d7f8c91bd89f4ce2eda5064864c25/Blob DB: Add statistics Summary: Adding a list of blob db counters. Also remove WaStats() which doesnt expose the stats and can be substitute by (BLOB_DB_BYTES_WRITTEN / BLOB_DB_BLOB_FILE_BYTES_WRITTEN). Closes Differential Revision: D6394216 Pulled By: yiwu-arbug fbshipit-source-id: 017508c8ff3fcd7ea7403c64d0f9834b24816803/
,,0.1648,rocksdb,Blob DB: Add statistics Summary: Adding a list of blob db counters. Also remove WaStats() which doesnt expose the stats and can be substitute by (BLOB_DB_BYTES_WRITTEN / BLOB_DB_BLOB_FILE_BYTES_WRITTEN). Closes Differential Revision: D6394216 Pulled By: yiwu-arbug fbshipit-source-id: 017508c8ff3fcd7ea7403c64d0f9834b24816803/
,,0.1366,rocksdb,"BlobDB: refactor DB open logic Summary: Refactor BlobDB open logic. List of changes: Major: * On reopen, mark blob files found as immutable, do not use them for writing new keys. * Not to scan the whole file to find file footer. Instead just seek to the end of the file and try to read footer. Minor: * Move most of the real logic from blob_db.cc to blob_db_impl.cc. * Not to hold shared_ptr of event listeners in global maps in blob_db.cc * Some changes to BlobFile interface. * Improve logging and error handling. Closes Differential Revision: D6526147 Pulled By: yiwu-arbug fbshipit-source-id: 9dc4cdd63359a2f9b696af817086949da8d06952/Blob DB: Add statistics Summary: Adding a list of blob db counters. Also remove WaStats() which doesnt expose the stats and can be substitute by (BLOB_DB_BYTES_WRITTEN / BLOB_DB_BLOB_FILE_BYTES_WRITTEN). Closes Differential Revision: D6394216 Pulled By: yiwu-arbug fbshipit-source-id: 017508c8ff3fcd7ea7403c64d0f9834b24816803/"
,,0.1612,rocksdb,Blob DB: Add statistics Summary: Adding a list of blob db counters. Also remove WaStats() which doesnt expose the stats and can be substitute by (BLOB_DB_BYTES_WRITTEN / BLOB_DB_BLOB_FILE_BYTES_WRITTEN). Closes Differential Revision: D6394216 Pulled By: yiwu-arbug fbshipit-source-id: 017508c8ff3fcd7ea7403c64d0f9834b24816803/
,,0.1648,rocksdb,Blob DB: Add statistics Summary: Adding a list of blob db counters. Also remove WaStats() which doesnt expose the stats and can be substitute by (BLOB_DB_BYTES_WRITTEN / BLOB_DB_BLOB_FILE_BYTES_WRITTEN). Closes Differential Revision: D6394216 Pulled By: yiwu-arbug fbshipit-source-id: 017508c8ff3fcd7ea7403c64d0f9834b24816803/
,,0.0712,rocksdb,Refactor ReadBlockContents() Summary: Divide ReadBlockContents() to multiple sub-functions. Maintaining the input and intermediate data in a new class BlockFetcher. I hope in general it makes the code easier to maintain. Another motivation to do it is to clearly divide the logic before file reading and after file reading. The refactor will help us evaluate how can we make I/O async in the future. Closes Differential Revision: D6520983 Pulled By: siying fbshipit-source-id: 338d90bc0338472d46be7a7682028dc9114b12e9/
,,0.1093,rocksdb,"Tests for dynamic universal compaction options Summary: Added a test for three dynamic universal compaction options, in the realm of read amplification: size_ratio min_merge_width max_merge_width Also updated DynamicUniversalCompactionSizeAmplification by adding a check on compaction reason. Found a bug in compaction reason setting while working on this PR, and fixed in . TODO for later: Still to add tests for these options: compression_size_percent, stop_style and trivial_move. Closes Differential Revision: D6822217 Pulled By: sagar0 fbshipit-source-id: 074573fca6389053cbac229891a0163f38bb56c4/Make Universal compaction options dynamic Summary: Let me know if more test coverage is needed Closes Differential Revision: D6457165 Pulled By: miasantreble fbshipit-source-id: 3f944abff28aa7775237f1c4f61c64ccbad4eea9/"
,,0.1004,rocksdb,Make Universal compaction options dynamic Summary: Let me know if more test coverage is needed Closes Differential Revision: D6457165 Pulled By: miasantreble fbshipit-source-id: 3f944abff28aa7775237f1c4f61c64ccbad4eea9/
,,0.1043,rocksdb,Make DBOption compaction_readahead_size dynamic Summary: Closes Differential Revision: D6056141 Pulled By: miasantreble fbshipit-source-id: 56df1630f464fd56b07d25d38161f699e0528b7f/
,,0.114,rocksdb,Make DBOption compaction_readahead_size dynamic Summary: Closes Differential Revision: D6056141 Pulled By: miasantreble fbshipit-source-id: 56df1630f464fd56b07d25d38161f699e0528b7f/
,,0.1983,rocksdb,"WritePrepared Txn: Fix DBIterator and add test Summary: In DBIter, Prev() calls FindValueForCurrentKey() to search the current value backward. If it finds that there are too many stale value being skipped, it falls back to FindValueForCurrentKeyUsingSeek(), seeking directly to the key with snapshot sequence. After introducing read_callback, however, the key it seeks to might not be visible, according to read_callback. It thus needs to keep searching forward until the first visible value. Closes Differential Revision: D6756148 Pulled By: yiwu-arbug fbshipit-source-id: 064e39b1eec5e083af1c10142600f26d1d2697be/Make iterator invalid on Merge error Summary: Since on merge error, iterator will be set to corrupted status, but it doesnt invalidate the iterator. Fixing it. Closes Differential Revision: D6499094 Pulled By: yiwu-arbug fbshipit-source-id: 80222930f949e31f90a6feaa37ddc3529b510d2c/fix Seek with lower_bound Summary: When Seek a key less than `lower_bound`, should return `lower_bound`. ajkr PTAL Closes Differential Revision: D6421126 Pulled By: ajkr fbshipit-source-id: a06c825830573e0040630704f6bcb3f7f48626f7/Add a ticker stat for number of keys skipped during iteration Summary: This diff adds a new ticker stat, NUMBER_ITER_SKIP, to count the number of internal keys skipped during iteration. Keys can be skipped due to deletes, or lower sequence number, or higher sequence number than the one requested. Also, fix the issue when StatisticsData is naturally aligned on cacheline boundary, padding becomes a zero size array, which the Windows compiler doesnt like. So add a cacheline worth of padding in that case to keep it happy. We cannot conditionally add padding as gcc doesnt allow using sizeof in preprocessor directives. Closes Differential Revision: D6353897 Pulled By: anand1976 fbshipit-source-id: 441d5a09af9c4e22e7355242dfc0c7b27aa0a6c2/"
,,0.1599,rocksdb,"WritePrepared Txn: update compaction_iterator_test and db_iterator_test Summary: Update compaction_iterator_test with write-prepared transaction DB related tests. Transaction related tests are group in CompactionIteratorWithSnapshotCheckerTest. The existing test are duplicated to make them also test with dummy SnapshotChecker that will say every key is visible to every snapshot (this is okay, we still compare sequence number to verify visibility). Merge related tests are disabled and will be revisit in another PR. Existing db_iterator_tests are also duplicated to test with dummy read_callback that will say every key is committed. Closes Differential Revision: D6909253 Pulled By: yiwu-arbug fbshipit-source-id: 2ae4656b843a55e2e9ff8beecf21f2832f96cd25/WritePrepared Txn: Fix DBIterator and add test Summary: In DBIter, Prev() calls FindValueForCurrentKey() to search the current value backward. If it finds that there are too many stale value being skipped, it falls back to FindValueForCurrentKeyUsingSeek(), seeking directly to the key with snapshot sequence. After introducing read_callback, however, the key it seeks to might not be visible, according to read_callback. It thus needs to keep searching forward until the first visible value. Closes Differential Revision: D6756148 Pulled By: yiwu-arbug fbshipit-source-id: 064e39b1eec5e083af1c10142600f26d1d2697be/Add a ticker stat for number of keys skipped during iteration Summary: This diff adds a new ticker stat, NUMBER_ITER_SKIP, to count the number of internal keys skipped during iteration. Keys can be skipped due to deletes, or lower sequence number, or higher sequence number than the one requested. Also, fix the issue when StatisticsData is naturally aligned on cacheline boundary, padding becomes a zero size array, which the Windows compiler doesnt like. So add a cacheline worth of padding in that case to keep it happy. We cannot conditionally add padding as gcc doesnt allow using sizeof in preprocessor directives. Closes Differential Revision: D6353897 Pulled By: anand1976 fbshipit-source-id: 441d5a09af9c4e22e7355242dfc0c7b27aa0a6c2/"
,,0.1561,rocksdb,Print out compression type of new SST files in logging Summary: Closes Differential Revision: D6552768 Pulled By: siying fbshipit-source-id: 6303110aff22f341d5cff41f8d2d4f138a53652d/Make DBOption compaction_readahead_size dynamic Summary: Closes Differential Revision: D6056141 Pulled By: miasantreble fbshipit-source-id: 56df1630f464fd56b07d25d38161f699e0528b7f/
,,0.1302,rocksdb,make MockTimeEnv::current_time_ atomic to fix data race Summary: fix a new TSAN failure Closes Differential Revision: D7565310 Pulled By: miasantreble fbshipit-source-id: f672c96e925797b34dec6e20b59527e8eebaa825/Fix up backupable_db stack corruption. Summary: Fix up OACR(Lint) warnings. Closes Differential Revision: D7563869 Pulled By: ajkr fbshipit-source-id: 8c1e5045c8a6a2d85b2933fdbc60fde93bf0c9de/
,,0.19399999999999998,rocksdb,comment unused parameters to turn on flag Summary: This PR comments out the rest of the unused arguments which allow us to turn on the flag. This is the second part of a codemod relating to Closes Differential Revision: D7426121 Pulled By: Dayvedde fbshipit-source-id: 223994923b42bd4953eb016a0129e47560f7e352/
,,0.2111,rocksdb,comment unused parameters to turn on flag Summary: This PR comments out the rest of the unused arguments which allow us to turn on the flag. This is the second part of a codemod relating to Closes Differential Revision: D7426121 Pulled By: Dayvedde fbshipit-source-id: 223994923b42bd4953eb016a0129e47560f7e352/Comment out unused variables Summary: Submitting on behalf of another employee. Closes Differential Revision: D7146025 Pulled By: ajkr fbshipit-source-id: 495ca5db5beec3789e671e26f78170957704e77e/
,,0.0977,rocksdb,"Sync parent directory after deleting a file in delete scheduler Summary: sync parent directory after deleting a file in delete scheduler. Otherwise, trim speed may not be as smooth as what we want. Closes Differential Revision: D7760136 Pulled By: siying fbshipit-source-id: ec131d53b61953f09c60d67e901e5eeb2716b05f/"
,,0.1048,rocksdb,"Enable cancelling manual compactions if they hit the sfm size limit Summary: Manual compactions should be cancelled, just like scheduled compactions are cancelled, if sfm->EnoughRoomForCompaction is not true. Closes Differential Revision: D7457683 Pulled By: amytai fbshipit-source-id: 669b02fdb707f75db576d03d2c818fb98d1876f5/"
,,0.1038,rocksdb,Comment out unused variables Summary: Submitting on behalf of another employee. Closes Differential Revision: D7146025 Pulled By: ajkr fbshipit-source-id: 495ca5db5beec3789e671e26f78170957704e77e/
,,0.1038,rocksdb,Comment out unused variables Summary: Submitting on behalf of another employee. Closes Differential Revision: D7146025 Pulled By: ajkr fbshipit-source-id: 495ca5db5beec3789e671e26f78170957704e77e/
,,0.1038,rocksdb,Comment out unused variables Summary: Submitting on behalf of another employee. Closes Differential Revision: D7146025 Pulled By: ajkr fbshipit-source-id: 495ca5db5beec3789e671e26f78170957704e77e/
,,0.1038,rocksdb,Comment out unused variables Summary: Submitting on behalf of another employee. Closes Differential Revision: D7146025 Pulled By: ajkr fbshipit-source-id: 495ca5db5beec3789e671e26f78170957704e77e/
,,0.1038,rocksdb,Comment out unused variables Summary: Submitting on behalf of another employee. Closes Differential Revision: D7146025 Pulled By: ajkr fbshipit-source-id: 495ca5db5beec3789e671e26f78170957704e77e/
,,0.17,rocksdb,"comment unused parameters to turn on flag Summary: This PR comments out the rest of the unused arguments which allow us to turn on the flag. This is the second part of a codemod relating to Closes Differential Revision: D7426121 Pulled By: Dayvedde fbshipit-source-id: 223994923b42bd4953eb016a0129e47560f7e352/Java wrapper for Native Comparators Summary: This is an abstraction for working with custom Comparators implemented in native C++ code from Java. Native code must directly extend `rocksdb::Comparator`. When the native code comparator is compiled into the RocksDB codebase, you can then create a Java Class, and JNI stub to wrap it. Useful if the C++/JNI barrier overhead is too much for your applications comparator performance. An example is provided in `java/rocksjni/native_comparator_wrapper_test.cc` and `java/src/main/java/org/rocksdb/NativeComparatorWrapperTest.java`. Closes Differential Revision: D7172605 Pulled By: miasantreble fbshipit-source-id: e24b7eb267a3bcb6afa214e0379a1d5e8a2ceabe/"
,,0.1885,rocksdb,comment unused parameters to turn on flag Summary: This PR comments out the rest of the unused arguments which allow us to turn on the flag. This is the second part of a codemod relating to Closes Differential Revision: D7426121 Pulled By: Dayvedde fbshipit-source-id: 223994923b42bd4953eb016a0129e47560f7e352/
,,0.1687,rocksdb,"comment unused parameters to turn on flag Summary: This PR comments out the rest of the unused arguments which allow us to turn on the flag. This is the second part of a codemod relating to Closes Differential Revision: D7426121 Pulled By: Dayvedde fbshipit-source-id: 223994923b42bd4953eb016a0129e47560f7e352/Java wrapper for Native Comparators Summary: This is an abstraction for working with custom Comparators implemented in native C++ code from Java. Native code must directly extend `rocksdb::Comparator`. When the native code comparator is compiled into the RocksDB codebase, you can then create a Java Class, and JNI stub to wrap it. Useful if the C++/JNI barrier overhead is too much for your applications comparator performance. An example is provided in `java/rocksjni/native_comparator_wrapper_test.cc` and `java/src/main/java/org/rocksdb/NativeComparatorWrapperTest.java`. Closes Differential Revision: D7172605 Pulled By: miasantreble fbshipit-source-id: e24b7eb267a3bcb6afa214e0379a1d5e8a2ceabe/"
,,0.1792,rocksdb,"comment unused parameters to turn on flag Summary: This PR comments out the rest of the unused arguments which allow us to turn on the flag. This is the second part of a codemod relating to Closes Differential Revision: D7426121 Pulled By: Dayvedde fbshipit-source-id: 223994923b42bd4953eb016a0129e47560f7e352/Java wrapper for Native Comparators Summary: This is an abstraction for working with custom Comparators implemented in native C++ code from Java. Native code must directly extend `rocksdb::Comparator`. When the native code comparator is compiled into the RocksDB codebase, you can then create a Java Class, and JNI stub to wrap it. Useful if the C++/JNI barrier overhead is too much for your applications comparator performance. An example is provided in `java/rocksjni/native_comparator_wrapper_test.cc` and `java/src/main/java/org/rocksdb/NativeComparatorWrapperTest.java`. Closes Differential Revision: D7172605 Pulled By: miasantreble fbshipit-source-id: e24b7eb267a3bcb6afa214e0379a1d5e8a2ceabe/"
,,0.1831,rocksdb,comment unused parameters to turn on flag Summary: This PR comments out the rest of the unused arguments which allow us to turn on the flag. This is the second part of a codemod relating to Closes Differential Revision: D7426121 Pulled By: Dayvedde fbshipit-source-id: 223994923b42bd4953eb016a0129e47560f7e352/
,,0.0956,rocksdb,Brings the Java API for WriteBatch inline with the C++ API Summary: * Exposes status * Corrects some method naming * Adds missing functionality Closes Differential Revision: D7140790 Pulled By: sagar0 fbshipit-source-id: cbdab6c5a7ae4f3030fb46739e9060e381b26fa6/
,,0.0822,rocksdb,"Add a stat for MultiGet keys found, update memtable hit/miss stats Summary: 1. Add a new ticker stat rocksdb.number.multiget.keys.found to track the number of keys successfully read 2. Update rocksdb.memtable.hit/miss in DBImpl::MultiGet(). It was being done in DBImpl::GetImpl(), but not MultiGet Closes Differential Revision: D7677364 Pulled By: anand1976 fbshipit-source-id: af22bd0ef8ddc5cf2b4244b0a024e539fe48bca5/"
,,0.1038,rocksdb,Comment out unused variables Summary: Submitting on behalf of another employee. Closes Differential Revision: D7146025 Pulled By: ajkr fbshipit-source-id: 495ca5db5beec3789e671e26f78170957704e77e/
,,0.0992,rocksdb,Fix build with USE_RTTI=0 Summary: utilities/column_aware_encoding_util.cc:61:23: error: cannot use dynamic_cast with table_reader_.reset(dynamic_cast<BlockBasedTable*>(table_reader.release())); ^ 1 error generated. It was added as a [local patch]( on FreeBSD since RocksDB 5.8. It also fixes Closes Differential Revision: D7005571 Pulled By: siying fbshipit-source-id: 351a9055d21d0accdd7a932e8e7bfcd3c8e22068/
,,0.115,rocksdb,Blob DB: blob_dump to show uncompressed values Summary: Make blob_dump tool able to show uncompressed values if the blob file is compressed. Also show total compressed vs. raw size at the end if is provided. Closes Differential Revision: D7348926 Pulled By: yiwu-arbug fbshipit-source-id: ca709cb4ed5cf6a550ff2987df8033df81516f8e/
,,0.08,rocksdb,Ignore empty filter block when data block is empty Summary: Close Closes Differential Revision: D7291706 Pulled By: ajkr fbshipit-source-id: 9dd8f40bd7716588e1e3fd6be0c2bc2766861f8c/
,,0.1903,rocksdb,comment unused parameters to turn on flag Summary: This PR comments out the rest of the unused arguments which allow us to turn on the flag. This is the second part of a codemod relating to Closes Differential Revision: D7426121 Pulled By: Dayvedde fbshipit-source-id: 223994923b42bd4953eb016a0129e47560f7e352/
,,0.1922,rocksdb,comment unused parameters to turn on flag Summary: This PR comments out the rest of the unused arguments which allow us to turn on the flag. This is the second part of a codemod relating to Closes Differential Revision: D7426121 Pulled By: Dayvedde fbshipit-source-id: 223994923b42bd4953eb016a0129e47560f7e352/
,,0.1794,rocksdb,comment unused parameters to turn on flag Summary: This PR comments out the rest of the unused arguments which allow us to turn on the flag. This is the second part of a codemod relating to Closes Differential Revision: D7426121 Pulled By: Dayvedde fbshipit-source-id: 223994923b42bd4953eb016a0129e47560f7e352/
