Topic_no,Keywords,Contrib,System,Text
,,0.3813,rocksdb,"Stream Summary: Add a simple policy for NVMe write time life hint Closes Differential Revision: D6298030 Pulled By: shligit fbshipit-source-id: 9a72a42e32e92193af11599eb71f0cf77448e24d/Blob DB: fix snapshot handling Summary: Blob db will keep blob file if data in the file is visible to an active snapshot. Before this patch it checks whether there is an active snapshot has sequence number greater than the earliest sequence in the file. This is problematic since we take snapshot on every read, if it keep having reads, old blob files will not be cleanup. Change to check if there is an active snapshot falls in the range of [earliest_sequence, obsolete_sequence) where obsolete sequence is 1. if data is relocated to another file by garbage collection, it is the latest sequence at the time garbage collection finish 2. otherwise, it is the latest sequence of the file Closes Differential Revision: D6182519 Pulled By: yiwu-arbug fbshipit-source-id: cdf4c35281f782eb2a9ad6a87b6727bbdff27a45/Add ValueType::kTypeBlobIndex Summary: Add kTypeBlobIndex value type, which will be used by blob db only, to insert a (key, blob_offset) KV pair. The purpose is to 1. Make it possible to open existing rocksdb instance as blob db. Existing value will be of kTypeIndex type, while value inserted by blob db will be of kTypeBlobIndex. 2. Make rocksdb able to detect if the db contains value written by blob db, if so return error. 3. Make it possible to have blob db optionally store value in SST file (with kTypeValue type) or as a blob value (with kTypeBlobIndex type). The root db (DBImpl) basically pretended kTypeBlobIndex are normal value on write. On Get if is_blob is provided, return whether the value read is of kTypeBlobIndex type, or return Status::NotSupported() status if is_blob is not provided. On scan allow_blob flag is pass and if the flag is true, return wether the value is of kTypeBlobIndex type via iter->IsBlob(). Changes on blob db side will be in a separate patch. Closes Differential Revision: D5838431 Pulled By: yiwu-arbug fbshipit-source-id: 3c5306c62bc13bb11abc03422ec5cbcea1203cca/WritePrepared Txn: Recovery Summary: Recover txns from the WAL. Also added some unit tests. Closes Differential Revision: D5859596 Pulled By: maysamyabandeh fbshipit-source-id: 6424967b231388093b4effffe0a3b1b7ec8caeb0/Make bytes_per_sync and wal_bytes_per_sync mutable Summary: SUMMARY Moves the bytes_per_sync and wal_bytes_per_sync options from immutableoptions to mutable options. Also if wal_bytes_per_sync is changed, the wal file and memtables are flushed. TEST PLAN ran make check all passed Two new tests SetBytesPerSync, SetWalBytesPerSync check that after issuing setoptions with a new value for the var, the db options have the new value. Closes Reviewed By: yiwu-arbug Differential Revision: D5845814 Pulled By: TheRushingWookie fbshipit-source-id: 93b52d779ce623691b546679dcd984a06d2ad1bd/write-prepared txn: call IsInSnapshot Summary: This patch instruments the read path to verify each read value against an optional ReadCallback class. If the value is rejected, the reader moves on to the next value. The WritePreparedTxn makes use of this feature to skip sequence numbers that are not in the read snapshot. Closes Differential Revision: D5787375 Pulled By: maysamyabandeh fbshipit-source-id: 49d808b3062ab35e7ae98ad388f659757794184c/"
,,0.2954,rocksdb,"WritePrepared Txn: Iterator Summary: On iterator create, take a snapshot, create a ReadCallback and pass the ReadCallback to the underlying DBIter to check if key is committed. Closes Differential Revision: D6001471 Pulled By: yiwu-arbug fbshipit-source-id: 3565c4cdaf25370ba47008b0e0cb65b31dfe79fe/Add ValueType::kTypeBlobIndex Summary: Add kTypeBlobIndex value type, which will be used by blob db only, to insert a (key, blob_offset) KV pair. The purpose is to 1. Make it possible to open existing rocksdb instance as blob db. Existing value will be of kTypeIndex type, while value inserted by blob db will be of kTypeBlobIndex. 2. Make rocksdb able to detect if the db contains value written by blob db, if so return error. 3. Make it possible to have blob db optionally store value in SST file (with kTypeValue type) or as a blob value (with kTypeBlobIndex type). The root db (DBImpl) basically pretended kTypeBlobIndex are normal value on write. On Get if is_blob is provided, return whether the value read is of kTypeBlobIndex type, or return Status::NotSupported() status if is_blob is not provided. On scan allow_blob flag is pass and if the flag is true, return wether the value is of kTypeBlobIndex type via iter->IsBlob(). Changes on blob db side will be in a separate patch. Closes Differential Revision: D5838431 Pulled By: yiwu-arbug fbshipit-source-id: 3c5306c62bc13bb11abc03422ec5cbcea1203cca/"
,,0.375,rocksdb,"Add ValueType::kTypeBlobIndex Summary: Add kTypeBlobIndex value type, which will be used by blob db only, to insert a (key, blob_offset) KV pair. The purpose is to 1. Make it possible to open existing rocksdb instance as blob db. Existing value will be of kTypeIndex type, while value inserted by blob db will be of kTypeBlobIndex. 2. Make rocksdb able to detect if the db contains value written by blob db, if so return error. 3. Make it possible to have blob db optionally store value in SST file (with kTypeValue type) or as a blob value (with kTypeBlobIndex type). The root db (DBImpl) basically pretended kTypeBlobIndex are normal value on write. On Get if is_blob is provided, return whether the value read is of kTypeBlobIndex type, or return Status::NotSupported() status if is_blob is not provided. On scan allow_blob flag is pass and if the flag is true, return wether the value is of kTypeBlobIndex type via iter->IsBlob(). Changes on blob db side will be in a separate patch. Closes Differential Revision: D5838431 Pulled By: yiwu-arbug fbshipit-source-id: 3c5306c62bc13bb11abc03422ec5cbcea1203cca/write-prepared txn: call IsInSnapshot Summary: This patch instruments the read path to verify each read value against an optional ReadCallback class. If the value is rejected, the reader moves on to the next value. The WritePreparedTxn makes use of this feature to skip sequence numbers that are not in the read snapshot. Closes Differential Revision: D5787375 Pulled By: maysamyabandeh fbshipit-source-id: 49d808b3062ab35e7ae98ad388f659757794184c/"
,,0.2304,rocksdb,"Make writable_file_max_buffer_size dynamic Summary: The DBOptions::writable_file_max_buffer_size can be changed dynamically. Closes Differential Revision: D6152720 Pulled By: shligit fbshipit-source-id: aa0c0cfcfae6a54eb17faadb148d904797c68681/single-file bottom-level compaction when snapshot released Summary: When snapshots are held for a long time, files may reach the bottom level containing overwritten/deleted keys. We previously had no mechanism to trigger compaction on such files. This particularly impacted DBs that write to different parts of the keyspace over time, as such files would never be naturally compacted due to second-last level files moving down. This PR introduces a mechanism for bottommost files to be recompacted upon releasing all snapshots that prevent them from dropping their deleted/overwritten keys. Changed `CompactionPicker` to compact files in `BottommostFilesMarkedForCompaction()`. These are the last choice when picking. Each file will be compacted alone and output to the same level in which it originated. The goal of this type of compaction is to rewrite the data excluding deleted/overwritten keys. Changed `ReleaseSnapshot()` to recompute the bottom files marked for compaction when the oldest existing snapshot changes, and schedule a compaction if needed. We cache the value that oldest existing snapshot needs to exceed in order for another file to be marked in `bottommost_files_mark_threshold_`, which allows us to avoid recomputing marked files for most snapshot releases. Changed `VersionStorageInfo` to track the list of bottommost files, which is recomputed every time the version changes by `UpdateBottommostFiles()`. The list of marked bottommost files is first computed in `ComputeBottommostFilesMarkedForCompaction()` when the version changes, but may also be recomputed when `ReleaseSnapshot()` is called. Extracted core logic of `Compaction::IsBottommostLevel()` into `VersionStorageInfo::RangeMightExistAfterSortedRun()` since logic to check whether a file is bottommost is now necessary outside of compaction. Closes Differential Revision: D6062044 Pulled By: ajkr fbshipit-source-id: 123d201cf140715a7d5928e8b3cb4f9cd9f7ad21/Add ValueType::kTypeBlobIndex Summary: Add kTypeBlobIndex value type, which will be used by blob db only, to insert a (key, blob_offset) KV pair. The purpose is to 1. Make it possible to open existing rocksdb instance as blob db. Existing value will be of kTypeIndex type, while value inserted by blob db will be of kTypeBlobIndex. 2. Make rocksdb able to detect if the db contains value written by blob db, if so return error. 3. Make it possible to have blob db optionally store value in SST file (with kTypeValue type) or as a blob value (with kTypeBlobIndex type). The root db (DBImpl) basically pretended kTypeBlobIndex are normal value on write. On Get if is_blob is provided, return whether the value read is of kTypeBlobIndex type, or return Status::NotSupported() status if is_blob is not provided. On scan allow_blob flag is pass and if the flag is true, return wether the value is of kTypeBlobIndex type via iter->IsBlob(). Changes on blob db side will be in a separate patch. Closes Differential Revision: D5838431 Pulled By: yiwu-arbug fbshipit-source-id: 3c5306c62bc13bb11abc03422ec5cbcea1203cca/write-prepared txn: call IsInSnapshot Summary: This patch instruments the read path to verify each read value against an optional ReadCallback class. If the value is rejected, the reader moves on to the next value. The WritePreparedTxn makes use of this feature to skip sequence numbers that are not in the read snapshot. Closes Differential Revision: D5787375 Pulled By: maysamyabandeh fbshipit-source-id: 49d808b3062ab35e7ae98ad388f659757794184c/"
,,0.3073,rocksdb,"Blob DB: fix snapshot handling Summary: Blob db will keep blob file if data in the file is visible to an active snapshot. Before this patch it checks whether there is an active snapshot has sequence number greater than the earliest sequence in the file. This is problematic since we take snapshot on every read, if it keep having reads, old blob files will not be cleanup. Change to check if there is an active snapshot falls in the range of [earliest_sequence, obsolete_sequence) where obsolete sequence is 1. if data is relocated to another file by garbage collection, it is the latest sequence at the time garbage collection finish 2. otherwise, it is the latest sequence of the file Closes Differential Revision: D6182519 Pulled By: yiwu-arbug fbshipit-source-id: cdf4c35281f782eb2a9ad6a87b6727bbdff27a45/"
,,0.3075,rocksdb,"Add ValueType::kTypeBlobIndex Summary: Add kTypeBlobIndex value type, which will be used by blob db only, to insert a (key, blob_offset) KV pair. The purpose is to 1. Make it possible to open existing rocksdb instance as blob db. Existing value will be of kTypeIndex type, while value inserted by blob db will be of kTypeBlobIndex. 2. Make rocksdb able to detect if the db contains value written by blob db, if so return error. 3. Make it possible to have blob db optionally store value in SST file (with kTypeValue type) or as a blob value (with kTypeBlobIndex type). The root db (DBImpl) basically pretended kTypeBlobIndex are normal value on write. On Get if is_blob is provided, return whether the value read is of kTypeBlobIndex type, or return Status::NotSupported() status if is_blob is not provided. On scan allow_blob flag is pass and if the flag is true, return wether the value is of kTypeBlobIndex type via iter->IsBlob(). Changes on blob db side will be in a separate patch. Closes Differential Revision: D5838431 Pulled By: yiwu-arbug fbshipit-source-id: 3c5306c62bc13bb11abc03422ec5cbcea1203cca/Introduce conditional merge-operator invocation in point lookups Summary: For every merge operand encountered for a key in the read path we now have the ability to decide whether to look further (to retrieve more merge operands for the key) or stop and invoke the merge operator to return the value. The user needs to override `ShouldMerge()` method with a condition to terminate search when true to avail this facility. This has a couple of advantages: 1. It helps in limiting the number of merge operands that are looked at to compute a value as part of a user Get operation. 2. It allows to peek at a merge key-value to see if further merge operands need to look at. Example: Limiting the number of merge operands that are looked at: Lets say you have 10 merge operands for a key spread over various levels. If you only want RocksDB to look at the latest two merge operands instead of all 10 to compute the value, it is now possible with this PR. You can set the condition in `ShouldMerge()` to return true when the size of the operand list is 2. Look at the example implementation in the unit test. Without this PR, a Get might look at all the 10 merge operands in different levels before invoking the merge-operator. Added a new unit test. Made sure that there is no perf regression by running benchmarks. Command line to Load data: ``` TEST_TMPDIR=/dev/shm ./db_bench ... mergerandom : 12.861 micros/op 77757 ops/sec; 8.6 MB/s ( updates:10000000) ``` **ReadRandomMergeRandom bechmark results:** Command line: ``` TEST_TMPDIR=/dev/shm ./db_bench ``` Base Without this code change (on commit fc7476b): ``` readrandommergerandom : 38.586 micros/op 25916 ops/sec; (reads:3001599 merges:6998401 total:10000000 hits:842235 maxlength:8) ``` With this code change: ``` readrandommergerandom : 38.653 micros/op 25870 ops/sec; (reads:3001599 merges:6998401 total:10000000 hits:842235 maxlength:8) ``` Closes Differential Revision: D5898239 Pulled By: sagar0 fbshipit-source-id: daefa325019f77968639a75c851d46352c2303ef/do not call merge when checking to see if key exists Summary: Changes: * added check for value before merge is called on code path that should check if key exists Closes Reviewed By: IslamAbdelRahman Differential Revision: D5743966 Pulled By: armishra fbshipit-source-id: 6ac4283bc510c8ca50827d87ef0ba631f2b33b18/write-prepared txn: call IsInSnapshot Summary: This patch instruments the read path to verify each read value against an optional ReadCallback class. If the value is rejected, the reader moves on to the next value. The WritePreparedTxn makes use of this feature to skip sequence numbers that are not in the read snapshot. Closes Differential Revision: D5787375 Pulled By: maysamyabandeh fbshipit-source-id: 49d808b3062ab35e7ae98ad388f659757794184c/fix deleterange with memtable prefix bloom Summary: the range delete tombstones in memtable should be added to the aggregator even when the memtables prefix bloom filter tells us the lookup keys not there. This bug could cause data to temporarily reappear until the memtable containing range deletions is flushed. Reported in Closes Differential Revision: D5639007 Pulled By: ajkr fbshipit-source-id: 04fc6facb6f978340a3f639536f4ca7c0d73dfc9/"
,,0.1842,rocksdb,"BlobDB: Remove the need to get sequence number per write Summary: Previously we store sequence number range of each blob files, and use the sequence number range to check if the file can be possibly visible by a snapshot. But it adds complexity to the code, since the sequence number is only available after a write. (The current implementation get sequence number by calling GetLatestSequenceNumber(), which is wrong.) With the patch, we are not storing sequence number range, and check if snapshot_sequence obsolete_sequence to decide if the file is visible by a snapshot (previously we check if first_sequence snapshot_sequence obsolete_sequence). Closes Differential Revision: D6571497 Pulled By: yiwu-arbug fbshipit-source-id: ca06479dc1fcd8782f6525b62b7762cd47d61909/BlobDB: refactor DB open logic Summary: Refactor BlobDB open logic. List of changes: Major: * On reopen, mark blob files found as immutable, do not use them for writing new keys. * Not to scan the whole file to find file footer. Instead just seek to the end of the file and try to read footer. Minor: * Move most of the real logic from blob_db.cc to blob_db_impl.cc. * Not to hold shared_ptr of event listeners in global maps in blob_db.cc * Some changes to BlobFile interface. * Improve logging and error handling. Closes Differential Revision: D6526147 Pulled By: yiwu-arbug fbshipit-source-id: 9dc4cdd63359a2f9b696af817086949da8d06952/"
,,0.1325,rocksdb,"BlobDB: refactor DB open logic Summary: Refactor BlobDB open logic. List of changes: Major: * On reopen, mark blob files found as immutable, do not use them for writing new keys. * Not to scan the whole file to find file footer. Instead just seek to the end of the file and try to read footer. Minor: * Move most of the real logic from blob_db.cc to blob_db_impl.cc. * Not to hold shared_ptr of event listeners in global maps in blob_db.cc * Some changes to BlobFile interface. * Improve logging and error handling. Closes Differential Revision: D6526147 Pulled By: yiwu-arbug fbshipit-source-id: 9dc4cdd63359a2f9b696af817086949da8d06952/"
,,0.0715,rocksdb,BlockBasedTable::NewDataBlockIterator to always return BlockIter Summary: This is a pre-cleaning up before a major block based table iterator refactoring. BlockBasedTable::NewDataBlockIterator() will always return BlockIter. This simplifies the logic and code and enable further refactoring and optimization. Closes Differential Revision: D6780165 Pulled By: siying fbshipit-source-id: 273f7dc896724f682c0118fb69a359d9cc4418b4/
,,0.1502,rocksdb,"optimize file ingestion checks for range deletion overlap Summary: Before we were checking every file in the level which was unnecessary. We can piggyback onto the code for checking point-key overlap, which already opens all the files that could possibly contain overlapping range deletions. This PR makes us check just the range deletions from those files, so no extra ones will be opened. Closes Differential Revision: D6358125 Pulled By: ajkr fbshipit-source-id: 00e200770fdb8f3cc6b1b2da232b755e4ba36279/"
,,0.1557,rocksdb,"optimize file ingestion checks for range deletion overlap Summary: Before we were checking every file in the level which was unnecessary. We can piggyback onto the code for checking point-key overlap, which already opens all the files that could possibly contain overlapping range deletions. This PR makes us check just the range deletions from those files, so no extra ones will be opened. Closes Differential Revision: D6358125 Pulled By: ajkr fbshipit-source-id: 00e200770fdb8f3cc6b1b2da232b755e4ba36279/"
,,0.1529,rocksdb,"optimize file ingestion checks for range deletion overlap Summary: Before we were checking every file in the level which was unnecessary. We can piggyback onto the code for checking point-key overlap, which already opens all the files that could possibly contain overlapping range deletions. This PR makes us check just the range deletions from those files, so no extra ones will be opened. Closes Differential Revision: D6358125 Pulled By: ajkr fbshipit-source-id: 00e200770fdb8f3cc6b1b2da232b755e4ba36279/"
,,0.2205,rocksdb,"Add a stat for MultiGet keys found, update memtable hit/miss stats Summary: 1. Add a new ticker stat rocksdb.number.multiget.keys.found to track the number of keys successfully read 2. Update rocksdb.memtable.hit/miss in DBImpl::MultiGet(). It was being done in DBImpl::GetImpl(), but not MultiGet Closes Differential Revision: D7677364 Pulled By: anand1976 fbshipit-source-id: af22bd0ef8ddc5cf2b4244b0a024e539fe48bca5/WritePrepared Txn: add stats Summary: Adding some stats that would be helpful to monitor if the DB has gone to unlikely stats that would hurt the performance. These are mostly when we end up needing to acquire a mutex. Closes Differential Revision: D7529393 Pulled By: maysamyabandeh fbshipit-source-id: f7d36279a8f39bd84d8ddbf64b5c97f670c5d6d9/Stats for false positive rate of full filtesr Summary: Adds two stats to allow us measuring the false positive rate of full filters: The total count of positives: rocksdb.bloom.filter.full.positive The total count of true positives: rocksdb.bloom.filter.full.true.positive Not the term ""full"" in the stat name to indicate that they are meaningful in full filters. block-based filters are to be deprecated soon and supporting it is not worth the the additional cost of if-then-else branches. Closes Tested by: $ ./db_bench /dev/shm/rocksdb-tmpdb $ ./db_bench /dev/shm/rocksdb-tmpdb 2>&1 > /tmp/full.log $ grep filter.full /tmp/full.log rocksdb.bloom.filter.full.positive COUNT : 3628593 rocksdb.bloom.filter.full.true.positive COUNT : 3536026 which gives the false positive rate of 2.5% Closes Differential Revision: D7517570 Pulled By: maysamyabandeh fbshipit-source-id: 630ab1a473afdce404916d297035b6318de4c052/Blob DB: Improve FIFO eviction Summary: Improving blob db FIFO eviction with the following changes, * Change blob_dir_size to max_db_size. Take into account SST file size when computing DB size. * FIFO now only take into account live sst files and live blob files. It is normal for disk usage to go over max_db_size because there are obsolete sst files and blob files pending deletion. * FIFO eviction now also evict TTL blob files thats still open. It doesnt evict non-TTL blob files. * If FIFO is triggered, it will pass an expiration and the current sequence number to compaction filter. Compaction filter will then filter inlined keys to evict those with an earlier expiration and smaller sequence number. So call LSM FIFO. * Compaction filter also filter those blob indexes where corresponding blob file is gone. * Add an event listener to listen compaction/flush event and update sst file size. * Implement DB::Close() to make sure base db, as well as event listener and compaction filter, destruct before blob db. * More blob db statistics around FIFO. * Fix some locking issue when accessing a blob file. Closes Differential Revision: D7139328 Pulled By: yiwu-arbug fbshipit-source-id: ea5edb07b33dfceacb2682f4789bea61de28bbfa/"
,,0.3338,rocksdb,"Blob DB: Improve FIFO eviction Summary: Improving blob db FIFO eviction with the following changes, * Change blob_dir_size to max_db_size. Take into account SST file size when computing DB size. * FIFO now only take into account live sst files and live blob files. It is normal for disk usage to go over max_db_size because there are obsolete sst files and blob files pending deletion. * FIFO eviction now also evict TTL blob files thats still open. It doesnt evict non-TTL blob files. * If FIFO is triggered, it will pass an expiration and the current sequence number to compaction filter. Compaction filter will then filter inlined keys to evict those with an earlier expiration and smaller sequence number. So call LSM FIFO. * Compaction filter also filter those blob indexes where corresponding blob file is gone. * Add an event listener to listen compaction/flush event and update sst file size. * Implement DB::Close() to make sure base db, as well as event listener and compaction filter, destruct before blob db. * More blob db statistics around FIFO. * Fix some locking issue when accessing a blob file. Closes Differential Revision: D7139328 Pulled By: yiwu-arbug fbshipit-source-id: ea5edb07b33dfceacb2682f4789bea61de28bbfa/"
,,0.3329,rocksdb,"Blob DB: Improve FIFO eviction Summary: Improving blob db FIFO eviction with the following changes, * Change blob_dir_size to max_db_size. Take into account SST file size when computing DB size. * FIFO now only take into account live sst files and live blob files. It is normal for disk usage to go over max_db_size because there are obsolete sst files and blob files pending deletion. * FIFO eviction now also evict TTL blob files thats still open. It doesnt evict non-TTL blob files. * If FIFO is triggered, it will pass an expiration and the current sequence number to compaction filter. Compaction filter will then filter inlined keys to evict those with an earlier expiration and smaller sequence number. So call LSM FIFO. * Compaction filter also filter those blob indexes where corresponding blob file is gone. * Add an event listener to listen compaction/flush event and update sst file size. * Implement DB::Close() to make sure base db, as well as event listener and compaction filter, destruct before blob db. * More blob db statistics around FIFO. * Fix some locking issue when accessing a blob file. Closes Differential Revision: D7139328 Pulled By: yiwu-arbug fbshipit-source-id: ea5edb07b33dfceacb2682f4789bea61de28bbfa/"
