Topic_no,Keywords,Contrib,System,Text
,,0.2783,rocksdb,"Cache dictionary used for decompressing data blocks (#4881) Summary: If block cache disabled or not used for meta-blocks, `BlockBasedTableReader::Rep::uncompression_dict` owns the `UncompressionDict`. It is preloaded during `PrefetchIndexAndFilterBlocks`. If block cache is enabled and used for meta-blocks, block cache owns the `UncompressionDict`, which holds dictionary and digested dictionary when needed. It is never prefetched though there is a TODO for this in the code. The cache key is simply the compression dictionary block handle. New stats for compression dictionary accesses in block cache: ""BLOCK_CACHE_COMPRESSION_DICT_*"" and ""compression_dict_block_read_count"" Pull Request resolved: Differential Revision: D13663801 Pulled By: ajkr fbshipit-source-id: bdcc54044e180855cdcc57639b493b0e016c9a3f/Add a new per level counter for block cache hit (#4796) Summary: Add a new per level counter for block cache hits, increase it by one on every successful attempt to get an entry from cache. Pull Request resolved: Differential Revision: D13513688 Pulled By: zinoale fbshipit-source-id: 104df038f1232e3356e162eb2d8ca138e34a8281/Add PerfContext counters for index/filter block cache stats (#4540) Summary: Add counters to track block cache index/filter hits and misses. We currently count aggregate hits and misses, which includes index/filter/data blocks. Pull Request resolved: Differential Revision: D10459652 Pulled By: anand1976 fbshipit-source-id: 0c59eee7f12f5103dcb6686f0e7995babe63d425/Refactor BlockBasedTable::Open (#4636) Summary: Refactored and simplified `BlockBasedTable::Open` to be similar to `BlockBasedTableBuilder::Finish` as both these functions complement each other. Also added `BlockBasedTableBuilder::WriteFooter` along the way. Pull Request resolved: Differential Revision: D12933319 Pulled By: sagar0 fbshipit-source-id: 1ff1d02f6d80a63b5ba720a1fc75e71c7344137b/Fix BlockBasedTable not always using memory allocator if available (#4678) Summary: Fix block based table reader not using memory_allocator when allocating index blocks and compression dictionary blocks. Pull Request resolved: Differential Revision: D13054594 Pulled By: yiwu-arbug fbshipit-source-id: 379f25bcc665395662511c4f873f4b7b55104ce2/Clean up FragmentedRangeTombstoneList (#4692) Summary: Removed `one_time_use` flag, which removed the need for some tests, and changed all `NewRangeTombstoneIterator` methods to return `FragmentedRangeTombstoneIterators`. These changes also led to removing `RangeDelAggregatorV2::AddUnfragmentedTombstones` and one of the `MemTableListVersion::AddRangeTombstoneIterators` methods. Pull Request resolved: Differential Revision: D13106570 Pulled By: abhimadan fbshipit-source-id: cbab5432d7fc2d9cdfd8d9d40361a1bffaa8f845/Remove two variables from BlockContents class and dont use class Block for compressed block (#4650) Summary: We carry compression type and ""cachable"" variables for every block in the block cache, while they take well-known values. 8-byte is wasted for each block (2-byte for useful information but it takes 8 bytes because of padding). With this change, these two variables are removed. The cachable information is only useful in the process of reading the block. We use other information to infer from it. For compressed blocks, the compression type is a part of the block content itself so we can get it from there. Some code is slightly refactored so that the cachable information can flow better. Another change is to only use class BlockContents for compressed block, and narrow the class Block to only be used for uncompressed blocks, including blocks in compressed block cache. This can make the Block class less confusing. It also saves tens of bytes for each block in compressed block cache. Pull Request resolved: Differential Revision: D12969070 Pulled By: siying fbshipit-source-id: 548b62724e9eb66993026429fd9c7c3acd1f95ed/Move MemoryAllocator option from Cache to BlockBasedTableOptions (#4676) Summary: Per offline discussion with siying, `MemoryAllocator` and `Cache` should be decouple. The idea is that memory allocator handles memory allocation, while cache handle cache policy. It is normal that external cache libraries pack couple the two components for better optimization. If we want to integrate with such library in the future, we can make a wrapper of the library implementing both `Cache` and `MemoryAllocator` interface. Pull Request resolved: Differential Revision: D13047662 Pulled By: yiwu-arbug fbshipit-source-id: cd42e246d80ab600b4de47d073f7d2db308ce6dd/"
,,0.36700000000000005,rocksdb,"Cache dictionary used for decompressing data blocks (#4881) Summary: If block cache disabled or not used for meta-blocks, `BlockBasedTableReader::Rep::uncompression_dict` owns the `UncompressionDict`. It is preloaded during `PrefetchIndexAndFilterBlocks`. If block cache is enabled and used for meta-blocks, block cache owns the `UncompressionDict`, which holds dictionary and digested dictionary when needed. It is never prefetched though there is a TODO for this in the code. The cache key is simply the compression dictionary block handle. New stats for compression dictionary accesses in block cache: ""BLOCK_CACHE_COMPRESSION_DICT_*"" and ""compression_dict_block_read_count"" Pull Request resolved: Differential Revision: D13663801 Pulled By: ajkr fbshipit-source-id: bdcc54044e180855cdcc57639b493b0e016c9a3f/Fix BlockBasedTable not always using memory allocator if available (#4678) Summary: Fix block based table reader not using memory_allocator when allocating index blocks and compression dictionary blocks. Pull Request resolved: Differential Revision: D13054594 Pulled By: yiwu-arbug fbshipit-source-id: 379f25bcc665395662511c4f873f4b7b55104ce2/Remove two variables from BlockContents class and dont use class Block for compressed block (#4650) Summary: We carry compression type and ""cachable"" variables for every block in the block cache, while they take well-known values. 8-byte is wasted for each block (2-byte for useful information but it takes 8 bytes because of padding). With this change, these two variables are removed. The cachable information is only useful in the process of reading the block. We use other information to infer from it. For compressed blocks, the compression type is a part of the block content itself so we can get it from there. Some code is slightly refactored so that the cachable information can flow better. Another change is to only use class BlockContents for compressed block, and narrow the class Block to only be used for uncompressed blocks, including blocks in compressed block cache. This can make the Block class less confusing. It also saves tens of bytes for each block in compressed block cache. Pull Request resolved: Differential Revision: D12969070 Pulled By: siying fbshipit-source-id: 548b62724e9eb66993026429fd9c7c3acd1f95ed/"
,,0.3472,rocksdb,"Fix BlockBasedTable not always using memory allocator if available (#4678) Summary: Fix block based table reader not using memory_allocator when allocating index blocks and compression dictionary blocks. Pull Request resolved: Differential Revision: D13054594 Pulled By: yiwu-arbug fbshipit-source-id: 379f25bcc665395662511c4f873f4b7b55104ce2/Remove two variables from BlockContents class and dont use class Block for compressed block (#4650) Summary: We carry compression type and ""cachable"" variables for every block in the block cache, while they take well-known values. 8-byte is wasted for each block (2-byte for useful information but it takes 8 bytes because of padding). With this change, these two variables are removed. The cachable information is only useful in the process of reading the block. We use other information to infer from it. For compressed blocks, the compression type is a part of the block content itself so we can get it from there. Some code is slightly refactored so that the cachable information can flow better. Another change is to only use class BlockContents for compressed block, and narrow the class Block to only be used for uncompressed blocks, including blocks in compressed block cache. This can make the Block class less confusing. It also saves tens of bytes for each block in compressed block cache. Pull Request resolved: Differential Revision: D12969070 Pulled By: siying fbshipit-source-id: 548b62724e9eb66993026429fd9c7c3acd1f95ed/"
,,0.1271,rocksdb,"Modify FragmentedRangeTombstoneList member layout (#4632) Summary: Rather than storing a `vector<RangeTombstone>`, we now store a `vector<RangeTombstoneStack>` and a `vector<SequenceNumber>`. A `RangeTombstoneStack` contains the start and end keys of a range tombstone fragment, and indices into the seqnum vector to indicate which sequence numbers the fragment is located at. The diagram below illustrates an example: ``` tombstones_: [a, b) [c, e) [h, k) | \ / \ / | | \ / \ / | v v v v tombstone_seqs_: [ 5 3 10 7 2 8 6 ] ``` This format allows binary searching the tombstone list to use less key comparisons, which helps in cases where there are many overlapping tombstones. Also, this format makes it easier to add DBIter-like semantics to `FragmentedRangeTombstoneIterator` in the future. Pull Request resolved: Differential Revision: D13053103 Pulled By: abhimadan fbshipit-source-id: e8220cc712fcf5be4d602913bb23ace8ea5f8ef0/"
,,0.0922,rocksdb,"fix DeleteRange memory leak for mmap and block cache (#4810) Summary: Previously we were cleaning up range tombstone meta-block by calling `ReleaseCachedEntry`, which wouldnt work if `value nullptr && cache_handle nullptr`. This happened at least in the case with mmap reads and block cache both enabled. I noticed `NewDataBlockIterator` intends to handle all these cases, so migrated to that instead of `NewUnfragmentedRangeTombstoneIterator`. Also changed the table-opening logic to fail on `ReadRangeDelBlock` failure, since that can cause data corruption. Added a test case to verify this behavior. Note the test case does not fail on `TryReopen` because failure to preload table handlers is not considered critical. However, it does fail on any read involving that file since it cannot return correct data. Pull Request resolved: Differential Revision: D13534296 Pulled By: ajkr fbshipit-source-id: 55dde1111717cea6ec4bf38418daab81ccef3599/"
,,0.1604,rocksdb,"Cache dictionary used for decompressing data blocks (#4881) Summary: If block cache disabled or not used for meta-blocks, `BlockBasedTableReader::Rep::uncompression_dict` owns the `UncompressionDict`. It is preloaded during `PrefetchIndexAndFilterBlocks`. If block cache is enabled and used for meta-blocks, block cache owns the `UncompressionDict`, which holds dictionary and digested dictionary when needed. It is never prefetched though there is a TODO for this in the code. The cache key is simply the compression dictionary block handle. New stats for compression dictionary accesses in block cache: ""BLOCK_CACHE_COMPRESSION_DICT_*"" and ""compression_dict_block_read_count"" Pull Request resolved: Differential Revision: D13663801 Pulled By: ajkr fbshipit-source-id: bdcc54044e180855cdcc57639b493b0e016c9a3f/"
,,0.2496,rocksdb,"fix reading encrypted files beyond file boundaries (#5160) Summary: This fix should help reading from encrypted files if the file-to-be-read is smaller than expected. For example, when using the encrypted env and making it read a journal file of exactly 0 bytes size, the encrypted env code crashes with SIGSEGV in its Decrypt function, as there is no check if the read attempts to read over the files boundaries (as specified originally by the `dataSize` parameter). The most important problem this patch addresses is however that there is no size underlow check in `CTREncryptionProvider::CreateCipherStream`: The stream to be read will be initialized to a size of always `prefix.size() (2 * blockSize)`. If the prefix however is smaller than twice the block size, this will obviously assume a _very_ large stream and read over the bounds. The patch adds a check here as follows: // If the prefix is smaller than twice the block size, we would below read a // very large chunk of the file (and very likely read over the bounds) assert(prefix.size() >= 2 * blockSize); if (prefix.size() 2 * blockSize) { return Status::Corruption(""Unable to read from file "" + fname + "": read attempt would read beyond file bounds""); } so embedders can catch the error in their release builds. Pull Request resolved: Differential Revision: D14834633 Pulled By: sagar0 fbshipit-source-id: 47aa39a6db8977252cede054c7eb9a663b9a3484/"
,,0.1204,rocksdb,"Avoid per-key upper bound check in BlockBasedTableIterator (#5101) Summary: `BlockBasedTableIterator` avoid reading next block on `Next()` if it detects the iterator will be out of bound, by checking against index key. The optimization was added in and by the time it only check the bound per block. It seems later change make it a per-key check, which introduce unnecessary key comparisons. Pull Request resolved: Differential Revision: D14678707 Pulled By: siying fbshipit-source-id: 2372446116753c7892ea4cec7b4b49ef87ba463e/"
,,0.2286,rocksdb,"Turn CachableEntry into a proper resource handle (#5252) Summary: CachableEntry is used in a variety of contexts: it may refer to a cached object (i.e. an object in the block cache), an owned object, or an unowned object; also, in some cases (most notably with iterators), the responsibility of managing the pointed-to object gets handed off to another object. Each of the above scenarios have different implications for the lifecycle of the referenced object. For the most part, the patch does not change the lifecycle of managed objects; however, it makes these relationships explicit, and it also enables us to eliminate some hacks and accident-prone code around releasing cache handles and deleting/cleaning up objects. (The only places where the patch changes how an objects are managed are the partitions of partitioned indexes and filters.) Pull Request resolved: Differential Revision: D15101358 Pulled By: ltamasi fbshipit-source-id: 9eb59e9ae5a7230e3345789762d0ba1f189485be/Reduce binary search when reseek into the same data block (#5256) Summary: Right now, when Seek() is called again, RocksDB always does a binary search against the files and index blocks, even if they end up with the same file/block. Improve it as following: 1. in LevelIterator, reseek first try to check the boundary of the current file. If it falls into the same file, skip the binary search to find the file 2. in block based table iterator, reseek skip to reseek the iterator block if the seek key is larger than the current key and lower than the index key (boundary of the current block and the next block). Pull Request resolved: Differential Revision: D15105072 Pulled By: siying fbshipit-source-id: 39634bdb4a881082451fa39cecd7ecf12160bf80/Evict the uncompression dictionary from the block cache upon table close (#5150) Summary: The uncompression dictionary object has a Statistics pointer that might dangle if the database closed. This patch evicts the dictionary from the block cache when a table is closed, similarly to how index and filter readers are handled. Pull Request resolved: Differential Revision: D14782422 Pulled By: ltamasi fbshipit-source-id: 0cec9336c742c479aa92206e04521767f1aa9622/Revert ""Avoid per-key upper bound check in BlockBasedTableIterator (#5101)"" (#5132) Summary: This reverts commit f29dc1b90641e7f44b14f932e3866c5840391cd5. In BlockBasedTableIterator, index_iter_->key() is sometimes a user key, so it is wrong to call ExtractUserKey() against it. This is a bug introduced by Temporarily revert the diff to keep the branch clean. Pull Request resolved: Differential Revision: D14718584 Pulled By: siying fbshipit-source-id: 0ac55dc9b5dbc18c7809092146bdf7eb9364b9ad/Avoid per-key upper bound check in BlockBasedTableIterator (#5101) Summary: `BlockBasedTableIterator` avoid reading next block on `Next()` if it detects the iterator will be out of bound, by checking against index key. The optimization was added in and by the time it only check the bound per block. It seems later change make it a per-key check, which introduce unnecessary key comparisons. Pull Request resolved: Differential Revision: D14678707 Pulled By: siying fbshipit-source-id: 2372446116753c7892ea4cec7b4b49ef87ba463e/Apply automatic formatting to some files (#5114) Summary: Following files were run through automatic formatter: db/db_impl.cc db/db_impl.h db/db_impl_compaction_flush.cc db/db_impl_debug.cc db/db_impl_files.cc db/db_impl_readonly.h db/db_impl_write.cc db/dbformat.cc db/dbformat.h table/block.cc table/block.h table/block_based_filter_block.cc table/block_based_filter_block.h table/block_based_filter_block_test.cc table/block_based_table_builder.cc table/block_based_table_reader.cc table/block_based_table_reader.h table/block_builder.cc table/block_builder.h table/block_fetcher.cc table/block_prefix_index.cc table/block_prefix_index.h table/block_test.cc table/format.cc table/format.h I could easily run all the files, but I dont want people to feel that Im doing it for lines of code changes :) Pull Request resolved: Differential Revision: D14633040 Pulled By: siying fbshipit-source-id: 3f346cb53bf21e8c10704400da548dfce1e89a52/Fix perf_context.user_key_comparison_count for range scan (#5098) Summary: Currently `perf_context.user_key_comparison_count` is bump only in `InternalKeyComparator`. For places user comparator is used directly the counter is not bump. Fixing the majority of it. Index iterator and filter code also use user comparator directly and dont bump the counter. It is not fixed in this patch. Pull Request resolved: Differential Revision: D14603753 Pulled By: siying fbshipit-source-id: 1cd41035644ca9e49b97a51030a5d1e15f5f3cae/Fix SstFileReader not able to open ingested file (#5097) Summary: Since `SstFileReader` dont know largest seqno of a file, it will fail this check when it open a file with global seqno: Changes: * Pass largest_seqno=kMaxSequenceNumber from `SstFileReader` and allow it to bypass the above check. * `BlockBasedTable::VerifyChecksum` also double check if checksum will match when excluding global seqno (this is to make the new test in sst_table_reader_test pass). Pull Request resolved: Differential Revision: D14607434 Pulled By: riversand963 fbshipit-source-id: 9008599227c5fccbf9b73fee46b3bf4a1523f023/Apply modernize-use-override (2nd iteration) Summary: Use C++11ís override and remove virtual where applicable. Change are automatically generated. Reviewed By: Orvid Differential Revision: D14090024 fbshipit-source-id: 1e9432e87d2657e1ff0028e15370a85d1739ba2a/Checksum properties block for block-based table (#4956) Summary: Always enable properties block checksum verification for block-based table. For external SST file ingested with write_global_seqno==true, we use DecodeEntrySlow to parse its blocks contents so that the process will not die upon failing the assertion possibly caused by corruption. Pull Request resolved: Differential Revision: D14012741 Pulled By: riversand963 fbshipit-source-id: 8b766e6f54b36f8f9e074c0e19e0926ec3cce186/"
,,0.1349,rocksdb,"Checksum properties block for block-based table (#4956) Summary: Always enable properties block checksum verification for block-based table. For external SST file ingested with write_global_seqno==true, we use DecodeEntrySlow to parse its blocks contents so that the process will not die upon failing the assertion possibly caused by corruption. Pull Request resolved: Differential Revision: D14012741 Pulled By: riversand963 fbshipit-source-id: 8b766e6f54b36f8f9e074c0e19e0926ec3cce186/"
,,0.1748,rocksdb,"Evict the uncompression dictionary from the block cache upon table close (#5150) Summary: The uncompression dictionary object has a Statistics pointer that might dangle if the database closed. This patch evicts the dictionary from the block cache when a table is closed, similarly to how index and filter readers are handled. Pull Request resolved: Differential Revision: D14782422 Pulled By: ltamasi fbshipit-source-id: 0cec9336c742c479aa92206e04521767f1aa9622/Avoid per-key upper bound check in BlockBasedTableIterator (#5101) Summary: `BlockBasedTableIterator` avoid reading next block on `Next()` if it detects the iterator will be out of bound, by checking against index key. The optimization was added in and by the time it only check the bound per block. It seems later change make it a per-key check, which introduce unnecessary key comparisons. Pull Request resolved: Differential Revision: D14678707 Pulled By: siying fbshipit-source-id: 2372446116753c7892ea4cec7b4b49ef87ba463e/Apply modernize-use-override (2nd iteration) Summary: Use C++11ís override and remove virtual where applicable. Change are automatically generated. Reviewed By: Orvid Differential Revision: D14090024 fbshipit-source-id: 1e9432e87d2657e1ff0028e15370a85d1739ba2a/"
,,0.0767,rocksdb,Block cache tracing: Associate a unique id with Get and MultiGet (#5514) Summary: This PR associates a unique id with Get and MultiGet. This enables us to track how many blocks a Get/MultiGet request accesses. We can also measure the impact of row cache vs block cache. Pull Request resolved: Test Plan: make clean && COMPILE_WITH_ASAN=1 make check Differential Revision: D16032681 Pulled By: HaoyuHuang fbshipit-source-id: 775b05f4440badd58de6667e3ec9f4fc87a0af4c/
,,0.4414,rocksdb,"Add an option to put first key of each sst block in the index (#5289) Summary: The first key is used to defer reading the data block until this file gets to the top of merging iterators heap. For short range scans, most files never make it to the top of the heap, so this change can reduce read amplification by a lot sometimes. Consider the following workload. There are a few data streams (well be calling them ""logs""), each stream consisting of a sequence of blobs (well be calling them ""records""). Each record is identified by log ID and a sequence number within the log. RocksDB key is concatenation of log ID and sequence number (big endian). Reads are mostly relatively short range scans, each within a single log. Writes are mostly sequential for each log, but writes to different logs are randomly interleaved. Compactions are disabled; instead, when we accumulate a few tens of sst files, we create a new column family and start writing to it. So, a typical sst file consists of a few ranges of blocks, each range corresponding to one log ID (we use FlushBlockPolicy to cut blocks at log boundaries). A typical read would go like this. First, iterator Seek() reads one block from each sst file. Then a series of Next()s move through one sst file (since writes to each log are mostly sequential) until the subiterator reaches the end of this log in this sst file; then Next() switches to the next sst file and reads sequentially from that, and so on. Often a range scan will only return records from a small number of blocks in small number of sst files; in this case, the cost of initial Seek() reading one block from each file may be bigger than the cost of reading the actually useful blocks. Neither iterate_upper_bound nor bloom filters can prevent reading one block from each file in Seek(). But this PR can: if the index contains first key from each block, we dont have to read the block until this block actually makes it to the top of merging iterators heap, so for short range scans we wont read any blocks from most of the sst files. This PR does the deferred block loading inside value() call. This is not ideal: theres no good way to report an IO error from inside value(). As discussed with siying offline, it would probably be better to change InternalIterators interface to explicitly fetch deferred value and get status. Ill do it in a separate PR. Pull Request resolved: Differential Revision: D15256423 Pulled By: al13n321 fbshipit-source-id: 750e4c39ce88e8d41662f701cf6275d9388ba46a/"
