Topic_no,Keywords,Contrib,System,Text
15,"block, read, key, file, index, summary, sst_file, check, range_deletion, make, size, change, property, end, range, format, add, write, tombstone, blob",0.0902,conscrypt,"Add a function to force an engine read. (#453) The SSLEngine implementation sometimes need to prompt BoringSSL to process any incoming TLS data in order to determine whether there is enough data to produce plaintext. We previously were reading into a zero-byte buffer to do this, but that causes ambiguity in return values because a return of 0 from SSL_read() could mean a failure (generally EOF) or could mean a successful read of 0 bytes (which would be expected when reading into a zero-byte array). Instead, use SSL_peek. Fixes"
,,0.0648,frostwire,[android] ApolloFragmentAdpter.java recovers from possible index out of bounds exception/
,,0.0652,frostwire,[desktop] cleanup of old unused code in StringUtils (not the apache one)/
,,0.066,jna,require structure field order/address issue
,,0.0697,jna,improve library load debugging/revise string encoding/
,,0.0657,jna,check for options caching/revise string encoding/
,,0.066,jna,require structure field order/address issue
,,0.0577,jna,Mapped SHGetSpecialFolderPath of Shell32.dll/
,,0.0577,jna,Mapped SHGetSpecialFolderPath of Shell32.dll/
,,0.066,jna,require structure field order/address issue
,,0.0681,OpenDDS,Some more compiler fixes/Add WeakRcHandle support for RcObject subclasses/
,,0.0769,pljava,"Mention JDBC 4.0 to 4.2 types in Oid.c. These are still not given any mapping other than to InvalidOid, but at least they are mentioned (conditionally, for the JDBC 4.2 ones) in the switch statement now./"
,,0.0697,realm-java,updated check for less than 0 row index macro/
,,0.0738,realm-java,Primary keys are now indexed. Refactored Table/Row for missing cases + cleaner code. Additional unit tests./
,,0.0657,rocksdb,use mmap on 64-bit machines to speed-up reads; small build fixes/
,,0.0677,rocksdb,use mmap on 64-bit machines to speed-up reads; small build fixes/
,,0.1104,rocksdb,"[RocksDB] Refactor table.cc to reduce code duplication and improve readability. Summary: In table.cc, the code section that reads in BlockContent and then put it into a Block, appears at least 4 times. This is too much duplication. BlockReader is much shorter after the change and reads way better. D10077 attempted that for index block read. This is a complete cleanup. Test Plan: make check; ./db_stress Reviewers: dhruba, sheki Reviewed By: dhruba CC: leveldb Differential Revision:"
,,0.1232,rocksdb,"[RocksDB] Refactor table.cc to reduce code duplication and improve readability. Summary: In table.cc, the code section that reads in BlockContent and then put it into a Block, appears at least 4 times. This is too much duplication. BlockReader is much shorter after the change and reads way better. D10077 attempted that for index block read. This is a complete cleanup. Test Plan: make check; ./db_stress Reviewers: dhruba, sheki Reviewed By: dhruba CC: leveldb Differential Revision:"
,,0.1183,rocksdb,"[RocksDB] Improve sst_dump to take user key range Summary: The ability to dump internal keys associated with certain user keys, directly from sst files, is very useful for diagnosis. Will incorporate it directly into ldb later. Test Plan: run it Reviewers: dhruba CC: leveldb Differential Revision:"
,,0.0887,rocksdb,"Implement a compressed block cache. Summary: Rocksdb can now support a uncompressed block cache, or a compressed block cache or both. Lookups first look for a block in the uncompressed cache, if it is not found only then it is looked up in the compressed cache. If it is found in the compressed cache, then it is uncompressed and inserted into the uncompressed cache. It is possible that the same block resides in the compressed cache as well as the uncompressed cache at the same time. Both caches have their own individual LRU policy. Test Plan: Unit test case attached. Reviewers: kailiu, sdong, haobo, leveldb Reviewed By: haobo CC: xjin, haobo Differential Revision:"
,,0.1491,rocksdb,"Fix stress test failure when using mmap-reads. Summary: The mmap-read file->Read() does not use the scratch buffer to read in file-contents. Test Plan: ./db_stress Reviewers: haobo, kailiu Reviewed By: kailiu CC: leveldb, kailiu, emayanke Differential Revision: a compressed block cache. Summary: Rocksdb can now support a uncompressed block cache, or a compressed block cache or both. Lookups first look for a block in the uncompressed cache, if it is not found only then it is looked up in the compressed cache. If it is found in the compressed cache, then it is uncompressed and inserted into the uncompressed cache. It is possible that the same block resides in the compressed cache as well as the uncompressed cache at the same time. Both caches have their own individual LRU policy. Test Plan: Unit test case attached. Reviewers: kailiu, sdong, haobo, leveldb Reviewed By: haobo CC: xjin, haobo Differential Revision:"
,,0.23199999999999998,rocksdb,"Support for LZ4 compression./[Performance Branch] PlainTable to encode rows with seqID 0, value type using 1 internal byte. Summary: In PlainTable, use one single byte to represent 8 bytes of internal bytes, if seqID 0 and it is value type (which should be common for bottom most files). It is to save 7 bytes for uncompressed cases. Test Plan: make all check Reviewers: haobo, dhruba, kailiu Reviewed By: haobo CC: igor, leveldb Differential Revision: the property block for the plain table Summary: This is the last diff that adds the property block to plain table. The format resembles that of the block-based table: [data block] [meta block 1: stats block] [meta block 2: future extended block] ... [meta block K: future extended block] (we may add more meta blocks in the future) [metaindex block] [index block: we only have the placeholder here, we can add persistent index block in the future] [Footer: contains magic number, handle to metaindex block and index block] Test Plan: extended existing property block test. Reviewers: haobo, sdong, dhruba CC: leveldb Differential Revision: metaindex block from block-based table Summary: This change will allow other table to reuse the code for meta blocks. Test Plan: all existing unit tests passed Reviewers: dhruba, haobo, sdong CC: leveldb Differential Revision: the readability of the TableProperties::ToString()/Move flush_block_policy from Options to TableFactory Summary: Previously we introduce a `flush_block_policy_factory` in Options, however, that options is strongly releated to Table based tables. It will make more sense to move it to block based tables own factory class. Test Plan: make check to pass existing tests Reviewers: dhruba, haobo Reviewed By: dhruba CC: leveldb Differential Revision: the ""table stats"" Summary: The primary motivation of the changes is to make it easier to figure out the inside of the tables. * rename ""table stats"" to ""table properties"" since now we have more than ""integers"" to store in the property block. * Add filter block size to the basic table properties. * Whenever a table is built, well log the table properties (the sample output is in Test Plan). * Make an api to expose deleted keys. Test Plan: Passed all existing test. and the sample output of table stats: Basic Properties data blocks: 1 entries: 1 raw key size: 9 raw average key size: 9 raw value size: 9 raw average value size: 0 data block size: 25 index block size: 27 filter block size: 18 (estimated) table size: 70 filter policy: rocksdb.BuiltinBloomFilter User collected properties: InternalKeyPropertiesCollector kDeletedKeys: 1 Reviewers: dhruba, haobo Reviewed By: dhruba CC: leveldb Differential Revision:"
,,0.2103,rocksdb,"Fix UnmarkEOF for partial blocks Summary: Blocks in the transaction log are a fixed size, but the last block in the transaction log file is usually a partial block. When a new record is added after the reader hit the end of the file, a new physical record will be appended to the last block. ReadPhysicalRecord can only read full blocks and assumes that the file position indicator is aligned to the start of a block. If the reader is forced to read further by simply clearing the EOF flag, ReadPhysicalRecord will read a full block starting from somewhere in the middle of a real block, causing it to lose alignment and to have a partial physical record at the end of the read buffer. This will result in length mismatches and checksum failures. When the log file is tailed for replication this will cause the log iterator to become invalid, necessitating the creation of a new iterator which will have to read the log file from scratch. This diff fixes this issue by reading the remaining portion of the last block we read from. This is done when the reader is forced to read further (UnmarkEOF is called). Test Plan: Added unit tests Stress test (with replication). Check dbdir/LOG file for corruptions. Test on test tier Reviewers: emayanke, haobo, dhruba Reviewed By: haobo CC: vamsi, sheki, dhruba, kailiu, igor Differential Revision:"
,,0.1003,rocksdb,"remove malloc when create data and index iterator in Get Summary: Define Block::Iter to be an independent class to be used by block_based_table_reader When creating data and index iterator, update an existing iterator rather than new one Thus malloc and free could be reduced Benchmark, Base: commit 76286ee67ef4b89579a92134b996a681c36a1331 commands: ódisable_auto_compactions=1 malloc: 3.30% 1.42% free: 3.59%->1.61% Test Plan: make all check run db_stress valgrind ./db_test ./table_test Reviewers: ljin, yhchiang, dhruba, igor, sdong Reviewed By: sdong Subscribers: leveldb Differential Revision:"
,,0.3373,rocksdb,"Implement full filter for block based table. Summary: 1. Make filter_block.h a base class. Derive block_based_filter_block and full_filter_block. The previous one is the traditional filter block. The full_filter_block is newly added. It would generate a filter block that contain all the keys in SST file. 2. When querying a key, table would first check if full_filter is available. If not, it would go to the exact data block and check using block_based filter. 3. User could choose to use full_filter or tradional(block_based_filter). They would be stored in SST file with different meta index name. ""filter.filter_policy"" or ""full_filter.filter_policy"". Then, Table reader is able to know the fllter block type. 4. Some optimizations have been done for full_filter_block, thus it requires a different interface compared to the original one in filter_policy.h. 5. Actual implementation of filter bits coding/decoding is placed in util/bloom_impl.cc Benchmark: base commit 1d23b5c470844c1208301311f0889eca750431c0 Command: db_bench ódisable_auto_compactions=1 Read QPS increase for about 30% from 2230002 to 2991411. Test Plan: make all check valgrind db_test db_stress 0 ./auto_sanity_test.sh Reviewers: igor, yhchiang, ljin, sdong Reviewed By: sdong Subscribers: dhruba, leveldb Differential Revision:"
,,0.3543,rocksdb,"Implement full filter for block based table. Summary: 1. Make filter_block.h a base class. Derive block_based_filter_block and full_filter_block. The previous one is the traditional filter block. The full_filter_block is newly added. It would generate a filter block that contain all the keys in SST file. 2. When querying a key, table would first check if full_filter is available. If not, it would go to the exact data block and check using block_based filter. 3. User could choose to use full_filter or tradional(block_based_filter). They would be stored in SST file with different meta index name. ""filter.filter_policy"" or ""full_filter.filter_policy"". Then, Table reader is able to know the fllter block type. 4. Some optimizations have been done for full_filter_block, thus it requires a different interface compared to the original one in filter_policy.h. 5. Actual implementation of filter bits coding/decoding is placed in util/bloom_impl.cc Benchmark: base commit 1d23b5c470844c1208301311f0889eca750431c0 Command: db_bench ódisable_auto_compactions=1 Read QPS increase for about 30% from 2230002 to 2991411. Test Plan: make all check valgrind db_test db_stress 0 ./auto_sanity_test.sh Reviewers: igor, yhchiang, ljin, sdong Reviewed By: sdong Subscribers: dhruba, leveldb Differential Revision:"
,,0.3486,rocksdb,"Implement full filter for block based table. Summary: 1. Make filter_block.h a base class. Derive block_based_filter_block and full_filter_block. The previous one is the traditional filter block. The full_filter_block is newly added. It would generate a filter block that contain all the keys in SST file. 2. When querying a key, table would first check if full_filter is available. If not, it would go to the exact data block and check using block_based filter. 3. User could choose to use full_filter or tradional(block_based_filter). They would be stored in SST file with different meta index name. ""filter.filter_policy"" or ""full_filter.filter_policy"". Then, Table reader is able to know the fllter block type. 4. Some optimizations have been done for full_filter_block, thus it requires a different interface compared to the original one in filter_policy.h. 5. Actual implementation of filter bits coding/decoding is placed in util/bloom_impl.cc Benchmark: base commit 1d23b5c470844c1208301311f0889eca750431c0 Command: db_bench ódisable_auto_compactions=1 Read QPS increase for about 30% from 2230002 to 2991411. Test Plan: make all check valgrind db_test db_stress 0 ./auto_sanity_test.sh Reviewers: igor, yhchiang, ljin, sdong Reviewed By: sdong Subscribers: dhruba, leveldb Differential Revision:"
,,0.3464,rocksdb,"Implement full filter for block based table. Summary: 1. Make filter_block.h a base class. Derive block_based_filter_block and full_filter_block. The previous one is the traditional filter block. The full_filter_block is newly added. It would generate a filter block that contain all the keys in SST file. 2. When querying a key, table would first check if full_filter is available. If not, it would go to the exact data block and check using block_based filter. 3. User could choose to use full_filter or tradional(block_based_filter). They would be stored in SST file with different meta index name. ""filter.filter_policy"" or ""full_filter.filter_policy"". Then, Table reader is able to know the fllter block type. 4. Some optimizations have been done for full_filter_block, thus it requires a different interface compared to the original one in filter_policy.h. 5. Actual implementation of filter bits coding/decoding is placed in util/bloom_impl.cc Benchmark: base commit 1d23b5c470844c1208301311f0889eca750431c0 Command: db_bench ódisable_auto_compactions=1 Read QPS increase for about 30% from 2230002 to 2991411. Test Plan: make all check valgrind db_test db_stress 0 ./auto_sanity_test.sh Reviewers: igor, yhchiang, ljin, sdong Reviewed By: sdong Subscribers: dhruba, leveldb Differential Revision:"
,,0.1402,rocksdb,"Apply InfoLogLevel to the logs in table/meta_blocks.cc Summary: Apply InfoLogLevel to the logs in table/meta_blocks.cc Test Plan: make Reviewers: ljin, sdong, igor Reviewed By: igor Subscribers: dhruba, leveldb Differential Revision: make format on PR naked calls to operator new and delete (Fixes This replaces a mishmash of pointers in the Block and BlockContents classes with std::unique_ptr. It also changes the semantics of BlockContents to be limited to use as a constructor parameter for Block objects, as it owns any block buffers handed to it./"
,,0.35200000000000004,rocksdb,"Implement full filter for block based table. Summary: 1. Make filter_block.h a base class. Derive block_based_filter_block and full_filter_block. The previous one is the traditional filter block. The full_filter_block is newly added. It would generate a filter block that contain all the keys in SST file. 2. When querying a key, table would first check if full_filter is available. If not, it would go to the exact data block and check using block_based filter. 3. User could choose to use full_filter or tradional(block_based_filter). They would be stored in SST file with different meta index name. ""filter.filter_policy"" or ""full_filter.filter_policy"". Then, Table reader is able to know the fllter block type. 4. Some optimizations have been done for full_filter_block, thus it requires a different interface compared to the original one in filter_policy.h. 5. Actual implementation of filter bits coding/decoding is placed in util/bloom_impl.cc Benchmark: base commit 1d23b5c470844c1208301311f0889eca750431c0 Command: db_bench ódisable_auto_compactions=1 Read QPS increase for about 30% from 2230002 to 2991411. Test Plan: make all check valgrind db_test db_stress 0 ./auto_sanity_test.sh Reviewers: igor, yhchiang, ljin, sdong Reviewed By: sdong Subscribers: dhruba, leveldb Differential Revision:"
,,0.1275,rocksdb,"Run make format on PR naked calls to operator new and delete (Fixes This replaces a mishmash of pointers in the Block and BlockContents classes with std::unique_ptr. It also changes the semantics of BlockContents to be limited to use as a constructor parameter for Block objects, as it owns any block buffers handed to it./"
,,0.0913,rocksdb,"Remember whole key/prefix filtering on/off in SST file Summary: Remember whole key or prefix filtering on/off in SST files. If user opens the DB with a different setting that cannot be satisfied while reading the SST file, ignore the bloom filter. Test Plan: Add a unit test for it Reviewers: yhchiang, igor, rven Reviewed By: rven Subscribers: leveldb, dhruba Differential Revision:"
,,0.0976,rocksdb,"Remember whole key/prefix filtering on/off in SST file Summary: Remember whole key or prefix filtering on/off in SST files. If user opens the DB with a different setting that cannot be satisfied while reading the SST file, ignore the bloom filter. Test Plan: Add a unit test for it Reviewers: yhchiang, igor, rven Reviewed By: rven Subscribers: leveldb, dhruba Differential Revision:"
,,0.1157,rocksdb,"Remember whole key/prefix filtering on/off in SST file Summary: Remember whole key or prefix filtering on/off in SST files. If user opens the DB with a different setting that cannot be satisfied while reading the SST file, ignore the bloom filter. Test Plan: Add a unit test for it Reviewers: yhchiang, igor, rven Reviewed By: rven Subscribers: leveldb, dhruba Differential Revision: routine to BlockBasedTableReader Summary: Added necessary routines for dumping block based SST with block filter Test Plan: Added ""raw"" mode to utility sst_dump Reviewers: sdong, rven Reviewed By: rven Subscribers: dhruba Differential Revision:"
,,0.1135,rocksdb,"perf_context: report time spent on reading index and bloom blocks Summary: Add a perf context counter to help users figure out time spent on reading indexes and bloom filter blocks. Test Plan: Will write a unit test Subscribers: leveldb, dhruba Differential Revision:"
,,0.1875,rocksdb,"Experiments on column-aware encodings Summary: Experiments on column-aware encodings. Supported features: 1) extract data blocks from SST file and encode with specified encodings; 2) Decode encoded data back into row format; 3) Directly extract data blocks and write in row format (without prefix encoding); 4) Get column distribution statistics for column format; 5) Dump data blocks separated by columns in human-readable format. There is still on-going work on this diff. More refactoring is necessary. Test Plan: Wrote tests in `column_aware_encoding_test.cc`. More tests should be added. Reviewers: sdong Reviewed By: sdong Subscribers: arahut, andrewkr, dhruba Differential Revision:"
,,0.0967,rocksdb,"Fix flaky DBTestDynamicLevel.DynamicLevelMaxBytesBase2 Summary: We added more table properties for each SST file, so when using 2KB SST file size, the estimated size of SST files is off by almost half, causing the LSM tree structure not as expected. Fix it by making file size 4x as previously, as well as LSM base size. Also avoid the sleeping based synchronization and turn to use sync points. Test Plan: Run paralell unit tests multiple times and make sure they always pass. Reviewers: IslamAbdelRahman, kradhakrishnan Reviewed By: kradhakrishnan Subscribers: leveldb, andrewkr, dhruba Differential Revision: fix to disable DynamicLevelMaxBytesBase2/"
,,0.1371,rocksdb,"Fix compiling under Summary: MyRocks build is broken because they are using ""-Werror=missing-field-initializers"" We should fix that by explicitly passing these arguments Test Plan: Build MyRocks Reviewers: sdong, yiwu Reviewed By: yiwu Subscribers: andrewkr, dhruba Differential Revision: GetMutableOptionsFromStrings Summary: Add mutable options info into `OptionsTypeInfo` and use it to parse mutable options map. Also support `max_bytes_for_level_multiplier_additional` in option file. Test Plan: unit test Reviewers: yhchiang, IslamAbdelRahman, sdong Reviewed By: sdong Subscribers: andrewkr, dhruba, leveldb Differential Revision: Read amplification bitmap (read amp statistics) Summary: Add ReadOptions::read_amp_bytes_per_bit option which allow us to create a bitmap for every data block we read the bitmap will contain (block_size / read_amp_bytes_per_bit) bits. We will use this bitmap to mark which bytes have been used of the block so we can calculate the read amplification Test Plan: added new tests Reviewers: andrewkr, yhchiang, sdong Reviewed By: sdong Subscribers: yiwu, leveldb, march, andrewkr, dhruba Differential Revision: to cache index/filter blocks with priority Summary: Add option to block based table to insert index/filter blocks to block cache with priority. Combined with LRUCache with high_pri_pool_ratio, we can reserved space for index/filter blocks, make them less likely to be evicted. Depends on D61977. Test Plan: See unit test. Reviewers: lightmark, IslamAbdelRahman, sdong Reviewed By: sdong Subscribers: andrewkr, dhruba, march, leveldb Differential Revision:"
,,0.4456,rocksdb,"Support SST files with Global sequence numbers [reland] Summary: reland Update SstFileWriter to include a property for a global sequence number in the SST file `rocksdb.external_sst_file.global_seqno` Update TableProperties to be aware of the offset of each property in the file Update BlockBasedTableReader and Block to be able to honor the sequence number in `rocksdb.external_sst_file.global_seqno` property and use it to overwrite all sequence number in the file Something worth mentioning is that we dont update the seqno in the index block since and when doing a binary search, the reason for that is that its guaranteed that SST files with global seqno will have only one user_key and each key will have seqno=0 encoded in it, This mean that this key is greater than any other key with seqno> 0. That mean that we can actually keep the current logic for these blocks Test Plan: unit tests Reviewers: sdong, yhchiang Subscribers: andrewkr, dhruba Differential Revision: SST files with Global sequence numbers Summary: Update SstFileWriter to include a property for a global sequence number in the SST file `rocksdb.external_sst_file.global_seqno` Update TableProperties to be aware of the offset of each property in the file Update BlockBasedTableReader and Block to be able to honor the sequence number in `rocksdb.external_sst_file.global_seqno` property and use it to overwrite all sequence number in the file Something worth mentioning is that we dont update the seqno in the index block since and when doing a binary search, the reason for that is that its guaranteed that SST files with global seqno will have only one user_key and each key will have seqno=0 encoded in it, This mean that this key is greater than any other key with seqno> 0. That mean that we can actually keep the current logic for these blocks Test Plan: unit tests Reviewers: andrewkr, yhchiang, yiwu, sdong Reviewed By: sdong Subscribers: hcz, andrewkr, dhruba Differential Revision:"
,,0.1003,rocksdb,"LRU cache mid-point insertion Summary: Add mid-point insertion functionality to LRU cache. Caller of `Cache::Insert()` can set an additional parameter to make a cache entry have higher priority. The LRU cache will reserve at most `capacity * high_pri_pool_pct` bytes for high-pri cache entries. If `high_pri_pool_pct` is zero, the cache degenerates to normal LRU cache. Context: If we are to put index and filter blocks into RocksDB block cache, index/filter block can be swap out too early. We want to add an option to RocksDB to reserve some capacity in block cache just for index/filter blocks, to mitigate the issue. In later diffs Ill update block based table reader to use the interface to cache index/filter blocks at high priority, and expose the option to `DBOptions` and make it dynamic changeable. Test Plan: unit test. Reviewers: IslamAbdelRahman, sdong, lightmark Reviewed By: lightmark Subscribers: andrewkr, dhruba, march, leveldb Differential Revision:"
,,0.1537,rocksdb,"WriteBatch support for range deletion Summary: Add API to WriteBatch to store range deletions in its buffer which are later added to memtable. In the WriteBatch buffer, a range deletion is encoded as ""<optype><CF ID (optional)><begin key><end key>"". With this diff, the range tombstones are stored inline with the data in the memtable. Its useful for now because the test cases rely on the data being accessible via memtable. My next step is to store range tombstones in a separate area in the memtable. Test Plan: unit tests Reviewers: IslamAbdelRahman, sdong, wanning Reviewed By: wanning Subscribers: andrewkr, dhruba, leveldb Differential Revision:"
