Topic_no,Keywords,Contrib,System,Text
,,0.4285,rocksdb,"BlockBasedTableReader: automatically adjust tail prefetch size (#4156) Summary: Right now we use one hard-coded prefetch size to prefetch data from the tail of the SST files. However, this may introduce a waste for some use cases, while not efficient for others. Introduce a way to adjust this prefetch size by tracking 32 recent times, and pick a value with which the wasted read is less than 10% Pull Request resolved: Differential Revision: D8916847 Pulled By: siying fbshipit-source-id: 8413f9eb3987e0033ed0bd910f83fc2eeaaf5758/Remove external tracking of AlignedBuffers size (#4105) Summary: Remove external tracking of AlignedBuffers size in `ReadaheadRandomAccessFile` and `FilePrefetchBuffer`. Pull Request resolved: Differential Revision: D8805724 Pulled By: sagar0 fbshipit-source-id: d61d8c203c7c500e3f36e912132d7852026ed023/Improve direct IO range scan performance with readahead (#3884) Summary: This PR extends the improvements in to also work when using Direct IO. We see **4.5X performance improvement** in seekrandom benchmark doing long range scans, when using direct reads, on flash. **Description:** This change improves the performance of iterators doing long range scans (e.g. big/full index or table scans in MyRocks) by using readahead and prefetching additional data on each disk IO, and storing in a local buffer. This prefetching is automatically enabled on noticing more than 2 IOs for the same table file during iteration. The readahead size starts with 8KB and is exponentially increased on each additional sequential IO, up to a max of 256 KB. This helps in cutting down the number of IOs needed to complete the range scan. **Implementation Details:** Used `FilePrefetchBuffer` as the underlying buffer to store the readahead data. `FilePrefetchBuffer` can now take file_reader, readahead_size and max_readahead_size as input to the constructor, and automatically do readahead. `FilePrefetchBuffer::TryReadFromCache` can now call `FilePrefetchBuffer::Prefetch` if readahead is enabled. `AlignedBuffer` (which is the underlying store for `FilePrefetchBuffer`) now takes a few additional args in `AlignedBuffer::AllocateNewBuffer` to allow copying data from the old buffer. Made sure not to re-read partial chunks of data that were already available in the buffer, from device again. Fixed a couple of cases where `AlignedBuffer::cursize_` was not being properly kept up-to-date. **Constraints:** Similar to this gets currently enabled only when ReadOptions.readahead_size 0 (which is the default value). Since the prefetched data is stored in a temporary buffer allocated on heap, this could increase the memory usage if you have many iterators doing long range scans simultaneously. Enabled only for user reads, and disabled for compactions. Compaction reads are controlled by the options `use_direct_io_for_flush_and_compaction` and `compaction_readahead_size`, and the current feature takes precautions not to mess with them. **Benchmarks:** I used the same benchmark as used in Data fill: ``` TEST_TMPDIR=/data/users/$USER/benchmarks/iter ./db_bench ``` Do a long range scan: Seekrandom with large number of nexts ``` TEST_TMPDIR=/data/users/$USER/benchmarks/iter ./db_bench ``` ``` Before: seekrandom : 37939.906 micros/op 26 ops/sec; 29.2 MB/s (1636 of 1999 found) With this change: seekrandom : 8527.720 micros/op 117 ops/sec; 129.7 MB/s (6530 of 7999 found) ``` ~4.5X perf improvement. Taken on an average of 3 runs. Closes Differential Revision: D8082143 Pulled By: sagar0 fbshipit-source-id: 4d7a8561cbac03478663713df4d31ad2620253bb/"
,,0.1801,rocksdb,"Make rocksdb::Slice more interoperable with std::string_view (#4242) Summary: This change allows using std::string_view objects directly in the DB API: db->Get(some_string_view_object, ...); The conversion from std::string_view to rocksdb::Slice is done automatically, thanks to the added constructor. Im stopping short of adding an implicit conversion operator from rocksdb::Slice to std::string_view, as I dont think thats a good idea for PinnableSlices. Pull Request resolved: Differential Revision: D9224134 Pulled By: anand1976 fbshipit-source-id: f50aad04dd0b01737907c0fb88d495c83a81f4e4/"
,,0.1175,rocksdb,"Reduce runtime of compact_on_deletion_collector_test (#4117) Summary: This test routinely exceeds the FB contbuild test timeout of 10 minutes, due to the large number of iterations. The large number (mainly due to 100 randomly selected window sizes) does not seem to add any value. Reduce it to allow the test to finish in 10 mins. Pull Request resolved: Differential Revision: D8815646 Pulled By: anand1976 fbshipit-source-id: 260690d24f444767ad93b039dec3ae8b9cdd1843/"
,,0.11199999999999999,rocksdb,"Blob DB: enable readahead for garbage collection (#3648) Summary: Enable readahead for blob DB garbage collection, which should improve GC performance a little bit. Closes Differential Revision: D7383791 Pulled By: yiwu-arbug fbshipit-source-id: 642b3327f7105eca85986d3fb2d8f960a3d83cf1/"
,,0.171,rocksdb,"BlockBasedTableReader: automatically adjust tail prefetch size (#4156) Summary: Right now we use one hard-coded prefetch size to prefetch data from the tail of the SST files. However, this may introduce a waste for some use cases, while not efficient for others. Introduce a way to adjust this prefetch size by tracking 32 recent times, and pick a value with which the wasted read is less than 10% Pull Request resolved: Differential Revision: D8916847 Pulled By: siying fbshipit-source-id: 8413f9eb3987e0033ed0bd910f83fc2eeaaf5758/"
,,0.2181,rocksdb,"Improve point-lookup performance using a data block hash index (#4174) Summary: Add hash index support to data blocks, which helps to reduce the CPU utilization of point-lookup operations. This feature is backward compatible with the data block created without the hash index. It is disabled by default unless `BlockBasedTableOptions::data_block_index_type` is set to `data_block_index_type kDataBlockBinaryAndHash.` The DB size would be bigger with the hash index option as a hash table is added at the end of each data block. If the hash utilization ratio is 1:1, the space overhead is one byte per key. The hash table utilization ratio is adjustable using `BlockBasedTableOptions::data_block_hash_table_util_ratio`. A lower utilization ratio will improve more on the point-lookup efficiency, but take more space too. Pull Request resolved: Differential Revision: D8965914 Pulled By: fgwu fbshipit-source-id: 1c6bae5d1fc39c80282d8890a72e9e67bc247198/Add a unit test to verify iterators release data blocks after using them (#4170) Summary: Add a unit test to check that iterators release data blocks after it has moved away from it. Verify the same for compaction input iterators. Pull Request resolved: Differential Revision: D8962513 Pulled By: siying fbshipit-source-id: 05a5b604d7d29887fb488f2cda7286f554a14407/"
,,0.2472,rocksdb,"Improve point-lookup performance using a data block hash index (#4174) Summary: Add hash index support to data blocks, which helps to reduce the CPU utilization of point-lookup operations. This feature is backward compatible with the data block created without the hash index. It is disabled by default unless `BlockBasedTableOptions::data_block_index_type` is set to `data_block_index_type kDataBlockBinaryAndHash.` The DB size would be bigger with the hash index option as a hash table is added at the end of each data block. If the hash utilization ratio is 1:1, the space overhead is one byte per key. The hash table utilization ratio is adjustable using `BlockBasedTableOptions::data_block_hash_table_util_ratio`. A lower utilization ratio will improve more on the point-lookup efficiency, but take more space too. Pull Request resolved: Differential Revision: D8965914 Pulled By: fgwu fbshipit-source-id: 1c6bae5d1fc39c80282d8890a72e9e67bc247198/"
,,0.1078,rocksdb,"Avoid per-key linear scan over snapshots in compaction (#4495) Summary: `CompactionIterator::snapshots_` is ordered by ascending seqnum, just like `DBImpl`s linked list of snapshots from which it was copied. This PR exploits this ordering to make `findEarliestVisibleSnapshot` do binary search rather than linear scan. This can make flush/compaction significantly faster when many snapshots exist since that function is called on every single key. Pull Request resolved: Differential Revision: D10386470 Pulled By: ajkr fbshipit-source-id: 29734991631227b6b7b677e156ac567690118a8b/Drop unnecessary deletion markers during compaction (issue 3842) (#4289) Summary: This PR fixes issue 3842. We drop deletion markers iff 1. We are the bottom most level AND 2. All other occurrences of the key are in the same snapshot range as the delete Ive also enhanced db_stress_test to add an option that does a full compare of the keys. This is done by a single thread (thread 0). For tests Ive run (so far) make check db_stress db_stress /* to verify that new code doesnt break existing tests */ ./db_stress /* to verify new test code */ Pull Request resolved: Differential Revision: D9491165 Pulled By: shrikanthshankar fbshipit-source-id: ce144834f31736c189aaca81bed356ba990331e2/"
,,0.0905,rocksdb,Add PerfContextByLevel to provide per level perf context information (#4226) Summary: Current implementation of perf context is level agnostic. Making it hard to do performance evaluation for the LSM tree. This PR adds `PerfContextByLevel` to decompose the counters by level. This will be helpful when analyzing point and range query performance as well as tuning bloom filter Also replaced __thread with thread_local keyword for perf_context Pull Request resolved: Differential Revision: D10369509 Pulled By: miasantreble fbshipit-source-id: f1ced4e0de5fcebdb7f9cff36164516bc6382d82/
,,0.1175,rocksdb,Make NewBloomFilterPolicy() use full filter by default (#4735) Summary: Full block (use_block_based_builder=false) Bloom filter has clear CPU saving benefits but with limitation of using temp memory when building an SST file proportional to the SST file size. We reduced the chance of having large SST files with multi-level universal compaction. Now we change to a default with better performance. Pull Request resolved: Differential Revision: D13266674 Pulled By: siying fbshipit-source-id: 7594a4c3e32568a5a2adce22bb0e46553e55c602/
,,0.1305,rocksdb,"Fix compatibility of public ticker stats (#4701) Summary: Added back the `NO_ITERATORS` that was removed in 5945e16dfc6e99522c607841cfd387eebed256fc. Marked it as deprecated since it is no longer populated, but kept for API compatibility. Made sure the new tickers, `NO_ITERATOR_CREATED` and `NO_ITERATOR_DELETED`, are appended at the end of the enum, in case people are relying on the int values. The change where `NO_ITERATOR_CREATED` and `NO_ITERATOR_DELETED` were introduced is unreleased so I believe it is ok to change their ordering. Pull Request resolved: Differential Revision: D13142887 Pulled By: ajkr fbshipit-source-id: 29a336ce5b46632ce50ad42ccc4a29013f71d6d6/Divide `NO_ITERATORS` into two counters `NO_ITERATOR_CREATED` and `NO_ITERATOR_DELETE` (#4498) Summary: Currently, `Statistics` can record tick by `recordTick()` whose second parameter is an `uint64_t`. That means tick can only increase. If we want to reduce tick, we have to work around like `RecordTick(statistics_, NO_ITERATORS, uint64_t(-1));`. Thats kind of a hack. So, this PR divide `NO_ITERATORS` into two counters `NO_ITERATOR_CREATED` and `NO_ITERATOR_DELETE`, making the counters increase only. Fixes . Pull Request resolved: Differential Revision: D10395010 Pulled By: sagar0 fbshipit-source-id: cfb523b22a37411c794b4e9da090f1ae30293db2/"
,,0.1434,rocksdb,"Divide `NO_ITERATORS` into two counters `NO_ITERATOR_CREATED` and `NO_ITERATOR_DELETE` (#4498) Summary: Currently, `Statistics` can record tick by `recordTick()` whose second parameter is an `uint64_t`. That means tick can only increase. If we want to reduce tick, we have to work around like `RecordTick(statistics_, NO_ITERATORS, uint64_t(-1));`. Thats kind of a hack. So, this PR divide `NO_ITERATORS` into two counters `NO_ITERATOR_CREATED` and `NO_ITERATOR_DELETE`, making the counters increase only. Fixes . Pull Request resolved: Differential Revision: D10395010 Pulled By: sagar0 fbshipit-source-id: cfb523b22a37411c794b4e9da090f1ae30293db2/"
,,0.1067,rocksdb,Disallow customized hash function in DynamicBloom (#4915) Summary: I didnt find where customized hash function is used in DynamicBloom. This can only reduce performance. Remove it. Pull Request resolved: Differential Revision: D13794452 Pulled By: siying fbshipit-source-id: e38669b11e01444d2d782da11c7decabbd851819/
,,0.5365,rocksdb,"Introduce a new MultiGet batching implementation (#5011) Summary: This PR introduces a new MultiGet() API, with the underlying implementation grouping keys based on SST file and batching lookups in a file. The reason for the new API is twofold the definition allows callers to allocate storage for status and values on stack instead of std::vector, as well as return values as PinnableSlices in order to avoid copying, and it keeps the original MultiGet() implementation intact while we experiment with batching. Batching is useful when there is some spatial locality to the keys being queries, as well as larger batch sizes. The main benefits are due to 1. Fewer function calls, especially to BlockBasedTableReader::MultiGet() and FullFilterBlockReader::KeysMayMatch() 2. Bloom filter cachelines can be prefetched, hiding the cache miss latency The next step is to optimize the binary searches in the level_storage_info, index blocks and data blocks, since we could reduce the number of key comparisons if the keys are relatively close to each other. The batching optimizations also need to be extended to other formats, such as PlainTable and filter formats. This also needs to be added to db_stress. Benchmark results from db_bench for various batch size/locality of reference combinations are given below. Locality was simulated by offsetting the keys in a batch by a stride length. Each SST file is about 8.6MB uncompressed and key/value size is 16/100 uncompressed. To focus on the cpu benefit of batching, the runs were single threaded and bound to the same cpu to eliminate interference from other system events. The results show a 10-25% improvement in micros/op from smaller to larger batch sizes (4 32). Batch Sizes 1 | 2 | 4 | 8 | 16 | 32 Random pattern (Stride length 0) 4.158 | 4.109 | 4.026 | 4.05 | 4.1 | 4.074 Get 4.438 | 4.302 | 4.165 | 4.122 | 4.096 | 4.075 MultiGet (no batching) 4.461 | 4.256 | 4.277 | 4.11 | 4.182 | 4.14 MultiGet (w/ batching) Good locality (Stride length 16) 4.048 | 3.659 | 3.248 | 2.99 | 2.84 | 2.753 4.429 | 3.728 | 3.406 | 3.053 | 2.911 | 2.781 4.452 | 3.45 | 2.833 | 2.451 | 2.233 | 2.135 Good locality (Stride length 256) 4.066 | 3.786 | 3.581 | 3.447 | 3.415 | 3.232 4.406 | 4.005 | 3.644 | 3.49 | 3.381 | 3.268 4.393 | 3.649 | 3.186 | 2.882 | 2.676 | 2.62 Medium locality (Stride length 4096) 4.012 | 3.922 | 3.768 | 3.61 | 3.582 | 3.555 4.364 | 4.057 | 3.791 | 3.65 | 3.57 | 3.465 4.479 | 3.758 | 3.316 | 3.077 | 2.959 | 2.891 dbbench command used (on a DB with 4 levels, 12 million keys)- TEST_TMPDIR=/dev/shm numactl 10 ./db_bench.tmp Pull Request resolved: Differential Revision: D14348703 Pulled By: anand1976 fbshipit-source-id: 774406dab3776d979c809522a67bedac6c17f84b/"
,,0.4134,rocksdb,"Consolidate hash function used for non-persistent data in a new function (#5155) Summary: Create new function NPHash64() and GetSliceNPHash64(), which are currently implemented using murmurhash. Replace the current direct call of murmurhash() to use the new functions if the hash results are not used in on-disk format. This will make it easier to try out or switch to alternative functions in the uses where data format compatibility doesnt need to be considered. This part shouldnt have any performance impact. Also, the sharded cache hash function is changed to the new format, because it falls into this categoery. It doesnt show visible performance impact in db_bench results. CPU showed by perf is increased from about 0.2% to 0.4% in an extreme benchmark setting (4KB blocks, no-compression, everything cached in block cache). Weve known that the current hash function used, our own Hash() has serious hash quality problem. It can generate a lots of conflicts with similar input. In this use case, it means extra lock contention for reads from the same file. This slight CPU regression is worthy to me to counter the potential bad performance with hot keys. And hopefully this will get further improved in the future with a better hash function. cache_tests condition is relaxed a little bit to. The new hash is slightly more skewed in this use case, but I manually checked the data and see the hash results are still in a reasonable range. Pull Request resolved: Differential Revision: D14834821 Pulled By: siying fbshipit-source-id: ec9a2c0a2f8ae4b54d08b13a5c2e9cc97aa80cb5/"
,,0.5389,rocksdb,"Introduce a new MultiGet batching implementation (#5011) Summary: This PR introduces a new MultiGet() API, with the underlying implementation grouping keys based on SST file and batching lookups in a file. The reason for the new API is twofold the definition allows callers to allocate storage for status and values on stack instead of std::vector, as well as return values as PinnableSlices in order to avoid copying, and it keeps the original MultiGet() implementation intact while we experiment with batching. Batching is useful when there is some spatial locality to the keys being queries, as well as larger batch sizes. The main benefits are due to 1. Fewer function calls, especially to BlockBasedTableReader::MultiGet() and FullFilterBlockReader::KeysMayMatch() 2. Bloom filter cachelines can be prefetched, hiding the cache miss latency The next step is to optimize the binary searches in the level_storage_info, index blocks and data blocks, since we could reduce the number of key comparisons if the keys are relatively close to each other. The batching optimizations also need to be extended to other formats, such as PlainTable and filter formats. This also needs to be added to db_stress. Benchmark results from db_bench for various batch size/locality of reference combinations are given below. Locality was simulated by offsetting the keys in a batch by a stride length. Each SST file is about 8.6MB uncompressed and key/value size is 16/100 uncompressed. To focus on the cpu benefit of batching, the runs were single threaded and bound to the same cpu to eliminate interference from other system events. The results show a 10-25% improvement in micros/op from smaller to larger batch sizes (4 32). Batch Sizes 1 | 2 | 4 | 8 | 16 | 32 Random pattern (Stride length 0) 4.158 | 4.109 | 4.026 | 4.05 | 4.1 | 4.074 Get 4.438 | 4.302 | 4.165 | 4.122 | 4.096 | 4.075 MultiGet (no batching) 4.461 | 4.256 | 4.277 | 4.11 | 4.182 | 4.14 MultiGet (w/ batching) Good locality (Stride length 16) 4.048 | 3.659 | 3.248 | 2.99 | 2.84 | 2.753 4.429 | 3.728 | 3.406 | 3.053 | 2.911 | 2.781 4.452 | 3.45 | 2.833 | 2.451 | 2.233 | 2.135 Good locality (Stride length 256) 4.066 | 3.786 | 3.581 | 3.447 | 3.415 | 3.232 4.406 | 4.005 | 3.644 | 3.49 | 3.381 | 3.268 4.393 | 3.649 | 3.186 | 2.882 | 2.676 | 2.62 Medium locality (Stride length 4096) 4.012 | 3.922 | 3.768 | 3.61 | 3.582 | 3.555 4.364 | 4.057 | 3.791 | 3.65 | 3.57 | 3.465 4.479 | 3.758 | 3.316 | 3.077 | 2.959 | 2.891 dbbench command used (on a DB with 4 levels, 12 million keys)- TEST_TMPDIR=/dev/shm numactl 10 ./db_bench.tmp Pull Request resolved: Differential Revision: D14348703 Pulled By: anand1976 fbshipit-source-id: 774406dab3776d979c809522a67bedac6c17f84b/"
,,0.4142,rocksdb,"Consolidate hash function used for non-persistent data in a new function (#5155) Summary: Create new function NPHash64() and GetSliceNPHash64(), which are currently implemented using murmurhash. Replace the current direct call of murmurhash() to use the new functions if the hash results are not used in on-disk format. This will make it easier to try out or switch to alternative functions in the uses where data format compatibility doesnt need to be considered. This part shouldnt have any performance impact. Also, the sharded cache hash function is changed to the new format, because it falls into this categoery. It doesnt show visible performance impact in db_bench results. CPU showed by perf is increased from about 0.2% to 0.4% in an extreme benchmark setting (4KB blocks, no-compression, everything cached in block cache). Weve known that the current hash function used, our own Hash() has serious hash quality problem. It can generate a lots of conflicts with similar input. In this use case, it means extra lock contention for reads from the same file. This slight CPU regression is worthy to me to counter the potential bad performance with hot keys. And hopefully this will get further improved in the future with a better hash function. cache_tests condition is relaxed a little bit to. The new hash is slightly more skewed in this use case, but I manually checked the data and see the hash results are still in a reasonable range. Pull Request resolved: Differential Revision: D14834821 Pulled By: siying fbshipit-source-id: ec9a2c0a2f8ae4b54d08b13a5c2e9cc97aa80cb5/"
,,0.4149,rocksdb,"Consolidate hash function used for non-persistent data in a new function (#5155) Summary: Create new function NPHash64() and GetSliceNPHash64(), which are currently implemented using murmurhash. Replace the current direct call of murmurhash() to use the new functions if the hash results are not used in on-disk format. This will make it easier to try out or switch to alternative functions in the uses where data format compatibility doesnt need to be considered. This part shouldnt have any performance impact. Also, the sharded cache hash function is changed to the new format, because it falls into this categoery. It doesnt show visible performance impact in db_bench results. CPU showed by perf is increased from about 0.2% to 0.4% in an extreme benchmark setting (4KB blocks, no-compression, everything cached in block cache). Weve known that the current hash function used, our own Hash() has serious hash quality problem. It can generate a lots of conflicts with similar input. In this use case, it means extra lock contention for reads from the same file. This slight CPU regression is worthy to me to counter the potential bad performance with hot keys. And hopefully this will get further improved in the future with a better hash function. cache_tests condition is relaxed a little bit to. The new hash is slightly more skewed in this use case, but I manually checked the data and see the hash results are still in a reasonable range. Pull Request resolved: Differential Revision: D14834821 Pulled By: siying fbshipit-source-id: ec9a2c0a2f8ae4b54d08b13a5c2e9cc97aa80cb5/"
,,0.1025,rocksdb,Extend MultiGet batching to Transactions (#5210) Summary: MultiGet batching was implemented in in order to reduce CPU utilization when looking up multiple keys at once. This PR implements corresponding ```MultiGet``` and ```MultiGetSingleCFForUpdate``` in ```rocksdb::Transaction``` that call the underlying batching implementation. Pull Request resolved: Differential Revision: D15048164 Pulled By: anand1976 fbshipit-source-id: c52f6043102ab0cbc723f4cba2a7b7d1767f6f52/
,,0.1867,rocksdb,Extend MultiGet batching to Transactions (#5210) Summary: MultiGet batching was implemented in in order to reduce CPU utilization when looking up multiple keys at once. This PR implements corresponding ```MultiGet``` and ```MultiGetSingleCFForUpdate``` in ```rocksdb::Transaction``` that call the underlying batching implementation. Pull Request resolved: Differential Revision: D15048164 Pulled By: anand1976 fbshipit-source-id: c52f6043102ab0cbc723f4cba2a7b7d1767f6f52/Reduce copies of LockInfo (#5172) Summary: The LockInfo struct is not easy to copy because it contains std::vector. Reduce copies by using move constructor and `unordered_map::emplace`. Pull Request resolved: Differential Revision: D14882053 Pulled By: lth fbshipit-source-id: 93999ec6ab1a5841fb5115abb764b6c1831a6de1/
,,0.1228,rocksdb,Extend MultiGet batching to Transactions (#5210) Summary: MultiGet batching was implemented in in order to reduce CPU utilization when looking up multiple keys at once. This PR implements corresponding ```MultiGet``` and ```MultiGetSingleCFForUpdate``` in ```rocksdb::Transaction``` that call the underlying batching implementation. Pull Request resolved: Differential Revision: D15048164 Pulled By: anand1976 fbshipit-source-id: c52f6043102ab0cbc723f4cba2a7b7d1767f6f52/
