Topic_no,Keywords,Contrib,System,Text
17,"revision_pulle, summary, closes_differential, pull_request, resolved_differential, fbshipit_source, yiwu_arbug, maysamyabandeh_fbshipit, ajkr_fbshipit, pr, ad, sagar_fbshipit, riversand_fbshipit, call, sst_file, range_tombstone, siying_fbshipit, part, include, rocksdb",0.0763,OpenDDS,return const char* since only dealing with string literals/Remove use of streams when interacting with Guid and GuidConverter. Added header for stream includes allowed/not allowed in SafetyProfile/
,,0.063,pljava,Coersion for getXXX now applies to updateXXX as well/
,,0.0628,pljava,Added BlobValue coersion to the bytea type./
,,0.0648,rocksdb,Remove usage of C runtime API that has file handle limitation/
,,0.166,rocksdb,"Optimize sequential insert into memtable Part 2: Implementation Summary: Implement a insert hint into skip-list to hint insert position. This is to optimize for the write workload where there are multiple stream of sequential writes. For example, there is a stream of keys of a1, a2, a3... but also b1, b2, b2... Each stream are not neccessary strictly sequential, but can get reorder a little bit. User can specify a prefix extractor and the `SkipListRep` can thus maintan a hint for each of the stream for fast insert into memtable. This is the internal implementation part. See for the interface part. See inline comments for details. Closes Differential Revision: D4106781 Pulled By: yiwu-arbug fbshipit-source-id: f4d48c4/"
,,0.1357,rocksdb,"DeleteRange flush support Summary: Changed BuildTable() (used for flush) to (1) add range tombstones to the aggregator, which is used by CompactionIterator to determine which keys can be removed; and (2) add aggregators range tombstones to the table that is output for the flush. Closes Differential Revision: D4100025 Pulled By: ajkr fbshipit-source-id: cb01a70/"
,,0.1194,rocksdb,"DeleteRange flush support Summary: Changed BuildTable() (used for flush) to (1) add range tombstones to the aggregator, which is used by CompactionIterator to determine which keys can be removed; and (2) add aggregators range tombstones to the table that is output for the flush. Closes Differential Revision: D4100025 Pulled By: ajkr fbshipit-source-id: cb01a70/Add TableBuilderOptions::level and relevant changes (#1335)/"
,,0.1647,rocksdb,"Optimize sequential insert into memtable Part 2: Implementation Summary: Implement a insert hint into skip-list to hint insert position. This is to optimize for the write workload where there are multiple stream of sequential writes. For example, there is a stream of keys of a1, a2, a3... but also b1, b2, b2... Each stream are not neccessary strictly sequential, but can get reorder a little bit. User can specify a prefix extractor and the `SkipListRep` can thus maintan a hint for each of the stream for fast insert into memtable. This is the internal implementation part. See for the interface part. See inline comments for details. Closes Differential Revision: D4106781 Pulled By: yiwu-arbug fbshipit-source-id: f4d48c4/"
,,0.1184,rocksdb,"DeleteRange flush support Summary: Changed BuildTable() (used for flush) to (1) add range tombstones to the aggregator, which is used by CompactionIterator to determine which keys can be removed; and (2) add aggregators range tombstones to the table that is output for the flush. Closes Differential Revision: D4100025 Pulled By: ajkr fbshipit-source-id: cb01a70/Split DBOptions into ImmutableDBOptions and MutableDBOptions Summary: Use ImmutableDBOptions/MutableDBOptions internally and DBOptions only for user-facing APIs. MutableDBOptions is barely a placeholder for now. Ill start to move options to MutableDBOptions in following diffs. Test Plan: make all check Reviewers: yhchiang, IslamAbdelRahman, sdong Reviewed By: sdong Subscribers: andrewkr, dhruba, leveldb Differential Revision:"
,,0.0905,rocksdb,Fix rocksdb::Status::getState Summary: This fixes the Java API for Status#getState use in Native code and also simplifies the implementation of rocksdb::Status::getState. Closes Closes Differential Revision: D4364181 Pulled By: yiwu-arbug fbshipit-source-id: 8e073b4/
,,0.1511,rocksdb,disable UBSAN for functions with intentional shift / overflow Summary: disable UBSAN for functions with intentional left shift on number / overflow These functions are rocksdb:: Hash FixedLengthColBufEncoder::Append FaultInjectionTest:: Key Closes Differential Revision: D4240801 Pulled By: IslamAbdelRahman fbshipit-source-id: 3e1caf6/
,,0.0987,rocksdb,Remove sst_file_manager option from LITE Summary: Remove sst_file_manager option from LITE Closes Differential Revision: D4341331 Pulled By: IslamAbdelRahman fbshipit-source-id: 9f9328d/
,,0.1023,rocksdb,Gcc 7 fallthrough Summary: hopefully the last of the gcc-7 compile errors Closes Differential Revision: D4332106 Pulled By: IslamAbdelRahman fbshipit-source-id: 139448c/
,,0.0987,rocksdb,Remove sst_file_manager option from LITE Summary: Remove sst_file_manager option from LITE Closes Differential Revision: D4341331 Pulled By: IslamAbdelRahman fbshipit-source-id: 9f9328d/
,,0.0938,rocksdb,Implement PositionedAppend for PosixWritableFile Summary: This patch clarifies the contract of PositionedAppend with some unit tests and also implements it for PosixWritableFile. (Tasks: 14524071) Closes Differential Revision: D4204907 Pulled By: maysamyabandeh fbshipit-source-id: 06eabd2/
,,0.2278,rocksdb,"[rocksdb][PR] compaction_style and compaction_pri should output their value as a stÖ Summary: Öring Replace the numerical output for compaction_style and compaction_pri with strings Closes Differential Revision: D4482796 Pulled By: highker fbshipit-source-id: 5785768/Optimize sequential insert into memtable Part 1: Interface Summary: Currently our skip-list have an optimization to speedup sequential inserts from a single stream, by remembering the last insert position. We extend the idea to support sequential inserts from multiple streams, and even tolerate small reordering wihtin each stream. This PR is the interface part adding the following: Add `memtable_insert_prefix_extractor` to allow specifying prefix for each key. Add `InsertWithHint()` interface to memtable, to allow underlying implementation to return a hint of insert position, which can be later pass back to optimize inserts. Memtable will maintain a map from prefix to hints and pass the hint via `InsertWithHint()` if `memtable_insert_prefix_extractor` is non-null. Closes Differential Revision: D4079367 Pulled By: yiwu-arbug fbshipit-source-id: 3555326/"
,,0.1088,rocksdb,"Allow incrementing refcount on cache handles Summary: Previously the only way to increment a handles refcount was to invoke Lookup(), which (1) did hash table lookup to get cache handle, (2) incremented that handles refcount. For a future DeleteRange optimization, I added a function, Ref(), for when the caller already has a cache handle and only needs to do (2). Closes Differential Revision: D4397114 Pulled By: ajkr fbshipit-source-id: 9addbe5/"
,,0.1357,rocksdb,"Fix fd leak when using direct IOs Summary: We should close the fd, before overriding it. This bug was introduced by f89caa127baa086cb100976b14da1a531cf0e823 Closes Differential Revision: D4214101 Pulled By: siying fbshipit-source-id: 0d65de0/Implement PositionedAppend for PosixWritableFile Summary: This patch clarifies the contract of PositionedAppend with some unit tests and also implements it for PosixWritableFile. (Tasks: 14524071) Closes Differential Revision: D4204907 Pulled By: maysamyabandeh fbshipit-source-id: 06eabd2/"
,,0.0846,rocksdb,"direct reads refactor Summary: direct IO reads refactoring remove unnecessary classes and unified interfaces tested with db_bench need more change for options and ON/OFF for different files. Since disabled is default, it should be fine now Closes Differential Revision: D4307189 Pulled By: lightmark fbshipit-source-id: 6991e22/"
,,0.1275,rocksdb,"Allow SstFileWriter to Fadvise the file away from page cache Summary: Add `fadvise_trigger` option to `SstFileWriter` If fadvise_trigger is passed with a non-zero value, SstFileWriter will invalidate the os page cache every `fadvise_trigger` bytes for the sst file Closes Differential Revision: D4371246 Pulled By: IslamAbdelRahman fbshipit-source-id: 91caff1/"
,,0.0869,rocksdb,"NewLRUCache() to pick number of shard bits based on capacity if not given Summary: If the users use the NewLRUCache() without passing in the number of shard bits, instead of using hard-coded 6, well determine it based on capacity. Closes Differential Revision: D4242517 Pulled By: siying fbshipit-source-id: 86b0f18/"
,,0.0934,rocksdb,Cleaner default options using C++11 in-class init Summary: C++11 in-class initialization is cleaner and makes it the default more explicit to our users and more visible. Use it for ColumnFamilyOptions and DBOptions Closes Differential Revision: D4490473 Pulled By: IslamAbdelRahman fbshipit-source-id: c493a87/
,,0.2273,rocksdb,"Optimize sequential insert into memtable Part 1: Interface Summary: Currently our skip-list have an optimization to speedup sequential inserts from a single stream, by remembering the last insert position. We extend the idea to support sequential inserts from multiple streams, and even tolerate small reordering wihtin each stream. This PR is the interface part adding the following: Add `memtable_insert_prefix_extractor` to allow specifying prefix for each key. Add `InsertWithHint()` interface to memtable, to allow underlying implementation to return a hint of insert position, which can be later pass back to optimize inserts. Memtable will maintain a map from prefix to hints and pass the hint via `InsertWithHint()` if `memtable_insert_prefix_extractor` is non-null. Closes Differential Revision: D4079367 Pulled By: yiwu-arbug fbshipit-source-id: 3555326/"
,,0.1283,rocksdb,Fixes for MSVC compilation Summary: Closes Differential Revision: D4327421 Pulled By: yiwu-arbug fbshipit-source-id: 661ee0b/
,,0.102,rocksdb,Add support for JNI Library on Linux on PowerPC. Summary: Closes Closes Differential Revision: D4546491 Pulled By: siying fbshipit-source-id: 86190b4/
,,0.1495,rocksdb,disable UBSAN for functions with intentional shift / overflow Summary: disable UBSAN for functions with intentional left shift on number / overflow These functions are rocksdb:: Hash FixedLengthColBufEncoder::Append FaultInjectionTest:: Key Closes Differential Revision: D4240801 Pulled By: IslamAbdelRahman fbshipit-source-id: 3e1caf6/
,,0.1307,rocksdb,Dump persistent cache options Summary: Dump persistent cache options Closes Differential Revision: D4337019 Pulled By: yiwu-arbug fbshipit-source-id: 3812f8a/Persistent Cache: Expose stats to user via public API Summary: Exposing persistent cache stats (counters) to the user via public API. Closes Differential Revision: D4155274 Pulled By: siying fbshipit-source-id: 30a9f50/
,,0.1385,rocksdb,"Allow SstFileWriter to Fadvise the file away from page cache Summary: Add `fadvise_trigger` option to `SstFileWriter` If fadvise_trigger is passed with a non-zero value, SstFileWriter will invalidate the os page cache every `fadvise_trigger` bytes for the sst file Closes Differential Revision: D4371246 Pulled By: IslamAbdelRahman fbshipit-source-id: 91caff1/"
,,0.1062,rocksdb,Disable IngestExternalFile in ReadOnly mode Summary: Disable IngestExternalFile() in read only mode Closes Differential Revision: D4439179 Pulled By: IslamAbdelRahman fbshipit-source-id: b7e46e7/
,,0.0903,rocksdb,"Revert ""PinnableSlice"" Summary: This reverts commit 54d94e9c2cc0bf6eeb2a165ada33fa9c174f0b16. The pull request was landed by mistake. Closes Differential Revision: D4391678 Pulled By: maysamyabandeh fbshipit-source-id: 36d5149/"
,,0.1511,rocksdb,disable UBSAN for functions with intentional shift / overflow Summary: disable UBSAN for functions with intentional left shift on number / overflow These functions are rocksdb:: Hash FixedLengthColBufEncoder::Append FaultInjectionTest:: Key Closes Differential Revision: D4240801 Pulled By: IslamAbdelRahman fbshipit-source-id: 3e1caf6/
,,0.2494,rocksdb,"Fix for 2PC causing WAL to grow too large Summary: Consider the following single column family scenario: prepare in log A commit in log B *WAL is too large, flush all CFs to releast log A* *CFA is on log B so we do not see CFA is depending on log A so no flush is requested* To fix this we must also consider the log containing the prepare section when determining what log a CF is dependent on. Closes Differential Revision: D4403265 Pulled By: reidHoruff fbshipit-source-id: ce800ff/Avoid intentional overflow in GetL0ThresholdSpeedupCompaction Summary: fixes integer overflow in GetL0ThresholdSpeedupCompaction() by checking if int become UBSAN will complain about that since this is still an overflow, we can fix the issue by simply using int64_t Closes Differential Revision: D4241525 Pulled By: IslamAbdelRahman fbshipit-source-id: b3ae21f/Optimize sequential insert into memtable Part 1: Interface Summary: Currently our skip-list have an optimization to speedup sequential inserts from a single stream, by remembering the last insert position. We extend the idea to support sequential inserts from multiple streams, and even tolerate small reordering wihtin each stream. This PR is the interface part adding the following: Add `memtable_insert_prefix_extractor` to allow specifying prefix for each key. Add `InsertWithHint()` interface to memtable, to allow underlying implementation to return a hint of insert position, which can be later pass back to optimize inserts. Memtable will maintain a map from prefix to hints and pass the hint via `InsertWithHint()` if `memtable_insert_prefix_extractor` is non-null. Closes Differential Revision: D4079367 Pulled By: yiwu-arbug fbshipit-source-id: 3555326/"
,,0.0915,rocksdb,"Flush job should release reference current version if sync log failed Summary: Fix the bug when sync log fail, FlushJob::Run() will not be execute and reference to cfd->current() will not be release. Closes Differential Revision: D4441316 Pulled By: yiwu-arbug fbshipit-source-id: 5523e28/"
,,0.0903,rocksdb,"Revert ""PinnableSlice"" Summary: This reverts commit 54d94e9c2cc0bf6eeb2a165ada33fa9c174f0b16. The pull request was landed by mistake. Closes Differential Revision: D4391678 Pulled By: maysamyabandeh fbshipit-source-id: 36d5149/"
,,0.2194,rocksdb,"Optimize sequential insert into memtable Part 1: Interface Summary: Currently our skip-list have an optimization to speedup sequential inserts from a single stream, by remembering the last insert position. We extend the idea to support sequential inserts from multiple streams, and even tolerate small reordering wihtin each stream. This PR is the interface part adding the following: Add `memtable_insert_prefix_extractor` to allow specifying prefix for each key. Add `InsertWithHint()` interface to memtable, to allow underlying implementation to return a hint of insert position, which can be later pass back to optimize inserts. Memtable will maintain a map from prefix to hints and pass the hint via `InsertWithHint()` if `memtable_insert_prefix_extractor` is non-null. Closes Differential Revision: D4079367 Pulled By: yiwu-arbug fbshipit-source-id: 3555326/"
,,0.1062,rocksdb,Disable IngestExternalFile in ReadOnly mode Summary: Disable IngestExternalFile() in read only mode Closes Differential Revision: D4439179 Pulled By: IslamAbdelRahman fbshipit-source-id: b7e46e7/
,,0.1513,rocksdb,"Change DB::GetApproximateSizes for more flexibility needed for MyRocks Summary: Added an option to GetApproximateSizes to exclude file stats, as MyRocks has those counted exactly and we need only stats from memtables. Closes Differential Revision: D4441111 Pulled By: IslamAbdelRahman fbshipit-source-id: c11f4c3/Fix for 2PC causing WAL to grow too large Summary: Consider the following single column family scenario: prepare in log A commit in log B *WAL is too large, flush all CFs to releast log A* *CFA is on log B so we do not see CFA is depending on log A so no flush is requested* To fix this we must also consider the log containing the prepare section when determining what log a CF is dependent on. Closes Differential Revision: D4403265 Pulled By: reidHoruff fbshipit-source-id: ce800ff/Dynamic max_total_wal_size option Summary: Closes Differential Revision: D4176426 Pulled By: yiwu-arbug fbshipit-source-id: b57689d/"
,,0.1173,rocksdb,"Revert ""PinnableSlice"" Summary: This reverts commit 54d94e9c2cc0bf6eeb2a165ada33fa9c174f0b16. The pull request was landed by mistake. Closes Differential Revision: D4391678 Pulled By: maysamyabandeh fbshipit-source-id: 36d5149/Range deletion microoptimizations Summary: Made RangeDelAggregators InternalKeyComparator member a reference-to-const so we dont need to copy-construct it. Also added InternalKeyComparator to ImmutableCFOptions so we dont need to construct one for each DBIter. Made MemTable::NewRangeTombstoneIterator and the table readers NewRangeTombstoneIterator() functions return nullptr instead of NewEmptyInternalIterator to avoid the allocation. Updated callers accordingly. Closes Differential Revision: D4208169 Pulled By: ajkr fbshipit-source-id: 2fd65cf/"
,,0.08800000000000001,rocksdb,"Fix for 2PC causing WAL to grow too large Summary: Consider the following single column family scenario: prepare in log A commit in log B *WAL is too large, flush all CFs to releast log A* *CFA is on log B so we do not see CFA is depending on log A so no flush is requested* To fix this we must also consider the log containing the prepare section when determining what log a CF is dependent on. Closes Differential Revision: D4403265 Pulled By: reidHoruff fbshipit-source-id: ce800ff/"
,,0.1011,rocksdb,Compaction::IsTrivialMove relaxing Summary: IsTrivialMove returns true if no input file overlaps with output_level+1 with more than max_compaction_bytes_ bytes. Closes Differential Revision: D4278338 Pulled By: yiwu-arbug fbshipit-source-id: 994c001/
,,0.0942,rocksdb,"Revert ""PinnableSlice"" Summary: This reverts commit 54d94e9c2cc0bf6eeb2a165ada33fa9c174f0b16. The pull request was landed by mistake. Closes Differential Revision: D4391678 Pulled By: maysamyabandeh fbshipit-source-id: 36d5149/"
,,0.2522,rocksdb,"Test merge op covered by range deletion in memtable Summary: Its a test case for Also got rid of kTypeDeletion in the conditional since we treat it the same as kTypeRangeDeletion. Closes Differential Revision: D4451300 Pulled By: ajkr fbshipit-source-id: b39dda1/Revert ""PinnableSlice"" Summary: This reverts commit 54d94e9c2cc0bf6eeb2a165ada33fa9c174f0b16. The pull request was landed by mistake. Closes Differential Revision: D4391678 Pulled By: maysamyabandeh fbshipit-source-id: 36d5149/Range deletion microoptimizations Summary: Made RangeDelAggregators InternalKeyComparator member a reference-to-const so we dont need to copy-construct it. Also added InternalKeyComparator to ImmutableCFOptions so we dont need to construct one for each DBIter. Made MemTable::NewRangeTombstoneIterator and the table readers NewRangeTombstoneIterator() functions return nullptr instead of NewEmptyInternalIterator to avoid the allocation. Updated callers accordingly. Closes Differential Revision: D4208169 Pulled By: ajkr fbshipit-source-id: 2fd65cf/Remove Arena in RangeDelAggregator Summary: The Arena construction/destruction introduced significant overhead to read-heavy workload just by creating empty vectors for its blocks, so avoid it in RangeDelAggregator. Closes Differential Revision: D4207781 Pulled By: ajkr fbshipit-source-id: 9d1c130/Report memory usage by memtable insert hints map. Summary: It is hard to measure acutal memory usage by std containers. Even providing a custom allocator will miss count some of the usage. Here we only do a wild guess on its memory usage. Closes Differential Revision: D4179945 Pulled By: yiwu-arbug fbshipit-source-id: 32ab929/Optimize sequential insert into memtable Part 1: Interface Summary: Currently our skip-list have an optimization to speedup sequential inserts from a single stream, by remembering the last insert position. We extend the idea to support sequential inserts from multiple streams, and even tolerate small reordering wihtin each stream. This PR is the interface part adding the following: Add `memtable_insert_prefix_extractor` to allow specifying prefix for each key. Add `InsertWithHint()` interface to memtable, to allow underlying implementation to return a hint of insert position, which can be later pass back to optimize inserts. Memtable will maintain a map from prefix to hints and pass the hint via `InsertWithHint()` if `memtable_insert_prefix_extractor` is non-null. Closes Differential Revision: D4079367 Pulled By: yiwu-arbug fbshipit-source-id: 3555326/"
,,0.092,rocksdb,Allow Users to change customized ldb tools header in help printing Summary: Closes Differential Revision: D4748448 Pulled By: siying fbshipit-source-id: a54c2f9/
,,0.1385,rocksdb,Roundup read bytes in ReadaheadRandomAccessFile Summary: Fix alignment in ReadaheadRandomAccessFile Closes Differential Revision: D5012336 Pulled By: lightmark fbshipit-source-id: 10d2c829520cb787227ef653ef63d5d701725778/readahead backwards from sst end Summary: prefetch some data from the end of the file for each compaction to reduce IO. Closes Differential Revision: D4880576 Pulled By: lightmark fbshipit-source-id: aa767cd1afc84c541837fbf1ad6c0d45b34d3932/alignment is on in ReadaheadRandomAccessFile::Read() Summary: Closes Differential Revision: D4534518 Pulled By: wat-ze-hex fbshipit-source-id: b456946/
,,0.11199999999999999,rocksdb,CoreLocalArray class Summary: Moved the logic for core-local array out of ConcurrentArena and into a separate class because I want to reuse it for core-local stats. Closes Differential Revision: D5011518 Pulled By: ajkr fbshipit-source-id: a75a7b8f7b7a42fd6273489ada405f14c6be196a/
,,0.0919,rocksdb,alignment is on in ReadaheadRandomAccessFile::Read() Summary: Closes Differential Revision: D4534518 Pulled By: wat-ze-hex fbshipit-source-id: b456946/
,,0.1173,rocksdb,"Limit maximum memory used in the WriteBatch representation Summary: Extend TransactionOptions to include max_write_batch_size which determines the maximum size of the writebatch representation. If memory limit is exceeded, the operation will abort with subcode kMemoryLimit. Closes Differential Revision: D4861842 Pulled By: lth fbshipit-source-id: 46fd172ea67cc90bbba829bf0d70cfab2261c161/"
,,0.1082,rocksdb,"add max to histogram stats Summary: Domas enlightened me about p100 (i.e., max) stats. Lets add them to our histograms. Closes Differential Revision: D4678716 Pulled By: ajkr fbshipit-source-id: 65e7118/"
,,0.0897,rocksdb,Support SstFileManager::SetDeleteRateBytesPerSecond() Summary: Update DeleteScheduler component to support changing delete rate in runtime by introducing SstFileManager::SetDeleteRateBytesPerSecond() Closes Differential Revision: D4719906 Pulled By: IslamAbdelRahman fbshipit-source-id: e6b8d9e/
,,0.0869,rocksdb,Add a new SstFileWriter constructor without explicit comparator Summary: The comparator param in SstFileWriter constructor is redundant as it already exists as a field in options. So the current SstFileWriter constructor should be deprecated in favor of a new one which does not take a comparator. Note that the jni/java apis have not been touched yet. Closes Differential Revision: D4685629 Pulled By: sagar0 fbshipit-source-id: 372ce96/
,,0.1513,rocksdb,Blob storage helper methods Summary: Split out interfaces needed for blob storage from including * CompactionEventListener and OnFlushBegin listener interfaces. * Blob filename support. Closes Differential Revision: D4905463 Pulled By: yiwu-arbug fbshipit-source-id: 564e73448f1b7a367e5e46216a521e57ea9011b5/
,,0.0821,rocksdb,Object lifetime in cache Summary: Any non-raw-data dependent object must be destructed before the table closes. There was a bug of not doing that for filter object. This patch fixes the bug and adds a unit test to prevent such bugs in future. Closes Differential Revision: D5001318 Pulled By: maysamyabandeh fbshipit-source-id: 6d8772e58765485868094b92964da82ef9730b6d/
,,0.0869,rocksdb,Added SstFileWriter construtor without explicit comparator to JNI api Summary: Adding API missing after adamretter IslamAbdelRahman Tested locally. Closes Differential Revision: D4762817 Pulled By: IslamAbdelRahman fbshipit-source-id: 833f478/
,,0.0869,rocksdb,Added SstFileWriter construtor without explicit comparator to JNI api Summary: Adding API missing after adamretter IslamAbdelRahman Tested locally. Closes Differential Revision: D4762817 Pulled By: IslamAbdelRahman fbshipit-source-id: 833f478/
,,0.1,rocksdb,Expose DB::DeleteRange and WriteBath::DeleteRange in Java Summary: Added JNI wrapper from `DeleteRange` methods Closes Differential Revision: D4657746 Pulled By: yiwu-arbug fbshipit-source-id: 3fc7ab8/
,,0.1,rocksdb,Expose DB::DeleteRange and WriteBath::DeleteRange in Java Summary: Added JNI wrapper from `DeleteRange` methods Closes Differential Revision: D4657746 Pulled By: yiwu-arbug fbshipit-source-id: 3fc7ab8/
,,0.0917,rocksdb,Added missing options to RocksJava Summary: This adds almost all missing options to RocksJava Closes Differential Revision: D4779991 Pulled By: siying fbshipit-source-id: 4a1bf28/
,,0.0954,rocksdb,Added missing options to RocksJava Summary: This adds almost all missing options to RocksJava Closes Differential Revision: D4779991 Pulled By: siying fbshipit-source-id: 4a1bf28/
,,0.0972,rocksdb,Added missing options to RocksJava Summary: This adds almost all missing options to RocksJava Closes Differential Revision: D4779991 Pulled By: siying fbshipit-source-id: 4a1bf28/
