Topic_no,Keywords,Contrib,System,Text
4,"test_plan, summary, reviewer, sdong_reviewe, revision, sdong_subscriber, diff, column_family, leveldb_differential, make, differential_revision, dhruba_haobo, igor_reviewe, table, column_familie, option, igor_subscriber, unit, property, family",0.0566,jna,Get additional library paths from ldconfig on Linux/
,,0.0664,jna,some cosmetics/
,,0.066,jna,removed some warnings/some cosmetics/
,,0.0586,jna,some changes added some unit tests/clean up some platform win32 junk/
,,0.0648,OpenDDS,Updated for compilers where conversion from string mgr to const char* is broken/
,,0.0609,pljava,Initial revision/
,,0.0609,pljava,Initial revision/
,,0.0609,pljava,Initial revision/
,,0.0673,pljava,Initial revision/
,,0.0704,rocksdb,add zlib compression Summary: add zlib compression Test Plan: Will add more testcases Reviewers: dhruba Reviewed By: dhruba Differential Revision:
,,0.075,rocksdb,"[RocksDB] Include 64bit random number generator Summary: As title. Test Plan: make check; Reviewers: chip, MarkCallaghan CC: leveldb Differential Revision:"
,,0.0628,rocksdb,"Migrate names of properties from leveldb prefix to rocksdb prefix. Summary: Migrate names of properties from leveldb prefix to rocksdb prefix. Test Plan: make check Reviewers: emayanke, haobo Reviewed By: haobo CC: leveldb Differential Revision:"
,,0.0628,rocksdb,"Migrate names of properties from leveldb prefix to rocksdb prefix. Summary: Migrate names of properties from leveldb prefix to rocksdb prefix. Test Plan: make check Reviewers: emayanke, haobo Reviewed By: haobo CC: leveldb Differential Revision:"
,,0.0782,rocksdb,"Avoid malloc in NotFound key status if no message is given. Summary: In some places we have NotFound status created with empty message, but it doesnt avoid a malloc. With this patch, the malloc is avoided for that case. The motivation of it is that I found in db_bench readrandom test when all keys are not existing, about 4% of the total running time is spent on malloc of Status, plus a similar amount of CPU spent on free of them, which is not necessary. Test Plan: make all check Reviewers: dhruba, haobo, igor Reviewed By: haobo CC: leveldb Differential Revision:"
,,0.0974,rocksdb,"[RocksDB] [Performance Branch] Added dynamic bloom, to be used for memable non-existing key filtering Summary: as title Test Plan: dynamic_bloom_test Reviewers: dhruba, sdong, kailiu CC: leveldb Differential Revision:"
,,0.0938,rocksdb,"Clean up arena API Summary: Easy thing goes first. This patch moves arena to internal dir; based on which, the coming patch will deal with memtable_rep. Test Plan: make check Reviewers: haobo, sdong, dhruba CC: leveldb Differential Revision: the aligned and unaligned memory allocation Summary: Use two vectors for different types of memory allocation. Test Plan: run all unit tests. Reviewers: haobo, sdong Reviewed By: haobo CC: leveldb Differential Revision:"
,,0.4756,rocksdb,"[CF] Rethink table cache Summary: Adapting table cache to column families is interesting. We want table cache to be global LRU, so if some column families are use not as often as others, we want them to be evicted from cache. However, current TableCache object also constructs tables on its own. If table is not found in the cache, TableCache automatically creates new table. We want each column family to be able to specify different table factory. To solve the problem, we still have a single LRU, but we provide the LRUCache object to TableCache on construction. We have one TableCache per column family, but the underyling cache is shared by all TableCache objects. This allows us to have a global LRU, but still be able to support different table factories for different column families. Also, in the future it will also be able to support different directories for different column families. Test Plan: make check Reviewers: dhruba, haobo, kailiu, sdong CC: leveldb Differential Revision: cleanup Summary: Removed icmp_ from VersionSet (since its per-column-family, not per-DB-instance) Unfriended VersionSet and ColumnFamilyData (yay) Removed VersionSet::NumberLevels() Cleaned up DBImpl Test Plan: make check Reviewers: dhruba, haobo, kailiu CC: leveldb Differential Revision: VersionSet::ReduceNumberOfLevels() static Summary: A lot of our code implicitly assumes number_levels to be static. ReduceNumberOfLevels() breaks that assumption. For example, after calling ReduceNumberOfLevels(), DBImpl::NumberLevels() will be different from VersionSet::NumberLevels(). This is dangerous. Thankfully, its not in public headers and is only used from LDB cmd tool. LDB tool is only using it statically, i.e. it never calls it with running DB instance. With this diff, we make it explicitly static. This way, we can assume number_levels to be immutable and not break assumption that lot of our code is relying upon. LDB tool can still use the method. Also, I removed the method from a separate file since it breaks filename completition. version_se<TAB> now completes to ""version_set."" instead of ""version_set"" (without the dot). I dont see a big reason that the function should be in a different file. Test Plan: reduce_levels_test Reviewers: dhruba, haobo, kailiu, sdong Reviewed By: kailiu CC: leveldb Differential Revision: Summary: I created a separate class ColumnFamilySet to keep track of column families. Before we did this in VersionSet and I believe this approach is cleaner. Let me know if you have any comments. I will commit tomorrow. Test Plan: make check Reviewers: dhruba, haobo, kailiu, sdong CC: leveldb Differential Revision: dumper broken when merge operator is in log] Summary: $title Test Plan: on my dev box Revert Plan: OK Task ID: Reviewers: emayanke, dhruba, haobo Reviewed By: haobo CC: leveldb Differential Revision:"
,,0.4048,rocksdb,"[CF] Separate dumping of DBOptions and ColumnFamilyOptions Summary: When we open a DB, we should dump only DBOptions and then when we create a new column family, we dump ColumnFamilyOptions for each one. Test Plan: make check, confirm contents of the LOG Reviewers: dhruba, haobo, sdong, kailiu CC: leveldb Differential Revision: printf format/Merge branch master into columnfamilies/Improve RocksDB ""get"" performance by computing merge result in memtable Summary: Added an option (max_successive_merges) that can be used to specify the maximum number of successive merge operations on a key in the memtable. This can be used to improve performance of the ""get"" operation. If many successive merge operations are performed on a key, the performance of ""get"" operations on the key deteriorates, as the value has to be computed for each ""get"" operation by applying all the successive merge operations. FB Task ID: Test Plan: make all check db_bench counter_stress_test Reviewers: haobo, vamsi, dhruba, sdong Reviewed By: haobo CC: zshao Differential Revision: families] Implement DB::OpenWithColumnFamilies() Summary: In addition to implementing OpenWithColumnFamilies, this diff also includes some minor changes: * Changed all column family names from Slice() to std::string. The performance of column family name handling is not critical, and its more convenient and cleaner to have names as std::strings * Implemented ColumnFamilyOptions(const Options&) and DBOptions(const Options&) * Added ColumnFamilyOptions to VersionSet::ColumnFamilyData. ColumnFamilyOptions are specified on OpenWithColumnFamilies() and CreateColumnFamily() I will keep the diff in the Phabricator for a day or two and will push to the branch then. Feel free to comment even after the diff has been pushed. Test Plan: Added a simple unit test Reviewers: dhruba, haobo CC: leveldb Differential Revision: [Column Family] Interface proposal Summary: diff is for Column Family branch> Sharing some of the work Ive done so far. This diff compiles and passes the tests. The biggest change is in options.h I broke down Options into two parts DBOptions and ColumnFamilyOptions. DBOptions is DB-specific (env, create_if_missing, block_cache, etc.) and ColumnFamilyOptions is column family-specific (all compaction options, compresion options, etc.). Note that this does not break backwards compatibility at all. Further, I created DBWithColumnFamily which inherits DB interface and adds new functions with column family support. Clients can transparently switch to DBWithColumnFamily and it will not break their backwards compatibility. There are few methods worth checking out: ListColumnFamilies(), MultiNewIterator(), MultiGet() and GetSnapshot(). [GetSnapshot() returns the snapshot across all column families for now I think thats what we agreed on] Finally, I made small changes to WriteBatch so we are able to atomically insert data across column families. Please provide feedback. Test Plan: make check works, the code is backward compatible Reviewers: dhruba, haobo, sdong, kailiu, emayanke CC: leveldb Differential Revision: [Performance Branch] Added dynamic bloom, to be used for memable non-existing key filtering Summary: as title Test Plan: dynamic_bloom_test Reviewers: dhruba, sdong, kailiu CC: leveldb Differential Revision: compression options to db_bench Summary: This adds 2 options for compression to db_bench: * universal_compression_size_percent * compression_level to set zlib compression level It also logs compression_size_percent at startup in LOG Task ID: Blame Rev: Test Plan: make check, run db_bench Revert Plan: Database Impact: Memcache Impact: Other Notes: EImportant: begin *PUBLIC* platform impact section Bugzilla: end platform impact Reviewers: dhruba CC: leveldb Differential Revision: CompactionFilter thread safety requirements Summary: Documenting our discussion Test Plan: make Reviewers: dhruba, haobo Reviewed By: dhruba CC: igor Differential Revision: the ""table stats"" Summary: The primary motivation of the changes is to make it easier to figure out the inside of the tables. * rename ""table stats"" to ""table properties"" since now we have more than ""integers"" to store in the property block. * Add filter block size to the basic table properties. * Whenever a table is built, well log the table properties (the sample output is in Test Plan). * Make an api to expose deleted keys. Test Plan: Passed all existing test. and the sample output of table stats: Basic Properties data blocks: 1 entries: 1 raw key size: 9 raw average key size: 9 raw value size: 9 raw average value size: 0 data block size: 25 index block size: 27 filter block size: 18 (estimated) table size: 70 filter policy: rocksdb.BuiltinBloomFilter User collected properties: InternalKeyPropertiesCollector kDeletedKeys: 1 Reviewers: dhruba, haobo Reviewed By: dhruba CC: leveldb Differential Revision:"
,,0.1838,rocksdb,"[Performance Branch] PlainTable to encode rows with seqID 0, value type using 1 internal byte. Summary: In PlainTable, use one single byte to represent 8 bytes of internal bytes, if seqID 0 and it is value type (which should be common for bottom most files). It is to save 7 bytes for uncompressed cases. Test Plan: make all check Reviewers: haobo, dhruba, kailiu Reviewed By: haobo CC: igor, leveldb Differential Revision:"
,,0.1269,rocksdb,"Fsync directory after we create a new file Summary: Im not sure where we need to sync the directory. I implemented the function in Env() and added the dir sync just after we close the newly created file in the builder. Should I also add FsyncDir() to new files that get created by a compaction? Test Plan: Confirmed that FsyncDir is returning Status::OK() Reviewers: dhruba, haobo Reviewed By: dhruba CC: leveldb, dhruba Differential Revision: util/env_posix.cc work under mac Summary: This diff invoves some more complicated issues in the posix environment. Test Plan: works under mac os. will need to verify dev box. Reviewers: dhruba Reviewed By: dhruba CC: leveldb Differential Revision:"
,,0.0876,rocksdb,"IOError cleanup Summary: Clean up IOErrors so that it only indicates errors talking to device. Test Plan: make all check Reviewers: igor, haobo, dhruba, emayanke Reviewed By: igor CC: leveldb Differential Revision: malloc in NotFound key status if no message is given. Summary: In some places we have NotFound status created with empty message, but it doesnt avoid a malloc. With this patch, the malloc is avoided for that case. The motivation of it is that I found in db_bench readrandom test when all keys are not existing, about 4% of the total running time is spent on malloc of Status, plus a similar amount of CPU spent on free of them, which is not necessary. Test Plan: make all check Reviewers: dhruba, haobo, igor Reviewed By: haobo CC: leveldb Differential Revision:"
,,0.5582,rocksdb,"[CF] Rethinking ColumnFamilyHandle and fix to dropping column families Summary: The change to the public behavior: * When opening a DB or creating new column family client gets a ColumnFamilyHandle. * As long as column family handle is alive, client can do whatever he wants with it, even drop it * Dropped column family can still be read from (using the column family handle) * Added a new call CloseColumnFamily(). Client has to close all column families that he has opened before deleting the DB * As soon as column family is closed, any calls to DB using that column family handle will fail (also any outstanding calls) Internally: * Ref-counting ColumnFamilyData * New thread-safety for ColumnFamilySet * Dropped column families are now completely dropped and their memory cleaned-up Test Plan: added some tests to column_family_test Reviewers: dhruba, haobo, kailiu, sdong CC: leveldb Differential Revision: families] Move memtable and immutable memtable list to column family data Summary: All memtables and immutable memtables are moved from DBImpl to ColumnFamilyData. For now, they are all referenced from default column family in DBImpl. It shouldnt be hard to get them from custom column family. Test Plan: make check Reviewers: dhruba, kailiu, sdong CC: leveldb Differential Revision: branch master into columnfamilies Conflicts: db/db_impl.cc db/db_impl.h db/db_impl_readonly.h db/db_test.cc include/rocksdb/db.h include/utilities/stackable_db.h/[column families] Support to create and drop column families Summary: This diff provides basic implementations of CreateColumnFamily(), DropColumnFamily() and ListColumnFamilies(). It builds on top of It also includes a bug fix for DBImplReadOnly, where Get implementation would be redirected to DBImpl instead of DBImplReadOnly. Test Plan: Added unit test Reviewers: dhruba, haobo, kailiu CC: leveldb Differential Revision: [Column Family] Interface proposal Summary: diff is for Column Family branch> Sharing some of the work Ive done so far. This diff compiles and passes the tests. The biggest change is in options.h I broke down Options into two parts DBOptions and ColumnFamilyOptions. DBOptions is DB-specific (env, create_if_missing, block_cache, etc.) and ColumnFamilyOptions is column family-specific (all compaction options, compresion options, etc.). Note that this does not break backwards compatibility at all. Further, I created DBWithColumnFamily which inherits DB interface and adds new functions with column family support. Clients can transparently switch to DBWithColumnFamily and it will not break their backwards compatibility. There are few methods worth checking out: ListColumnFamilies(), MultiNewIterator(), MultiGet() and GetSnapshot(). [GetSnapshot() returns the snapshot across all column families for now I think thats what we agreed on] Finally, I made small changes to WriteBatch so we are able to atomically insert data across column families. Please provide feedback. Test Plan: make check works, the code is backward compatible Reviewers: dhruba, haobo, sdong, kailiu, emayanke CC: leveldb Differential Revision: Summary: We need access to options for BackupableDB Test Plan: make check Reviewers: dhruba Reviewed By: dhruba CC: leveldb, reconnect.grayhat Differential Revision:"
,,0.371,rocksdb,"WriteBatch to provide a way for user to query data size directly and only return constant reference of data in Data() Summary: WriteBatch::Data() now is easily to be misuse by users. Also, there is no cheap way for user of WriteBatch to know the data size accumulated. This patch fix the problem by: (1) return a constant reference to Data() so its obvious to caller what it means. (2) add a function to return data size directly Test Plan: make all check Reviewers: haobo, igor, kailiu Reviewed By: kailiu CC: zshao, leveldb Differential Revision: column family information to WAL Summary: I have added three new value types: * kTypeColumnFamilyDeletion * kTypeColumnFamilyValue * kTypeColumnFamilyMerge which include column family Varint32 before the data (value, deletion and merge). These values are used only in WAL (not in memtables yet). This endeavour required changing some WriteBatch internals. Test Plan: Added a unittest Reviewers: dhruba, haobo, sdong, kailiu CC: leveldb Differential Revision: [Column Family] Interface proposal Summary: diff is for Column Family branch> Sharing some of the work Ive done so far. This diff compiles and passes the tests. The biggest change is in options.h I broke down Options into two parts DBOptions and ColumnFamilyOptions. DBOptions is DB-specific (env, create_if_missing, block_cache, etc.) and ColumnFamilyOptions is column family-specific (all compaction options, compresion options, etc.). Note that this does not break backwards compatibility at all. Further, I created DBWithColumnFamily which inherits DB interface and adds new functions with column family support. Clients can transparently switch to DBWithColumnFamily and it will not break their backwards compatibility. There are few methods worth checking out: ListColumnFamilies(), MultiNewIterator(), MultiGet() and GetSnapshot(). [GetSnapshot() returns the snapshot across all column families for now I think thats what we agreed on] Finally, I made small changes to WriteBatch so we are able to atomically insert data across column families. Please provide feedback. Test Plan: make check works, the code is backward compatible Reviewers: dhruba, haobo, sdong, kailiu, emayanke CC: leveldb Differential Revision:"
,,0.3796,rocksdb,"Merge branch master into columnfamilies Conflicts: HISTORY.md db/db_impl.cc db/db_impl.h db/db_iter.cc db/db_test.cc db/dbformat.h db/memtable.cc db/memtable_list.cc db/memtable_list.h db/table_cache.cc db/table_cache.h db/version_edit.h db/version_set.cc db/version_set.h db/write_batch.cc db/write_batch_test.cc include/rocksdb/options.h util/options.cc/Moving Some includes from options.h to forward declaration Summary: By removing some includes form options.h and reply on forward declaration, we can more easily reason the dependencies. Test Plan: make all check Reviewers: kailiu, haobo, igor, dhruba Reviewed By: kailiu CC: leveldb Differential Revision: read/modify/write functionality to Put() api Summary: The application can set a callback function, which is applied on the previous value. And calculates the new value. This new value can be set, either inplace, if the previous value existed in memtable, and new value is smaller than previous value. Otherwise the new value is added normally. Test Plan: fbmake. Added unit tests. All unit tests pass. Reviewers: dhruba, haobo Reviewed By: haobo CC: sdong, kailiu, xinyaohu, sumeet, leveldb Differential Revision: the aligned and unaligned memory allocation Summary: Use two vectors for different types of memory allocation. Test Plan: run all unit tests. Reviewers: haobo, sdong Reviewed By: haobo CC: leveldb Differential Revision: [Column Family] Interface proposal Summary: diff is for Column Family branch> Sharing some of the work Ive done so far. This diff compiles and passes the tests. The biggest change is in options.h I broke down Options into two parts DBOptions and ColumnFamilyOptions. DBOptions is DB-specific (env, create_if_missing, block_cache, etc.) and ColumnFamilyOptions is column family-specific (all compaction options, compresion options, etc.). Note that this does not break backwards compatibility at all. Further, I created DBWithColumnFamily which inherits DB interface and adds new functions with column family support. Clients can transparently switch to DBWithColumnFamily and it will not break their backwards compatibility. There are few methods worth checking out: ListColumnFamilies(), MultiNewIterator(), MultiGet() and GetSnapshot(). [GetSnapshot() returns the snapshot across all column families for now I think thats what we agreed on] Finally, I made small changes to WriteBatch so we are able to atomically insert data across column families. Please provide feedback. Test Plan: make check works, the code is backward compatible Reviewers: dhruba, haobo, sdong, kailiu, emayanke CC: leveldb Differential Revision: the ""table stats"" Summary: The primary motivation of the changes is to make it easier to figure out the inside of the tables. * rename ""table stats"" to ""table properties"" since now we have more than ""integers"" to store in the property block. * Add filter block size to the basic table properties. * Whenever a table is built, well log the table properties (the sample output is in Test Plan). * Make an api to expose deleted keys. Test Plan: Passed all existing test. and the sample output of table stats: Basic Properties data blocks: 1 entries: 1 raw key size: 9 raw average key size: 9 raw value size: 9 raw average value size: 0 data block size: 25 index block size: 27 filter block size: 18 (estimated) table size: 70 filter policy: rocksdb.BuiltinBloomFilter User collected properties: InternalKeyPropertiesCollector kDeletedKeys: 1 Reviewers: dhruba, haobo Reviewed By: dhruba CC: leveldb Differential Revision:"
,,0.2031,rocksdb,"First phase API clean up Summary: Addressed all the issues in Now most table-related modules are hidden from user land. Test Plan: make check Reviewers: sdong, haobo, dhruba CC: leveldb Differential Revision: the ""table stats"" Summary: The primary motivation of the changes is to make it easier to figure out the inside of the tables. * rename ""table stats"" to ""table properties"" since now we have more than ""integers"" to store in the property block. * Add filter block size to the basic table properties. * Whenever a table is built, well log the table properties (the sample output is in Test Plan). * Make an api to expose deleted keys. Test Plan: Passed all existing test. and the sample output of table stats: Basic Properties data blocks: 1 entries: 1 raw key size: 9 raw average key size: 9 raw value size: 9 raw average value size: 0 data block size: 25 index block size: 27 filter block size: 18 (estimated) table size: 70 filter policy: rocksdb.BuiltinBloomFilter User collected properties: InternalKeyPropertiesCollector kDeletedKeys: 1 Reviewers: dhruba, haobo Reviewed By: dhruba CC: leveldb Differential Revision:"
,,0.4275,rocksdb,"Merge branch master into columnfamilies Conflicts: db/db_impl.cc db/db_impl.h db/db_impl_readonly.h db/db_test.cc include/rocksdb/db.h include/utilities/stackable_db.h/[RocksDB] [Column Family] Interface proposal Summary: diff is for Column Family branch> Sharing some of the work Ive done so far. This diff compiles and passes the tests. The biggest change is in options.h I broke down Options into two parts DBOptions and ColumnFamilyOptions. DBOptions is DB-specific (env, create_if_missing, block_cache, etc.) and ColumnFamilyOptions is column family-specific (all compaction options, compresion options, etc.). Note that this does not break backwards compatibility at all. Further, I created DBWithColumnFamily which inherits DB interface and adds new functions with column family support. Clients can transparently switch to DBWithColumnFamily and it will not break their backwards compatibility. There are few methods worth checking out: ListColumnFamilies(), MultiNewIterator(), MultiGet() and GetSnapshot(). [GetSnapshot() returns the snapshot across all column families for now I think thats what we agreed on] Finally, I made small changes to WriteBatch so we are able to atomically insert data across column families. Please provide feedback. Test Plan: make check works, the code is backward compatible Reviewers: dhruba, haobo, sdong, kailiu, emayanke CC: leveldb Differential Revision: Summary: We need access to options for BackupableDB Test Plan: make check Reviewers: dhruba Reviewed By: dhruba CC: leveldb, reconnect.grayhat Differential Revision: Interface changes required for BackupableDB Summary: This is part of smaller diff that is easier to review Test Plan: make asan_check Reviewers: dhruba, haobo, emayanke Reviewed By: emayanke CC: leveldb, kailiu, reconnect.grayhat Differential Revision:"
