Topic_no,Keywords,Contrib,System,Text
,,0.4221,realm-java,"allow to put Realm database file on external storage. (#3591) * set the path of the directory of named pipes to fix * update CHANGELOG * add a test for issue3140 * update test * follow the chenges in object-store * skip an external storage test on the device where SELinux is not enforced * rename test * rename variable * update object-store * make SharedRealm#temporaryDirectory volatile * address findbugs error/Fixed bug in path when getting access tokens for Realms (#157)/Add cause to RealmMigrationNeededException (#3482)/Introduce global init (#3457) Realm now uses a global init function instead of Context on the RealmConfiguration.Builder/fix merge mistakes/Merge branch master into master-sync Conflicts: realm/realm-annotations-processor/src/main/java/io/realm/processor/ClassMetaData.java realm/realm-annotations-processor/src/main/java/io/realm/processor/RealmProxyClassGenerator.java realm/realm-annotations-processor/src/test/resources/io/realm/AllTypesRealmProxy.java realm/realm-annotations-processor/src/test/resources/io/realm/BooleansRealmProxy.java realm/realm-annotations-processor/src/test/resources/io/realm/NullTypesRealmProxy.java realm/realm-annotations-processor/src/test/resources/io/realm/RealmDefaultModuleMediator.java realm/realm-annotations-processor/src/test/resources/io/realm/SimpleRealmProxy.java realm/realm-library/src/main/cpp/object-store realm/realm-library/src/main/java/io/realm/Realm.java realm/realm-library/src/main/java/io/realm/RealmSchema.java realm/realm-library/src/main/java/io/realm/internal/SharedRealm.java/Supporting both additive and manual schema modes (#91) * Adding very thin wrappers for Object Stores ObjectSchema and Property. * Adding method for building object schema is proxy classes * Adding rudimentary support for Object Store schemas. Using ObjectStore::update_schema() to update schema for the additive mode. * Disallowing destructive schema changes in additive mode./Upgrade to beta-33 / 2.0.0-rc4 (#90)/Invalidate schema cache when the schema version of Realm is changed by other process (#3409). invalidate schema cache when the schema version of Realm is changed by other process. Now schema cache referred by Realm instance is not shared and global schema cache is introduced instead./Public Sync API (#73)/Integrate Object Store [PART2] SharedRealm (#3031) This simplified our code base a lot. Basically all APIs we need from SharedGroup/Group are wrapped in the SharedRealm. So we can just remove those classes. But we do need a few APIs from SharedGroup which is not supplied by SharedRealm because of async queries. Currently we expose those in a friend class of ShareRealm, see realm/realm-object-store#141 We are still managing Realm caches in Java although there are mechanism in OS to do the same thing. The major reason is we have method like deleteRealm needs information from cache to check if all Realm instances are closed. The ShareRealm is actually a std::shared_ptr. We hold the pointer to the std::shared_ptr in Java. Another fundamental change is that we used to have separated SharedGroups for DynamicRealm and typed Realm in the same thread. But now they are using different SharedRealm but actually the different SharedRealms are point to the same SharedGroup. And some other code cleanup./Wait all async tasks done before next test (#3319) This is highly related with Below things are still guaranteed by this change after commit async transaction: * When callback function called (onSuccess/onError), the background Realm is closed. * When any change listeners called, the background Realm is closed. What is true now but it is not guaranteed in the future: * Background Realm might not be closed before REALM_CHANGED sent (not received). Due to this, to avoid the flaky tests, we have to ensure all async tasks quit peacefully before start the next test. This is implemented by wait and check in the TestRealmConfigurationFactory. NOTE: Any test, if the async tasks cannot be finished peacefully in a certain time, it has to be considered as a problem and fixed. This would be needed by OS notifications since Java wont have a precise control of sending REALM_CHANGED anymore./"
,,0.0935,realm-java,"Nh/fix 3966 (#3979) Realm migration is triggered, when the primary key definition is altered (#3966)/Fixed a bug that caused unexpected MigrationNeededException in very rare case. (#3768) In sync mode, `validateTable()` must get all fields in the tabla./"
,,0.1028,realm-java,"Nh/fix 3966 (#3979) Realm migration is triggered, when the primary key definition is altered (#3966)/Fixed a bug that caused unexpected MigrationNeededException in very rare case. (#3768) In sync mode, `validateTable()` must get all fields in the tabla./"
,,0.0824,realm-java,"Nh/fix 3966 (#3979) Realm migration is triggered, when the primary key definition is altered (#3966)/Fixed a bug that caused unexpected MigrationNeededException in very rare case. (#3768) In sync mode, `validateTable()` must get all fields in the tabla./"
,,0.0639,realm-java,Implement global logout (#3642)/
,,0.2465,realm-java,"Expose schemaVersion in SyncConfig (#4058)/Disallow listeners for Results & Object on non-looper/Disallow Realm listeners on non-looper thread It is possible to have listeners for non-looper thread, and trigger them through SharedRealm.refresh(). But there are many corner cases need to be covered if we enable it. Disallow it for now to stick with current behaviour./Single daemon thread for notification (#3666) With changes in , there is only one thread will be create for listening changes for all different Realms. But an additional SharedGroup will be created in the daemon thread for determine which SharedGroup has changed since last time. That requires some changes in the java side especially the daemon thread should not be created when Realm.compactRealm called./Create capabilities for every Realm instance/Fix get DynamicRealmObject from RealmResults./Clear the memory ownership for RowNotifier/Deliver global notification through OS did_change Remove AndroidNotifier which will have a common implementation among all platforms./Back the RealmResults by collection/Experiment of Results.get()/"
,,0.24600000000000002,realm-java,"Fix lots of minor issues/Get findAllAsync and findFirstAsync back the findAllAsync got deprecated since from OS Results point of view, the query updating will run in the background by default, then there would be no difference between findAll and findAsync. Apparently the isLoad() and load() should be deprecated as well. So like cocoa, the Query will be executed immediately if user tries to access the element in the Results. But ... That was wrong because of those use cases: 1) RxJava support, in the subscription, it needs to check isLoaded() to determine the next step. And it will be fired once after the Observable created. By always returning true from isLoaded(), that means for RxJava will always run sync query at the first time. 2) Create a RealmResults and pass it to a list adapter. Since UI will always call size() which will run the query immediately and the first time query becomes synced. So, we get all async related APIs back and keep them having the same functionality like before. The behavior wont be exact the same, but from users perspective, they are the same as before./Detect if collection itarator becomes unstable Instead of checking the version of TableView which requires exposing the TableView version from OS, we simply check if the iterator is used across detach/reattach. If reattach happens, the TableView will be synced, the iterators are not stable anymore./Disallow listeners for Results & Object on non-looper/Use ObserverPair to manage collection listeners/OS Resultss first and last/Move TableOrView.NO_MATCH to Table/Lint warnings/Distinct support/Results.contains()/Results.sort()/Wrap NotificationToken/Back the RealmResults by collection/WiP start using Object Stores Results class/"
,,0.1002,realm-java,Modify Java docs and comments. (#4124) * Remove unnecessary an addtional space. * Modify Java docs and comments. * PR feedback. * PR feedback./Remove final modifier from all major classes. (#3911)/
,,0.1472,realm-java,"Wire the ""like"" predicate into RealmQuery (#3992) * Wire the ""like"" predicate into RealmQuery Fixes"
,,0.2201,realm-java,"Free the SharedRealm in phantom daemon (#4096) Treat the SharedRealm the same as other native objects. SharedRealm.close will only call Object Store Realm::close without deleting the ShareRealm pointer. Then we dont need the finalizer anymore. Fix . This is related with as well. It is possible that java close the Realm in any of the Object Stores callbacks. To avoid Object Store operating on a invalid SharedRealm pointer, binding should try to make sure after callbacks. However, it cannot be totally avoided since user could set the Realm instance to null and the instance can be GCed at any time. It is still something should be considered in the Object Store implementation./Expose schemaVersion in SyncConfig (#4058)/Init some member vars in SharedRealm constructor move initialization of RealmNotifier and Capabilities to SharedRealm constructor to make it less confusing./Use term detach/reattach for Collection snapshot Also add some comments/canceltransaction posts to reattach collections To maintain the consistency behaviour: once a collection becomes detached because of beginTransaction, it can only be reattached in the next event loop./Merge remote-tracking branch origin/master into kneth/object-store/results/Fix concurrency problem with collection list/Workaround for the Alooper and postAtFrontQueue See with snapshot to support stable iterator But something is going wrong, more like a bug in core than Object Store./Remove handler related code The event handler logic stays in OS only, see util/android/event_loop_signal.hpp All the async related logic should be platform independent in java./"
,,0.0987,realm-java,Modify Java docs and comments. (#4124) * Remove unnecessary an addtional space. * Modify Java docs and comments. * PR feedback. * PR feedback./Remove final modifier from all major classes. (#3911)/Move TableOrView.NO_MATCH to Table/
,,0.1274,realm-java,Merge remote-tracking branch origin/master into kneth/object-store/results/Expose schemaVersion in SyncConfig (#4058)/Deliver the callbacks for async transaction/Remove final modifier from all major classes. (#3911)/Remove commitTransaction(boolean)/Nh/fixes 3732 insertOrUpdate using other Realm (#3755)/
,,0.09699999999999999,realm-java,Add the underlying information on RealmFileException. (#3940) Add the underlying information on RealmFileException to help investigating Incompatible lock file issue./Nh/objectstore userstore (#3838) * Add a UserStore based on ObjectStore implementation/WiP start using Object Stores Results class/
,,0.0683,realm-java,More docs for RealmNotifier Also added one more test case for it./Only trigger realm notifier when version changed/Clear the memory ownership for RowNotifier/
,,0.1082,realm-java,Nh/objectstore userstore (#3838) * Add a UserStore based on ObjectStore implementation/WiP start using Object Stores Results class/
,,0.1036,realm-java,"Update core to 2.3.0 (#3970) Also update object-store to 99570ba6e0 . * Adapt changes from sync Client::set_error_handler is removed. Session error handler signature changed. * Session error handler called after destruction According to the doc of Session::set_error_handler, the error handler could be called after the session object is destroyed. That is a problem since the java session object can be destroyed at that time. Use a weak_ptr of JavaGlobalRef in the lambda to solve the problem. * Ignore unknown category error from sync/"
,,0.5048,realm-java,"Feature/backlinks (#4406) * Refactor RealmObjectSchema Clean up Proxy generation Comments addressed * Fix Test, Checkstyle and Findbugs errors * Respond to comments/Backlinks (#4219) * Document multiple links to the same object * Fix non-object field reference bug * Load all tables before validating any * Update to gradle 3.4.1 * Fix Documentation * Fix Asynchronous UTs * Ignore, instead of throwing on, attempts to load Backlink fields w/JSON * Fix documentation and add notification unit tests * Require that backlink fields be final. * Address PR comments * Add tests for notification and distinct * Add interface methods and most of table validation * Check fields on JSON load * Fix fails in RealmTests * Respond to comments * Compile time type checking Refactor annotation handler * Improved error messages * Add Unit tests * Renamed Backlink to LinkingObjects. Added annotation processor tests. * Added annotation processor unit tests. * Add Backlink annotation/improve performance of getters and setters in proxy classes (#4206) * improve performance of getters and setters in proxy classes This change is a part of fixes of * removed unused argment * Update CHANGELOG.md/"
,,0.5016,realm-java,"Feature/backlinks (#4406) * Refactor RealmObjectSchema Clean up Proxy generation Comments addressed * Fix Test, Checkstyle and Findbugs errors * Respond to comments/Backlinks (#4219) * Document multiple links to the same object * Fix non-object field reference bug * Load all tables before validating any * Update to gradle 3.4.1 * Fix Documentation * Fix Asynchronous UTs * Ignore, instead of throwing on, attempts to load Backlink fields w/JSON * Fix documentation and add notification unit tests * Require that backlink fields be final. * Address PR comments * Add tests for notification and distinct * Add interface methods and most of table validation * Check fields on JSON load * Fix fails in RealmTests * Respond to comments * Compile time type checking Refactor annotation handler * Improved error messages * Add Unit tests * Renamed Backlink to LinkingObjects. Added annotation processor tests. * Added annotation processor unit tests. * Add Backlink annotation/improve performance of getters and setters in proxy classes (#4206) * improve performance of getters and setters in proxy classes This change is a part of fixes of * removed unused argment * Update CHANGELOG.md/"
,,0.4947,realm-java,"Introduce DynamicRealmObject#linkingObjects(String srcClassName, String srcFieldName) (#4492)/Feature/backlinks (#4406) * Refactor RealmObjectSchema Clean up Proxy generation Comments addressed * Fix Test, Checkstyle and Findbugs errors * Respond to comments/Backlinks (#4219) * Document multiple links to the same object * Fix non-object field reference bug * Load all tables before validating any * Update to gradle 3.4.1 * Fix Documentation * Fix Asynchronous UTs * Ignore, instead of throwing on, attempts to load Backlink fields w/JSON * Fix documentation and add notification unit tests * Require that backlink fields be final. * Address PR comments * Add tests for notification and distinct * Add interface methods and most of table validation * Check fields on JSON load * Fix fails in RealmTests * Respond to comments * Compile time type checking Refactor annotation handler * Improved error messages * Add Unit tests * Renamed Backlink to LinkingObjects. Added annotation processor tests. * Added annotation processor unit tests. * Add Backlink annotation/improve performance of getters and setters in proxy classes (#4206) * improve performance of getters and setters in proxy classes This change is a part of fixes of * removed unused argment * Update CHANGELOG.md/"
,,0.4257,realm-java,"Backlinks (#4219) * Document multiple links to the same object * Fix non-object field reference bug * Load all tables before validating any * Update to gradle 3.4.1 * Fix Documentation * Fix Asynchronous UTs * Ignore, instead of throwing on, attempts to load Backlink fields w/JSON * Fix documentation and add notification unit tests * Require that backlink fields be final. * Address PR comments * Add tests for notification and distinct * Add interface methods and most of table validation * Check fields on JSON load * Fix fails in RealmTests * Respond to comments * Compile time type checking Refactor annotation handler * Improved error messages * Add Unit tests * Renamed Backlink to LinkingObjects. Added annotation processor tests. * Added annotation processor unit tests. * Add Backlink annotation/"
,,0.4154,realm-java,"Backlinks (#4219) * Document multiple links to the same object * Fix non-object field reference bug * Load all tables before validating any * Update to gradle 3.4.1 * Fix Documentation * Fix Asynchronous UTs * Ignore, instead of throwing on, attempts to load Backlink fields w/JSON * Fix documentation and add notification unit tests * Require that backlink fields be final. * Address PR comments * Add tests for notification and distinct * Add interface methods and most of table validation * Check fields on JSON load * Fix fails in RealmTests * Respond to comments * Compile time type checking Refactor annotation handler * Improved error messages * Add Unit tests * Renamed Backlink to LinkingObjects. Added annotation processor tests. * Added annotation processor unit tests. * Add Backlink annotation/"
,,0.4154,realm-java,"Backlinks (#4219) * Document multiple links to the same object * Fix non-object field reference bug * Load all tables before validating any * Update to gradle 3.4.1 * Fix Documentation * Fix Asynchronous UTs * Ignore, instead of throwing on, attempts to load Backlink fields w/JSON * Fix documentation and add notification unit tests * Require that backlink fields be final. * Address PR comments * Add tests for notification and distinct * Add interface methods and most of table validation * Check fields on JSON load * Fix fails in RealmTests * Respond to comments * Compile time type checking Refactor annotation handler * Improved error messages * Add Unit tests * Renamed Backlink to LinkingObjects. Added annotation processor tests. * Added annotation processor unit tests. * Add Backlink annotation/"
,,0.27399999999999997,realm-java,Fine grained locks for RealmCache (#4551) Separated lock for different RealmConfiguration instead of one lock on the RealmCache class. So Opening Realm instances from different configurations wont block each other. DynamicRealm which is created during opening type Realm will not be associated to any RealmCache to avoid recursive locks and multiple times initial block. (Also make the code easier.) This is for and part of implementation of ./fix API incompatibility introduced in 3.1.0 (#4455)/Refactor Schemas into separate native and realm-based implementations (#4382) * Refactor Schemas into separate native and realm-based implementations * Fix all tests * Respond to PR comments * Temporary (git add .) kludge to fix visiblity problem/
,,0.4356,realm-java,"Introduce DynamicRealmObject#linkingObjects(String srcClassName, String srcFieldName) (#4492)/Backlinks (#4219) * Document multiple links to the same object * Fix non-object field reference bug * Load all tables before validating any * Update to gradle 3.4.1 * Fix Documentation * Fix Asynchronous UTs * Ignore, instead of throwing on, attempts to load Backlink fields w/JSON * Fix documentation and add notification unit tests * Require that backlink fields be final. * Address PR comments * Add tests for notification and distinct * Add interface methods and most of table validation * Check fields on JSON load * Fix fails in RealmTests * Respond to comments * Compile time type checking Refactor annotation handler * Improved error messages * Add Unit tests * Renamed Backlink to LinkingObjects. Added annotation processor tests. * Added annotation processor unit tests. * Add Backlink annotation/Deprecate distinctXxx methods of RealmResults (#4210)/Enable listeners on RealmList (#4216) The RealmList holds a Collection which is used for listeners. Other RealmList APIs are still calling from LinkView./Add OrderedRealmCollectionSnapshot (#4172) Introduce OrderedRealmCollectionSnapshot as another type of OrderedRealmCollection. A snapshot can be created from RealmResults or RealmList. A snapshot is backed by a snapshot of OS Results. So the snapshot itself wont be updated. The size and order stay the same forever (elements inside are still live objects.). Since the RealmResults is auto-updated all the time, snapshot will be usefull when changing the results in a simple loops. This commit also moves the common code from RealmResults to OrderedRealmCollectionImpl since those can be shared with snapshot implementation. Implement"
,,0.5246,realm-java,"Hide StandardRealmSchema class from public API. (#4444) fixes * add package private methods to RealmSchema instead of BaseRealm.getSchemaInternal()./refactor internal method name in RealmSchema (#4429)/Feature/backlinks (#4406) * Refactor RealmObjectSchema Clean up Proxy generation Comments addressed * Fix Test, Checkstyle and Findbugs errors * Respond to comments/Refactor Schemas into separate native and realm-based implementations (#4382) * Refactor Schemas into separate native and realm-based implementations * Fix all tests * Respond to PR comments * Temporary (git add .) kludge to fix visiblity problem/Backlinks (#4219) * Document multiple links to the same object * Fix non-object field reference bug * Load all tables before validating any * Update to gradle 3.4.1 * Fix Documentation * Fix Asynchronous UTs * Ignore, instead of throwing on, attempts to load Backlink fields w/JSON * Fix documentation and add notification unit tests * Require that backlink fields be final. * Address PR comments * Add tests for notification and distinct * Add interface methods and most of table validation * Check fields on JSON load * Fix fails in RealmTests * Respond to comments * Compile time type checking Refactor annotation handler * Improved error messages * Add Unit tests * Renamed Backlink to LinkingObjects. Added annotation processor tests. * Added annotation processor unit tests. * Add Backlink annotation/Fix error message to show correct character limit and minor grammar fix/"
,,0.1685,realm-java,"Feature/backlinks (#4406) * Refactor RealmObjectSchema Clean up Proxy generation Comments addressed * Fix Test, Checkstyle and Findbugs errors * Respond to comments/"
,,0.3851,realm-java,"Clean up SharedRealm source Remove unused methods. Fix double negatives. Use auto& to avoid creating temp objects./Rename Context to NativeContext (#4597)/Dont reset SharedRealm ptr (#4478) Keep the SharedRealm ptr valid when close it. To allow the is_closed checking could throw in the Object Store and it can be converted to a friendly Java exception. Check if SharedRealm is closed when create collection iterator. Throw an ISE if it is. Fix ./Refactor Schemas into separate native and realm-based implementations (#4382) * Refactor Schemas into separate native and realm-based implementations * Fix all tests * Respond to PR comments * Temporary (git add .) kludge to fix visiblity problem/Add detailed notification for RealmObject (#4331) See Add ObjectChangeSet & RealmObjectChangeListener. Add OsObject to wrap ObjectStores Object for notifications. No more false positive notifications for RealmObject. Use ObserverPairList in ProxyState instead of normal list to solve the potential listener removal problems which is handled well by the ObserverPairList. Fix tests./Using ObjectStore SyncManager & Session (#4214) Using ObjectStores SyncManager & Session/RealmResults is always live-to-updated This is the precondition of fine grained notifications. OS will trigger the collection notification immediately when transaction begins on the local thread to compute the change set if there is any. This conflicts with Javas original RealmResults behavior the original RealmResults would only be synced in the next event loop. Also, there are some edge cases dont work well with the original RealmResults behavior, see details in So: RealmResults becomes always up-to-date again which means it will never contains a invalid row. Behavior of iteration on a RealmResults still just works, it will just iterate on snapshot of collection. This means user can still delete elements from a RealmResults inside iteration. Deletion & Modification on RealmResults in simple-for-loop wont work as expected if the changes will impact the order/elements of the results. This could be solved by the future new Collection type RealmCollectionSnapshot. Add Collection.load() and Collection.isLoaded() to support java sync queries. Test fix. wont be an issue anymore since the RealmResults is always up to date and it wont contain any invalid rows. So remove the related tests. Failure tests caused by listener being triggred with beginTransaction() Remove realmResultsListenerAddedAfterCommit. when add listener to the OS Results after commit transaction, the OS CollectionNotifier will be created at the SharedGroup version of transaction committed. So the listener wont be called anymore since the all changes already exist in current SharedGroup./Dont remove callback in AndroidRealmNotifier We still have to ensure the async transaction callbacks delivered./"
,,0.0917,realm-java,Rename Context to NativeContext (#4597)/Use target table to create snapshot from LinkView (#4556) Fix . Remove useless confusing `LinkView.getTable()`./
