Topic_no,Keywords,Contrib,System,Text
,,0.1454,conscrypt,"Convert EVP_PKEY to new style To avoid conflicts in the language spec and how Conscrypt does native calls, we need to wrap all native references in a Java object reference. Calling NativeCryptos static native methods with a raw pointer doesnt guarantee that the calling object wont be finalized during the method running. This pass fixes EVP_PKEY references, but more passes are needed. Bug: 16656908 Change-Id: I5925da40cb37cd328b3a126404944f771732a43e/"
,,0.2522,conscrypt,"Call EVP_CIPHER_CTX_free instead of EVP_CIPHER_CTX_cleanup. The latter doesnt OpenSSL_free memory allocated by EVP_CIPHER_CTX_new. Its worth noting that EVP_CIPHER_CTX_free doesnt check the return value of EVP_CIPHER_CTX_cleanup so we cant throw if cleanup failed, but we were only ever calling this method from a finalizer anyway. (cherry picked from commit c64652932d8e17ccf7e54c0c76c1b38a86841732) bug: 18617384 Change-Id: Ida65e14ffbed41f56a59e2f5fe77289cac0f5947/Convert EC_GROUP and EC_POINT to new style Bug: 16656908 Change-Id: Ie912f376f69327ce634cac50763bf86b418049f5/Switch EVP_CIPHER_CTX to new style Bug: 16656908 Change-Id: Id519c20474a02c70e72d362bc84d26855a74fa33/Convert EVP_PKEY to new style To avoid conflicts in the language spec and how Conscrypt does native calls, we need to wrap all native references in a Java object reference. Calling NativeCryptos static native methods with a raw pointer doesnt guarantee that the calling object wont be finalized during the method running. This pass fixes EVP_PKEY references, but more passes are needed. Bug: 16656908 Change-Id: I5925da40cb37cd328b3a126404944f771732a43e/Convert EVP_MD_CTX to new style To avoid conflicts in the language spec and how Conscrypt does native calls, we need to wrap all native references in a Java object reference. Calling NativeCryptos static native methods with a raw pointer doesnt guarantee that the calling object wont be finalized during the method running. Bug: 16656908 Change-Id: I165e041a8fe056770d6ce6d6cd064c411575b7c4/Clean up unused variables Change-Id: I9234e649a910408cff9f9d33008642e0c8334276/Track upgrade to OpenSSL 1.0.1j Bug: 18018599 Change-Id: I2b8c62190a9dd5e5fdc6894334cf1d3edfce0a06/Remove SSLv3 from default protocols list for TLS SSLv3 has some systemic problems demonstrated by the POODLE attack. Disable it by default when ""TLS"" is requested since the documentation in Java Standard Names allows us to not support SSL when TLS is requested. Bug: 17136008 Change-Id: Icad1639c7e33b6e495f452a5289b0d20b819d679/"
,,0.0588,conscrypt,Switch EVP_CIPHER_CTX to new style Bug: 16656908 Change-Id: Id519c20474a02c70e72d362bc84d26855a74fa33/
,,0.1509,conscrypt,"Convert EVP_PKEY to new style To avoid conflicts in the language spec and how Conscrypt does native calls, we need to wrap all native references in a Java object reference. Calling NativeCryptos static native methods with a raw pointer doesnt guarantee that the calling object wont be finalized during the method running. This pass fixes EVP_PKEY references, but more passes are needed. Bug: 16656908 Change-Id: I5925da40cb37cd328b3a126404944f771732a43e/"
,,0.14800000000000002,conscrypt,"OpenSSLEngineImpl: return bytes consumed for unwrap During a handshake, unwrap should return the number of bytes consumed by the SSL implementation in addition to changing the source buffer position so that the client can alter its state based on either. Bug: 18921387 Bug: Change-Id: Idf5a3b24c8ad053ef2970bfb66d142a7c2685c02/Return BUFFER_UNDERFLOW if no source bytes were consumed. ... either during the handshake or after. With this change, were backward compatible with older versions of android. Note that newer versions of apache-http rely on this behaviour. bug: 18554122 (cherry picked from commit 6a1b7a85dcdeb19305ad5153579bd11c1eb0bfad) Change-Id: I741d2585548b3d72abae2b696eee2a186e58414c/Return BUFFER_UNDERFLOW if no source bytes were consumed. ... either during the handshake or after. With this change, were backward compatible with older versions of android. Note that newer versions of apache-http rely on this behaviour. bug: 18554122 Change-Id: I574c263e8df4a5f2396ac860608fe85cdbcdbb49/Fix SSLEngine to support session resumption. (cherry picked from commit cd50afad1567b1311e6e979e94a7167b7bf69c94) Bug: 17877118 Change-Id: I388b59cde58fdc506ecac9f536e4bbd9161df6ad/"
