Topic_no,Keywords,Contrib,System,Text
,,0.2002,rocksdb,"Make table properties shareable Summary: We are going to expose properties of all tables to end users through ""some"" db interface. However, current design doesnt naturally fit for this need, which is because: 1. If a table presents in table cache, we cannot simply return the reference to its table properties, because the table may be destroy after compaction (and we dont want to hold the ref of the version). 2. Copy table properties is OK, but its slow. Thus in this diff, I change the table readers interface to return a shared pointer (for const table properties), instead a const refernce. Test Plan: `make check` passed Reviewers: haobo, sdong, dhruba Reviewed By: haobo CC: leveldb Differential Revision: Branch] PlainTable to encode rows with seqID 0, value type using 1 internal byte. Summary: In PlainTable, use one single byte to represent 8 bytes of internal bytes, if seqID 0 and it is value type (which should be common for bottom most files). It is to save 7 bytes for uncompressed cases. Test Plan: make all check Reviewers: haobo, dhruba, kailiu Reviewed By: haobo CC: igor, leveldb Differential Revision: disable caching index/filter blocks Summary: Mixing index/filter blocks with data blocks resulted in some known issues. To make sure in next release our users wont be affected, we added a new option in BlockBasedTableFactory::TableOption to conceal this functionality for now. This patch also introduced a BlockBasedTableReader::OpenOptions, which avoids the ""infinite"" growth of parameters in BlockBasedTableReader::Open(). Test Plan: make check Reviewers: haobo, sdong, igor, dhruba Reviewed By: igor CC: leveldb, tnovak Differential Revision: the property block for the plain table Summary: This is the last diff that adds the property block to plain table. The format resembles that of the block-based table: [data block] [meta block 1: stats block] [meta block 2: future extended block] ... [meta block K: future extended block] (we may add more meta blocks in the future) [metaindex block] [index block: we only have the placeholder here, we can add persistent index block in the future] [Footer: contains magic number, handle to metaindex block and index block] Test Plan: extended existing property block test. Reviewers: haobo, sdong, dhruba CC: leveldb Differential Revision: rid of some shared_ptrs Summary: I went through all remaining shared_ptrs and removed the ones that I found not-necessary. Only GenerateCachePrefix() is called fairly often, so dont expect much perf wins. The ones that are left are accessed infrequently and I think were fine with keeping them. Test Plan: make asan_check Reviewers: dhruba, haobo Reviewed By: dhruba CC: leveldb Differential Revision: Use raw pointer instead of shared pointer when passing Statistics object internally Summary: liveness of the statistics object is already ensured by the shared pointer in DB options. Theres no reason to pass again shared pointer among internal functions. Raw pointer is sufficient and efficient. Test Plan: make check Reviewers: dhruba, MarkCallaghan, igor Reviewed By: dhruba CC: leveldb, reconnect.grayhat Differential Revision: the ""table stats"" Summary: The primary motivation of the changes is to make it easier to figure out the inside of the tables. * rename ""table stats"" to ""table properties"" since now we have more than ""integers"" to store in the property block. * Add filter block size to the basic table properties. * Whenever a table is built, well log the table properties (the sample output is in Test Plan). * Make an api to expose deleted keys. Test Plan: Passed all existing test. and the sample output of table stats: Basic Properties data blocks: 1 entries: 1 raw key size: 9 raw average key size: 9 raw value size: 9 raw average value size: 0 data block size: 25 index block size: 27 filter block size: 18 (estimated) table size: 70 filter policy: rocksdb.BuiltinBloomFilter User collected properties: InternalKeyPropertiesCollector kDeletedKeys: 1 Reviewers: dhruba, haobo Reviewed By: dhruba CC: leveldb Differential Revision: bloom filters Summary: broke bloom filters. If filter is not in cache, we want to return true (safe thing). Am I right? Test Plan: when benchmarking I got different results when using bloom filters vs. when not using them. This fixed the issue. I will also be putting this change to the other diff, but that one will probably be in review for longer time. Reviewers: kailiu, dhruba, haobo Reviewed By: kailiu CC: leveldb Differential Revision:"
,,0.2329,rocksdb,"Fix UnmarkEOF for partial blocks Summary: Blocks in the transaction log are a fixed size, but the last block in the transaction log file is usually a partial block. When a new record is added after the reader hit the end of the file, a new physical record will be appended to the last block. ReadPhysicalRecord can only read full blocks and assumes that the file position indicator is aligned to the start of a block. If the reader is forced to read further by simply clearing the EOF flag, ReadPhysicalRecord will read a full block starting from somewhere in the middle of a real block, causing it to lose alignment and to have a partial physical record at the end of the read buffer. This will result in length mismatches and checksum failures. When the log file is tailed for replication this will cause the log iterator to become invalid, necessitating the creation of a new iterator which will have to read the log file from scratch. This diff fixes this issue by reading the remaining portion of the last block we read from. This is done when the reader is forced to read further (UnmarkEOF is called). Test Plan: Added unit tests Stress test (with replication). Check dbdir/LOG file for corruptions. Test on test tier Reviewers: emayanke, haobo, dhruba Reviewed By: haobo CC: vamsi, sheki, dhruba, kailiu, igor Differential Revision:"
,,0.0897,rocksdb,"Revert ""Revert ""Allow allocating dynamic bloom, plain table indexes and hash linked list from huge page TLB"""" And make the default 0 for hash linked list memtable This reverts commit d69dc64be78a8da3ce661454655966d11ff61bb6./"
,,0.0861,rocksdb,[C-API] added the possiblity to create a HashSkipList or HashLinkedList to support prefix seeks/added a test case for custom merge operator/
,,0.3237,rocksdb,"Remember whole key/prefix filtering on/off in SST file Summary: Remember whole key or prefix filtering on/off in SST files. If user opens the DB with a different setting that cannot be satisfied while reading the SST file, ignore the bloom filter. Test Plan: Add a unit test for it Reviewers: yhchiang, igor, rven Reviewed By: rven Subscribers: leveldb, dhruba Differential Revision: to use prefix bloom filter when filter is not block based Summary: Get() now doesnt make use of bloom filter if it is prefix based. Add the check. Didnt touch block based bloom filter. I cant fully reason whether it is correct to do that. But its straight-forward to for full bloom filter. Test Plan: make all check Add a test case in DBTest Reviewers: rven, yhchiang, igor Reviewed By: igor Subscribers: MarkCallaghan, leveldb, dhruba, yoshinorim Differential Revision: BlockBasedTable version better compressed block format Summary: This diff adds BlockBasedTable format_version 2. New format version brings better compressed block format for these compressions: 1) Zlib encode decompressed size in compressed block header 2) BZip2 encode decompressed size in compressed block header 3) LZ4 and LZ4HC instead of doing memcpy of size_t encode size as varint32. memcpy is very bad because the DB is not portable accross big/little endian machines or even platforms where size_t might be 8 or 4 bytes. It does not affect format for snappy. If you write a new database with format_version 2, it will not be readable by RocksDB versions before 3.10. DB::Open() will return corruption in that case. Test Plan: Added a new test in db_test. I will also run db_bench and verify VSIZE when block_cache 1GB Reviewers: yhchiang, rven, MarkCallaghan, dhruba, sdong Reviewed By: sdong Subscribers: dhruba, leveldb Differential Revision: footer versions bigger than 1 Summary: In this diff I add another parameter to BlockBasedTableOptions that will let users specify block based tables format. This will greatly simplify block based tables format changes in the future. First format change that this will support is encoding decompressed size in Zlib and BZip2 blocks. This diff is blocking Test Plan: Added a unit tests. More tests to come as part of Reviewers: dhruba, MarkCallaghan, yhchiang, rven, sdong Reviewed By: sdong Subscribers: dhruba, leveldb Differential Revision: routine to BlockBasedTableReader Summary: Added necessary routines for dumping block based SST with block filter Test Plan: Added ""raw"" mode to utility sst_dump Reviewers: sdong, rven Reviewed By: rven Subscribers: dhruba Differential Revision:"
,,0.3279,rocksdb,"New BlockBasedTable version better compressed block format Summary: This diff adds BlockBasedTable format_version 2. New format version brings better compressed block format for these compressions: 1) Zlib encode decompressed size in compressed block header 2) BZip2 encode decompressed size in compressed block header 3) LZ4 and LZ4HC instead of doing memcpy of size_t encode size as varint32. memcpy is very bad because the DB is not portable accross big/little endian machines or even platforms where size_t might be 8 or 4 bytes. It does not affect format for snappy. If you write a new database with format_version 2, it will not be readable by RocksDB versions before 3.10. DB::Open() will return corruption in that case. Test Plan: Added a new test in db_test. I will also run db_bench and verify VSIZE when block_cache 1GB Reviewers: yhchiang, rven, MarkCallaghan, dhruba, sdong Reviewed By: sdong Subscribers: dhruba, leveldb Differential Revision: footer versions bigger than 1 Summary: In this diff I add another parameter to BlockBasedTableOptions that will let users specify block based tables format. This will greatly simplify block based tables format changes in the future. First format change that this will support is encoding decompressed size in Zlib and BZip2 blocks. This diff is blocking Test Plan: Added a unit tests. More tests to come as part of Reviewers: dhruba, MarkCallaghan, yhchiang, rven, sdong Reviewed By: sdong Subscribers: dhruba, leveldb Differential Revision: routine to BlockBasedTableReader Summary: Added necessary routines for dumping block based SST with block filter Test Plan: Added ""raw"" mode to utility sst_dump Reviewers: sdong, rven Reviewed By: rven Subscribers: dhruba Differential Revision:"
,,0.2997,rocksdb,"Move rate_limiter, write buffering, most perf context instrumentation and most random kill out of Env Summary: We want to keep Env a think layer for better portability. Less platform dependent codes should be moved out of Env. In this patch, I create a wrapper of file readers and writers, and put rate limiting, write buffering, as well as most perf context instrumentation and random kill out of Env. It will make it easier to maintain multiple Env in the future. Test Plan: Run all existing unit tests. Reviewers: anthony, kradhakrishnan, IslamAbdelRahman, yhchiang, igor Reviewed By: igor Subscribers: leveldb, dhruba Differential Revision:"
,,0.1809,rocksdb,"Use malloc_usable_size() for accounting block cache size Summary: Currently, when we insert something into block cache, we say that the block cache capacity decreased by the size of the block. However, size of the block might be less than the actual memory used by this object. For example, 4.5KB block will actually use 8KB of memory. So even if we configure block cache to 10GB, our actually memory usage of block cache will be 20GB This problem showed up a lot in testing and just recently also showed up in MongoRocks production where we were using 30GB more memory than expected. This diff will fix the problem. Instead of counting the block size, we will count memory used by the block. That way, a block cache configured to be 10GB will actually use only 10GB of memory. Im using non-portable function and I couldnt find info on portability on Google. However, it seems to work on Linux, which will cover majority of our use-cases. Test Plan: 1. fill up mongo instance with 80GB of data 2. restart mongo with block cache size configured to 10GB 3. do a table scan in mongo 4. memory usage before the diff: 12GB. memory usage after the diff: 10.5GB Reviewers: sdong, MarkCallaghan, rven, yhchiang Reviewed By: yhchiang Subscribers: dhruba, leveldb Differential Revision:"
,,0.2826,rocksdb,"Block cuckoo table tests in ROCKSDB_LITE Summary: Cuckoo table is not supported in ROCKSDB_LITE, blocking its tests Test Plan: cuckoo_table_builder_test cuckoo_table_db_test cuckoo_table_reader_test Reviewers: sdong, igor, yhchiang Reviewed By: yhchiang Subscribers: dhruba Differential Revision: rate_limiter, write buffering, most perf context instrumentation and most random kill out of Env Summary: We want to keep Env a think layer for better portability. Less platform dependent codes should be moved out of Env. In this patch, I create a wrapper of file readers and writers, and put rate limiting, write buffering, as well as most perf context instrumentation and random kill out of Env. It will make it easier to maintain multiple Env in the future. Test Plan: Run all existing unit tests. Reviewers: anthony, kradhakrishnan, IslamAbdelRahman, yhchiang, igor Reviewed By: igor Subscribers: leveldb, dhruba Differential Revision:"
,,0.308,rocksdb,"Move rate_limiter, write buffering, most perf context instrumentation and most random kill out of Env Summary: We want to keep Env a think layer for better portability. Less platform dependent codes should be moved out of Env. In this patch, I create a wrapper of file readers and writers, and put rate limiting, write buffering, as well as most perf context instrumentation and random kill out of Env. It will make it easier to maintain multiple Env in the future. Test Plan: Run all existing unit tests. Reviewers: anthony, kradhakrishnan, IslamAbdelRahman, yhchiang, igor Reviewed By: igor Subscribers: leveldb, dhruba Differential Revision:"
,,0.3112,rocksdb,"Move rate_limiter, write buffering, most perf context instrumentation and most random kill out of Env Summary: We want to keep Env a think layer for better portability. Less platform dependent codes should be moved out of Env. In this patch, I create a wrapper of file readers and writers, and put rate limiting, write buffering, as well as most perf context instrumentation and random kill out of Env. It will make it easier to maintain multiple Env in the future. Test Plan: Run all existing unit tests. Reviewers: anthony, kradhakrishnan, IslamAbdelRahman, yhchiang, igor Reviewed By: igor Subscribers: leveldb, dhruba Differential Revision: report time spent on reading index and bloom blocks Summary: Add a perf context counter to help users figure out time spent on reading indexes and bloom filter blocks. Test Plan: Will write a unit test Subscribers: leveldb, dhruba Differential Revision: malloc_usable_size() for accounting block cache size Summary: Currently, when we insert something into block cache, we say that the block cache capacity decreased by the size of the block. However, size of the block might be less than the actual memory used by this object. For example, 4.5KB block will actually use 8KB of memory. So even if we configure block cache to 10GB, our actually memory usage of block cache will be 20GB This problem showed up a lot in testing and just recently also showed up in MongoRocks production where we were using 30GB more memory than expected. This diff will fix the problem. Instead of counting the block size, we will count memory used by the block. That way, a block cache configured to be 10GB will actually use only 10GB of memory. Im using non-portable function and I couldnt find info on portability on Google. However, it seems to work on Linux, which will cover majority of our use-cases. Test Plan: 1. fill up mongo instance with 80GB of data 2. restart mongo with block cache size configured to 10GB 3. do a table scan in mongo 4. memory usage before the diff: 12GB. memory usage after the diff: 10.5GB Reviewers: sdong, MarkCallaghan, rven, yhchiang Reviewed By: yhchiang Subscribers: dhruba, leveldb Differential Revision:"
,,0.2984,rocksdb,"Move rate_limiter, write buffering, most perf context instrumentation and most random kill out of Env Summary: We want to keep Env a think layer for better portability. Less platform dependent codes should be moved out of Env. In this patch, I create a wrapper of file readers and writers, and put rate limiting, write buffering, as well as most perf context instrumentation and random kill out of Env. It will make it easier to maintain multiple Env in the future. Test Plan: Run all existing unit tests. Reviewers: anthony, kradhakrishnan, IslamAbdelRahman, yhchiang, igor Reviewed By: igor Subscribers: leveldb, dhruba Differential Revision:"
,,0.2772,rocksdb,"Removing duplicate code Summary: While working on , I found duplicate code in the tests. This patch removes it. Test Plan: make clean all check Reviewers: igor, sdong, rven, anthony, yhchiang Reviewed By: yhchiang Subscribers: dhruba, leveldb Differential Revision: rate_limiter, write buffering, most perf context instrumentation and most random kill out of Env Summary: We want to keep Env a think layer for better portability. Less platform dependent codes should be moved out of Env. In this patch, I create a wrapper of file readers and writers, and put rate limiting, write buffering, as well as most perf context instrumentation and random kill out of Env. It will make it easier to maintain multiple Env in the future. Test Plan: Run all existing unit tests. Reviewers: anthony, kradhakrishnan, IslamAbdelRahman, yhchiang, igor Reviewed By: igor Subscribers: leveldb, dhruba Differential Revision:"
,,0.276,rocksdb,"Removing duplicate code Summary: While working on , I found duplicate code in the tests. This patch removes it. Test Plan: make clean all check Reviewers: igor, sdong, rven, anthony, yhchiang Reviewed By: yhchiang Subscribers: dhruba, leveldb Differential Revision: rate_limiter, write buffering, most perf context instrumentation and most random kill out of Env Summary: We want to keep Env a think layer for better portability. Less platform dependent codes should be moved out of Env. In this patch, I create a wrapper of file readers and writers, and put rate limiting, write buffering, as well as most perf context instrumentation and random kill out of Env. It will make it easier to maintain multiple Env in the future. Test Plan: Run all existing unit tests. Reviewers: anthony, kradhakrishnan, IslamAbdelRahman, yhchiang, igor Reviewed By: igor Subscribers: leveldb, dhruba Differential Revision:"
,,0.4547,rocksdb,"Store SST file compression algorithm as a TableProperty Summary: Store SST file compression algorithm as a TableProperty. Test Plan: Modified and ran the table_test UT that checks for TableProperties Reviewers: IslamAbdelRahman Reviewed By: IslamAbdelRahman Subscribers: lgalanis, andrewkr, dhruba, IslamAbdelRahman Differential Revision: dictionary compression using reference block Summary: This adds a new metablock containing a shared dictionary that is used to compress all data blocks in the SST file. The size of the shared dictionary is configurable in CompressionOptions and defaults to 0. Its currently only used for zlib/lz4/lz4hc, but the block will be stored in the SST regardless of the compression type if the user chooses a nonzero dictionary size. During compaction, computes the dictionary by randomly sampling the first output file in each subcompaction. It pre-computes the intervals to sample by assuming the output file will have the maximum allowable length. In case the file is smaller, some of the pre-computed sampling intervals can be beyond end-of-file, in which case we skip over those samples and the dictionary will be a bit smaller. After the dictionary is generated using the first file in a subcompaction, it is loaded into the compression library before writing each block in each subsequent file of that subcompaction. On the read path, gets the dictionary from the metablock, if it exists. Then, loads that dictionary into the compression library before reading each block. Test Plan: new unit test Reviewers: yhchiang, IslamAbdelRahman, cyan, sdong Reviewed By: sdong Subscribers: andrewkr, yoshinorim, kradhakrishnan, dhruba, leveldb Differential Revision: comparator, merge operator, property collectors to SST file properties (again) Summary: This is the original diff that I have landed and reverted and now I want to land again For old SST files we will show ``` comparator name: N/A merge operator name: N/A property collectors names: N/A ``` For new SST files with no merge operator name and with no property collectors ``` comparator name: leveldb.BytewiseComparator merge operator name: nullptr property collectors names: [] ``` for new SST files with these properties ``` comparator name: leveldb.BytewiseComparator merge operator name: UInt64AddOperator property collectors names: [DummyPropertiesCollector1,DummyPropertiesCollector2] ``` Test Plan: unittests Reviewers: andrewkr, yhchiang, sdong Reviewed By: sdong Subscribers: andrewkr, dhruba Differential Revision: column family name in SST file Summary: Added the column family name to the properties block. This property is omitted only if the property is unavailable, such as when RepairDB() writes SST files. In a next diff, I will change RepairDB to use this new property for deciding to which column family an existing SST file belongs. If this property is missing, it will add it to the ""unknown"" column family (same as its existing behavior). Test Plan: New unit test: $ ./db_table_properties_test Reviewers: IslamAbdelRahman, yhchiang, sdong Reviewed By: sdong Subscribers: andrewkr, dhruba, leveldb Differential Revision:"
