Topic_no,Keywords,Contrib,System,Text
,,0.4358,rocksdb,"Removing duplicate code in db_bench/db_stress, fixing typos Summary: While working on single delete support for db_bench, I realized that db_bench/db_stress contain a bunch of duplicate code related to copmression and found some typos. This patch removes duplicate code, typos and a redundant in internal_stats.cc. Test Plan: make db_stress && make db_bench && ./db_bench Reviewers: yhchiang, sdong, rven, anthony, igor Reviewed By: igor Subscribers: dhruba, leveldb Differential Revision: format"" against last 10 commits Summary: This helps Windows port to format their changes, as discussed. Might have formatted some other codes too becasue last 10 commits include more. Test Plan: Build it. Reviewers: anthony, IslamAbdelRahman, kradhakrishnan, yhchiang, igor Reviewed By: igor Subscribers: leveldb, dhruba Differential Revision: Change] Improve EventListener::OnFlushCompleted interface Summary: EventListener::OnFlushCompleted() now passes a structure instead of a list of parameters. This minimizes the API change in the future. Test Plan: listener_test compact_files_test example/compact_files_example Reviewers: kradhakrishnan, sdong, IslamAbdelRahman, rven, igor Reviewed By: rven, igor Subscribers: IslamAbdelRahman, rven, dhruba, leveldb Differential Revision: EventListener::OnTableFileCreated() Summary: Add EventListener::OnTableFileCreated(), which will be called when a table file is created. This patch is part of the EventLogger and EventListener integration. Test Plan: Augment existing test in db/listener_test.cc Reviewers: anthony, kradhakrishnan, rven, igor, sdong Reviewed By: sdong Subscribers: dhruba, leveldb Differential Revision: db_stress Summary: Fixed db_stress by correcting the verification of column family names in the Listener of db_stress Test Plan: db_stress Reviewers: igor, sdong Subscribers: dhruba, leveldb Differential Revision: a compile warning in db_stress Summary: Fixed the following compile warning in db_stress: error: OnCompactionCompleted overrides a member function but is not marked override [-Werror,-Winconsistent-missing-override] Test Plan: make db_stress Reviewers: sdong, igor, anthony Subscribers: dhruba, leveldb Differential Revision: EventListener in stress test. Summary: Include EventListener in stress test. Test Plan: make blackbox_crash_test whitebox_crash_test Reviewers: anthony, igor, rven, sdong Reviewed By: sdong Subscribers: dhruba, leveldb Differential Revision: saving history in memtable_list Summary: For transactions, we are using the memtables to validate that there are no write conflicts. But after flushing, we dont have any memtables, and transactions could fail to commit. So we want to someone keep around some extra history to use for conflict checking. In addition, we want to provide a way to increase the size of this history if too many transactions fail to commit. After chatting with people, it seems like everyone prefers just using Memtables to store this history (instead of a separate history structure). It seems like the best place for this is abstracted inside the memtable_list. I decide to create a separate list in MemtableListVersion as using the same list complicated the flush/installalflushresults logic too much. This diff adds a new parameter to control how much memtable history to keep around after flushing. However, it sounds like people arent too fond of adding new parameters. So I am making the default size of flushed+not-flushed memtables be set to max_write_buffers. This should not change the maximum amount of memory used, but make it more likely were using closer the the limit. (We are now postponing deleting flushed memtables until the max_write_buffer limit is reached). So while we might use more memory on average, we are still obeying the limit set (and you could argue its better to go ahead and use up memory now instead of waiting for a write stall to happen to test this limit). However, if people are opposed to this default behavior, we can easily set it to 0 and require this parameter be set in order to use transactions. Test Plan: Added a xfunc test to play around with setting different values of this parameter in all tests. Added testing in memtablelist_test and planning on adding more testing here. Reviewers: sdong, rven, igor Reviewed By: igor Subscribers: dhruba, leveldb Differential Revision:"
,,0.515,rocksdb,"Dont let flushes preempt compactions Summary: When we first started, max_background_flushes was 0 by default and compaction thread was executing flushes (since there was no flush thread). Then, we switched the default max_background_flushes to 1. However, we still support the case where there is no flush thread and flushes are done in compaction. This is making our code a bit more complicated. By not supporting this use-case we can make our code simpler. We have a special case that when you set max_background_flushes to 0, we schedule the flush to execute on the compaction thread. Test Plan: make check (there might be some unit tests that depend on this behavior) Reviewers: IslamAbdelRahman, yhchiang, sdong Reviewed By: sdong Subscribers: dhruba, leveldb Differential Revision: ability to specify a compaction filter via the Java API/Support saving history in memtable_list Summary: For transactions, we are using the memtables to validate that there are no write conflicts. But after flushing, we dont have any memtables, and transactions could fail to commit. So we want to someone keep around some extra history to use for conflict checking. In addition, we want to provide a way to increase the size of this history if too many transactions fail to commit. After chatting with people, it seems like everyone prefers just using Memtables to store this history (instead of a separate history structure). It seems like the best place for this is abstracted inside the memtable_list. I decide to create a separate list in MemtableListVersion as using the same list complicated the flush/installalflushresults logic too much. This diff adds a new parameter to control how much memtable history to keep around after flushing. However, it sounds like people arent too fond of adding new parameters. So I am making the default size of flushed+not-flushed memtables be set to max_write_buffers. This should not change the maximum amount of memory used, but make it more likely were using closer the the limit. (We are now postponing deleting flushed memtables until the max_write_buffer limit is reached). So while we might use more memory on average, we are still obeying the limit set (and you could argue its better to go ahead and use up memory now instead of waiting for a write stall to happen to test this limit). However, if people are opposed to this default behavior, we can easily set it to 0 and require this parameter be set in order to use transactions. Test Plan: Added a xfunc test to play around with setting different values of this parameter in all tests. Added testing in memtablelist_test and planning on adding more testing here. Reviewers: sdong, rven, igor Reviewed By: igor Subscribers: dhruba, leveldb Differential Revision:"
,,0.0664,rocksdb,The ability to specify a compaction filter via the Java API/
,,0.4496,rocksdb,"Dont let flushes preempt compactions Summary: When we first started, max_background_flushes was 0 by default and compaction thread was executing flushes (since there was no flush thread). Then, we switched the default max_background_flushes to 1. However, we still support the case where there is no flush thread and flushes are done in compaction. This is making our code a bit more complicated. By not supporting this use-case we can make our code simpler. We have a special case that when you set max_background_flushes to 0, we schedule the flush to execute on the compaction thread. Test Plan: make check (there might be some unit tests that depend on this behavior) Reviewers: IslamAbdelRahman, yhchiang, sdong Reviewed By: sdong Subscribers: dhruba, leveldb Differential Revision: purge_redundant_kvs_while_flush Summary: This option is guarding the feature implemented 2 and a half years ago: D8991. The feature was enabled by default back then and has been running without issues. There is no reason why any client would turn this feature off. I found no reference in fbcode. Test Plan: none Reviewers: sdong, yhchiang, anthony, dhruba Reviewed By: dhruba Subscribers: dhruba, leveldb Differential Revision: the latest changes from github/master/Use CompactRangeOptions for CompactRange Summary: This diff update DB::CompactRange to use RangeCompactionOptions instead of using multiple parameters Old CompactRange is still available but deprecated Test Plan: make all check make rocksdbjava USE_CLANG=1 make all OPT=-DROCKSDB_LITE make release Reviewers: sdong, yhchiang, igor Reviewed By: igor Subscribers: dhruba Differential Revision: add support for WriteBatch SliceParts params/Support saving history in memtable_list Summary: For transactions, we are using the memtables to validate that there are no write conflicts. But after flushing, we dont have any memtables, and transactions could fail to commit. So we want to someone keep around some extra history to use for conflict checking. In addition, we want to provide a way to increase the size of this history if too many transactions fail to commit. After chatting with people, it seems like everyone prefers just using Memtables to store this history (instead of a separate history structure). It seems like the best place for this is abstracted inside the memtable_list. I decide to create a separate list in MemtableListVersion as using the same list complicated the flush/installalflushresults logic too much. This diff adds a new parameter to control how much memtable history to keep around after flushing. However, it sounds like people arent too fond of adding new parameters. So I am making the default size of flushed+not-flushed memtables be set to max_write_buffers. This should not change the maximum amount of memory used, but make it more likely were using closer the the limit. (We are now postponing deleting flushed memtables until the max_write_buffer limit is reached). So while we might use more memory on average, we are still obeying the limit set (and you could argue its better to go ahead and use up memory now instead of waiting for a write stall to happen to test this limit). However, if people are opposed to this default behavior, we can easily set it to 0 and require this parameter be set in order to use transactions. Test Plan: Added a xfunc test to play around with setting different values of this parameter in all tests. Added testing in memtablelist_test and planning on adding more testing here. Reviewers: sdong, rven, igor Reviewed By: igor Subscribers: dhruba, leveldb Differential Revision: extra bbto / noop slice transform/C api: human-readable statistics/"
,,0.397,rocksdb,"Report live data size estimate Summary: Fixes T6548822. Added a new function for estimating the size of the live data as proposed in the task. The value can be accessed through the property rocksdb.estimate-live-data-size. Test Plan: There are two unit tests in version_set_test and a simple test in db_test. make version_set_test && ./version_set_test; make db_test && ./db_test gtest_filter=GetProperty Reviewers: rven, igor, yhchiang, sdong Reviewed By: sdong Subscribers: dhruba, leveldb Differential Revision: a bug of CompactionStats in multi-level universal compaction case Summary: Universal compaction can involves in multiple levels. However, the current implementation of bytes_readn and bytes_readnp1 (and some other stats with postfix `n` and `np1`) assumes compaction can only have two levels. This patch fixes this bug and redefines bytes_readn and bytes_readnp1: * bytes_readnp1: the number of bytes read in the compaction output level. * bytes_readn: the total number of bytes read minus bytes_readnp1 Test Plan: Add a test in compaction_job_stats_test Reviewers: igor, sdong, rven, anthony, kradhakrishnan, IslamAbdelRahman Reviewed By: IslamAbdelRahman Subscribers: dhruba, leveldb Differential Revision: saving history in memtable_list Summary: For transactions, we are using the memtables to validate that there are no write conflicts. But after flushing, we dont have any memtables, and transactions could fail to commit. So we want to someone keep around some extra history to use for conflict checking. In addition, we want to provide a way to increase the size of this history if too many transactions fail to commit. After chatting with people, it seems like everyone prefers just using Memtables to store this history (instead of a separate history structure). It seems like the best place for this is abstracted inside the memtable_list. I decide to create a separate list in MemtableListVersion as using the same list complicated the flush/installalflushresults logic too much. This diff adds a new parameter to control how much memtable history to keep around after flushing. However, it sounds like people arent too fond of adding new parameters. So I am making the default size of flushed+not-flushed memtables be set to max_write_buffers. This should not change the maximum amount of memory used, but make it more likely were using closer the the limit. (We are now postponing deleting flushed memtables until the max_write_buffer limit is reached). So while we might use more memory on average, we are still obeying the limit set (and you could argue its better to go ahead and use up memory now instead of waiting for a write stall to happen to test this limit). However, if people are opposed to this default behavior, we can easily set it to 0 and require this parameter be set in order to use transactions. Test Plan: Added a xfunc test to play around with setting different values of this parameter in all tests. Added testing in memtablelist_test and planning on adding more testing here. Reviewers: sdong, rven, igor Reviewed By: igor Subscribers: dhruba, leveldb Differential Revision: for db_bench and more IO stats Summary: See for the IO stats. I added ""Cumulative compaction:"" and ""Interval compaction:"" lines. The IO rates can be confusing. Rates fro per-level stats lines, Wr(MB/s) & Rd(MB/s), are computed using the duration of the compaction job. If the job reads 10MB, writes 9MB and the job (IO & merging) takes 1 second then the rates are 10MB/s for read and 9MB/s for writes. The IO rates in the Cumulative compaction line uses the total uptime. The IO rates in the Interval compaction line uses the interval uptime. So these Cumalative & Interval compaction IO rates cannot be compared to the per-level IO rates. But both forms of the rates are useful for debugging perf. Task ID: Blame Rev: Test Plan: run db_bench Revert Plan: Database Impact: Memcache Impact: Other Notes: EImportant: begin *PUBLIC* platform impact section Bugzilla: end platform impact Reviewers: igor Reviewed By: igor Subscribers: dhruba Differential Revision:"
,,0.1378,rocksdb,"Enable testing CompactFiles in db_stress Summary: Enable testing CompactFiles in db_stress by adding flag test_compact_files to db_stress. Test Plan: ./db_stress ./db_stress Sample output (note that its normal to have some CompactFiles() failed): Stress Test : 491.891 micros/op 65054 ops/sec : Wrote 21.98 MB (0.45 MB/sec) (45% of 3200352 ops) : Wrote 1440728 times : Deleted 441616 times : Single deleted 38181 times : 319251 read and 19025 found the key : Prefix scanned 640520 times : Iterator size sum is 9691415 : Iterated 319704 times : Got errors 0 times : 1323 CompactFiles() succeed : 32 CompactFiles() failed 2016/04/11-15:50:58 Verification successful Reviewers: sdong, IslamAbdelRahman, kradhakrishnan, yiwu, andrewkr Reviewed By: andrewkr Subscribers: andrewkr, dhruba, leveldb Differential Revision:"
,,0.121,rocksdb,db_stress support for range deletions Summary: made db_stress capable of adding range deletions to its db and verifying their correctness. ill make db_crashtest.py use this option later once the collapsing optimization ( is committed because currently it slows down the test too much. Closes Differential Revision: D4293939 Pulled By: ajkr fbshipit-source-id: d3beb3a/
,,0.0994,rocksdb,"CodeMod: Prefer ADD_FAILURE() over EXPECT_TRUE(false), et cetera Summary: CodeMod: Prefer `ADD_FAILURE()` over `EXPECT_TRUE(false)`, et cetera. The tautologically-conditioned and tautologically-contradicted boolean expectations/assertions have better alternatives: unconditional passes and failures. Reviewed By: Orvid Differential Revision: D5432398 Tags: codemod, codemod-opensource fbshipit-source-id: d16b447e8696a6feaa94b41199f5052226ef6914/"
,,0.0883,rocksdb,Do not schedule memtable trimming if there is no history (#6177) Summary: We have observed an increase in CPU load caused by frequent calls to `ColumnFamilyData::InstallSuperVersion` from `DBImpl::TrimMemtableHistory` when using `max_write_buffer_size_to_maintain` to limit the amount of memtable history maintained for transaction conflict checking. Part of the issue is that trimming can potentially be scheduled even if there is no memtable history. The patch adds a check that fixes this. See also Pull Request resolved: Test Plan: Compared `perf` output for ``` ./db_bench ``` before and after the change. There is a significant reduction for the call chain `rocksdb::DBImpl::TrimMemtableHistory` `rocksdb::ColumnFamilyData::InstallSuperVersion` `rocksdb::ThreadLocalPtr::StaticMeta::Scrape` even without Differential Revision: D19057445 Pulled By: ltamasi fbshipit-source-id: dff81882d7b280e17eda7d9b072a2d4882c50f79/
