Topic_no,Keywords,Contrib,System,Text
,,0.337,conscrypt,"Stop allocating empty arrays. Bug: 3166662 Change-Id: I151de373b2bf53786d19824336fa434c02b0b0e8/SSL* AppData should not hold onto JNI global references Summary: NativeCrypto.SSL_do_handshake stored JNI global references in its AppData instance for use in upcalls from OpenSSL that invoke Java callbacks. However, one of the references was to the SSLHandshakeCallbacks which in the common case of OpenSSLSocketImpl is the OpenSSLSocketImpl instance itself. This meant that if code dropped the OpenSSLSocketImpl without closing (such as Apache HTTP Client), the instances would never be collected, and perhaps more importantly, file descriptors would not be closed. The fix is to pass in the objects required during a callback in all downcalls to SSL_* methods that could result in a callback and clear them on return. The existing code already did this for the JNIEnv*, so that code was expanded to handle setting the jobjects as well. Details: In the native code used to extract the FileDescriptor object from a Socket on the call to NativeCrypto.SSL_do_handshake. However, since we need this for every read and write operations, we now do this in Java to avoid the repeated overhead. NativeCrypto.SSL_do_handshake now takes a FileDescriptor, which it extracted from the Socket the convenience function using NativeCrypto.getFileDescriptor(Socket) luni/src/main/java/org/apache/harmony/xnet/provider/jsse/NativeCrypto.java In addition to tracking changes to pass FileDescriptor and SSLHandshakeCallbacks, removed final uses of getFieldId since the code no longer needs to extract FileDescriptors itself luni/src/main/native/NativeCrypto.cpp The Socket field used to be non-null in the wrapper case and null in the non-wrapper case. To simplify things a bit, ""socket this"" in the non-wrapper case. The socket field is now also final and joined by a final FileDescriptor field. luni/src/main/java/org/apache/harmony/xnet/provider/jsse/OpenSSLSocketImpl.java Updated NativeCryptoTest to track FileDescriptor and SSLHandshakeCallbacks by expanding the Hooks.afterHandshake to provide them. Also changed to add a 5 second timeout to many test cases. luni/src/test/java/org/apache/harmony/xnet/provider/jsse/NativeCryptoTest.java Bug: 2989218 Change-Id: Iccef92b59475f3c1929e990893579493ece9d442/Implement OpenSSLMessageDigestJDK.clone and fix OpenSSLMessageDigestJDK.digest DigestInputStream2Test.test_onZ was failing because OpenSSLMessageDigestJDK did not implement Clonable Implementing Clonable required a new NativeCrypto.EVP_MD_CTX_copy method While adding NativeCrypto.EVP_MD_CTX_copy, noticed other methods were not properly named in NativeCrypto.EVP_MD_CTX_* convention. Converted rest of NativeCrypto.cpp to JNI_TRACE logging while debugging DigestOutputStreamTest.test_onZ was failing because OpenSSLMessageDigestJDK.digest did an engineReset Removing the engineReset revealed that digest() could not be called repeatedly on an OpenSSLMessageDigestJDK. Problem was that EVP_DigestFinal can only be called once per digest. Changed engineDigest implementation to use new EVP_MD_CTX_copy to create a temp EVP_MD_CTX which can be used to retreive the digest and then discarded. Bug: 2997405 Change-Id: Ie97c22be245911300d2e729e451a9c4afdb27937/"
,,0.3589,conscrypt,"Avoid races between OpenSSLSocketImpl I/O and close() The previous change: commit 5f2e6872311240319509aed64d9f58cd5b64719b Author: Brian Carlstrom Date: Mon Aug 23 14:06:51 2010 SSLSocket.read should throw SocketException not NullPointerException added checkOpen() to throw SocketException instead of NullPointerException, but there was still a race between read/write on one thread and close on another that could allow a NullPointerException to escape. This change moves checkOpen() calls to be protected by the existing writeLock/readLock/handshakeLock synchronzied blocks to avoid this case. byte buffer error checking for read/write is also moved into the to lock region to preserve compatability as measured by the test: libcore.javax.net.ssl.SSLSocketTest#test_SSLSocket_close Bug: 3153162 Change-Id: I16299f09dc91871407e88eb718073d21a816f683/CloseGuard: finalizers for closeable objects should log complaints Introducing CloseGuard which warns when resources are implictly cleaned up by finalizers when an explicit termination method, to use the Effective Java ""Issue 7: Avoid finalizers"" terminology, should have been used by the caller. libcore classes that can use CloseGuard now do so. Bug: 3041575 Change-Id: I4a4e3554addaf3075c823feb0a0ff0ad1c1f6196/SSL* AppData should not hold onto JNI global references Summary: NativeCrypto.SSL_do_handshake stored JNI global references in its AppData instance for use in upcalls from OpenSSL that invoke Java callbacks. However, one of the references was to the SSLHandshakeCallbacks which in the common case of OpenSSLSocketImpl is the OpenSSLSocketImpl instance itself. This meant that if code dropped the OpenSSLSocketImpl without closing (such as Apache HTTP Client), the instances would never be collected, and perhaps more importantly, file descriptors would not be closed. The fix is to pass in the objects required during a callback in all downcalls to SSL_* methods that could result in a callback and clear them on return. The existing code already did this for the JNIEnv*, so that code was expanded to handle setting the jobjects as well. Details: In the native code used to extract the FileDescriptor object from a Socket on the call to NativeCrypto.SSL_do_handshake. However, since we need this for every read and write operations, we now do this in Java to avoid the repeated overhead. NativeCrypto.SSL_do_handshake now takes a FileDescriptor, which it extracted from the Socket the convenience function using NativeCrypto.getFileDescriptor(Socket) luni/src/main/java/org/apache/harmony/xnet/provider/jsse/NativeCrypto.java In addition to tracking changes to pass FileDescriptor and SSLHandshakeCallbacks, removed final uses of getFieldId since the code no longer needs to extract FileDescriptors itself luni/src/main/native/NativeCrypto.cpp The Socket field used to be non-null in the wrapper case and null in the non-wrapper case. To simplify things a bit, ""socket this"" in the non-wrapper case. The socket field is now also final and joined by a final FileDescriptor field. luni/src/main/java/org/apache/harmony/xnet/provider/jsse/OpenSSLSocketImpl.java Updated NativeCryptoTest to track FileDescriptor and SSLHandshakeCallbacks by expanding the Hooks.afterHandshake to provide them. Also changed to add a 5 second timeout to many test cases. luni/src/test/java/org/apache/harmony/xnet/provider/jsse/NativeCryptoTest.java Bug: 2989218 Change-Id: Iccef92b59475f3c1929e990893579493ece9d442/OpenSSLSocketImpl should not call NativeCrypto.SSL_set_client_CA_list with an empty array Bug: 3034616 Change-Id: Ib39ebfa737910f0ebce5ac2ad87715579bd7aa3d/SSLSocket should respect timeout of a wrapped Socket Change to using getSoTimeout in OpenSSLSocketImpl instead of directly using the timeout field. This means the proper timeout will be used for instances of the OpenSSLSocketImplWrapper subclass, which is used when an SSLSocket is wrapped around an existing connected non-SSL Socket. The code still maintains the local timeout field, now renamed timeoutMilliseconds, which is now accesed via OpenSSLSocketImpl.getSoTimeout. Doing so prevents a getsockopt syscall that otherwise would be necessary if the super.getSoTimeout() was used. Added two unit tests for testing timeouts with SSLSockets wrapped around Socket. One is simply for getters/setters. The second makes sure the timeout is functioning when set on the underlying socket. Bug: 2973305 Change-Id: Idac52853f5d777fae5060a840eefbfe85d448e4c/Fix HttpsURLConnectionTest failures Focusing on HttpsURLConnectionTest.test_doOutput found a number of unrelated issues, all of which are addressed by this change: {HttpURLConnection,HttpsURLConnection}.connect not ignored on subsequent calls OpenSSLSessionImpl.{getPeerCertificates,getPeerCertificateChain} did not include client certificate OpenSSLSocketImpl.getSession did not skip handshake when SSLSession was already available Fix 3 test issues in HttpsURLConnectionTest Fix 2 test issues in NativeCryptoTest Details: HttpsURLConnectionTest tests (such as test_doOutput) that tried to call URLConnection.connect() at the end of the test were raising exception. The RI URLConnection.connect documentation says calls on connected URLConnections should be ignored. Use ""connected"" instead of ""connection null"" as reason to ignore ""connect"" luni/src/main/java/org/apache/harmony/luni/internal/net/www/protocol/ luni/src/main/java/org/apache/harmony/luni/internal/net/www/protocol/ Converted one caller of getPeerCertificateChain to getPeerCertificates which is the new fast path. Track OpenSSLSessionImpl change to take ""java"" vs ""javax"" certificates. luni/src/main/java/org/apache/harmony/xnet/provider/jsse/AbstractSessionContext.java Move SSL_SESSION_get_peer_cert_chain to be SSL_get_peer_cert_chain (similar to SSL_get_certificate). The problem was that SSL_SESSION_get_peer_cert_chain used SSL_get_peer_cert_chain which in the server case did not include the client cert itself, which required a call to SSL_get_peer_certificate, which needed the SSL instance pointer. luni/src/main/java/org/apache/harmony/xnet/provider/jsse/NativeCrypto.java luni/src/main/native/NativeCrypto.cpp Improved NativeCrypto_SSL_set_verify tracing luni/src/main/native/NativeCrypto.cpp As a side effect of the move to NativeCrypto.SSL_get_peer_certificate, it no longer made sense to lazily create the peer certificate chain since the SSLSession should not depend on a particular SSL instance. The peer chain is now passed in as part of the constructor and the peerCertifcates in the OpenSSLSession can be final (also made localCertificates final). Since peerCertifcates is the newew (java not javax) API and more commonly used, it is what is created from the native code, and peerCertificateChain is not derived from peerCertifcates instead of vice versa. luni/src/main/java/org/apache/harmony/xnet/provider/jsse/OpenSSLSessionImpl.java Factored out code to used to create local certificate chain to from array of DER byte arrays into createCertChain so it can be reused to create peer certificate chain. luni/src/main/java/org/apache/harmony/xnet/provider/jsse/OpenSSLSocketImpl.java Fix OpenSSLSocketImpl.getSession to check for existing sslSession to and skip handshake, which was causing an exception if the connection had already been closed. luni/src/main/java/org/apache/harmony/xnet/provider/jsse/OpenSSLSocketImpl.java Fix test issues: Removed PrintStream wrapper of System.out which was causing vogar to lose output. Added null check in closeSocket, which can happen in timeout case. Removed use of InputStream.available which in OpenSSLSocket case returned 0, causing test to fail incorrectly. luni/src/test/java/org/apache/harmony/luni/tests/internal/net/www/protocol/ Updating to track change to SSL_get_peer_cert_chain. Also fixed some other unrelated test failures caused by IOException on shutdown and false start (aka SSL_MODE_HANDSHAKE_CUTTHROUGH) causing clientCallback.handshakeCompleted to be false. luni/src/test/java/org/apache/harmony/xnet/provider/jsse/NativeCryptoTest.java Bug: b/2981767 Change-Id: Id083beb6496558296c2f74f51ab0970e158b23a9/Use BlockGuard for OpenSSL sockets. StrictMode wasnt catching network usage via SSL. Bug: 2976407 Change-Id: I31fe09861e3aca7b26724b94af88687fb6b9442b/SSLSocket.read should throw SocketException not NullPointerException OpenSSLSocketImpl now uses checkOpen similar to Sockets checkOpenAndCreate to ensure that SocketExceptions are thrown if certain operations are tried after the socket is closed. Also added *_setUseClientMode_afterHandshake tests for SSLSocket and SSLEngine. We properly through IllegalArgument exception in this case, but it wasnt covered by the tests previously. Bug: 2918499 Change-Id: I393ad39bed40a33725d2c0f3f08b9d0b0d3ff85f/"
,,0.2941,conscrypt,"Add support for TLS_EMPTY_RENEGOTIATION_INFO_SCSV cipher suite ""TLS_EMPTY_RENEGOTIATION_INFO_SCSV"" is RFC 5746s renegotiation indication signaling cipher suite value. It is not a real cipher suite. It is just an indication in the default and supported cipher suite lists indicates that the implementation supports secure renegotiation. In the RI, its presence means that the SCSV is sent in the cipher suite list to indicate secure renegotiation support and its absence means to send an empty TLS renegotiation info extension instead. However, OpenSSL doesnt provide an API to give this level of control, instead always sending the SCSV and always including the empty renegotiation info if TLS is used (as opposed to SSL). So we simply allow TLS_EMPTY_RENEGOTIATION_INFO_SCSV to be passed for compatibility as to provide the hint that we support secure renegotiation. Change-Id: I0850bea47568edcfb1f7df99d4e8a747f938406d/Toward EC TLS support Summary: javax.net.ssl tests are now working on the RI KeyManager can now handle EC_EC and EC_RSA OpenSSLSocketImpl.startHandshake now works if KeyManager contains EC certificates Details: Add CipherSuite.getKeyType to provide X509KeyManager key type strings, refactored from OpenSSLServerSocketImpl.checkEnabledCipherSuites. getKeyType is now also used in OpenSSLSocketImpl.startHandshake to avoid calling setCertificate for unnecessary key types. luni/src/main/java/org/apache/harmony/xnet/provider/jsse/CipherSuite.java luni/src/main/java/org/apache/harmony/xnet/provider/jsse/OpenSSLServerSocketImpl.java luni/src/main/java/org/apache/harmony/xnet/provider/jsse/OpenSSLSocketImpl.java New CipherSuiteTest to cover new getKeyType as well as existing functionality luni/src/test/java/org/apache/harmony/xnet/provider/jsse/CipherSuiteTest.java Add support to KeyManager implementation for key types of the form EC_EC and EC_RSA. The first part implies the KeyPair algorithm (EC in these new key types) with a potentially different signature algorithm (EC vs RSA in these) luni/src/main/java/org/apache/harmony/xnet/provider/jsse/KeyManagerImpl.java Update NativeCrypto.keyType to support EC_EC and EC_RSA in addition to EC which was added earlier. Change from array of KEY_TYPES to named KEY_TYPE_* constants. luni/src/main/java/org/apache/harmony/xnet/provider/jsse/NativeCrypto.java Overhauled KeyManagerFactoryTest to cover EC, EC_EC, EC_RSA cases luni/src/test/java/libcore/javax/net/ssl/KeyManagerFactoryTest.java support/src/test/java/libcore/java/security/StandardNames.java Changed TestKeyStore.createKeyStore from always using BKS to now use JKS on the RI between BC EC Keys and RI X509 certificates. Because JKS requires a password, we now default ""password"" on the RI. support/src/test/java/libcore/java/security/TestKeyStore.java luni/src/test/java/libcore/javax/net/ssl/SSLContextTest.java support/src/test/java/libcore/java/security/StandardNames.java TestKeyStore.create now accepts key types like EC_RSA. Changed TestKeyStore.createKeys to allow a PrivateKeyEntry to be specified for signing to enable creation of EC_RSA test certificate. Added getRootCertificate/rootCertificate to allow lookup of PrivateKeyEntry for signing. Changed TestKeyStore.getPrivateKey to take explicit signature algorithm to retrieve EC_EC vs EC_RSA entries. support/src/test/java/libcore/java/security/TestKeyStore.java luni/src/test/java/libcore/java/security/KeyStoreTest.java luni/src/test/java/libcore/javax/net/ssl/KeyManagerFactoryTest.java luni/src/test/java/libcore/java/security/cert/PKIXParametersTest.java luni/src/test/java/libcore/javax/net/ssl/TrustManagerFactoryTest.java luni/src/test/java/org/apache/harmony/xnet/provider/jsse/NativeCryptoTest.java support/src/test/java/libcore/java/security/StandardNames.java Added support for EC cipher suites on the RI. Also test with and without new TLS_EMPTY_RENEGOTIATION_INFO_SCSV cipher suite which is used to specify the new TLS secure renegotiation. luni/src/test/java/libcore/javax/net/ssl/SSLEngineTest.java luni/src/test/java/libcore/javax/net/ssl/SSLSocketTest.java support/src/test/java/libcore/java/security/StandardNames.java New TestKeyManager and additional logging in TestTrustManager. Logging in both is disabled by default using DevNullPrintStream. support/src/test/java/libcore/javax/net/ssl/TestKeyManager.java support/src/test/java/libcore/javax/net/ssl/TestTrustManager.java support/src/test/java/libcore/java/io/DevNullPrintStream.java Bug: 3058375 Change-Id: Ia5e2a00a025858e10d1076b900886994b481e05a/"
,,0.3486,conscrypt,"Toward EC TLS support Summary: javax.net.ssl tests are now working on the RI KeyManager can now handle EC_EC and EC_RSA OpenSSLSocketImpl.startHandshake now works if KeyManager contains EC certificates Details: Add CipherSuite.getKeyType to provide X509KeyManager key type strings, refactored from OpenSSLServerSocketImpl.checkEnabledCipherSuites. getKeyType is now also used in OpenSSLSocketImpl.startHandshake to avoid calling setCertificate for unnecessary key types. luni/src/main/java/org/apache/harmony/xnet/provider/jsse/CipherSuite.java luni/src/main/java/org/apache/harmony/xnet/provider/jsse/OpenSSLServerSocketImpl.java luni/src/main/java/org/apache/harmony/xnet/provider/jsse/OpenSSLSocketImpl.java New CipherSuiteTest to cover new getKeyType as well as existing functionality luni/src/test/java/org/apache/harmony/xnet/provider/jsse/CipherSuiteTest.java Add support to KeyManager implementation for key types of the form EC_EC and EC_RSA. The first part implies the KeyPair algorithm (EC in these new key types) with a potentially different signature algorithm (EC vs RSA in these) luni/src/main/java/org/apache/harmony/xnet/provider/jsse/KeyManagerImpl.java Update NativeCrypto.keyType to support EC_EC and EC_RSA in addition to EC which was added earlier. Change from array of KEY_TYPES to named KEY_TYPE_* constants. luni/src/main/java/org/apache/harmony/xnet/provider/jsse/NativeCrypto.java Overhauled KeyManagerFactoryTest to cover EC, EC_EC, EC_RSA cases luni/src/test/java/libcore/javax/net/ssl/KeyManagerFactoryTest.java support/src/test/java/libcore/java/security/StandardNames.java Changed TestKeyStore.createKeyStore from always using BKS to now use JKS on the RI between BC EC Keys and RI X509 certificates. Because JKS requires a password, we now default ""password"" on the RI. support/src/test/java/libcore/java/security/TestKeyStore.java luni/src/test/java/libcore/javax/net/ssl/SSLContextTest.java support/src/test/java/libcore/java/security/StandardNames.java TestKeyStore.create now accepts key types like EC_RSA. Changed TestKeyStore.createKeys to allow a PrivateKeyEntry to be specified for signing to enable creation of EC_RSA test certificate. Added getRootCertificate/rootCertificate to allow lookup of PrivateKeyEntry for signing. Changed TestKeyStore.getPrivateKey to take explicit signature algorithm to retrieve EC_EC vs EC_RSA entries. support/src/test/java/libcore/java/security/TestKeyStore.java luni/src/test/java/libcore/java/security/KeyStoreTest.java luni/src/test/java/libcore/javax/net/ssl/KeyManagerFactoryTest.java luni/src/test/java/libcore/java/security/cert/PKIXParametersTest.java luni/src/test/java/libcore/javax/net/ssl/TrustManagerFactoryTest.java luni/src/test/java/org/apache/harmony/xnet/provider/jsse/NativeCryptoTest.java support/src/test/java/libcore/java/security/StandardNames.java Added support for EC cipher suites on the RI. Also test with and without new TLS_EMPTY_RENEGOTIATION_INFO_SCSV cipher suite which is used to specify the new TLS secure renegotiation. luni/src/test/java/libcore/javax/net/ssl/SSLEngineTest.java luni/src/test/java/libcore/javax/net/ssl/SSLSocketTest.java support/src/test/java/libcore/java/security/StandardNames.java New TestKeyManager and additional logging in TestTrustManager. Logging in both is disabled by default using DevNullPrintStream. support/src/test/java/libcore/javax/net/ssl/TestKeyManager.java support/src/test/java/libcore/javax/net/ssl/TestTrustManager.java support/src/test/java/libcore/java/io/DevNullPrintStream.java Bug: 3058375 Change-Id: Ia5e2a00a025858e10d1076b900886994b481e05a/"
,,0.2858,conscrypt,"resolved conflicts for merge of 5fc737eb to master Change-Id: Ifc2a4fd44cef525709a3b9dc0a502b1a0690c6fd/Lots more bounds-checking/exception-throwing consistency. Overflow-safe checks all round, plus better detail messages. This isnt quite everything, but its a large chunk of the work. Most notably, this is all of io and nio. There are numerous changes of exception priority here, and the harmony tests noticed a subset of them in the nio code. Ive modified our checked-out copy of the tests to accept any of the throwable exceptions. Change-Id: Id185f1228fb9a1d5fc9494e78375b5623fb0fe14/Rewrite all backwards comparisons. Strictly, all the ones I could find. This is everything with 0 or null on the left-hand side. Note that this touches several incorrect bounds checks, which I havent fixed: Im going to come back and finish that independent cleanup separately. Change-Id: Ibdb054b53df9aace47c7d2a00ff19122190053e8/Toward EC TLS support Summary: javax.net.ssl tests are now working on the RI KeyManager can now handle EC_EC and EC_RSA OpenSSLSocketImpl.startHandshake now works if KeyManager contains EC certificates Details: Add CipherSuite.getKeyType to provide X509KeyManager key type strings, refactored from OpenSSLServerSocketImpl.checkEnabledCipherSuites. getKeyType is now also used in OpenSSLSocketImpl.startHandshake to avoid calling setCertificate for unnecessary key types. luni/src/main/java/org/apache/harmony/xnet/provider/jsse/CipherSuite.java luni/src/main/java/org/apache/harmony/xnet/provider/jsse/OpenSSLServerSocketImpl.java luni/src/main/java/org/apache/harmony/xnet/provider/jsse/OpenSSLSocketImpl.java New CipherSuiteTest to cover new getKeyType as well as existing functionality luni/src/test/java/org/apache/harmony/xnet/provider/jsse/CipherSuiteTest.java Add support to KeyManager implementation for key types of the form EC_EC and EC_RSA. The first part implies the KeyPair algorithm (EC in these new key types) with a potentially different signature algorithm (EC vs RSA in these) luni/src/main/java/org/apache/harmony/xnet/provider/jsse/KeyManagerImpl.java Update NativeCrypto.keyType to support EC_EC and EC_RSA in addition to EC which was added earlier. Change from array of KEY_TYPES to named KEY_TYPE_* constants. luni/src/main/java/org/apache/harmony/xnet/provider/jsse/NativeCrypto.java Overhauled KeyManagerFactoryTest to cover EC, EC_EC, EC_RSA cases luni/src/test/java/libcore/javax/net/ssl/KeyManagerFactoryTest.java support/src/test/java/libcore/java/security/StandardNames.java Changed TestKeyStore.createKeyStore from always using BKS to now use JKS on the RI between BC EC Keys and RI X509 certificates. Because JKS requires a password, we now default ""password"" on the RI. support/src/test/java/libcore/java/security/TestKeyStore.java luni/src/test/java/libcore/javax/net/ssl/SSLContextTest.java support/src/test/java/libcore/java/security/StandardNames.java TestKeyStore.create now accepts key types like EC_RSA. Changed TestKeyStore.createKeys to allow a PrivateKeyEntry to be specified for signing to enable creation of EC_RSA test certificate. Added getRootCertificate/rootCertificate to allow lookup of PrivateKeyEntry for signing. Changed TestKeyStore.getPrivateKey to take explicit signature algorithm to retrieve EC_EC vs EC_RSA entries. support/src/test/java/libcore/java/security/TestKeyStore.java luni/src/test/java/libcore/java/security/KeyStoreTest.java luni/src/test/java/libcore/javax/net/ssl/KeyManagerFactoryTest.java luni/src/test/java/libcore/java/security/cert/PKIXParametersTest.java luni/src/test/java/libcore/javax/net/ssl/TrustManagerFactoryTest.java luni/src/test/java/org/apache/harmony/xnet/provider/jsse/NativeCryptoTest.java support/src/test/java/libcore/java/security/StandardNames.java Added support for EC cipher suites on the RI. Also test with and without new TLS_EMPTY_RENEGOTIATION_INFO_SCSV cipher suite which is used to specify the new TLS secure renegotiation. luni/src/test/java/libcore/javax/net/ssl/SSLEngineTest.java luni/src/test/java/libcore/javax/net/ssl/SSLSocketTest.java support/src/test/java/libcore/java/security/StandardNames.java New TestKeyManager and additional logging in TestTrustManager. Logging in both is disabled by default using DevNullPrintStream. support/src/test/java/libcore/javax/net/ssl/TestKeyManager.java support/src/test/java/libcore/javax/net/ssl/TestTrustManager.java support/src/test/java/libcore/java/io/DevNullPrintStream.java Bug: 3058375 Change-Id: Ia5e2a00a025858e10d1076b900886994b481e05a/"
