Topic_no,Keywords,Contrib,System,Text
12,"harmony_xnet, main_java, change, test, nativecrypto, socket, jsse_java, instance, native, implementation, xnet_provider, add, pass, remove, client, exception, properly, certificate, move, class",0.0702,conscrypt,Remove duplication in OpenSSLSocket/OpenSSLServerSocket./
,,0.0681,conscrypt,Remove duplication in OpenSSLSocket/OpenSSLServerSocket./
,,0.8516,conscrypt,"Rewrite JSSE code to use one openssl SSL per SSLSocket an one SSL_CTX per SSLSessionContext Summary: b/1758225: Revisit OpenSSL locking Removed the locking original put in to address b/1678800 which had been causing problems for the HeapWorker thread which was timing out waiting for the lock in the finalizers while other threads were connecting. b/1678800: Reliability tool: Crash in libcrypto Properly fixed the native crash by avoid sharing SSL_SESSION objects between SSL_CTX objects Testing: adb shell run-core-tests tests.xnet.AllTests adb shell run-core-tests javax.net.ssl.AllTests Test app that reloads Details: Each AbstractSessionContext now has an associated SSL_CTX, referenced through the sslCtxNativePointer. SSL_CTX on the native side defines the scope of SSL_SESSION caching, and this brings the Java SSLSessionContext caching into alignment with the native code. OpenSSLSessionImpl now uses AbstractSessionContext instead of SSLSessionContext for access to the underlying SSL_CTX. x-net/src/main/java/org/apache/harmony/xnet/provider/jsse/AbstractSessionContext.java x-net/src/main/java/org/apache/harmony/xnet/provider/jsse/ClientSessionContext.java x-net/src/main/java/org/apache/harmony/xnet/provider/jsse/OpenSSLSessionImpl.java x-net/src/main/java/org/apache/harmony/xnet/provider/jsse/SSLParameters.java x-net/src/main/java/org/apache/harmony/xnet/provider/jsse/ServerSessionContext.java Added AbstractSessionContext.putSession so OpenSSLSocketImpl/OpenSSLSessionImpl can directly assign to the current AbstractSessionContext (whether it be a ClientSessionContext or a ServerSessionContext) without casting. x-net/src/main/java/org/apache/harmony/xnet/provider/jsse/AbstractSessionContext.java x-net/src/main/java/org/apache/harmony/xnet/provider/jsse/ClientSessionContext.java x-net/src/main/java/org/apache/harmony/xnet/provider/jsse/OpenSSLSocketImpl.java x-net/src/main/java/org/apache/harmony/xnet/provider/jsse/ServerSessionContext.java Cleaning up use of SSL_CTX and SSL instances in SSLSocket/SSLServerSocket implementation The major change is that openssl SSL instances are allocated for the life of the matching Java object, replacing the SSL_CTX and the SSL objects that had previously been allocated only starting at handshake time. We should never have been sharing SSL_SESSION instances between SSL_CTX instances, which was the source of the native crashes dating back to cupcake which the OpenSSLSocket.class locking had been preventing. NativeCrypto now has better defined and independant wrappers on openssl functionality. A followon checkin should move the remaining openssl JNI code here with the intent of being able to write and end-to-end test of the openssl code using NativeCrypto without the JSSE implementation classes. The following gives a list of the new native functions with a mapping to the old implementation code. The new code has a more functional style where SSL_CTX and SSL instances are passed and returned as arguments, not extracted from Java instances SSL_CTX_new OpenSSLSocketImpl.nativeinit, OpenSSLServerSocketImpl.nativeinit, SSLParameters.nativeinitsslctx SSL_CTX_get_ciphers_list OpenSSLSocketImpl.nativeGetEnabledCipherSuites SSL_CTX_free OpenSSLSocketImpl.nativefree, OpenSSLServerSocketImpl.nativefree SSL_new OpenSSLSocketImpl.nativeinit, OpenSSLSocketImpl.init, OpenSSLServerSocketImpl.nativeinit, OpenSSLServerSocketImpl.init SSL_get_options OpenSSLSocketImpl.nativesetenabledprotocols SSL_set_options OpenSSLSocketImpl.nativesetenabledprotocols SSL_get_ciphers OpenSSLSocketImpl.nativeGetEnabledCipherSuites SSL_set_cipher_list OpenSSLSocketImpl.nativeSetEnabledCipherSuites SSL_free OpenSSLSocketImpl.nativefree, OpenSSLServerSocketImpl.nativefree While the focus in NativeCrypto is on native code, it also contains some helpers/wrappers especially for code that doesnt depend on specific SSL_CTX, SSL instances or that needs to do massaging of data formats between Java and OpenSSL. Some of these had previously been duplicated in the client and server versions of the code. For example: getSupportedCipherSuites OpenSSLSocketImpl.nativegetsupportedciphersuites, OpenSSLServerSocketImpl.nativegetsupportedciphersuites getSupportedProtocols OpenSSLSocketImpl.getSupportedProtocols, OpenSSLServerSocketImpl.getSupportedProtocols getEnabledProtocols OpenSSLSocketImpl.getEnabledProtocols,OpenSSLServerSocketImpl.getEnabledProtocols setEnabledProtocols OpenSSLSocketImpl.setEnabledProtocols setEnabledCipherSuites OpenSSLSocketImpl.setEnabledCipherSuites Moved JNI initialization from OpenSSLSocketImpl to NativeCrypto which is the future home of all the openssl related native code. clinit OpenSSLSocketImpl.nativeinitstatic NativeCrypto.CertificateChainVerifier is a new interface to decouple callbacks from openssl from a specific dependence on a OpenSSLSocketImpl.verify_callback method. Changed to return boolean instead of int. Renamed OpenSSLSocketImpl.ssl to OpenSSLSocketImpl.sslNativePointer for consistency Changed OpenSSLSocketImpl nativeconnect, nativegetsslsession, nativecipherauthenticationmethod, nativeaccept, nativeread, nativewrite, nativeinterrupt, nativeclose, nativefree to take arguments instead of inspect object state in preparation for moving to NativeCrypto other notable NativeCrypto changes included * adding SSL_SESSION_get_peer_cert_chain, SSL_SESSION_get_version, and SSL_get_version (and get_ssl_version) which are ""missing methods"" in openssl * ssl_msg_callback_LOG callback and get_content_type for handshake debugging * removing jfieldIDs for our classes now that we pass in values in arguments * changed aliveAndKicking to be volative since we poll on it to communicate between threads * changed from C style declarations at beginning of block to C++ at first use on methods with major changes * stop freeing SSL instances on error, only SSL_clear it * improved session reuse logging when reproducing b/1678800 * change verify_callback to return verifyCertificateChain result x-net/src/main/java/org/apache/harmony/xnet/provider/jsse/NativeCrypto.java x-net/src/main/native/org_apache_harmony_xnet_provider_jsse_NativeCrypto.cpp x-net/src/main/java/org/apache/harmony/xnet/provider/jsse/OpenSSLServerSocketImpl.java x-net/src/main/java/org/apache/harmony/xnet/provider/jsse/OpenSSLSocketFactoryImpl.java When we accept a server socket, we pass the existing SSL state instance from the server socket to the newly accepted socket via the constructor where it is copied with SSL_dup, instead of through both the constructor and later the accept method. x-net/src/main/java/org/apache/harmony/xnet/provider/jsse/OpenSSLSocketImpl.java x-net/src/main/java/org/apache/harmony/xnet/provider/jsse/OpenSSLServerSocketImpl.java Cleaned up nativesetclientauth from using SSL_CTX to SSL, passing ssl as argument in preparation for future movement to NativeCrypto. x-net/src/main/java/org/apache/harmony/xnet/provider/jsse/OpenSSLServerSocketImpl.java Removed ssl_op_no cache for rarely used enabled protocol methods so that code could more easily be shared in NativeCrypto between client and server. x-net/src/main/java/org/apache/harmony/xnet/provider/jsse/OpenSSLServerSocketImpl.java x-net/src/main/java/org/apache/harmony/xnet/provider/jsse/OpenSSLSocketImpl.java Changed public getId, getCreationTime, getPeerCertificates, getCipherSuite, getProtocol from being instance methods that looked at the OpenSSLSessionImpl object state to be static mthods that take the native pointers as arguments in preparation for moving to NativeCrypto. Rename session sslSessionNativePointer for consistency. Inlined initializeNative, which wasnt really the native code. x-net/src/main/java/org/apache/harmony/xnet/provider/jsse/OpenSSLSessionImpl.java Removed lock on OpenSSLSocketImpl.class lock from around OpenSSLSocketImpls use of nativeconnect, nativegetsslsession, and nativecipherauthenticationmethod as well as OpenSSLSessionImpls use of freeImpl, fixing b/1758225: Revisit OpenSSL locking x-net/src/main/java/org/apache/harmony/xnet/provider/jsse/OpenSSLSocketImpl.java x-net/src/main/java/org/apache/harmony/xnet/provider/jsse/OpenSSLSessionImpl.java Unrelated changes Removed unused ssl_ctx, nativeinitsslctx, getSSLCTX x-net/src/main/java/org/apache/harmony/xnet/provider/jsse/SSLParameters.java Fix bug in both putSession implementations where we cached sessions with zero length id. Also change indexById to pass in id in client implementation. x-net/src/main/java/org/apache/harmony/xnet/provider/jsse/ClientSessionContext.java x-net/src/main/java/org/apache/harmony/xnet/provider/jsse/ServerSessionContext.java Make sure we clone SSLParameters passed to the SSLSocketFactory and SSLServerSocketFactory so that muting the client instance does not change the server instance and vice versa. Explicitly set setUseClientMode(false) on the server SSLParameters. These changes are to bring things more into alignment with the original harmony classes which properly support client/server role switching during handshaking. x-net/src/main/java/org/apache/harmony/xnet/provider/jsse/OpenSSLServerSocketFactoryImpl.java Make locks object fields final x-net/src/main/java/org/apache/harmony/xnet/provider/jsse/OpenSSLSocketImpl.java Moved updateInstanceCount(1) logic and sslParameters assignment to init method x-net/src/main/java/org/apache/harmony/xnet/provider/jsse/OpenSSLSocketImpl.java Changed getCachedClientSession to respect getUseClientMode x-net/src/main/java/org/apache/harmony/xnet/provider/jsse/OpenSSLSocketImpl.java Spelling of listensers to listeners in javadoc x-net/src/main/java/org/apache/harmony/xnet/provider/jsse/OpenSSLSocketImpl.java Spelling SSLInputStream to SSLOutputStream in comment x-net/src/main/java/org/apache/harmony/xnet/provider/jsse/OpenSSLSocketImpl.java Changed shutdownInput and shutdownOutput to call to the underlying socket x-net/src/main/java/org/apache/harmony/xnet/provider/jsse/OpenSSLSocketImpl.java Set sslNativePointer to 0 when freeing underlying SSL object x-net/src/main/java/org/apache/harmony/xnet/provider/jsse/OpenSSLSocketImpl.java Removed IOException logging in getSession, which is expected to simply return SSL_NULL_WITH_NULL_NULL when there are problems. x-net/src/main/java/org/apache/harmony/xnet/provider/jsse/OpenSSLSocketImpl.java Disabled ""Using factory"" message on successful creation of SocketFactory which was a bit noisy running tests. However, added logging in failure case including the related exception: x-net/src/main/java/javax/net/ssl/SSLSocketFactory.java Disabled logging of OpenSSL session deallocation x-net/src/main/native/org_apache_harmony_xnet_provider_jsse_NativeCrypto.cpp Register SSLContextImpl as a source of SSL and SSL3 SSLContexts, not just TLS and TLSv1. x-net/src/main/java/org/apache/harmony/xnet/provider/jsse/JSSEProvider.java Fix whitespace in comment x-net/src/main/java/org/apache/harmony/xnet/provider/jsse/CertificateRequest.java Change-Id: I99975ae22599c7df0d249fa013ae7ea7c9c08051/"
,,0.8475,conscrypt,"Rewrite JSSE code to use one openssl SSL per SSLSocket an one SSL_CTX per SSLSessionContext Summary: b/1758225: Revisit OpenSSL locking Removed the locking original put in to address b/1678800 which had been causing problems for the HeapWorker thread which was timing out waiting for the lock in the finalizers while other threads were connecting. b/1678800: Reliability tool: Crash in libcrypto Properly fixed the native crash by avoid sharing SSL_SESSION objects between SSL_CTX objects Testing: adb shell run-core-tests tests.xnet.AllTests adb shell run-core-tests javax.net.ssl.AllTests Test app that reloads Details: Each AbstractSessionContext now has an associated SSL_CTX, referenced through the sslCtxNativePointer. SSL_CTX on the native side defines the scope of SSL_SESSION caching, and this brings the Java SSLSessionContext caching into alignment with the native code. OpenSSLSessionImpl now uses AbstractSessionContext instead of SSLSessionContext for access to the underlying SSL_CTX. x-net/src/main/java/org/apache/harmony/xnet/provider/jsse/AbstractSessionContext.java x-net/src/main/java/org/apache/harmony/xnet/provider/jsse/ClientSessionContext.java x-net/src/main/java/org/apache/harmony/xnet/provider/jsse/OpenSSLSessionImpl.java x-net/src/main/java/org/apache/harmony/xnet/provider/jsse/SSLParameters.java x-net/src/main/java/org/apache/harmony/xnet/provider/jsse/ServerSessionContext.java Added AbstractSessionContext.putSession so OpenSSLSocketImpl/OpenSSLSessionImpl can directly assign to the current AbstractSessionContext (whether it be a ClientSessionContext or a ServerSessionContext) without casting. x-net/src/main/java/org/apache/harmony/xnet/provider/jsse/AbstractSessionContext.java x-net/src/main/java/org/apache/harmony/xnet/provider/jsse/ClientSessionContext.java x-net/src/main/java/org/apache/harmony/xnet/provider/jsse/OpenSSLSocketImpl.java x-net/src/main/java/org/apache/harmony/xnet/provider/jsse/ServerSessionContext.java Cleaning up use of SSL_CTX and SSL instances in SSLSocket/SSLServerSocket implementation The major change is that openssl SSL instances are allocated for the life of the matching Java object, replacing the SSL_CTX and the SSL objects that had previously been allocated only starting at handshake time. We should never have been sharing SSL_SESSION instances between SSL_CTX instances, which was the source of the native crashes dating back to cupcake which the OpenSSLSocket.class locking had been preventing. NativeCrypto now has better defined and independant wrappers on openssl functionality. A followon checkin should move the remaining openssl JNI code here with the intent of being able to write and end-to-end test of the openssl code using NativeCrypto without the JSSE implementation classes. The following gives a list of the new native functions with a mapping to the old implementation code. The new code has a more functional style where SSL_CTX and SSL instances are passed and returned as arguments, not extracted from Java instances SSL_CTX_new OpenSSLSocketImpl.nativeinit, OpenSSLServerSocketImpl.nativeinit, SSLParameters.nativeinitsslctx SSL_CTX_get_ciphers_list OpenSSLSocketImpl.nativeGetEnabledCipherSuites SSL_CTX_free OpenSSLSocketImpl.nativefree, OpenSSLServerSocketImpl.nativefree SSL_new OpenSSLSocketImpl.nativeinit, OpenSSLSocketImpl.init, OpenSSLServerSocketImpl.nativeinit, OpenSSLServerSocketImpl.init SSL_get_options OpenSSLSocketImpl.nativesetenabledprotocols SSL_set_options OpenSSLSocketImpl.nativesetenabledprotocols SSL_get_ciphers OpenSSLSocketImpl.nativeGetEnabledCipherSuites SSL_set_cipher_list OpenSSLSocketImpl.nativeSetEnabledCipherSuites SSL_free OpenSSLSocketImpl.nativefree, OpenSSLServerSocketImpl.nativefree While the focus in NativeCrypto is on native code, it also contains some helpers/wrappers especially for code that doesnt depend on specific SSL_CTX, SSL instances or that needs to do massaging of data formats between Java and OpenSSL. Some of these had previously been duplicated in the client and server versions of the code. For example: getSupportedCipherSuites OpenSSLSocketImpl.nativegetsupportedciphersuites, OpenSSLServerSocketImpl.nativegetsupportedciphersuites getSupportedProtocols OpenSSLSocketImpl.getSupportedProtocols, OpenSSLServerSocketImpl.getSupportedProtocols getEnabledProtocols OpenSSLSocketImpl.getEnabledProtocols,OpenSSLServerSocketImpl.getEnabledProtocols setEnabledProtocols OpenSSLSocketImpl.setEnabledProtocols setEnabledCipherSuites OpenSSLSocketImpl.setEnabledCipherSuites Moved JNI initialization from OpenSSLSocketImpl to NativeCrypto which is the future home of all the openssl related native code. clinit OpenSSLSocketImpl.nativeinitstatic NativeCrypto.CertificateChainVerifier is a new interface to decouple callbacks from openssl from a specific dependence on a OpenSSLSocketImpl.verify_callback method. Changed to return boolean instead of int. Renamed OpenSSLSocketImpl.ssl to OpenSSLSocketImpl.sslNativePointer for consistency Changed OpenSSLSocketImpl nativeconnect, nativegetsslsession, nativecipherauthenticationmethod, nativeaccept, nativeread, nativewrite, nativeinterrupt, nativeclose, nativefree to take arguments instead of inspect object state in preparation for moving to NativeCrypto other notable NativeCrypto changes included * adding SSL_SESSION_get_peer_cert_chain, SSL_SESSION_get_version, and SSL_get_version (and get_ssl_version) which are ""missing methods"" in openssl * ssl_msg_callback_LOG callback and get_content_type for handshake debugging * removing jfieldIDs for our classes now that we pass in values in arguments * changed aliveAndKicking to be volative since we poll on it to communicate between threads * changed from C style declarations at beginning of block to C++ at first use on methods with major changes * stop freeing SSL instances on error, only SSL_clear it * improved session reuse logging when reproducing b/1678800 * change verify_callback to return verifyCertificateChain result x-net/src/main/java/org/apache/harmony/xnet/provider/jsse/NativeCrypto.java x-net/src/main/native/org_apache_harmony_xnet_provider_jsse_NativeCrypto.cpp x-net/src/main/java/org/apache/harmony/xnet/provider/jsse/OpenSSLServerSocketImpl.java x-net/src/main/java/org/apache/harmony/xnet/provider/jsse/OpenSSLSocketFactoryImpl.java When we accept a server socket, we pass the existing SSL state instance from the server socket to the newly accepted socket via the constructor where it is copied with SSL_dup, instead of through both the constructor and later the accept method. x-net/src/main/java/org/apache/harmony/xnet/provider/jsse/OpenSSLSocketImpl.java x-net/src/main/java/org/apache/harmony/xnet/provider/jsse/OpenSSLServerSocketImpl.java Cleaned up nativesetclientauth from using SSL_CTX to SSL, passing ssl as argument in preparation for future movement to NativeCrypto. x-net/src/main/java/org/apache/harmony/xnet/provider/jsse/OpenSSLServerSocketImpl.java Removed ssl_op_no cache for rarely used enabled protocol methods so that code could more easily be shared in NativeCrypto between client and server. x-net/src/main/java/org/apache/harmony/xnet/provider/jsse/OpenSSLServerSocketImpl.java x-net/src/main/java/org/apache/harmony/xnet/provider/jsse/OpenSSLSocketImpl.java Changed public getId, getCreationTime, getPeerCertificates, getCipherSuite, getProtocol from being instance methods that looked at the OpenSSLSessionImpl object state to be static mthods that take the native pointers as arguments in preparation for moving to NativeCrypto. Rename session sslSessionNativePointer for consistency. Inlined initializeNative, which wasnt really the native code. x-net/src/main/java/org/apache/harmony/xnet/provider/jsse/OpenSSLSessionImpl.java Removed lock on OpenSSLSocketImpl.class lock from around OpenSSLSocketImpls use of nativeconnect, nativegetsslsession, and nativecipherauthenticationmethod as well as OpenSSLSessionImpls use of freeImpl, fixing b/1758225: Revisit OpenSSL locking x-net/src/main/java/org/apache/harmony/xnet/provider/jsse/OpenSSLSocketImpl.java x-net/src/main/java/org/apache/harmony/xnet/provider/jsse/OpenSSLSessionImpl.java Unrelated changes Removed unused ssl_ctx, nativeinitsslctx, getSSLCTX x-net/src/main/java/org/apache/harmony/xnet/provider/jsse/SSLParameters.java Fix bug in both putSession implementations where we cached sessions with zero length id. Also change indexById to pass in id in client implementation. x-net/src/main/java/org/apache/harmony/xnet/provider/jsse/ClientSessionContext.java x-net/src/main/java/org/apache/harmony/xnet/provider/jsse/ServerSessionContext.java Make sure we clone SSLParameters passed to the SSLSocketFactory and SSLServerSocketFactory so that muting the client instance does not change the server instance and vice versa. Explicitly set setUseClientMode(false) on the server SSLParameters. These changes are to bring things more into alignment with the original harmony classes which properly support client/server role switching during handshaking. x-net/src/main/java/org/apache/harmony/xnet/provider/jsse/OpenSSLServerSocketFactoryImpl.java Make locks object fields final x-net/src/main/java/org/apache/harmony/xnet/provider/jsse/OpenSSLSocketImpl.java Moved updateInstanceCount(1) logic and sslParameters assignment to init method x-net/src/main/java/org/apache/harmony/xnet/provider/jsse/OpenSSLSocketImpl.java Changed getCachedClientSession to respect getUseClientMode x-net/src/main/java/org/apache/harmony/xnet/provider/jsse/OpenSSLSocketImpl.java Spelling of listensers to listeners in javadoc x-net/src/main/java/org/apache/harmony/xnet/provider/jsse/OpenSSLSocketImpl.java Spelling SSLInputStream to SSLOutputStream in comment x-net/src/main/java/org/apache/harmony/xnet/provider/jsse/OpenSSLSocketImpl.java Changed shutdownInput and shutdownOutput to call to the underlying socket x-net/src/main/java/org/apache/harmony/xnet/provider/jsse/OpenSSLSocketImpl.java Set sslNativePointer to 0 when freeing underlying SSL object x-net/src/main/java/org/apache/harmony/xnet/provider/jsse/OpenSSLSocketImpl.java Removed IOException logging in getSession, which is expected to simply return SSL_NULL_WITH_NULL_NULL when there are problems. x-net/src/main/java/org/apache/harmony/xnet/provider/jsse/OpenSSLSocketImpl.java Disabled ""Using factory"" message on successful creation of SocketFactory which was a bit noisy running tests. However, added logging in failure case including the related exception: x-net/src/main/java/javax/net/ssl/SSLSocketFactory.java Disabled logging of OpenSSL session deallocation x-net/src/main/native/org_apache_harmony_xnet_provider_jsse_NativeCrypto.cpp Register SSLContextImpl as a source of SSL and SSL3 SSLContexts, not just TLS and TLSv1. x-net/src/main/java/org/apache/harmony/xnet/provider/jsse/JSSEProvider.java Fix whitespace in comment x-net/src/main/java/org/apache/harmony/xnet/provider/jsse/CertificateRequest.java Change-Id: I99975ae22599c7df0d249fa013ae7ea7c9c08051/"
