Topic_no,Keywords,Contrib,System,Text
,,0.5383,realm-java,"fix API incompatibility introduced in 3.1.0 (#4455)/Feature/backlinks (#4406) * Refactor RealmObjectSchema Clean up Proxy generation Comments addressed * Fix Test, Checkstyle and Findbugs errors * Respond to comments/Refactor Schemas into separate native and realm-based implementations (#4382) * Refactor Schemas into separate native and realm-based implementations * Fix all tests * Respond to PR comments * Temporary (git add .) kludge to fix visiblity problem/Backlinks (#4219) * Document multiple links to the same object * Fix non-object field reference bug * Load all tables before validating any * Update to gradle 3.4.1 * Fix Documentation * Fix Asynchronous UTs * Ignore, instead of throwing on, attempts to load Backlink fields w/JSON * Fix documentation and add notification unit tests * Require that backlink fields be final. * Address PR comments * Add tests for notification and distinct * Add interface methods and most of table validation * Check fields on JSON load * Fix fails in RealmTests * Respond to comments * Compile time type checking Refactor annotation handler * Improved error messages * Add Unit tests * Renamed Backlink to LinkingObjects. Added annotation processor tests. * Added annotation processor unit tests. * Add Backlink annotation/Fix error message to show correct character limit and minor grammar fix/"
,,0.5137,realm-java,"Fine grained locks for RealmCache (#4551) Separated lock for different RealmConfiguration instead of one lock on the RealmCache class. So Opening Realm instances from different configurations wont block each other. DynamicRealm which is created during opening type Realm will not be associated to any RealmCache to avoid recursive locks and multiple times initial block. (Also make the code easier.) This is for and part of implementation of ./removed nested try-finally/address findbugs warnings/dispose OsRealmObjectSchema in OsRealmSchema.Creator/Fix OsRealmSchema leak (#4422)/refactor internal method name in RealmSchema (#4429)/Feature/backlinks (#4406) * Refactor RealmObjectSchema Clean up Proxy generation Comments addressed * Fix Test, Checkstyle and Findbugs errors * Respond to comments/Refactor Schemas into separate native and realm-based implementations (#4382) * Refactor Schemas into separate native and realm-based implementations * Fix all tests * Respond to PR comments * Temporary (git add .) kludge to fix visiblity problem/Backlinks (#4219) * Document multiple links to the same object * Fix non-object field reference bug * Load all tables before validating any * Update to gradle 3.4.1 * Fix Documentation * Fix Asynchronous UTs * Ignore, instead of throwing on, attempts to load Backlink fields w/JSON * Fix documentation and add notification unit tests * Require that backlink fields be final. * Address PR comments * Add tests for notification and distinct * Add interface methods and most of table validation * Check fields on JSON load * Fix fails in RealmTests * Respond to comments * Compile time type checking Refactor annotation handler * Improved error messages * Add Unit tests * Renamed Backlink to LinkingObjects. Added annotation processor tests. * Added annotation processor unit tests. * Add Backlink annotation/Using ObjectStore SyncManager & Session (#4214) Using ObjectStores SyncManager & Session/"
,,0.0849,realm-java,KeepMember OsObject.notifyChangeListeners Fix Use release assertion when finding java method./Using ObjectStore SyncManager & Session (#4214) Using ObjectStores SyncManager & Session/
,,0.1196,realm-java,Suppress warnings in generated code. (#4779) * Suppress warnings in generated code. * Add compile time flag controlling the SuppressWarnings annotation on generated classes/
,,0.1179,realm-java,"Removed unused methods from internal Table class (#4812)/Refactor object creation into OsObject (#4632) Hide the addEmptyRow from java to support future stable ID. Add bulk insertion benchmark. This wont be the final design of internal object creation API, when integration of OS object accessor, the internal API might be changed a bit since it doesnt look nice at all 5 params for the JNI call to create an object with integer primary key/"
,,0.3914,realm-java,"Final step for OS schema integration (#5065) Build the column indices cache from OsSchemaInfo. Not like before, the column indices are not built when the Realm instance is created. Instead, they will only be built when the relevant RealmObject needs to be accessed. Column indices cache system has been changed. Different Realm instance will not share the same cache. Instead, every Realm instance will have its own cache. So we dont rely on the schema version any more. The cache can handle the situation when the schema versions are the same but schemas are not. Refresh column indices cache when schema changes. This is also supported in multi-processes environment. Almost all of the Realm initialization work is handled by Object Store. So we have the same routine for both sync/non-sync Realm. Also the initialization routine has be simplified a lot in java side. A new class OsRealmConfig is introduced to solve the 20+ arguments need to be passed to JNI to create Realm config. The transaction for schema initialization should be cancelled if exception happens in Java migration/initialization callbacks./"
,,0.3976,realm-java,"Final step for OS schema integration (#5065) Build the column indices cache from OsSchemaInfo. Not like before, the column indices are not built when the Realm instance is created. Instead, they will only be built when the relevant RealmObject needs to be accessed. Column indices cache system has been changed. Different Realm instance will not share the same cache. Instead, every Realm instance will have its own cache. So we dont rely on the schema version any more. The cache can handle the situation when the schema versions are the same but schemas are not. Refresh column indices cache when schema changes. This is also supported in multi-processes environment. Almost all of the Realm initialization work is handled by Object Store. So we have the same routine for both sync/non-sync Realm. Also the initialization routine has be simplified a lot in java side. A new class OsRealmConfig is introduced to solve the 20+ arguments need to be passed to JNI to create Realm config. The transaction for schema initialization should be cancelled if exception happens in Java migration/initialization callbacks./"
,,0.3727,realm-java,"Add Supports for Primitive Lists (#5031) * Extended Annotation Processor to support it in model classes * Relaxed Generic Constraints * Support in insert/insertOrUpdate * Support in copyToRealm/copyToRealmOrUpdate * Support in copyFromRealm/Use OS List instead of cores LinkView (#5171) Replace LinkView with OS List. Code clean up. Fix a potential leak with LinkView in insertion APIs./Final step for OS schema integration (#5065) Build the column indices cache from OsSchemaInfo. Not like before, the column indices are not built when the Realm instance is created. Instead, they will only be built when the relevant RealmObject needs to be accessed. Column indices cache system has been changed. Different Realm instance will not share the same cache. Instead, every Realm instance will have its own cache. So we dont rely on the schema version any more. The cache can handle the situation when the schema versions are the same but schemas are not. Refresh column indices cache when schema changes. This is also supported in multi-processes environment. Almost all of the Realm initialization work is handled by Object Store. So we have the same routine for both sync/non-sync Realm. Also the initialization routine has be simplified a lot in java side. A new class OsRealmConfig is introduced to solve the 20+ arguments need to be passed to JNI to create Realm config. The transaction for schema initialization should be cancelled if exception happens in Java migration/initialization callbacks./"
,,0.3433,realm-java,Merge remote-tracking branch origin/master into mc/os-schema-migration/Add annotation to public APIs (#5044) * add annotation to parameters and suppress null related warnings * add annotation to objectserver APIs * fix compile error in example * remove annotation from equals(Object) * remove annotation from each overriding methods. Add more package-infos instead. * remove from parameters * remove from parameters * remove from parameters * remove unused import * remove unused import * add Nullability by Annotataion section to CONTRIBUTING.md * fix typo in CONTRIBUTING.md * replace assert with noinspection comment * add more annotation to address findbugs warnings/
,,0.3926,realm-java,"Final step for OS schema integration (#5065) Build the column indices cache from OsSchemaInfo. Not like before, the column indices are not built when the Realm instance is created. Instead, they will only be built when the relevant RealmObject needs to be accessed. Column indices cache system has been changed. Different Realm instance will not share the same cache. Instead, every Realm instance will have its own cache. So we dont rely on the schema version any more. The cache can handle the situation when the schema versions are the same but schemas are not. Refresh column indices cache when schema changes. This is also supported in multi-processes environment. Almost all of the Realm initialization work is handled by Object Store. So we have the same routine for both sync/non-sync Realm. Also the initialization routine has be simplified a lot in java side. A new class OsRealmConfig is introduced to solve the 20+ arguments need to be passed to JNI to create Realm config. The transaction for schema initialization should be cancelled if exception happens in Java migration/initialization callbacks./"
,,0.3367,realm-java,Update realm-sync to 1.10.8 (#5129) And update object-store to 2274604de9/Add annotation to public APIs (#5044) * add annotation to parameters and suppress null related warnings * add annotation to objectserver APIs * fix compile error in example * remove annotation from equals(Object) * remove annotation from each overriding methods. Add more package-infos instead. * remove from parameters * remove from parameters * remove from parameters * remove unused import * remove unused import * add Nullability by Annotataion section to CONTRIBUTING.md * fix typo in CONTRIBUTING.md * replace assert with noinspection comment * add more annotation to address findbugs warnings/
,,0.3354,realm-java,Add annotation to public APIs (#5044) * add annotation to parameters and suppress null related warnings * add annotation to objectserver APIs * fix compile error in example * remove annotation from equals(Object) * remove annotation from each overriding methods. Add more package-infos instead. * remove from parameters * remove from parameters * remove from parameters * remove unused import * remove unused import * add Nullability by Annotataion section to CONTRIBUTING.md * fix typo in CONTRIBUTING.md * replace assert with noinspection comment * add more annotation to address findbugs warnings/
,,0.3876,realm-java,"Final step for OS schema integration (#5065) Build the column indices cache from OsSchemaInfo. Not like before, the column indices are not built when the Realm instance is created. Instead, they will only be built when the relevant RealmObject needs to be accessed. Column indices cache system has been changed. Different Realm instance will not share the same cache. Instead, every Realm instance will have its own cache. So we dont rely on the schema version any more. The cache can handle the situation when the schema versions are the same but schemas are not. Refresh column indices cache when schema changes. This is also supported in multi-processes environment. Almost all of the Realm initialization work is handled by Object Store. So we have the same routine for both sync/non-sync Realm. Also the initialization routine has be simplified a lot in java side. A new class OsRealmConfig is introduced to solve the 20+ arguments need to be passed to JNI to create Realm config. The transaction for schema initialization should be cancelled if exception happens in Java migration/initialization callbacks./"
,,0.3989,realm-java,"Final step for OS schema integration (#5065) Build the column indices cache from OsSchemaInfo. Not like before, the column indices are not built when the Realm instance is created. Instead, they will only be built when the relevant RealmObject needs to be accessed. Column indices cache system has been changed. Different Realm instance will not share the same cache. Instead, every Realm instance will have its own cache. So we dont rely on the schema version any more. The cache can handle the situation when the schema versions are the same but schemas are not. Refresh column indices cache when schema changes. This is also supported in multi-processes environment. Almost all of the Realm initialization work is handled by Object Store. So we have the same routine for both sync/non-sync Realm. Also the initialization routine has be simplified a lot in java side. A new class OsRealmConfig is introduced to solve the 20+ arguments need to be passed to JNI to create Realm config. The transaction for schema initialization should be cancelled if exception happens in Java migration/initialization callbacks./"
