Topic_no,Keywords,Contrib,System,Text
,,0.3094,realm-java,"RealmCollection iterators are now stable (#2124) This commit changes the semantics of how live RealmResults really are. Before this commit RealmResults where live _all the time_, which meant that code like the below didnt work as expected (only half the elements would be deleted): ``` for (int i 0; i results.size(); i++) { results.get(i).deleteFromRealm(); } ``` The rather unintuitive work-around was counting backwards: ``` for (int i results.size() i >=0; i--) { results.get(i).deleteFromRealm(); } ``` This commit changes the behaviour of RealmResults, so they no longer are automatically up to date. They are instead refreshed using Looper events just like changes from other threads. RealmList iterators are not live in the same way that RealmResults are but act more like standard ArrayLists, so they dont suffer from the same liveness issues. The high-level arguments for doing this change was: Pros: * All iterators now work as you would normally expect (ease of use). * The liveness of Realm objects are now all controlled through the Looper (simpler internal code / easier to document Realm behaviour). Cons: * There is a small chance that people can accidentally reference a deleted RealmObject in a RealmResult. (Can be checked through use of `RealmObject.isValid()`)/Interface as supplement to extending RealmObject (#2599) * Backup * Add RealmModel * Modifying the annotation processor & byte code modification to use RealmModel, add UnitTests * fixing examples * WIP * fix Annotation processor * clean up * fix javadoc * add transformer tests & fix DynamicRealm tests * fixing tests * adding tests * adding tests * fixing tests for the realm-annotations-processor * add tests to cover more UC for RealmList * renamed POJO to RealmModel * reduce method count by using proxyState only in RealmObjectProxy * fix examples, no need to exclude RealmObject using Gson * making RealmList final, remove unused method & fixing APT test/Added RealmCollection APIs/Adapt core fix for the delete RealmList Update core to 0.96.1. No more exception will be thrown when access RealmResults if the base RealmList has be deleted. Instead, it will be treated as an empty RealmResults forever./"
,,0.129,realm-java,"Adapt core fix for the delete RealmList Update core to 0.96.1. No more exception will be thrown when access RealmResults if the base RealmList has be deleted. Instead, it will be treated as an empty RealmResults forever./"
,,0.1019,realm-java,"Multi-arguments distinct(...) for Realm, DynamicRealm, RealmQuery, and RealmResults/"
,,0.2461,realm-java,"Expanding time resolution into millisecs (#2679) Expanding time resolution into milliseconds but using cores new column type Timestamp. An upgrade to core version 0.100.0 is required, and some minor updates are coming from some changes in the core in String, Byte, Short, Integer, and Long types can be null. (#2634) is allowed to be null for String and Boxed primitive types. Features part of this commit are 1. A annotated field in java.lang.String/Byte/Short/Integer/Long type can be null. 2. The object with nil primary key can be updated. 3. Migration checks if existing nullable type is set to be nullable in existing file. If not, throws RealmMigrationNeeded. 4. Duplicated null as PrimaryKey throws RealmPrimaryKeyConstraintException. 5. When a new empty row is added, the default value checked for duplicated is still the same empty string ("""") at Table.addEmptyRow() 6. Since there isnt equivalent term for Optional in Java 7 yet, nullable PK types are configured as following in this PR. | String PK | Number PK | Primitive PK | Table Column | Nullable | Nullable | Not Nullable |/fix the String from DynamicRealmObject.toString(). Now DynamicRealmObject.toString() shows null value as ""null"". ""class_"" prefix is removed from type name in that String. Align the format to the String from typed RealmObject./"
,,0.063,realm-java,optimize imports/
,,0.1776,realm-java,Added RealmCollection APIs/More checkings when modify RealmList Fix * New method LinkView.getTargetTable(). * Proper checking to add DynamicRealmObject to RealmList. * Disallow modifying with RealmObject belongs to another Realm instance./
,,0.2492,realm-java,"Make all methods on RealmObject and all classes in public API final (#2675) We should mark all methods that should not be overridden final. We should mark all classes that should not be inherited final./Add getPrimaryKey() method to RealmObjectSchema (#2648) Without this method it was necessary to iterator over all fields manually to find the primary key using in String, Byte, Short, Integer, and Long types can be null. (#2634) is allowed to be null for String and Boxed primitive types. Features part of this commit are 1. A annotated field in java.lang.String/Byte/Short/Integer/Long type can be null. 2. The object with nil primary key can be updated. 3. Migration checks if existing nullable type is set to be nullable in existing file. If not, throws RealmMigrationNeeded. 4. Duplicated null as PrimaryKey throws RealmPrimaryKeyConstraintException. 5. When a new empty row is added, the default value checked for duplicated is still the same empty string ("""") at Table.addEmptyRow() 6. Since there isnt equivalent term for Optional in Java 7 yet, nullable PK types are configured as following in this PR. | String PK | Number PK | Primitive PK | Table Column | Nullable | Nullable | Not Nullable |/Fixed wrong method name in exception Fixed wrong method name in exception/Added RealmCollection APIs/Add RealmObjectSchema.isPrimaryKey() * Add RealmObjectSchema.isPrimaryKey(). RealmObjectSchema.getPrimaryKey() is not added since it doesnt seem to be necessary. * isNullable & isRequired didnt throw which is wrong. * Add throws doc to hasIndex. Close"
,,0.3526,realm-java,"Give async related vars better names asyncQueryExecutor and pendingQuery seem to be very confusing since they are used for async transaction as well./Move all query methods to RealmQuery (#2620) Currently we have the following helper query methods on Realm/DynamicRealm: allObjects() and distinct() However we have to be mindful about the number of methods in our API and from the projects we have seen so far, these methods does not seem to have been used much. Moving all query methods to RealmQuery has two advantages: 1) It helps us to reduce our overall method count and 2) It makes our API more consistent as now all RealmQuery methods are only found on RealmQuery./Deprecated 3 field sort in Realm and RealmQuery (#2619)/Make Realm.createObject(Class,PrimaryKey) public (#2622) This method is a way to solve the problem that people might have data with a primary key that is is the default value for that type, e.g a long primary key with the value 0. Once this object is saved in Realm any calls to the normal Realm.createObject() would throw an exception as it would try to assign the default value (zero) to the object before the user could set it to something else. With this method that is no longer a problem. Internally we already use this method and it is already public in the Dynamic API. The reason for not making this public earlier was due to fear of mis-use since there is no type-safe guarantee at compile time. However since it is already public in the Dynamic API and we havent seen any indication of that being misused we feel it should be safe to make this public. Also our Query API is also semi-threadsafe so there is precedence there as well./Only throw RealmException if absolutely necessary (#2618) We should avoid wrapping lower level exceptions in RealmExceptions unless there is a good reason for it. We had multiple support issues where people were confused about the RealmException and didnt understand they had to dig through the stack trace for the original exception. This change alters the behaviour of all our JSON methods so they now only convert JSONException to RealmException in order to prevent checked exceptions to reach the user. All other exceptions should be thrown directly./Interface as supplement to extending RealmObject (#2599) * Backup * Add RealmModel * Modifying the annotation processor & byte code modification to use RealmModel, add UnitTests * fixing examples * WIP * fix Annotation processor * clean up * fix javadoc * add transformer tests & fix DynamicRealm tests * fixing tests * adding tests * adding tests * fixing tests for the realm-annotations-processor * add tests to cover more UC for RealmList * renamed POJO to RealmModel * reduce method count by using proxyState only in RealmObjectProxy * fix examples, no need to exclude RealmObject using Gson * making RealmList final, remove unused method & fixing APT test/Added RealmConfiguration.initialData() (#2602)/Remove Realm.getTable() from public API Close RealmCollection APIs/migrateRealm throws when db doesnt exsit Close ./follow lint warnings/Multi-arguments distinct(...) for Realm, DynamicRealm, RealmQuery, and RealmResults/Thread local notifactions are now triggered using the Looper instead of immediately/RealmQuery.distinctAsync(), RealmResults.distinctAsync() support./"
,,0.1561,realm-java,RealmResults and RealmObjects are no longer accidentally GCed while their Observable is still alive./Realm Observables now holds a Realm instance until unsubscribed/fixed typo/
,,0.2668,realm-java,"Merge commit ecbacf into merge-ecbacf-to-master/Use qualified name for model classes in generated code in order to avoid name conflict. (#3083) * use qualified name for model classes in generated code in order to avoid name conflict. * add model classes that test issue 3077. * update changelog for inserts (#2999) Added `insert(RealmModel obj)`, `insertOrUpdate(RealmModel obj)`, `insert(Collection<RealmModel> collection)` and `insertOrUpdate(Collection<RealmModel> collection)` to perform batch inserts (#1684)./Objects not in Realm are now called unmananged everywhere. (#2828)/"
,,0.2595,realm-java,"Merge commit ecbacf into merge-ecbacf-to-master/Use qualified name for model classes in generated code in order to avoid name conflict. (#3083) * use qualified name for model classes in generated code in order to avoid name conflict. * add model classes that test issue 3077. * update changelog for inserts (#2999) Added `insert(RealmModel obj)`, `insertOrUpdate(RealmModel obj)`, `insert(Collection<RealmModel> collection)` and `insertOrUpdate(Collection<RealmModel> collection)` to perform batch inserts (#1684)./Objects not in Realm are now called unmananged everywhere. (#2828)/"
,,0.1589,realm-java,Use qualified name for model classes in generated code in order to avoid name conflict. (#3083) * use qualified name for model classes in generated code in order to avoid name conflict. * add model classes that test issue 3077. * update changelog for
,,0.1734,realm-java,"Annotation processor no longer consume annotations (#3216) This commit changes the Realm annotation processor so it no longer consumes the annotations. The only effect this has is that it is now possible to write multiple annotation processors for the same annotation. It is not possible to specify the order of annotation processors from two different libraries, so if one of the processors consumed the annotation it would be random if both ran or only one of them./"
,,0.1084,realm-java,Disable change listeners on IntentService threads (#3232)/add a null check to addChangeListener and removeChangeListener (#2805) * add a null check to addChangeListener and removeChangeListener in Realm and DynamicRealm (fixes * reflect review comments/
,,0.244,realm-java,"bulk inserts (#2999) Added `insert(RealmModel obj)`, `insertOrUpdate(RealmModel obj)`, `insert(Collection<RealmModel> collection)` and `insertOrUpdate(Collection<RealmModel> collection)` to perform batch inserts (#1684)./ PrimaryKey index rearrangement in migration revisited (#2920) This PR fixes two issues; 1) When a column with a smaller index than that of a primary key field gets removed, the primary key field index decrements, which causes a cached primary key index to point a wrong field. 2) When a primary key field is renamed, the primary key meta table is not updated accordingly./"
,,0.1761,realm-java,"bulk inserts (#2999) Added `insert(RealmModel obj)`, `insertOrUpdate(RealmModel obj)`, `insert(Collection<RealmModel> collection)` and `insertOrUpdate(Collection<RealmModel> collection)` to perform batch inserts (#1684)./"
,,0.17800000000000002,realm-java,"bulk inserts (#2999) Added `insert(RealmModel obj)`, `insertOrUpdate(RealmModel obj)`, `insert(Collection<RealmModel> collection)` and `insertOrUpdate(Collection<RealmModel> collection)` to perform batch inserts (#1684)./"
,,0.17800000000000002,realm-java,"bulk inserts (#2999) Added `insert(RealmModel obj)`, `insertOrUpdate(RealmModel obj)`, `insert(Collection<RealmModel> collection)` and `insertOrUpdate(Collection<RealmModel> collection)` to perform batch inserts (#1684)./"
,,0.2226,realm-java,"Disable change listeners on IntentService threads (#3232)/bulk inserts (#2999) Added `insert(RealmModel obj)`, `insertOrUpdate(RealmModel obj)`, `insert(Collection<RealmModel> collection)` and `insertOrUpdate(Collection<RealmModel> collection)` to perform batch inserts (#1684)./Fix async transaction problem when async query already exist. (#2780) I have rewritten how async transactions works. Before they did this: 1) commitOnBackgroundThread() post REALM_CHANGED post onSuccess runnable The problem with that approach was that the REALM_CHANGED would be swallowed if async queries existed which meant that the async transaction would call onSuccess on an old version of the Realm (making it look like it didnt work). Instead we now do this: 2) commitOnBackgroundThread post runnable that calls HandlerController.handleAsyncTransactionCompleted(runnable) The special runnable is treated as a combined REALM_CHANGED + Callback, which makes it possible for us to queue up callbacks until we are finally able to trigger all of them. Unfortunately the Handler has poor support for this so it means that we no longer can detect if such a message is in the queue. This means that it introduces a slight chance of such a event plus a real REALM_CHANGED event to be in the message queue at the same time. I considered that acceptable (since it can already happen today), and since preventing this will introduce more complexity to something that is already entirely to complex./Objects not in Realm are now called unmananged everywhere. (#2828)/"
,,0.4848,realm-java,"Allow to specify default value of the field in models constructor (#3397) * Allow to call its accessors, and replace its field accesses with accessor calls in models constructor. fixes fixes * use field instead of checking transaction * fix a bug that acceptDefaultValue is not set correctly * reject default values when the getter of a model creates other model object * add simple test for default value * supports default value of model field * supports default value of RealmList fields * add tests for assignment in constructor and setter in constructor * update javadoc comments of createObject * always ignores the default value of primary key if the object is managed * update javadoc * add a test for default values handling in copyToRealm(). the last assertion of RealmTests.copyToRealm_defaultValuesAreIgnored() is failing now. * refactor tests * use isPrimaryKey() * fix a bug that unexpected realm object is created by default value of RealmModel/RealmList fields * remove extra ; from generated code * add more tests for default value * fix tests * fix a bug that creates unexpected objects * rename internal methods * update changelog * update CHANGELOG * review comments * update CHANGELOG * added a description of how proxy object should be created in the Javadoc comment of RealmProcessor/Supporting both additive and manual schema modes (#91) * Adding very thin wrappers for Object Stores ObjectSchema and Property. * Adding method for building object schema is proxy classes * Adding rudimentary support for Object Store schemas. Using ObjectStore::update_schema() to update schema for the additive mode. * Disallowing destructive schema changes in additive mode./Invalidate schema cache when the schema version of Realm is changed by other process (#3409). invalidate schema cache when the schema version of Realm is changed by other process. Now schema cache referred by Realm instance is not shared and global schema cache is introduced instead./Integrate Object Store [PART2] SharedRealm (#3031) This simplified our code base a lot. Basically all APIs we need from SharedGroup/Group are wrapped in the SharedRealm. So we can just remove those classes. But we do need a few APIs from SharedGroup which is not supplied by SharedRealm because of async queries. Currently we expose those in a friend class of ShareRealm, see realm/realm-object-store#141 We are still managing Realm caches in Java although there are mechanism in OS to do the same thing. The major reason is we have method like deleteRealm needs information from cache to check if all Realm instances are closed. The ShareRealm is actually a std::shared_ptr. We hold the pointer to the std::shared_ptr in Java. Another fundamental change is that we used to have separated SharedGroups for DynamicRealm and typed Realm in the same thread. But now they are using different SharedRealm but actually the different SharedRealms are point to the same SharedGroup. And some other code cleanup./"
,,0.4789,realm-java,"Allow to specify default value of the field in models constructor (#3397) * Allow to call its accessors, and replace its field accesses with accessor calls in models constructor. fixes fixes * use field instead of checking transaction * fix a bug that acceptDefaultValue is not set correctly * reject default values when the getter of a model creates other model object * add simple test for default value * supports default value of model field * supports default value of RealmList fields * add tests for assignment in constructor and setter in constructor * update javadoc comments of createObject * always ignores the default value of primary key if the object is managed * update javadoc * add a test for default values handling in copyToRealm(). the last assertion of RealmTests.copyToRealm_defaultValuesAreIgnored() is failing now. * refactor tests * use isPrimaryKey() * fix a bug that unexpected realm object is created by default value of RealmModel/RealmList fields * remove extra ; from generated code * add more tests for default value * fix tests * fix a bug that creates unexpected objects * rename internal methods * update changelog * update CHANGELOG * review comments * update CHANGELOG * added a description of how proxy object should be created in the Javadoc comment of RealmProcessor/Supporting both additive and manual schema modes (#91) * Adding very thin wrappers for Object Stores ObjectSchema and Property. * Adding method for building object schema is proxy classes * Adding rudimentary support for Object Store schemas. Using ObjectStore::update_schema() to update schema for the additive mode. * Disallowing destructive schema changes in additive mode./Invalidate schema cache when the schema version of Realm is changed by other process (#3409). invalidate schema cache when the schema version of Realm is changed by other process. Now schema cache referred by Realm instance is not shared and global schema cache is introduced instead./Integrate Object Store [PART2] SharedRealm (#3031) This simplified our code base a lot. Basically all APIs we need from SharedGroup/Group are wrapped in the SharedRealm. So we can just remove those classes. But we do need a few APIs from SharedGroup which is not supplied by SharedRealm because of async queries. Currently we expose those in a friend class of ShareRealm, see realm/realm-object-store#141 We are still managing Realm caches in Java although there are mechanism in OS to do the same thing. The major reason is we have method like deleteRealm needs information from cache to check if all Realm instances are closed. The ShareRealm is actually a std::shared_ptr. We hold the pointer to the std::shared_ptr in Java. Another fundamental change is that we used to have separated SharedGroups for DynamicRealm and typed Realm in the same thread. But now they are using different SharedRealm but actually the different SharedRealms are point to the same SharedGroup. And some other code cleanup./"
,,0.1874,realm-java,Create object without setting PK is not allowed (#3379) * Create object without setting PK is not allowed * createObject must be called with PK value when creating a object with PK defined. * Creating objects from JSON must have have corresponding PK defined in the JSON object. Known issue: The default values for creating object from JSONStream will be differnt from those created by createObject. Default values from default constructor VS default values from core. This has to be addressed by
,,0.2425,realm-java,"Introduce global init (#3457) Realm now uses a global init function instead of Context on the RealmConfiguration.Builder/Remove deprecated constructor + add directory() (#3357) This commit simplifies the RealmConfiguration constructors and also ensures that we always have an Android context. It does so by now only having the`RealmConfiguration.Builder(context)` constructor. Custom file locations are now supported through the `directory()` builder method. This also made it possible to simply `assetFile(Context, location)` to only `assetFile(location)`. Having the Context means that we are now able to access system services and other framework classes without exposing any Android functionality in any potential interface (which will be needed to support Realm on the JVM)./Wait all async tasks done before next test (#3319) This is highly related with Below things are still guaranteed by this change after commit async transaction: * When callback function called (onSuccess/onError), the background Realm is closed. * When any change listeners called, the background Realm is closed. What is true now but it is not guaranteed in the future: * Background Realm might not be closed before REALM_CHANGED sent (not received). Due to this, to avoid the flaky tests, we have to ensure all async tasks quit peacefully before start the next test. This is implemented by wait and check in the TestRealmConfigurationFactory. NOTE: Any test, if the async tasks cannot be finished peacefully in a certain time, it has to be considered as a problem and fixed. This would be needed by OS notifications since Java wont have a precise control of sending REALM_CHANGED anymore./"
,,0.0859,realm-java,Introduce global init (#3457) Realm now uses a global init function instead of Context on the RealmConfiguration.Builder/
,,0.324,realm-java,"Use CheckedRow when creating a DynamicRealm Object. (#3551) And this removes a check of UncheckedRow in some constructors of DynamicRealmObject since CheckedRow is never passed to it./Sync facade to make spliting lib possible (#116) * Sync facade to make spliting lib possible * Add class SyncObjectServerFacade which will only exist in the sync lib. * Check if SyncObjectServerFacade exists and create an singleton instance. * Empty implementations for base ObjectServerFacade. * Add RealmConfiguration.isSyncConfiguration to make the checks faster. * Other cleanups. Close both additive and manual schema modes (#91) * Adding very thin wrappers for Object Stores ObjectSchema and Property. * Adding method for building object schema is proxy classes * Adding rudimentary support for Object Store schemas. Using ObjectStore::update_schema() to update schema for the additive mode. * Disallowing destructive schema changes in additive mode./Integrate Object Store [PART2] SharedRealm (#3031) This simplified our code base a lot. Basically all APIs we need from SharedGroup/Group are wrapped in the SharedRealm. So we can just remove those classes. But we do need a few APIs from SharedGroup which is not supplied by SharedRealm because of async queries. Currently we expose those in a friend class of ShareRealm, see realm/realm-object-store#141 We are still managing Realm caches in Java although there are mechanism in OS to do the same thing. The major reason is we have method like deleteRealm needs information from cache to check if all Realm instances are closed. The ShareRealm is actually a std::shared_ptr. We hold the pointer to the std::shared_ptr in Java. Another fundamental change is that we used to have separated SharedGroups for DynamicRealm and typed Realm in the same thread. But now they are using different SharedRealm but actually the different SharedRealms are point to the same SharedGroup. And some other code cleanup./getFieldIndex returns null for non-existing field (#3295) Close"
