Topic_no,Keywords,Contrib,System,Text
14,"test, make, case, add, error, fail, parameter, db_stress, expect, transaction, fix, default, memory, build, change, limit, set, format, false, testing",0.1082,conscrypt,"GCM: set default tag size to 12 bytes According to RFC 5084, the default value of the GCM tag should be 12 octets (bytes). Change the default tag length from 0 to 12 to honor this. Bug: 22855843 Change-Id: I1ed16df24d0cfa9fff2593a3402c97faf913e05e/GCM: return the correct AlgorithmParameters Instead of the correct AlgorithmParameters of type ""GCM,"" we were returning the generic ""AES"" version that basically only converts to an IvParameterSpec. Bug: 22319986 Change-Id: Ib42905c3ad31e44b72e8066192bd26981c8351ba/OpenSSLCipher: adjust expected length with padding in decrypt mode Consider the |final| buffer when computing the expected length Should not expect an extra block when using padding in decrypting mode Bug: 19186852 Change-Id: I206442d45c4cf68363201738ba9d0b035f19c436/Revert ""OpenSSLCipher: adjust expected length with padding in decrypt mode"" This reverts commit eb3a7e31c78231a19cb76ce2a5974b03a0187b96. Change-Id: I822a51cfb7c8a2a3785d8694f5ab9f9fef552111/"
,,0.0901,conscrypt,"Track False Start change in tests In BoringSSL, the SSL_MODE_ENABLE_FALSE_START (aka SSL_MODE_HANDSHAKE_CUTTHROUGH) is unconditionally enabled because BoringSSL does the appropriate checks internally. Make sure our tests also reflect this fact by testing the appropriate settings. Bug: 26139262 Bug: 26139500 Change-Id: I125aa440cdb76d2efbfee2be7387b47d22446950/"
,,0.0556,conscrypt,Run tests on Java 11 as well as 7 and 8 (#668)/
,,0.0703,Frostwire,"[android] removed not useful calculateDiskCacheSize The nature of this app is heavy use of disk, increasing or decreasing, the target shouldt change in each app start, also, the phone will more likely to fail before we reach the ~120MB max specified./"
,,0.0577,Frostwire,[android] test START_NOT_STICKY on EngineService/[android] applovin 9.4.0/
,,0.0577,Frostwire,[desktop] com.limegroup.gnutella.gui code formatting/
,,0.0577,jna,allow String[] as callback argument/return git-svn-id: 2f8a963e-d2e4-e7d0-97bf-ccb7fcea9d80/
,,0.0577,jna,allow String[] as callback argument/return git-svn-id: 2f8a963e-d2e4-e7d0-97bf-ccb7fcea9d80/
,,0.0706,OpenDDS,"Multicast Transport work possible deadlocking in MulticastTransport.cpp, added logging to trace assoc failures throughout multicast, removed an unused TransportClient* arg in UdpTransport/"
,,0.0938,pljava,Batch execution of PreparedStatements failed because addBatch was only saving off the parameter values while it ignored the parameter types. Save both the types and values. Reported by Lucas Madar Bug
,,0.0681,realm-java,Correct transcoding from UTF-16 to UTF-8/Correct transcoding from UTF-8 to UTF-16/
,,0.0597,realm-java,minor test added/
,,0.0823,realm-java,subtable sort test case added + try fail added more places/
,,0.0774,realm-java,close made public and added to TableOrView interface. Initial test cases added for GC case/added jni bridge to getColumnIndex/
,,0.0929,realm-java,check for if group is closed when closing transactions + test case Will crash core if not detected/
,,0.0664,realm-java,Asset file as an initial dataset (#2692)/
,,0.2605,rocksdb,"[RocksDB] [MergeOperator] The new Merge Interface Uses merge sequences. Summary: Here are the major changes to the Merge Interface. It has been expanded to handle cases where the MergeOperator is not associative. It does so by stacking up merge operations while scanning through the key history (i.e.: during Get() or Compaction), until a valid Put/Delete/end-of-history is encountered; it then applies all of the merge operations in the correct sequence starting with the base/sentinel value. I have also introduced an ""AssociativeMerge"" function which allows the user to take advantage of associative merge operations (such as in the case of counters). The implementation will always attempt to merge the operations/operands themselves together when they are encountered, and will resort to the ""stacking"" method if and only if the ""associative-merge"" fails. This implementation is conjectured to allow MergeOperator to handle the general case, while still providing the user with the ability to take advantage of certain efficiencies in their own merge-operator / data-structure. NOTE: This is a preliminary diff. This must still go through a lot of review, revision, and testing. Feedback welcome Test Plan: is a preliminary diff. I have only just begun testing/debugging it. will be testing this with the existing MergeOperator use-cases and unit-tests (counters, string-append, and redis-lists) will be ""desk-checking"" and walking through the code with the help gdb. will find a way of stress-testing the new interface / implementation using db_bench, db_test, merge_test, and/or db_stress. will ensure that my tests cover all cases: Get-Memtable, Get-Immutable-Memtable, Get-from-Disk, Iterator-Range-Scan, Flush-Memtable-to-L0, Compaction-L0-L1, Compaction-Ln-L(n+1), Put/Delete found, Put/Delete not-found, end-of-history, end-of-file, etc. lot of feedback from the reviewers. Reviewers: haobo, dhruba, zshao, emayanke Reviewed By: haobo CC: leveldb Differential Revision:"
,,0.2634,rocksdb,"[RocksDB] [MergeOperator] The new Merge Interface Uses merge sequences. Summary: Here are the major changes to the Merge Interface. It has been expanded to handle cases where the MergeOperator is not associative. It does so by stacking up merge operations while scanning through the key history (i.e.: during Get() or Compaction), until a valid Put/Delete/end-of-history is encountered; it then applies all of the merge operations in the correct sequence starting with the base/sentinel value. I have also introduced an ""AssociativeMerge"" function which allows the user to take advantage of associative merge operations (such as in the case of counters). The implementation will always attempt to merge the operations/operands themselves together when they are encountered, and will resort to the ""stacking"" method if and only if the ""associative-merge"" fails. This implementation is conjectured to allow MergeOperator to handle the general case, while still providing the user with the ability to take advantage of certain efficiencies in their own merge-operator / data-structure. NOTE: This is a preliminary diff. This must still go through a lot of review, revision, and testing. Feedback welcome Test Plan: is a preliminary diff. I have only just begun testing/debugging it. will be testing this with the existing MergeOperator use-cases and unit-tests (counters, string-append, and redis-lists) will be ""desk-checking"" and walking through the code with the help gdb. will find a way of stress-testing the new interface / implementation using db_bench, db_test, merge_test, and/or db_stress. will ensure that my tests cover all cases: Get-Memtable, Get-Immutable-Memtable, Get-from-Disk, Iterator-Range-Scan, Flush-Memtable-to-L0, Compaction-L0-L1, Compaction-Ln-L(n+1), Put/Delete found, Put/Delete not-found, end-of-history, end-of-file, etc. lot of feedback from the reviewers. Reviewers: haobo, dhruba, zshao, emayanke Reviewed By: haobo CC: leveldb Differential Revision:"
,,0.1935,rocksdb,"Change db_stress to work with format_version 2/Fix compile warning in db_stress Summary: Fix compile warning in db_stress Test Plan: make db_stress/Fix compile warning in db_stress.cc on Mac Summary: Fix the following compile warning in db_stress.cc on Mac tools/db_stress.cc:1688:52: error: format specifies type unsigned long but the argument has type ::google::uint64 (aka unsigned long long) [-Werror,-Wformat] fprintf(stdout, ""DB-write-buffer-size: %lu\n"", FLAGS_db_write_buffer_size); ~~~ ^~~~~~~~~~~~~~~~~~~~~~~~~~ %llu Test Plan: make/Enforce write buffer memory limit across column families Summary: Introduces a new class for managing write buffer memory across column families. We supplement ColumnFamilyOptions::write_buffer_size with ColumnFamilyOptions::write_buffer, a shared pointer to a WriteBuffer instance that enforces memory limits before flushing out to disk. Test Plan: Added SharedWriteBuffer unit test to db_test.cc Reviewers: sdong, rven, ljin, igor Reviewed By: igor Subscribers: tnovak, yhchiang, dhruba, xjin, MarkCallaghan, yoshinorim Differential Revision: rocksdb::ToString() to address cases where std::to_string is not available. Summary: In some environment such as android, the c++ library does not have std::to_string. This path adds rocksdb::ToString(), which wraps std::to_string when std::to_string is not available, and implements std::to_string in the other case. Test Plan: make dbg ./db_test make clean make dbg OPT=-DOS_ANDROID ./db_test Reviewers: ljin, sdong, igor Reviewed By: igor Subscribers: dhruba, leveldb Differential Revision:"
,,0.2716,rocksdb,"rocksdb: Fixed Dead assignment and Dead initialization scan-build warnings Summary: This diff contains trivial fixes for 6 scan-build warnings: **db/c_test.c** `db` variable is never read. Removed assignment. scan-build report: **db/db_iter.cc** `skipping` local variable is assigned to false. Then in the next switch block the only ""non return"" case assign `skipping` to true, the rest cases dont use it and all do return. scan-build report: **db/log_reader.cc** In `bool Reader::SkipToInitialBlock()` `offset_in_block` local variable is assigned to 0 `if (offset_in_block > kBlockSize 6)` and then never used. Removed the assignment and renamed it to `initial_offset_in_block` to avoid confusion. scan-build report: In `bool Reader::ReadRecord(Slice* record, std::string* scratch)` local variable `in_fragmented_record` in switch case `kFullType` block is assigned to false and then does `return` without use. In the other switch case `kFirstType` block the same `in_fragmented_record` is assigned to false, but later assigned to true without prior use. Removed assignment for both cases. scan-build reprots: **table/plain_table_key_coding.cc** Local variable `user_key_size` is assigned when declared. But then in both places where it is used assigned to `static_cast<uint32_t>(key.size() 8)`. Changed to initialize the variable to the proper value in declaration. scan-build report: **tools/db_stress.cc** Missing `break` in switch case block. This seems to be a bug. Added missing `break`. Test Plan: Make sure all tests are passing and scan-build does not report Dead assignment and Dead initialization bugs. ```lang=bash % make check % make analyze ``` Reviewers: meyering, igor, kradhakrishnan, sdong Reviewed By: sdong Subscribers: dhruba, leveldb Differential Revision:"
,,0.3148,rocksdb,"rocksdb: Add missing override Summary: When using latest clang (3.6 or 3.7/trunck) rocksdb is failing with many errors. Almost all of them are missing override errors. This diff adds missing override keyword. No manual changes. Prerequisites: bear and clang 3.5 build with extra tools ```lang=bash % USE_CLANG=1 bear make all generate a compilation database % clang-modernize . . % make format ``` Test Plan: Make sure all tests are passing. ```lang=bash % default fb code clang. % make check ``` Verify less error and no missing override errors. ```lang=bash % Have trunk clang present in path. % ROCKSDB_NO_FBCODE=1 CC=clang CXX=clang++ make ``` Reviewers: igor, kradhakrishnan, rven, meyering, sdong Reviewed By: sdong Subscribers: dhruba, leveldb Differential Revision:"
,,0.2959,rocksdb,"Build for CYGWIN Summary: Make it build for CYGWIN. Need to define ""-std=gnu++11"" instead of ""-std=c++11"" and use some replacement functions. Test Plan: Build it and run some unit tests in CYGWIN Reviewers: yhchiang, rven, anthony, kradhakrishnan, igor Reviewed By: igor Subscribers: leveldb, dhruba Differential Revision: up rocksDB close call. Summary: On RocksDB, when there are multiple instances doing flushes/compactions in the background, the close call takes a long time because the flushes/compactions need to complete before the database can shut down. If another instance is using the background threads and the compaction for this instance is in the queue since it has been scheduled, we still cannot shutdown. We now remove the scheduled background tasks which have not yet started running, so that shutdown is speeded up. Test Plan: DB Test added. Reviewers: yhchiang, igor, sdong Reviewed By: sdong Subscribers: dhruba, leveldb Differential Revision: Add missing override Summary: When using latest clang (3.6 or 3.7/trunck) rocksdb is failing with many errors. Almost all of them are missing override errors. This diff adds missing override keyword. No manual changes. Prerequisites: bear and clang 3.5 build with extra tools ```lang=bash % USE_CLANG=1 bear make all generate a compilation database % clang-modernize . . % make format ``` Test Plan: Make sure all tests are passing. ```lang=bash % default fb code clang. % make check ``` Verify less error and no missing override errors. ```lang=bash % Have trunk clang present in path. % ROCKSDB_NO_FBCODE=1 CC=clang CXX=clang++ make ``` Reviewers: igor, kradhakrishnan, rven, meyering, sdong Reviewed By: sdong Subscribers: dhruba, leveldb Differential Revision: Fix Division by zero scan-build warning Summary: scan-build complains with division by zero warning in a test. Added an assertion to prevent this. scan-build report: Test Plan: Make sure scan-build does not report Division by zero and all tests are passing. ```lang=bash % make analyze % make check ``` Reviewers: igor, meyering Reviewed By: meyering Subscribers: sdong, dhruba, leveldb Differential Revision:"
,,0.442,rocksdb,"Fix BackupEngine Summary: In D28521 we removed GarbageCollect() from BackupEngines constructor. The reason was that opening BackupEngine on HDFS was very slow and in most cases we didnt have any garbage. We allowed the user to call GarbageCollect() when it detects some garbage files in his backup directory. Unfortunately, this left us vulnerable to an interesting issue. Lets say we started a backup and copied files {1, 3} but the backup failed. On another host, we restore DB from backup and generate {1, 3, 5}. Since {1, 3} is already there, we will not overwrite. However, these files might be from a different database so their contents might be different. See internal task t6781803 for more info. Now, when were copying files and we discover a file already there, we check: 1. if the file is not referenced from any backups, we overwrite the file. 2. if the file is referenced from other backups AND the checksums dont match, we fail the backup. This will only happen if user is using a single backup directory for backing up two different databases. 3. if the file is referenced from other backups AND the checksums match, its all good. We skip the copy and go copy the next file. Test Plan: Added new test to backupable_db_test. The test fails before this patch. Reviewers: sdong, rven, yhchiang Reviewed By: yhchiang Subscribers: dhruba, leveldb Differential Revision: use ASSERT_TRUE, not ASSERT_EQ(true; same for false Summary: The usage Im fixing here caused trouble on Fedora 21 when compiling with the current gcc version 4.9.2 20150212 (Red Hat 4.9.2-6) (GCC): db/write_controller_test.cc: In member function ëvirtual void rocksdb::WriteControllerTest_SanityTest_Test::TestBody()í: db/write_controller_test.cc:23:165: error: converting ëfalseí to pointer type for argument 1 of ëchar testing::internal::IsNullLiteralHelper(testing::internal::Secret*)í [-Werror=conversion-null] ASSERT_EQ(false, controller.IsStopped()); ^ This change was induced mechanically via: git grep ASSERT_EQ\(false|xargs perl s/ASSERT_EQ\(false, /ASSERT_FALSE(/ git grep ASSERT_EQ\(true|xargs perl s/ASSERT_EQ\(true, /ASSERT_TRUE(/ Except for the three in utilities/backupable/backupable_db_test.cc for which I ended up reformatting (joining lines) in the result. As for why this problem is exhibited with that version of gcc, and none of the others Ive used (from 4.8.1 through gcc-5.0.0 and newer), I suspect its a bug in F21s gcc that has been fixed in gcc-5.0.0. Test Plan: ""make"" now succeed on Fedora 21 Reviewers: ljin, rven, igor.sugak, yhchiang, sdong, igor Reviewed By: igor Subscribers: dhruba Differential Revision: switch to gtest Summary: Our existing test notation is very similar to what is used in gtest. It makes it easy to adopt what is different. In this diff I modify existing [[ | test fixture ]] classes to inherit from `testing::Test`. Also for unit tests that use fixture class, `TEST` is replaced with `TEST_F` as required in gtest. There are several custom `main` functions in our existing tests. To make this transition easier, I modify all `main` functions to fallow gtest notation. But eventually we can remove them and use implementation of `main` that gtest provides. ```lang=bash % cat ~/transform files=$(git ls-files *test\.cc) for file in $files do if grep ""rocksdb::test::RunAllTests()"" $file then if grep ^class \w+Test { $file then perl s/^(class \w+Test) {/${1}: public testing::Test {/g $file perl s/^(TEST)/${1}_F/g $file fi perl s/(int main.*\{)/${1}::testing::InitGoogleTest(&argc, argv);/g $file perl s/rocksdb::test::RunAllTests/RUN_ALL_TESTS/g $file fi done % sh ~/transform % make format ``` Second iteration of this diff contains only scripted changes. Third iteration contains manual changes to fix last errors and make it compilable. Test Plan: Build and notice no errors. ```lang=bash % USE_CLANG=1 make check ``` Tests are still testing. Reviewers: meyering, sdong, rven, igor Reviewed By: igor Subscribers: dhruba, leveldb Differential Revision: Replace ASSERT* with EXPECT* in functions that does not return void value Summary: gtest does not use exceptions to fail a unit test by design, and `ASSERT*`s are implemented using `return`. As a consequence we cannot use `ASSERT*` in a function that does not return `void` value ([[ | 1]]), and have to fix our existing code. This diff does this in a generic way, with no manual changes. In order to detect all existing `ASSERT*` that are used in functions that doesnt return void value, I change the code to generate compile errors for such cases. In `util/testharness.h` I defined `EXPECT*` assertions, the same way as `ASSERT*`, and redefined `ASSERT*` to return `void`. Then executed: ```lang=bash % USE_CLANG=1 make all 2> build.log % perl print ""-- "".$F[0].""\n"" if /: error:/ \ build.log | xargs 1 perl s/ASSERT/EXPECT/g if $. $number % make format ``` After that I reverted back change to `ASSERT*` in `util/testharness.h`. But preserved introduced `EXPECT*`, which is the same as `ASSERT*`. This will be deleted once switched to gtest. This diff is independent and contains manual changes only in `util/testharness.h`. Test Plan: Make sure all tests are passing. ```lang=bash % USE_CLANG=1 make check ``` Reviewers: igor, lgalanis, sdong, yufei.zhu, rven, meyering Reviewed By: meyering Subscribers: dhruba, leveldb Differential Revision: a bug in ReadOnlyBackupEngine Summary: This diff fixes a bug introduced by D28521. Read-only backup engine can delete a backup that is later than the latest we never check the condition. I also added a bunch of logging that will help with debugging cases like this in the future. See more discussion at t6218248. Test Plan: Added a unit test that was failing before the change. Also, see new LOG file contents: Reviewers: benj, sanketh, sumeet, yhchiang, rven, sdong Reviewed By: sdong Subscribers: dhruba, leveldb Differential Revision:"
,,0.2295,rocksdb,"fix typos/rocksdb: Fix scan-build memory warning in table/block_based_table_reader.cc Summary: scan-build is reporting two memory leak bugs in `table/block_based_table_reader.cc`. They are both false positives. In both cases we allocate memory in `ReadBlockFromFile` if `s.ok()`. Then after the function `ReadBlockFromFile` returns we check for the same variable if `s.ok()` and then use the memory that was allocated. The bugs reported by scan-build is if `ReadBlockFromFile` allocates memory and returns, but for some reason status `s` is not the same and `s.ok() true`. In this case scan-build is concerned that memory owner transfer is not explicit. I modified `ReadBlockFromFile` to accept `std::unique_ptr<Block>*` as a parameter, instead of raw pointer. scan-build reports: Test Plan: Make sure scan-build does not report these bugs and all tests are passing. ```lang=bash % make check % make analyze ``` Reviewers: sdong, lgalanis, meyering, igor Reviewed By: igor Subscribers: dhruba, leveldb Differential Revision:"
,,0.5305,rocksdb,"Adding stats for the merge and filter operation Summary: We have addded new stats and perf_context for measuring the merge and filter operation time consumption. We have bounded all the merge operations within the GUARD statment and collected the total time for these operations in the DB. Test Plan: WIP Reviewers: rven, yhchiang, kradhakrishnan, igor, sdong Reviewed By: sdong Subscribers: dhruba Differential Revision: switch to gtest Summary: Our existing test notation is very similar to what is used in gtest. It makes it easy to adopt what is different. In this diff I modify existing [[ | test fixture ]] classes to inherit from `testing::Test`. Also for unit tests that use fixture class, `TEST` is replaced with `TEST_F` as required in gtest. There are several custom `main` functions in our existing tests. To make this transition easier, I modify all `main` functions to fallow gtest notation. But eventually we can remove them and use implementation of `main` that gtest provides. ```lang=bash % cat ~/transform files=$(git ls-files *test\.cc) for file in $files do if grep ""rocksdb::test::RunAllTests()"" $file then if grep ^class \w+Test { $file then perl s/^(class \w+Test) {/${1}: public testing::Test {/g $file perl s/^(TEST)/${1}_F/g $file fi perl s/(int main.*\{)/${1}::testing::InitGoogleTest(&argc, argv);/g $file perl s/rocksdb::test::RunAllTests/RUN_ALL_TESTS/g $file fi done % sh ~/transform % make format ``` Second iteration of this diff contains only scripted changes. Third iteration contains manual changes to fix last errors and make it compilable. Test Plan: Build and notice no errors. ```lang=bash % USE_CLANG=1 make check ``` Tests are still testing. Reviewers: meyering, sdong, rven, igor Reviewed By: igor Subscribers: dhruba, leveldb Differential Revision: Small refactoring before migrating to gtest Summary: These changes are necessary to make tests look more generic, and avoid feature conflicts with gtest. Test Plan: Make sure no build errors, and all test are passing. ``` % make check ``` Reviewers: igor, meyering Reviewed By: meyering Subscribers: dhruba, leveldb Differential Revision: functionality to pre-fetch blocks specified by a key range to BlockBasedTable implementation. Summary: Pre-fetching is a common operation performed by data stores for disk/flash based systems as part of database startup. This is part of task 5197184. Test Plan: Run the newly added unit test Reviewers: rven, igor, sdong Reviewed By: sdong Subscribers: dhruba, leveldb Differential Revision: Add missing override Summary: When using latest clang (3.6 or 3.7/trunck) rocksdb is failing with many errors. Almost all of them are missing override errors. This diff adds missing override keyword. No manual changes. Prerequisites: bear and clang 3.5 build with extra tools ```lang=bash % USE_CLANG=1 bear make all generate a compilation database % clang-modernize . . % make format ``` Test Plan: Make sure all tests are passing. ```lang=bash % default fb code clang. % make check ``` Verify less error and no missing override errors. ```lang=bash % Have trunk clang present in path. % ROCKSDB_NO_FBCODE=1 CC=clang CXX=clang++ make ``` Reviewers: igor, kradhakrishnan, rven, meyering, sdong Reviewed By: sdong Subscribers: dhruba, leveldb Differential Revision: add missing 5th arg in TestArgs initializer Summary: Adding and to CXXFLAGS provoked this failure: table/table_test.cc:1854:56: error: missing initializer for member ërocksdb::TestArgs::format_versioní [-Werror=missing-field-initializers] TestArgs args { DB_TEST, false, 16, kNoCompression }; ^ Add the missing, 5th value (format_version). Test Plan: Run ""make EXTRA_CXXFLAGS=-W and see fewer errors. Reviewers: ljin, sdong, igor.sugak, igor Reviewed By: igor Subscribers: dhruba Differential Revision:"
,,0.3148,rocksdb,"rocksdb: Add missing override Summary: When using latest clang (3.6 or 3.7/trunck) rocksdb is failing with many errors. Almost all of them are missing override errors. This diff adds missing override keyword. No manual changes. Prerequisites: bear and clang 3.5 build with extra tools ```lang=bash % USE_CLANG=1 bear make all generate a compilation database % clang-modernize . . % make format ``` Test Plan: Make sure all tests are passing. ```lang=bash % default fb code clang. % make check ``` Verify less error and no missing override errors. ```lang=bash % Have trunk clang present in path. % ROCKSDB_NO_FBCODE=1 CC=clang CXX=clang++ make ``` Reviewers: igor, kradhakrishnan, rven, meyering, sdong Reviewed By: sdong Subscribers: dhruba, leveldb Differential Revision:"
