Topic_no,Keywords,Contrib,System,Text
1,"test, realm, object, update, change, method, comment, check, annotation, close, null, realmresult, field, create, unit_test, query, core, add, object_store, nullable",0.0737,conscrypt,Fix NativeCrypto FindBugs warnings. Change-Id: I102367575b1257582bb20c659223e3f02650fda4/
,,0.1086,conscrypt,"Update d2i_SSL_SESSION test expectations Update d2i_SSL_SESSION to only throw IOException and change tests to expect that to happen. Since IOException is declared as a thrown exception, non-test code should already be expecting this. Bug: 27526112 Change-Id: Ic8c1a47debce9cb76221150d050be86d010c6ec3/"
,,0.0639,Frostwire,[common] fixed SC search/
,,0.063,Frostwire,[desktop] avoid UI thread violation/
,,0.0825,javacpp,"Update version in the `pom.xml` file to 0.11-SNAPSHOT * Provide `UByteIndexer` and `UShortIndexer`, treating array and buffer data as unsigned integers, for ease of use * Clean up Windows `java.io.tmpdir` even when program messes with `java.class.path` (issue"
,,0.0744,javacpp,Add `PointerScope.getInnerScope()` that can be called from any context/ * Add `PointerScope` to manage more easily the resources of a group of `Pointer` objects/
,,0.0577,pljava,Changes needed for PostgreSQL 8.1.x/
,,0.1407,pljava,"Annotate Connection methods and add more comments. Add to the methods in SPIConnection that are specified by the Connection API (to make it easier to spot the ones that arent). For those added in JDBC 4.1, the annotation is commented out, as PL/Java 1.5 still strives to be buildable with Java 6. Once the back-compatibility horizon is Java 7 or later, those can be uncommented. It would also be fair to say this has added annotations (or commented-out annotations) through JDBC 4.2, as it didnt add any new Connection methods. The PL/Java-specific and internal methods are now easier to pick out (theyre the ones without annotations), and have some more extensive comments about what theyre doing there. Also moved one method to be nearer the stuff it pertains to. No code changes (except to add the specified generic signature on getTypeMap/setTypeMap). Indentation adjusted in a couple contiguous areas./"
,,0.0664,realm-java,Use java.io.IOException./
,,0.066,realm-java,Added hasChanged() to SharedGroup/
,,0.0985,realm-java,Updated test of TableView and Query close() test. + other minor updates/added private_close/Renamed class util to Util./Added finalize to TableQuery/
,,0.1629,realm-java,Outcommented lookup in table and tableview/Query could leak./Updated test of TableView and Query close() test. + other minor updates/Renamed class util to Util./Space in public comments added + Renaming of addLong to incrementInColumn (including test cases)/
,,0.125,realm-java,"Lookup reenabled on typed table. Test case added, Check for null otherwise core crash/debugging datebug fixed one/merged develop into breaking/Renamed to reflect c++ renames/Outcommented lookup in table and tableview/Table.close() now private (added private_debug_close() instead. Added better support for detecting valid View and Query after close of table. Still not completely tested, also missing core-support./Renamed class util to Util./Space in public comments added + Renaming of addLong to incrementInColumn (including test cases)/"
,,0.0807,realm-java,"removed CloseMutex class Commented out/added jni bridge to getColumnIndex/pivot native test cases added/throw exception when setting null on string + test cases/missing "".""/"
,,0.2165,realm-java,Refactored json methods to support standalone objects. Added stub methods + begun work on unit tests./Merge branch master into cm-primary-keys Conflicts: changelog.txt realm-annotations-processor/src/main/java/io/realm/processor/RealmProcessor.java realm-annotations-processor/src/main/java/io/realm/processor/RealmProxyClassGenerator.java realm/src/androidTest/java/io/realm/RealmAnnotationTest.java realm/src/main/java/io/realm/internal/Row.java realm/src/main/java/io/realm/internal/Table.java/Allow custom constructors but require no arg public constructor as well./Added unit tests and fixes bug found on the way/Preliminary support for primary keys in the binding + Unit tests./
,,0.1386,realm-java,Throw NoSuchMethodError when RealmResults.indexOf() is called as the method is not implemented./Improved error message for child object sorting./Changing sort to be in-place./Added support for remove in RealmResults iterators. Additional unit tests for their usage./Proper iterators implemented for RealmResults./Root cause unit test added./Adding thread check on RealmObject. Refactoring unit tests. Updating changelog./
,,0.0689,realm-java,Preliminary support for primary keys in the binding + Unit tests./
,,0.1056,realm-java,Setting same value to a primary field no longer violates the primary key constraint./Primary keys are now indexed. Refactored Table/Row for missing cases + cleaner code. Additional unit tests./Preliminary support for primary keys in the binding + Unit tests./
,,0.193,realm-java,"Only check for duplicate values when switching primary key fields./Style fixes./Setting same value to a primary field no longer violates the primary key constraint./Merge branch master into cm-primary-keys Conflicts: changelog.txt realm-annotations-processor/src/main/java/io/realm/processor/RealmProcessor.java realm-annotations-processor/src/main/java/io/realm/processor/RealmProxyClassGenerator.java realm/src/androidTest/java/io/realm/RealmAnnotationTest.java realm/src/main/java/io/realm/internal/Row.java realm/src/main/java/io/realm/internal/Table.java/It is no longer possible to manually set 0 or """" in primary key fields. Refactored error checking so it is more maintainable./Primary keys are now indexed. Refactored Table/Row for missing cases + cleaner code. Additional unit tests./Preliminary support for primary keys in the binding + Unit tests./"
,,0.1513,realm-java,"Better error reporting for error cases when creating a Realm using the File constructors./Revert ""Revert ""Merge pull request from realm/kg-core-0.87.0"""" This reverts commit 6be8edca486f53273f28553584d28bc17c5a0ddf./Mitigate the file size growing problem This change does the following: * disables the caching of Realm instances in threads without an event loop * makes the Realm class implement Closable * does reference counting for closing Realm instances * checks if the Realm instance has not been closed before any operation/"
,,0.0681,realm-java,Fixed issues with Null when using JSONObject./
,,0.0704,realm-java,Made Thread example more resilient to monkey test events./
,,0.1187,realm-java,Handle null value for String in Json when updating Fix Update the objects String field to empty string when the corresponding field in Json is null./Updates due to PR feedback/Tighter check on table validation involving RealmList<> fields./
,,0.092,realm-java,Improve unit test for class with boolean fields in the AP/Updates due to PR feedback/Tighter check on table validation involving RealmList<> fields./
,,0.1448,realm-java,"Add analytics on annotation/Index fields with annotation And update test cases to adapt this change./Support search indexing for column int, bool, date 1. Enable the search index annotation on byte, short, int, long, boolean, and Date. 2. Enable add/remove search index in java. 3. Annotation processor test to support better detailed test cases. 4. Modify JNI test cases. 5. Update doc. 6. Add AnnotationIndexTypes to avoid polluting other test cases. This is the first PR for Implicit index to int primary keys will be handled in another PR./Simple dynamic API added./Add check on fields of type RealmList/"
,,0.0795,realm-java,Populate after generating the metadata/Avoid wildcard imports and execute in the background/Add analytics on annotation/
,,0.1102,realm-java,Support UnreachableVersionException from Core/Realm will now throw a RealmError when Realm Core enters an unrecoverable error condition./
,,0.1648,realm-java,"add logic to release handover resources, update threading example with asyc transaction/using std::unique_ptr for handover + remove unnecessary begin_read in a spearate JNI call + latest fixes from fsa_handover_demo (untyped query etc.)/add support for findFirst & findAllSorted*, update UnitTests/Changing logic to handover the query from caller to background thread, handle different failure points (begin_read, import_handover), update UnitTests/Support UnreachableVersionException from Core/add retry policy + concurrency tests + perf improvement to the query/POC async query, using Core fsa_handover_demo branch/"
,,0.0849,realm-java,Merge remote-tracking branch origin/master into nh-async-query/
,,0.0998,realm-java,Add support for in-memory Realm 1. Add durability to createNativeWithImplicitTransactions. 2. Add inMemory to RealmConfiguration. 3. Support passing durability to SharedGroup constructor. 4. Add new static method getInMemoryRealm to Realm class. 5. Add test cases./
,,0.3392,realm-java,"Suppress useless cast and raw type warnings in generated proxy classes. This warnings are reported when `-Xlint:all` is added to the compilar args. Example configuration of `build.gradle` is: ``` allprojects { gradle.projectsEvaluated { tasks.withType(JavaCompile) { options.compilerArgs options.compilerArgs } } } ```/reorder parameters of ColumnInfo class/fix for Problem: The Proxy class of each model holds column indices in static fields. These indices are good only when all Realm databases have the same column index in every column of the model class. If Realm databases have different column indices, the getter/setter of Proxy class reads/writes wrong column. Solution: This commit introduces `ColumnInfo` object that holds column indices information per Realm instance which shares the same database file./Add Nullable suport * Add boxed type support. * Add annotation. * isNull and isNotNull support all nullable types now. * equalTo query can take null as input param for nullable fields. * Add functions for nullable related migration. * JSON converter behavior changes for null value. * Update test cases./"
,,0.3401,realm-java,"Suppress useless cast and raw type warnings in generated proxy classes. This warnings are reported when `-Xlint:all` is added to the compilar args. Example configuration of `build.gradle` is: ``` allprojects { gradle.projectsEvaluated { tasks.withType(JavaCompile) { options.compilerArgs options.compilerArgs } } } ```/reorder parameters of ColumnInfo class/fix for Problem: The Proxy class of each model holds column indices in static fields. These indices are good only when all Realm databases have the same column index in every column of the model class. If Realm databases have different column indices, the getter/setter of Proxy class reads/writes wrong column. Solution: This commit introduces `ColumnInfo` object that holds column indices information per Realm instance which shares the same database file./Add Nullable suport * Add boxed type support. * Add annotation. * isNull and isNotNull support all nullable types now. * equalTo query can take null as input param for nullable fields. * Add functions for nullable related migration. * JSON converter behavior changes for null value. * Update test cases./"
,,0.0681,realm-java,fix tests/Milestone 4: before merging origin/master/
,,0.2908,realm-java,"Change to is_not_null for links Since it is supported by core now./add distinctAsync/fix code style/Added RealmQuery.isEmpty()/optimising TableView construction/small code style fix/using TableRef/remove dynamic allocation for Handover TableView/now throwing Exception if we try to add/remove listener for unmanaged RealmObject/RealmResults/update as per round 2 feedback/Add Nullable suport * Add boxed type support. * Add annotation. * isNull and isNotNull support all nullable types now. * equalTo query can take null as input param for nullable fields. * Add functions for nullable related migration. * JSON converter behavior changes for null value. * Update test cases./update branch as per PR feedback/Milestone 4: before merging origin/master/Milestone 3: findAllSorted, findFirst & asyncTransaction working/Milestone 2: findAllAsync & findFirst working with retries sratetgies/"
,,0.1276,realm-java,now throwing Exception if we try to add/remove listener for unmanaged RealmObject/RealmResults/update as per round 2 feedback/Milestone 4: before merging origin/master/Milestone 2: findAllAsync & findFirst working with retries sratetgies/
,,0.0694,realm-java,Update core to v0.89.8 Add RealmEncryptionNotSupportedException/
,,0.2585,realm-java,Add Nullable suport * Add boxed type support. * Add annotation. * isNull and isNotNull support all nullable types now. * equalTo query can take null as input param for nullable fields. * Add functions for nullable related migration. * JSON converter behavior changes for null value. * Update test cases./
,,0.0841,realm-java,Adapt core changes in 0.92.0 * Remove insert_xxx methods from Table. * Table.where() changed to user a Ref instead of a raw ptr. * makeWriteLogCollector to make_client_history * advance_read/promote_to_write/rollback_and_continue_as_read need a replication ptr as param now. * Remove add_int method. * A bug fix in linkview jni. * adjust is removed from TableOrView. * Other test cases fix. ** testMoveUp & testRemove dont pass right now./
,,0.1068,realm-java,More fixes for the AP/Fix the AP unit tests/Fix the unit tests of the annotations processor. Also remove one unit test which makes no sense now that users can write model classes in any way they like./update unit tests for annotation-processor/Added Realm.copyFromRealm()/New Migration and Dynamic API. New Sort/Case enums. New RealmCache/
,,0.1068,realm-java,More fixes for the AP/Fix the AP unit tests/Fix the unit tests of the annotations processor. Also remove one unit test which makes no sense now that users can write model classes in any way they like./update unit tests for annotation-processor/Added Realm.copyFromRealm()/New Migration and Dynamic API. New Sort/Case enums. New RealmCache/
,,0.1066,realm-java,Remove reflection from the generated proxy code./Address the first wave of review comments/Realm.createOrUpdateObjectFromJson() now works correctly if the RealmObject class contains a primary key/
,,0.3758,realm-java,"Access to RealmResults based on deleted RealmList * When the original RealmList is deleted, for most methods of RealmResults should just work without crash by just treat it like an empty RealmResults. * RealmResults.where() throws IllegalStateExecption in this case. * RealmResults.isValid() returns false in this case. This is a temp fix, check for more details. Close RealmQuery.distinct(), RealmResults.distinct()/Fix PMD error. Nested if/Applying code review recommendations and adding removed from Realm tests. Review recommendations are from and and jni layer interop code to utilize find method. Testing Adding header file Checking to ensure were on the right Realm before performing the contains check. Adding changlog Adding table view code and changing return types to jlong so we can use them in the indexOf Adding multi-realm test Removing code that should not have been in the commit Changing LinkView.cpp method to use commonly used Macro and udpated null checks. Changing LinkView.cpp method to use commonly used Macro and udpated null checks and moved contains method to override instead of overload. Using instance of instead of assignable from and using long value instead of returning a boolean. Checking for row and index validity in the cpp layer. Also removing the not found constant in order to the use the constant in TableOrView Checking for managed mode. Falling back to default impl. Updating changelog. Reverting back to to_jlong_or_not_found Fixing a few compilation issues as well as applying code review updates. Fixing managed mode bug that I accidentally introduced. Updates as per recommended, issues listed below. After changing cpp code to return tests started failing items were not found. Im on the fence if this is expected or not. Im not to familiar wit the underlying core to know if should be needed. Also added tests to check to see if a query or list contains an item that is in the same Realm, but from another query/result. This test creates a native crash. I tried to identify the root cause by pulling the tombstone and performing `ndk-stack` and `addr2line` on it but I could not properly identify the symbols and where they might be. Inspiration and HOWTO to debug NDK from here: Adding nativePtr to JNI call. Also added isLoaded() call. Not contained test failing on out of bounds exception on row indexes. Changing TableOrView#find() name to TableOrView#sourceRowIndex() as per recommendation of Adding check for parent table and re-enabled the other jni targets and fixed incorrect test. Received help with this from and RxJava support/fix 1894 changelistener not called/enhancing notifications, adding Async queries for DynamicRealmObject/New Migration and Dynamic API. New Sort/Case enums. New RealmCache/"
,,0.2045,realm-java,"Access to RealmResults based on deleted RealmList * When the original RealmList is deleted, for most methods of RealmResults should just work without crash by just treat it like an empty RealmResults. * RealmResults.where() throws IllegalStateExecption in this case. * RealmResults.isValid() returns false in this case. This is a temp fix, check for more details. Close Migration and Dynamic API. New Sort/Case enums. New RealmCache/"
,,0.1044,realm-java,Fix RealmQuery.isNotEmpty(). It is fix for Fix the native method + Renaming./Support for RealmQuery.isNotEmpty() added/New Migration and Dynamic API. New Sort/Case enums. New RealmCache/
,,0.1236,realm-java,"Added RealmQuery.distinct(), RealmResults.distinct()/Cleanup internal classes/"
,,0.0891,realm-java,"Notify listeners of async RealmObject even if the result is empty/enhancing notifications, adding Async queries for DynamicRealmObject/"
,,0.1177,realm-java,"Cleanup internal classes/enhancing notifications, adding Async queries for DynamicRealmObject/New Migration and Dynamic API. New Sort/Case enums. New RealmCache/"
,,0.11199999999999999,realm-java,New Migration and Dynamic API. New Sort/Case enums. New RealmCache/Release LinkView native pointers Fix * Add abstract method to NativeObjectReference for native resource releasing. * Implement NativeObjectReference.cleanup for UncheckRow and LinkView/
,,0.0838,realm-java,Release LinkView native pointers Fix * Add abstract method to NativeObjectReference for native resource releasing. * Implement NativeObjectReference.cleanup for UncheckRow and LinkView/
,,0.3387,realm-java,"Add RealmList.removeAllFromRealm and Realm.clear * Add LinkView.removeAllTargetRows. * Add Realm.clear to remove all objects from Realm. * Add RealmList.removeAllFromRealm(). * Javadoc & test case update. Close code review recommendations and adding removed from Realm tests. Review recommendations are from and and jni layer interop code to utilize find method. Testing Adding header file Checking to ensure were on the right Realm before performing the contains check. Adding changlog Adding table view code and changing return types to jlong so we can use them in the indexOf Adding multi-realm test Removing code that should not have been in the commit Changing LinkView.cpp method to use commonly used Macro and udpated null checks. Changing LinkView.cpp method to use commonly used Macro and udpated null checks and moved contains method to override instead of overload. Using instance of instead of assignable from and using long value instead of returning a boolean. Checking for row and index validity in the cpp layer. Also removing the not found constant in order to the use the constant in TableOrView Checking for managed mode. Falling back to default impl. Updating changelog. Reverting back to to_jlong_or_not_found Fixing a few compilation issues as well as applying code review updates. Fixing managed mode bug that I accidentally introduced. Updates as per recommended, issues listed below. After changing cpp code to return tests started failing items were not found. Im on the fence if this is expected or not. Im not to familiar wit the underlying core to know if should be needed. Also added tests to check to see if a query or list contains an item that is in the same Realm, but from another query/result. This test creates a native crash. I tried to identify the root cause by pulling the tombstone and performing `ndk-stack` and `addr2line` on it but I could not properly identify the symbols and where they might be. Inspiration and HOWTO to debug NDK from here: Adding nativePtr to JNI call. Also added isLoaded() call. Not contained test failing on out of bounds exception on row indexes. Changing TableOrView#find() name to TableOrView#sourceRowIndex() as per recommendation of Adding check for parent table and re-enabled the other jni targets and fixed incorrect test. Received help with this from and internal classes/Release LinkView native pointers Fix * Add abstract method to NativeObjectReference for native resource releasing. * Implement NativeObjectReference.cleanup for UncheckRow and LinkView/"
,,0.2108,realm-java,"Using separate interfaces for async transaction also fixes RealmQuery.distinct(), RealmResults.distinct()/Fix flaky tests related with async transaction * Background realm needs to be closed before notifying other threads in async transaction. * Latch needs to be called after Realm closed./fix 1884 listener trigger/Fix crash when closing a Realm in listener Realm.copyFromRealm()/Realm.createOrUpdateObjectFromJson() now works correctly if the RealmObject class contains a primary key/New Migration and Dynamic API. New Sort/Case enums. New RealmCache/Checking to see if a transaction is currently in progress for sync and async transaction pathways. Also adding logging. Added a test helper to assist with log assertion. Fixes Fixing typo. Removing logger after testing Removing extra line Fixing tests and adding change log message. Adding breaking change message Small cosmetic changes Adding punctuation formatting Fixing unit test./"
,,0.2076,realm-java,"Access to RealmResults based on deleted RealmList * When the original RealmList is deleted, for most methods of RealmResults should just work without crash by just treat it like an empty RealmResults. * RealmResults.where() throws IllegalStateExecption in this case. * RealmResults.isValid() returns false in this case. This is a temp fix, check for more details. Close Migration and Dynamic API. New Sort/Case enums. New RealmCache/"
,,0.1995,realm-java,"Access to RealmResults based on deleted RealmList * When the original RealmList is deleted, for most methods of RealmResults should just work without crash by just treat it like an empty RealmResults. * RealmResults.where() throws IllegalStateExecption in this case. * RealmResults.isValid() returns false in this case. This is a temp fix, check for more details. Close"
,,0.2972,realm-java,"RealmChangeListener should provide the changes object/realm/collection as well (#2705) RealmChangeListener should provide the changes object/realm/collection as well/Interface as supplement to extending RealmObject (#2599) * Backup * Add RealmModel * Modifying the annotation processor & byte code modification to use RealmModel, add UnitTests * fixing examples * WIP * fix Annotation processor * clean up * fix javadoc * add transformer tests & fix DynamicRealm tests * fixing tests * adding tests * adding tests * fixing tests for the realm-annotations-processor * add tests to cover more UC for RealmList * renamed POJO to RealmModel * reduce method count by using proxyState only in RealmObjectProxy * fix examples, no need to exclude RealmObject using Gson * making RealmList final, remove unused method & fixing APT test/Thread check for copyToRealm/copyToRealmOrUpdate/Fix the cast in proxy generator for CacheData Close realm and row as a field name of model class. This fixes"
,,0.3101,realm-java,"RealmChangeListener should provide the changes object/realm/collection as well (#2705) RealmChangeListener should provide the changes object/realm/collection as well/Interface as supplement to extending RealmObject (#2599) * Backup * Add RealmModel * Modifying the annotation processor & byte code modification to use RealmModel, add UnitTests * fixing examples * WIP * fix Annotation processor * clean up * fix javadoc * add transformer tests & fix DynamicRealm tests * fixing tests * adding tests * adding tests * fixing tests for the realm-annotations-processor * add tests to cover more UC for RealmList * renamed POJO to RealmModel * reduce method count by using proxyState only in RealmObjectProxy * fix examples, no need to exclude RealmObject using Gson * making RealmList final, remove unused method & fixing APT test/Thread check for copyToRealm/copyToRealmOrUpdate/Fix the cast in proxy generator for CacheData Close realm and row as a field name of model class. This fixes"
,,0.1931,realm-java,"Interface as supplement to extending RealmObject (#2599) * Backup * Add RealmModel * Modifying the annotation processor & byte code modification to use RealmModel, add UnitTests * fixing examples * WIP * fix Annotation processor * clean up * fix javadoc * add transformer tests & fix DynamicRealm tests * fixing tests * adding tests * adding tests * fixing tests for the realm-annotations-processor * add tests to cover more UC for RealmList * renamed POJO to RealmModel * reduce method count by using proxyState only in RealmObjectProxy * fix examples, no need to exclude RealmObject using Gson * making RealmList final, remove unused method & fixing APT test/"
